746137,7010005031603,01,0,2020-03-17,2020-03-17,豊田藤岡特定目的会社,,399,東京都,千代田区,平河町１丁目６番１５号シルスフィア会計事務所内,,13,101,1020093,,,,,,,2020-03-17,1,,,,,トヨタフジオカ,0
746138,7010005031611,01,0,2020-03-27,2020-03-27,一般社団法人ＨＩＣＣ,,399,東京都,千代田区,有楽町２丁目７番１号,,13,101,1000006,,,,,,,2020-03-27,1,,,,,エイチアイシーシー,0
746139,7010005031628,01,0,2020-03-24,2020-03-24,Ｇｒａｖｉｔｙ一般社団法人,,399,東京都,千代田区,丸の内３丁目１番１号東京共同会計事務所内,,13,101,1000005,,,,,,,2020-03-24,1,,,,,グラヴィティ,0
746140,7010005031644,01,0,2020-03-31,2020-03-31,一般社団法人日本皇家美顔美身協会,,399,東京都,千代田区,東神田２丁目６番７号６Ｆ,,13,101,1010031,,,,,,,2020-03-31,1,,,,,ニホンコウカビガンビシンキョウカイ,0
746141,7010005031660,01,0,2020-04-02,2020-04-02,一般社団法人オーケーチャタン,,399,東京都,千代田区,丸の内３丁目１番１号東京共同会計事務所内,,13,101,1000005,,,,,,,2020-04-02,1,,,,,オーケーチャタン,0
746142,7010005031669,01,0,2020-04-03,2020-04-03,一般社団法人日本組織適合性学会,,399,東京都,文京区,本郷２丁目２６番１１号ＫＡＺＥＮ第２ビル６階中西印刷株式会社東京営業部内,,13,105,1130033,,,,,,,2020-04-03,1,,,,,ニホンソシキテキゴウセイガッカイ,0
746143,7010005031677,01,0,2020-04-03,2020-04-03,一般社団法人オフショアウィンドファーム事業推進協会,,399,東京都,中央区,京橋１丁目１８番１号,,13,102,1040031,,,,,,,2020-04-03,1,,,,,オフショアウィンドファームジギョウスイシンキョウカイ,0
746144,7010005031685,01,0,2020-04-06,2020-04-06,特定非営利活動法人Ｄｉｇｉｔａｌ　Ｓｕｓｔａｉｎａｂｌｅ　Ｖｉｌｌａｇｅ,,399,東京都,中央区,銀座１丁目１５番７号ＭＡＣ銀座ビル３階,,13,102,1040061,,,,,,,2020-04-06,1,,,,,デジタルサスティナブルビレッジ,0
746145,7010005031693,01,0,2020-04-21,2020-04-21,一般社団法人Ｗｅｌｌ－Ｂｅｉｎｇ　Ｌｉｖｅ　Ｄａｔａ協議会,,399,東京都,千代田区,麹町２丁目６番地５,,13,101,1020083,,,,,,,2020-04-21,1,,,,,ウェルビーイングライブデータキョウギカイ,0
746146,7010005031702,01,0,2020-04-13,2020-04-13,一般社団法人日本胸部外科学会,,399,東京都,文京区,後楽２丁目３番２７号テラル後楽ビル１階,,13,105,1120004,,,,,,,2020-04-13,1,,,,,ニホンキョウブゲカガッカイ,0
746147,7010005031710,01,0,2020-04-13,2020-04-13,一般社団法人キャンサー・ベネフィッツ,,399,東京都,中央区,日本橋箱崎町２０番３号,,13,102,1030015,,,,,,,2020-04-13,1,,,,,キャンサーベネフィッツ,0
746148,7010005031735,01,0,2020-04-23,2020-04-23,一般社団法人プロギングジャパン,,399,東京都,千代田区,九段南１丁目５－６りそな九段ビル５階,,13,101,1020074,,,,,,,2020-04-23,1,,,,,プロギングジャパン,0
746149,7010005031743,01,0,2020-04-22,2020-04-22,Ｈａｋｕｂａ　Ｍｉｒａｉ一般社団法人,,399,東京都,中央区,銀座１丁目６番１１号土志田ビルディング３Ｆ,,13,102,1040061,,,,,,,2020-04-22,1,,,,,ハクバミライ,0
746150,7010005031751,01,0,2020-04-23,2020-04-23,一般社団法人ヴィレッジファイブ,,399,東京都,中央区,日本橋１丁目４番１号,,13,102,1030027,,,,,,,2020-04-23,1,,,,,ヴィレッジファイブ,0
746151,7010005031768,01,0,2020-04-28,2020-04-28,一般社団法人生命の碧い星,,399,東京都,千代田区,東神田１丁目７番１０号,,13,101,1010031,,,,,,,2020-04-28,1,,,,,イノチノアオイホシ,0
746152,7010005031784,01,0,2020-04-28,2020-04-28,一般社団法人リバーサイド・ホールディングス・ツー,,399,東京都,千代田区,内幸町２丁目１番６号,,13,101,1000011,,,,,,,2020-04-28,1,,,,,リバーサイドホールディングスツー,0
746153,7010005031792,01,0,2020-05-08,2020-05-08,一般社団法人心土不二,,399,東京都,千代田区,平河町２丁目３番１０号,,13,101,1020093,,,,,,,2020-05-08,1,,,,,シンドフジ,0
746154,7010005031818,01,0,2020-05-15,2020-05-15,一般社団法人子どもと家族のＱＯＬ研究センター,,399,東京都,文京区,本郷３丁目２６番１号－７０２,,13,105,1130033,,,,,,,2020-05-15,1,,,,,コドモトカゾクノキューオーエルケンキュウセンター,0
746155,7010005031834,01,0,2020-05-18,2020-05-18,一般社団法人霞が関総合情報センター,,399,東京都,千代田区,霞が関３丁目４番２号,,13,101,1000013,,,,,,,2020-05-18,1,,,,,カスミガセキソウゴウジョウホウセンター,0
746156,7010005031842,01,0,2020-05-21,2020-05-21,カルミア一般社団法人,,399,東京都,千代田区,丸の内３丁目１番１号東京共同会計事務所内,,13,101,1000005,,,,,,,2020-05-21,1,,,,,カルミア,0
746157,7010005031850,01,0,2020-05-22,2020-05-22,日本ロジスティクス協同組合,,399,東京都,千代田区,神田駿河台２丁目５番１２号,,13,101,1010062,,,,,,,2020-05-22,1,,,,,ニホンロジスティクス,0
746158,7010005031859,01,0,2020-05-26,2020-05-26,一般社団法人ＦＬＯＷ,,399,東京都,文京区,本郷３丁目４０番１０号,,13,105,1130033,,,,,,,2020-05-26,1,,,,,フロウ,0
867162,8010005030018,01,0,2019-04-12,2019-04-09,特定非営利活動法人公共政策調査機構,,399,東京都,千代田区,霞が関３丁目６－１４三久ビル４階,,13,101,1000013,,,,,,,2019-04-09,1,,,,,コウキョウセイサクチョウサキコウ,0
867163,8010005030026,01,0,2019-04-12,2019-04-09,モントリオール一般社団法人,,399,東京都,千代田区,丸の内３丁目１番１号東京共同会計事務所内,,13,101,1000005,,,,,,,2019-04-09,1,,,,,モントリオール,0
867164,8010005030034,01,0,2019-04-16,2019-04-11,一般社団法人ＮＵ日本特別支部,,399,東京都,千代田区,神田須田町２丁目１７番地山梅ビル５階,,13,101,1010041,,,,,,,2019-04-11,1,,,,,エヌウーニホントクベツシブ,0
867165,8010005030042,01,0,2019-04-19,2019-04-16,ＳＫＩＰ監査法人,,399,東京都,千代田区,二番町１２番地１３セブネスビル,,13,101,1020084,,,,,,,2019-04-16,1,,,,,スキップ,0
867166,8010005030050,01,0,2019-04-22,2019-04-17,一般社団法人奈良大宮ホテル,,399,東京都,千代田区,霞が関３丁目２番５号,,13,101,1000013,,,,,,,2019-04-17,1,,,,,ナラオオミヤホテル,0
867167,8010005030059,01,0,2019-04-22,2019-04-17,一般社団法人国際アカデミー振興会,,399,東京都,千代田区,平河町１丁目４番３号,,13,101,1020093,,,,,,,2019-04-17,1,,,,,コクサイアカデミーシンコウカイ,0
867168,8010005030075,12,0,2019-12-10,2019-12-05,大阪北港マリーナ特定目的会社,,399,東京都,港区,高輪４丁目４番１３号,,13,103,1080074,,,,,,,2019-04-24,1,,,,,オオサカホッコウマリーナ,0
867169,8010005030091,01,0,2019-05-07,2019-04-24,一般社団法人五泉市発電所,,399,東京都,千代田区,丸の内３丁目１番１号東京共同会計事務所内,,13,101,1000005,,,,,,,2019-04-24,1,,,,,ゴセンシハツデンショ,0
867170,8010005030100,01,0,2019-06-03,2019-05-29,一般社団法人ＶＲＭコンソーシアム,,399,東京都,中央区,銀座４丁目１２－１５歌舞伎座タワー,,13,102,1040061,,,,,,,2019-05-29,1,,,,,ブイアールエムコンソーシアム,0
867171,8010005030109,01,0,2019-05-13,2019-05-08,一般社団法人リバー,,399,東京都,千代田区,丸の内３丁目１番１号東京共同会計事務所内,,13,101,1000005,,,,,,,2019-05-08,1,,,,,リバー,0
867172,8010005030117,01,0,2019-05-16,2019-05-13,一般社団法人ＳＤＧｓプラットフォーム,,399,東京都,千代田区,九段南１丁目５番６号りそな九段ビル５階,,13,101,1020074,,,,,,,2019-05-13,1,,,,,エスディージーズプラットフォーム,0
867173,8010005030125,01,0,2019-05-14,2019-05-09,一般社団法人キッズキッチン協会,,399,東京都,千代田区,有楽町１丁目１番３号,,13,101,1000006,,,,,,,2019-05-09,1,,,,,キッズキッチンキョウカイ,0
867174,8010005030133,01,0,2019-05-20,2019-05-15,特定非営利活動法人首都圏地盤解析ネットワーク,,399,東京都,中央区,築地７丁目１８番２８－１０１４,,13,102,1040045,,,,,,,2019-05-15,1,,,,,シュトケンジバンカイセキネットワーク,0
867175,8010005030158,01,0,2019-05-20,2019-05-15,一般社団法人ＶＣ銀座ホールディング,,399,東京都,千代田区,丸の内３丁目１番１号東京共同会計事務所内,,13,101,1000005,,,,,,,2019-05-15,1,,,,,ブイシーギンザホールディング,0
867176,8010005030174,01,0,2019-05-23,2019-05-20,トリオ特定目的会社,,399,東京都,中央区,銀座１丁目６番１１号アースタックス税理士法人内,,13,102,1040061,,,,,,,2019-05-20,1,,,,,トリオ,0
867177,8010005030182,01,0,2019-05-23,2019-05-20,一般社団法人日本ウインドパワー,,399,東京都,千代田区,丸の内３丁目１番１号東京共同会計事務所内,,13,101,1000005,,,,,,,2019-05-20,1,,,,,ニホンウインドパワー,0
867178,8010005030190,01,0,2019-05-22,2019-05-17,一般社団法人赤羽志茂開発,,399,東京都,千代田区,平河町１丁目６番１５号シルスフィア会計事務所内,,13,101,1020093,,,,,,,2019-05-17,1,,,,,アカバネシモカイハツ,0
867179,8010005030199,01,0,2019-05-24,2019-05-21,一般社団法人菊池泗水,,399,東京都,文京区,本郷４丁目９番２２号,,13,105,1130033,,,,,,,2019-05-21,1,,,,,キクチシスイ,0
867180,8010005030208,01,0,2019-05-28,2019-05-23,一般社団法人ギビングフォワード,,399,東京都,千代田区,平河町１丁目４－１５ＶＯＲＴ麹町４階,,13,101,1020093,,,,,,,2019-05-23,1,,,,,ギビングフォワード,0
867181,8010005030224,01,0,2019-06-05,2019-05-31,一般社団法人腎癌研究会,,399,東京都,千代田区,丸の内１丁目９番２号グラントウキョウサウスタワー１７階,,13,101,1000005,,,,,,,2019-05-31,1,,,,,ジンガンケンキュウカイ,0
867182,8010005030232,01,0,2019-05-31,2019-05-28,一般社団法人日本陝西総商会,,399,東京都,中央区,東日本橋２丁目２５番４号第３シラカワビル５Ｆ,,13,102,1030004,,,,,,,2019-05-28,1,,,,,ニホンセンセイソウショウカイ,0
867183,8010005030240,01,0,2019-05-31,2019-05-28,一般社団法人日本セキュリティトークン協会,,399,東京都,中央区,日本橋本町４丁目８番１６号千城ビル５階ＢｃＨ,,13,102,1030023,,,,,,,2019-05-28,1,,,,,ニホンセキュリティトークンキョウカイ,0
867184,8010005030257,01,0,2019-06-06,2019-06-03,一般社団法人晴海ホールディングス,,399,東京都,千代田区,丸の内３丁目１番１号東京共同会計事務所内,,13,101,1000005,,,,,,,2019-06-03,1,,,,,ハルミホールディングス,0
867185,8010005030265,01,0,2019-06-14,2019-06-11,一般社団法人志根塾,,399,東京都,千代田区,九段南１丁目５－６りそな九段ビル５Ｆ,,13,101,1020074,,,,,,,2019-06-11,1,,,,,シコンジュク,0
867186,8010005030273,01,0,2019-06-19,2019-06-14,一般財団法人サンダーバードグローバル経営大学院教育財団,,399,東京都,千代田区,丸の内１丁目６番２号新丸の内センタービルディング２１階,,13,101,1000005,,,,,,,2019-06-14,1,,,,,サンダーバードグローバルケイエイダイガクインキョウイクザイダン,0
867187,8010005030298,01,0,2019-06-17,2019-06-12,一般社団法人西新宿ワン,,399,東京都,中央区,日本橋本町１丁目６番３号８０５,,13,102,1030023,,,,,,,2019-06-12,1,,,,,ニシシンジュクワン,0
867188,8010005030307,01,0,2019-06-18,2019-06-13,特定非営利活動法人国際ペット共生協会,,399,東京都,中央区,日本橋箱崎町３９番４－７０３号,,13,102,1030015,,,,,,,2019-06-13,1,,,,,コクサイペットキョウセイキョウカイ,0
867189,8010005030315,01,0,2019-06-19,2019-06-14,一般社団法人子育て支援機構,,399,東京都,中央区,日本橋浜町１丁目７番４号,,13,102,1030007,,,,,,,2019-06-14,1,,,,,コソダテシエンキコウ,0
867190,8010005030323,01,1,2019-06-27,2019-06-18,特許業務法人アドバンス,,399,東京都,千代田区,有楽町２丁目１０番１号,,13,101,1000006,,,,,,,2019-06-18,1,Advance Patent Professional Corporation,Tokyo,"10-1, Yurakucho 2-Chome, Chiyoda ku",,アドバンス,0
867191,8010005030331,01,0,2019-06-24,2019-06-19,一般社団法人プライムソーラー２ホールディング,,399,東京都,千代田区,丸の内３丁目１番１号東京共同会計事務所内,,13,101,1000005,,,,,,,2019-06-19,1,,,,,プライムソーラーツーホールディング,0
867192,8010005030364,01,0,2019-06-28,2019-06-25,一般社団法人ＶＣ銀座ホールディング２号,,399,東京都,千代田区,丸の内３丁目１番１号東京共同会計事務所内,,13,101,1000005,,,,,,,2019-06-25,1,,,,,ブイシーギンザホールディングニゴウ,0
867193,8010005030372,01,0,2019-07-08,2019-07-03,弁護士法人東京永田町法律事務所,,399,東京都,千代田区,永田町２丁目９番８号パレロワイヤル永田町７０６号,,13,101,1000014,,,,,,,2019-07-03,1,,,,,トウキョウナガタチョウホウリツジムショ,0
867194,8010005030380,01,0,2019-07-03,2019-06-28,一般社団法人悠洛,,399,東京都,千代田区,霞が関３丁目２番５号,,13,101,1000013,,,,,,,2019-06-28,1,,,,,ユウラ,0
867195,8010005030389,01,0,2019-07-04,2019-07-01,一般社団法人ヒトイクラボ,,399,東京都,千代田区,神田佐久間町３丁目３８第５東ビル５Ｆ,,13,101,1010025,,,,,,,2019-07-01,1,,,,,ヒトイクラボ,0
867196,8010005030414,01,0,2019-07-08,2019-07-03,一般社団法人日本社会薬学会,,399,東京都,千代田区,一ツ橋１丁目１番１号株式会社毎日学術フォーラム内,,13,101,1000003,,,,,,,2019-07-03,1,,,,,,0
867197,8010005030422,01,0,2019-07-29,2019-07-24,一般財団法人メコン現代美術振興財団,,399,東京都,千代田区,霞が関３丁目２番５号霞が関ビルディング３１階,,13,101,1000013,,,,,,,2019-07-24,1,,,,,メコンゲンダイビジュツシンコウザイダン,0
867198,8010005030439,01,0,2019-07-19,2019-07-16,一般社団法人グリーングラスウィンド草原の風,,399,東京都,千代田区,神田駿河台３丁目１番地８,,13,101,1010062,,,,,,,2019-07-16,1,,,,,グリーングラスウィンドソウゲンノカゼ,0
867199,8010005030447,01,0,2019-07-18,2019-07-12,特定非営利活動法人小笠原の原植生を育む会,,399,東京都,千代田区,六番町７番地日林協会館３階,,13,101,1020085,,,,,,,2019-07-12,1,,,,,オガサワラノゲンショクセイヲハグクムカイ,0
867200,8010005030455,01,0,2019-07-19,2019-07-16,一般社団法人サポートホールディングスＪＲＥさつま,,399,東京都,千代田区,丸の内３丁目１番１号東京共同会計事務所内,,13,101,1000005,,,,,,,2019-07-16,1,,,,,サポートホールディングスジェイアールイーサツマ,0
867201,8010005030463,01,0,2019-07-22,2019-07-17,一般社団法人キャリアエデュケーション協会,,399,東京都,中央区,銀座７丁目１３番６号サガミビル２階,,13,102,1040061,,,,,,,2019-07-17,1,,,,,キャリアエデュケーションキョウカイ,0
867202,8010005030471,01,0,2019-07-22,2019-07-17,一般社団法人東京国際消化器内視鏡医療促進協会,,399,東京都,千代田区,九段南１丁目５番６号りそな九段ビル５Ｆ,,13,101,1020074,,,,,,,2019-07-17,1,,,,,トウキョウコクサイショウカキナイシキョウイリョウソクシンキョウカイ,0
867203,8010005030505,01,0,2019-07-30,2019-07-25,一般社団法人無線ＬＡＮビジネス推進連絡会,,399,東京都,千代田区,岩本町３丁目２番４号,,13,101,1010032,,,,,,,2019-07-25,1,,,,,ムセンランビジネススイシンレンラクカイ,0
867204,8010005030513,01,0,2019-07-30,2019-07-25,一般社団法人開発７５号,,399,東京都,千代田区,飯田橋１丁目３番２号曙杉館４階清和コンサルティング株式会社内,,13,101,1020072,,,,,,,2019-07-25,1,,,,,カイハツナナジュウゴゴウ,0
867205,8010005030538,12,0,2019-10-07,2019-10-01,特定非営利活動法人皮膚がん・免疫・アレルギー疾患治療支援センター,,399,東京都,新宿区,信濃町３５,,13,104,1600016,,,,,,,2019-08-08,1,,,,,ヒフガンメンエキアレルギーシッカンチリョウシエンセンター,0
867206,8010005030546,01,0,2019-08-06,2019-08-01,東京レジ９一般社団法人,,399,東京都,千代田区,丸の内３丁目１番１号東京共同会計事務所内,,13,101,1000005,,,,,,,2019-08-01,1,,,,,トウキョウレジナイン,0
867207,8010005030554,01,0,2019-08-06,2019-08-01,一般社団法人オタクコイン協会,,399,東京都,千代田区,平河町２丁目５番３号,,13,101,1020093,,,,,,,2019-08-01,1,,,,,オタクコインキョウカイ,0
867208,8010005030579,01,0,2019-08-09,2019-08-06,一般社団法人日本図書読み聞かせ協会,,399,東京都,文京区,本郷１丁目３３番１２号,,13,105,1130033,,,,,,,2019-08-06,1,,,,,ニホントショヨミキカセキョウカイ,0
867209,8010005030587,01,0,2019-08-15,2019-08-09,一般社団法人留学生就職サポート協会,,399,東京都,千代田区,神田神保町２丁目２３番地５,,13,101,1010051,,,,,,,2019-08-09,1,,,,,リュウガクセイシュウショクサポートキョウカイ,0
867210,8010005030604,01,0,2019-08-20,2019-08-15,ＬＪＰＦ１一般社団法人,,399,東京都,千代田区,丸の内３丁目１番１号東京共同会計事務所内,,13,101,1000005,,,,,,,2019-08-15,1,,,,,エルジェイピーエフワン,0
867211,8010005030612,01,0,2019-08-27,2019-08-22,一般社団法人Ｇａｍｉｎｇ　Ｃｏｍｍｕｎｉｔｙ　Ｎｅｔｗｏｒｋ,,399,東京都,中央区,東日本橋２丁目２５番４号第３シラカワビル２階,,13,102,1030004,,,,,,,2019-08-22,1,,,,,ゲーミングコミュニティネットワーク,0
867212,8010005030629,01,0,2019-08-22,2019-08-19,一般社団法人Ｔｒｉ　Ｆｌｏｒｉ,,399,東京都,千代田区,霞が関３丁目２番５号,,13,101,1000013,,,,,,,2019-08-19,1,,,,,,0
867213,8010005030637,01,0,2019-08-26,2019-08-21,一般社団法人日本科学技術協会,,399,東京都,千代田区,内神田３丁目４番６号冨士エレベータービル２Ｆ,,13,101,1010047,,,,,,,2019-08-21,1,,,,,ニホンカガクギジュツキョウカイ,0
867214,8010005030661,01,0,2019-09-03,2019-08-29,一般社団法人まほろば会,,399,東京都,中央区,勝どき１丁目８番１－５２０８号,,13,102,1040054,,,,,,,2019-08-29,1,,,,,マホロバカイ,0
867215,8010005030686,01,0,2019-09-05,2019-09-02,一般社団法人ＧＯＯＤ　ＯＮ　ＲＯＯＦＳ,,399,東京都,千代田区,内幸町２丁目２番３号日比谷国際ビル１８階１８０１号,,13,101,1000011,,,,,,,2019-09-02,1,,,,,グッドオンルーフス,0
867216,8010005030694,01,0,2019-09-06,2019-09-03,一般社団法人伊良部島リゾート,,399,東京都,千代田区,霞が関３丁目２番５号,,13,101,1000013,,,,,,,2019-09-03,1,,,,,イラブジマリゾート,0
867217,8010005030711,01,0,2019-09-09,2019-09-04,ＡＭ　ａｌｐｈａ特定目的会社,,399,東京都,千代田区,丸の内３丁目１番１号東京共同会計事務所内,,13,101,1000005,,,,,,,2019-09-04,1,,,,,エーエムアルファ,0
867218,8010005030736,01,0,2019-09-12,2019-09-09,東京レジ・アイリス・１一般社団法人,,399,東京都,千代田区,丸の内３丁目１番１号東京共同会計事務所内,,13,101,1000005,,,,,,,2019-09-09,1,,,,,トウキョウレジアイリスワン,0
867219,8010005030744,01,0,2019-09-24,2019-09-18,一般社団法人ジャパンイノベーションパーク,,399,東京都,中央区,日本橋本町３丁目３番３号,,13,102,1030023,,,,,,,2019-09-18,1,,,,,ジャパンイノベーションパーク,0
867220,8010005030752,01,0,2019-09-13,2019-09-10,一般社団法人日本アジア協会,,399,東京都,千代田区,麹町３丁目４番１号麹町三丁目ビル３０２,,13,101,1020083,,,,,,,2019-09-10,1,,,,,ニホンアジアキョウカイ,0
867221,8010005030760,12,0,2020-04-06,2020-04-01,一般社団法人ＡＤ．Ｓｔｅｍ　Ｃｅｌｌ,,399,東京都,中央区,銀座２丁目７番６号,,13,102,1040061,,,,,,,2019-09-13,1,,,,,エーディーステムセル,0
867222,8010005030769,01,0,2019-09-20,2019-09-17,医療法人社団月島キャピタル・クリニック,,399,東京都,中央区,月島１丁目５番２号２階,,13,102,1040052,,,,,,,2019-09-17,1,,,,,ツキシマキャピタルクリニック,0
867223,8010005030777,01,0,2019-09-20,2019-09-17,一般社団法人温故知新エイト,,399,東京都,千代田区,平河町１丁目６番１５号シルスフィア会計事務所内,,13,101,1020093,,,,,,,2019-09-17,1,,,,,オンコチシンエイト,0
867224,8010005030785,01,0,2019-09-25,2019-09-19,一般社団法人トラストワン,,399,東京都,千代田区,内神田２丁目２番６号５階あすな会計事務所内,,13,101,1010047,,,,,,,2019-09-19,1,,,,,トラストワン,0
867225,8010005030819,01,0,2019-10-03,2019-09-30,一般社団法人ＰＧＨ,,399,東京都,中央区,日本橋人形町３丁目１０番１号,,13,102,1030013,,,,,,,2019-09-30,1,,,,,ピージーエイチ,0
867226,8010005030835,01,0,2019-10-07,2019-10-02,税理士法人渡辺会計,,399,東京都,中央区,日本橋室町１丁目８番２号末広ビル５Ｆ,,13,102,1030022,,,,,,,2019-10-02,1,,,,,ワタナベカイケイ,0
867227,8010005030843,01,0,2019-10-10,2019-10-07,一般財団法人ＣＴＣ未来財団,,399,東京都,千代田区,霞が関３丁目２番５号,,13,101,1000013,,,,,,,2019-10-07,1,,,,,シーティーシーミライザイダン,0
867228,8010005030851,01,0,2019-11-05,2019-10-30,社会保険労務士法人日本橋事務所,,399,東京都,中央区,日本橋本町２丁目３番６号協同ビル,,13,102,1030023,,,,,,,2019-10-30,1,,,,,ニホンバシジムショ,0
867229,8010005030868,01,0,2019-10-10,2019-10-07,一般社団法人エス・ケー・ビー宮崎台,,399,東京都,中央区,日本橋１丁目４番１号,,13,102,1030027,,,,,,,2019-10-07,1,,,,,エスケービーミヤザキダイ,0
867230,8010005030884,01,0,2019-10-23,2019-10-17,一般社団法人強羅,,399,東京都,千代田区,霞が関３丁目２番５号,,13,101,1000013,,,,,,,2019-10-17,1,,,,,ゴウラ,0
867231,8010005030892,01,0,2019-10-21,2019-10-16,一般社団法人Ａｒｃｈ　Ａｎｇｅｌ　Ａｓｓｏｃｉａｔｉｏｎ,,399,東京都,中央区,銀座４丁目１４番７号,,13,102,1040061,,,,,,,2019-10-16,1,,,,,アーキエンジェルアソシエイション,0
867232,8010005030926,01,0,2019-10-30,2019-10-25,一般社団法人日本アクティブ・ケア協会,,399,東京都,中央区,日本橋１丁目１４番５号,,13,102,1030027,,,,,,,2019-10-25,1,,,,,ニホンアクティブケアキョウカイ,0
867233,8010005030934,12,0,2020-02-19,2020-02-17,浦和美園特定目的会社,,399,東京都,千代田区,飯田橋４丁目７番１号結和税理士法人内,,13,101,1020072,,,,,,,2019-10-25,1,,,,,ウラワミソノ,0
867234,8010005030942,01,0,2019-11-05,2019-10-30,一般社団法人日本社会学会,,399,東京都,文京区,本郷７丁目３番１号東京大学文学部社会学研究室内,,13,105,1130033,,,,,,,2019-10-30,1,,,,,ニホンシャカイガッカイ,0
867235,8010005030950,01,0,2019-11-06,2019-11-01,一般社団法人ＫＨＣＦ２,,399,東京都,千代田区,内幸町２丁目１番６号,,13,101,1000011,,,,,,,2019-11-01,1,,,,,ケイエイチシーエフツー,0
867236,8010005030959,01,0,2019-11-08,2019-11-05,ＰｗＣ行政書士法人,,399,東京都,千代田区,霞が関３丁目２番５号,,13,101,1000013,,,,,,,2019-11-05,1,,,,,ピーダブリューシー,0
867237,8010005030967,01,0,2019-11-12,2019-11-07,一般社団法人日中人工知能学会,,399,東京都,中央区,八丁堀４丁目１０番地２八丁堀ビル３Ｆ,,13,102,1040032,,,,,,,2019-11-07,1,,,,,ニッチュウジンコウチノウガッカイ,0
867238,8010005030983,01,0,2019-11-11,2019-11-06,一般社団法人日本他家幹細胞国際研究会,,399,東京都,千代田区,神田小川町２丁目２番８号,,13,101,1010052,,,,,,,2019-11-06,1,,,,,ニホンタカカンサイボウコクサイケンキュウカイ,0
867239,8010005031024,01,0,2019-11-13,2019-11-08,一般社団法人全国医療的ケア児者支援協議会,,399,東京都,千代田区,神田神保町１丁目１４番１号,,13,101,1010051,,,,,,,2019-11-08,1,,,,,ゼンコクイリョウテキケアジシャシエンキョウギカイ,0
867240,8010005031032,01,0,2019-11-14,2019-11-11,一般社団法人ｉｎｃ．Ａｌｌｉａｎｃｅ　Ｓｅｒｖｉｃｅ,,399,東京都,千代田区,丸の内２丁目３番２号,,13,101,1000005,,,,,,,2019-11-11,1,,,,,インクアライアンスサービス,0
867241,8010005031040,01,0,2019-11-18,2019-11-13,一般社団法人ロッキーゲートスリー,,399,東京都,中央区,日本橋１丁目４番１号,,13,102,1030027,,,,,,,2019-11-13,1,,,,,ロッキーゲートスリー,0
867242,8010005031057,01,0,2019-11-18,2019-11-13,ＳＴＦ一般社団法人,,399,東京都,千代田区,丸の内３丁目１番１号東京共同会計事務所内,,13,101,1000005,,,,,,,2019-11-13,1,,,,,エスティーエフ,0
