275969,3010405011258,01,1,2018-07-23,2015-10-05,一般社団法人国際魅力学会,,399,東京都,港区,港南３丁目６番２１－１２０２号,,13,103,1080075,,,,,,,2015-10-05,1,,,,,コクサイミリョクガッカイ,0
275970,3010405011274,21,0,2019-10-02,2019-09-19,一般社団法人東京不動産相続センター,,399,東京都,港区,赤坂３丁目４番３号アパ赤坂ゲイトウェイビル７階,,13,103,1070052,,,2019-09-19,01,,,2015-10-05,1,,,,,トウキョウフドウサンソウゾクセンター,0
275971,3010405011282,21,0,2019-10-09,2019-09-27,富士一般社団法人,,399,東京都,港区,虎ノ門３丁目２２番１０－２０１号,,13,103,1050001,,,2019-09-27,01,,,2015-10-05,1,,,,,フジ,0
275972,3010405011290,01,1,2018-08-01,2015-10-05,一般社団法人麻布教育研究所,,399,東京都,港区,東麻布１丁目２７－８,,13,103,1060044,,,,,,,2015-10-05,1,,,,,アザブキョウイクケンキュウジョ,0
275973,3010405011299,01,0,2015-10-28,2015-10-05,一般社団法人旬食ニッポン,,399,東京都,台東区,三ノ輪１丁目２１番５号菊地ビル,,13,106,1100011,,,,,,,2015-10-05,1,,,,,,0
275974,3010405011308,01,1,2018-05-18,2015-10-05,特定非営利活動法人Ｎａｇｏｍｉ　Ｖｉｓｉｔ,,399,東京都,港区,南青山２丁目２番１５号,,13,103,1070062,,,,,,,2015-10-05,1,,,,,ナゴミビジット,0
275975,3010405011332,01,1,2019-01-18,2015-10-05,Ｇｒａｎａｄａ一般社団法人,,399,東京都,港区,西新橋１丁目２番９号ＥＰコンサルティングサービス内,,13,103,1050003,,,,,,,2015-10-05,1,,,,,グラナダ,0
275976,3010405011456,21,0,2018-09-07,2018-08-30,当別アグリソーラー一般社団法人,,399,東京都,港区,新橋３丁目２６番３号会計ビル,,13,103,1050004,,,2018-08-30,01,,,2015-10-05,1,,,,,トウベツアグリソーラー,0
275977,3010405011489,11,0,2018-07-27,2018-07-17,一般社団法人ワーク・アット,,399,東京都,港区,赤坂６丁目１９番７－３０７号,,13,103,1070052,,,,,,,2015-10-05,1,,,,,ワークアット,0
275978,3010405011679,01,0,2015-10-26,2015-10-05,弁護士法人廣澤法律事務所,,399,東京都,港区,新橋２丁目１６番１号ニュー新橋ビル６１８号室,,13,103,1050004,,,,,,,2015-10-05,1,,,,,,0
275979,3010405011720,01,0,2015-10-26,2015-10-05,一般財団法人経営革新審査支援機構,,399,東京都,港区,芝４丁目１６番１－２６０２号,,13,103,1080014,,,,,,,2015-10-05,1,,,,,,0
275980,3010405011745,12,0,2017-04-26,2017-04-17,一般社団法人国際医療健康福祉協会,,399,東京都,港区,港南２丁目１２番２３号,,13,103,1080075,,,,,,,2015-10-05,1,,,,,,0
275981,3010405011761,12,0,2016-04-15,2016-04-12,一般社団法人インターナショナル幼児教育協会,,399,東京都,大田区,田園調布４丁目２番１２号,,13,111,1450071,,,,,,,2015-10-05,1,,,,,,0
275982,3010405011778,01,0,2015-10-26,2015-10-05,特定非営利活動法人Ｆｅｌｉｃｉｄａｄ　ｓｐｏｒｔｓ　ｃｏｍｍｕｎｉｔｙ,,399,東京都,港区,元麻布３丁目１１番４号アパートメント麻布１０－５０６,,13,103,1060046,,,,,,,2015-10-05,1,,,,,,0
275983,3010405011803,12,1,2019-02-27,2016-04-07,一般社団法人日本薬学生連盟,,399,東京都,渋谷区,幡ヶ谷３丁目３９番１２号渋谷ウェストビル１階,,13,113,1510072,,,,,,,2015-10-05,1,,,,,ニホンヤクガクセイレンメイ,0
275984,3010405011836,01,0,2015-10-26,2015-10-05,一般社団法人日本スポーツビューティ協会,,399,東京都,港区,六本木１丁目９番３５号,,13,103,1060032,,,,,,,2015-10-05,1,,,,,,0
275985,3010405011844,01,1,2019-03-19,2015-10-05,Ｏｉｔａ　Ｓｏｌａｒ　Ｈｏｌｄｉｎｇｓ一般社団法人,,399,東京都,港区,虎ノ門３丁目２２番１０―２０１号,,13,103,1050001,,,,,,,2015-10-05,1,,,,,オオイタソーラーホールディングス,0
275986,3010405011869,01,0,2015-10-26,2015-10-05,一般社団法人渡邊三郎会,,399,東京都,港区,高輪４丁目６番１５号,,13,103,1080074,,,,,,,2015-10-05,1,,,,,,0
275987,3010405011877,01,0,2015-10-26,2015-10-05,一般社団法人エスエイチ３号,,399,東京都,港区,元赤坂１丁目１番８号株式会社赤坂国際会計内,,13,103,1070051,,,,,,,2015-10-05,1,,,,,,0
275988,3010405011902,01,0,2015-10-26,2015-10-05,一般社団法人日本心身セルフケア協会,,399,東京都,港区,麻布十番１丁目５番１１－３０２号,,13,103,1060045,,,,,,,2015-10-05,1,,,,,,0
275989,3010405011927,01,0,2015-10-26,2015-10-05,特定非営利活動法人風の谷委員会,,399,東京都,港区,高輪３丁目２５番２０号,,13,103,1080074,,,,,,,2015-10-05,1,,,,,,0
275990,3010405011935,21,0,2016-12-20,2016-12-14,Ｒａｎｎｏｃｈ一般社団法人,,399,東京都,港区,西新橋１丁目２番９号ＥＰコンサルティングサービス内,,13,103,1050003,,,2016-12-14,01,,,2015-10-05,1,,,,,,0
275991,3010405011976,12,1,2018-10-30,2018-10-23,特定非営利活動法人音楽支援協会,,399,東京都,港区,赤坂６丁目１９番４０号赤坂レジデンス２０５,,13,103,1070052,,,,,,,2015-10-05,1,,,,,オンガクシエンキョウカイ,0
275992,3010405011984,01,0,2015-10-26,2015-10-05,一般社団法人ＳｏｌＤｅａ,,399,東京都,港区,三田２丁目１３番７号みた春日野３０１,,13,103,1080073,,,,,,,2015-10-05,1,,,,,,0
275993,3010405011992,12,1,2019-05-28,2015-12-08,一般社団法人日本エキスパート協会,,399,東京都,港区,南青山２丁目２番１５号ウィン青山９４２,,13,103,1070062,,,,,,,2015-10-05,1,,,,,ニホンエキスパートキョウカイ,0
275994,3010405012009,01,1,2018-10-03,2015-10-05,東扇島シャトル事業協同組合,,399,東京都,港区,芝浦２丁目３番３９号,,13,103,1080023,,,,,,,2015-10-05,1,,,,,ヒガシオギシマシャトル,0
745,3010405012066,21,0,2020-05-29,2020-04-30,一般財団法人沖縄公共政策研究所,,399,東京都,港区,赤坂１丁目１２番３２号アーク森ビル３６階,,13,103,1070052,,,2020-04-30,01,,,2015-10-05,1,,,,,オキナワコウキョウセイサクケンキュウジョ,0
275996,3010405012082,01,0,2015-10-28,2015-10-05,一般社団法人ミャンマー証券経済研究所,,399,東京都,江東区,北砂１丁目３番４３－５０９号,,13,108,1360073,,,,,,,2015-10-05,1,,,,,,0
275997,3010405012108,12,0,2019-07-30,2019-07-24,一般社団法人日本・ミャンマー・文化経済交流協会,,399,東京都,目黒区,東が丘２丁目１１番１５号,,13,110,1520021,,,,,,,2015-10-05,1,,,,,ニホンミャンマーブンカケイザイコウリュウキョウカイ,0
275998,3010405012116,12,1,2019-04-26,2018-01-10,一般財団法人未来を創る財団,,399,東京都,渋谷区,恵比寿南１丁目７番８号,,13,113,1500022,,,,,,,2015-10-05,1,,,,,ミライヲツクルザイダン,0
275999,3010405012124,12,0,2016-05-12,2016-04-28,一般社団法人ミスキャンパスサミット委員会,,399,東京都,港区,南青山２丁目２２番１４号,,13,103,1070062,,,,,,,2015-10-05,1,,,,,,0
276000,3010405012140,01,1,2018-09-13,2015-10-05,医療法人財団Ｃｈｉｒｏｎ,,399,東京都,港区,芝浦４丁目２０番４号芝浦アイランドブルームホームズ２階,,13,103,1080023,,,,,,,2015-10-05,1,,,,,キロン,0
276001,3010405012157,01,1,2019-12-03,2015-10-05,一般社団法人今井メガソーラー,,399,東京都,港区,元赤坂１丁目１番７号,,13,103,1070051,,,,,,,2015-10-05,1,,,,,イマイメガソーラー,0
276002,3010405012198,21,0,2016-10-19,2016-10-14,特定目的会社ＴＳＭＹ７,,399,東京都,港区,元赤坂１丁目１番７号,,13,103,1070051,,,2016-10-14,01,,,2015-10-05,1,,,,,,0
276003,3010405012215,01,1,2018-04-09,2015-10-05,川越特定目的会社,,399,東京都,港区,赤坂２丁目１０番５号税理士法人赤坂国際会計事務所内,,13,103,1070052,,,,,,,2015-10-05,1,,,,,カワゴエ,0
276004,3010405012223,01,0,2015-10-26,2015-10-05,一般社団法人在日本留学生会協議会,,399,東京都,港区,三田３丁目１番２３号,,13,103,1080073,,,,,,,2015-10-05,1,,,,,,0
276005,3010405012256,01,1,2019-11-26,2015-10-05,一般社団法人ＢＡＢＹＳＨＯＷＥＲ　ＪＡＰＡＮ,,399,東京都,港区,南青山２丁目２番１５号ウィン青山１４０３,,13,103,1070062,,,,,,,2015-10-05,1,,,,,ベビーシャワージャパン,0
276006,3010405012280,21,0,2016-10-19,2016-10-14,特定目的会社ＴＳＭＹ１１,,399,東京都,港区,元赤坂１丁目１番７号,,13,103,1070051,,,2016-10-14,01,,,2015-10-05,1,,,,,,0
276007,3010405012289,21,0,2019-03-08,2019-03-04,一般社団法人刈谷,,399,東京都,港区,虎ノ門３丁目２２番１０－２０１号,,13,103,1050001,,,2019-03-04,01,,,2015-10-05,1,,,,,カリヤ,0
276008,3010405012297,21,0,2016-11-02,2016-10-31,Ｔｓｕｋｉ特定目的会社,,399,東京都,港区,虎ノ門３丁目２２番１０－２０１号,,13,103,1050001,,,2016-10-31,01,,,2015-10-05,1,,,,,,0
276009,3010405012306,01,1,2019-11-27,2015-10-05,一般財団法人全陽倶楽部,,399,東京都,港区,虎ノ門３丁目１０番５号,,13,103,1050001,,,,,,,2015-10-05,1,,,,,ゼンヨウクラブ,0
276010,3010405012355,21,0,2015-11-10,2015-11-05,一般社団法人ＳＨ５３,,399,東京都,港区,虎ノ門３丁目２２番１０－２０１号,,13,103,1050001,,,2015-11-05,01,,,2015-10-05,1,,,,,,0
276011,3010405012405,01,0,2015-10-26,2015-10-05,一般財団法人井上・月丘映画財団,,399,東京都,港区,南青山１丁目１番１号新青山ビルヂング東館２Ｆ,,13,103,1070062,,,,,,,2015-10-05,1,,,,,,0
276012,3010405012413,01,0,2015-10-26,2015-10-05,特定非営利活動法人シーハート,,399,東京都,港区,虎ノ門４丁目２番１２号,,13,103,1050001,,,,,,,2015-10-05,1,,,,,,0
276013,3010405012421,01,1,2019-02-25,2015-10-05,一般社団法人スターエンタープライズ,,399,東京都,港区,白金台２丁目２５番１２号,,13,103,1080071,,,,,,,2015-10-05,1,,,,,スターエンタープライズ,0
276014,3010405012470,01,1,2018-12-25,2015-10-05,一般財団法人ドリーム夜さ来い祭りグローバル振興財団,,399,東京都,港区,港南４丁目６番８号ＷＣＴ－３１０６号室,,13,103,1080075,,,,,,,2015-10-05,1,,,,,ドリームヨサコイマツリグローバルシンコウザイダン,0
276015,3010405012479,12,1,2018-04-16,2017-05-12,一般社団法人ＳＨ５８,,399,東京都,港区,芝公園１丁目３番１号留園ビル６階,,13,103,1050011,,,,,,,2015-10-05,1,,,,,エスエイチファイブエイト,0
276016,3010405012537,01,0,2015-10-26,2015-10-05,特定非営利活動法人タブレット利活用協会,,399,東京都,港区,白金台３丁目２番３－７０８号,,13,103,1080071,,,,,,,2015-10-05,1,,,,,,0
276017,3010405012545,01,1,2018-08-09,2015-10-05,医療法人社団成章会,,399,東京都,港区,赤坂３丁目１番１６号ＢＩビル２階,,13,103,1070052,,,,,,,2015-10-05,1,,,,,セイショウカイ,0
276018,3010405012553,01,1,2018-05-14,2015-10-05,ブルーオーシャン一般社団法人,,399,東京都,港区,虎ノ門３丁目２２番１０－２０１号,,13,103,1050001,,,,,,,2015-10-05,1,,,,,ブルーオーシャン,0
276019,3010405012586,01,0,2015-10-26,2015-10-05,一般社団法人国際芸術認定機構,,399,東京都,港区,南青山５丁目１５番９号フラット青山１Ｆ,,13,103,1070062,,,,,,,2015-10-05,1,,,,,,0
276020,3010405012603,01,0,2015-10-26,2015-10-05,一般社団法人メイドインジャパン・ハラール支援協議会,,399,東京都,港区,六本木５丁目１８番１８号プレシャス六本木ビル７Ｆ,,13,103,1060032,,,,,,,2015-10-05,1,,,,,,0
276021,3010405012611,01,1,2018-05-16,2015-10-05,Ａｓｃｅｎｄａｓ　Ｊａｐａｎ　Ｎａｍｂａ特定目的会社,,399,東京都,港区,西新橋１丁目２番９号ＥＰコンサルティングサービス内,,13,103,1050003,,,,,,,2015-10-05,1,,,,,アセンダスジャパンナンバ,0
276022,3010405012702,21,0,2019-02-19,2019-02-13,Ｍｏｎｚａ特定目的会社,,399,東京都,港区,虎ノ門５丁目１番４号グローバル・ソリューションズ・コンサルティング株式会社内,,13,103,1050001,,,2019-02-13,01,,,2015-10-05,1,,,,,モンツァ,0
276023,3010405012727,01,0,2015-10-26,2015-10-05,一般財団法人御成門新報,,399,東京都,港区,西新橋３丁目２３番１２号,,13,103,1050003,,,,,,,2015-10-05,1,,,,,,0
276024,3010405012751,12,1,2018-04-10,2015-10-26,ＲＷ名古屋加福町特定目的会社,,399,東京都,中央区,日本橋１丁目４番１号日本橋一丁目ビルディング,,13,102,1030027,,,,,,,2015-10-05,1,,,,,アールダブリューナゴヤカフクチョウ,0
806,3010405012776,01,1,2020-06-04,2015-10-05,一般社団法人身元保証協会,,399,東京都,港区,南青山２丁目２番１５号ウィン青山１４０３,,13,103,1070062,,,,,,,2015-10-05,1,,,,,ミモトホショウキョウカイ,0
276026,3010405012784,01,0,2015-10-26,2015-10-05,一般社団法人オルタナティヴ・ラーニング協会,,399,東京都,港区,赤坂４丁目６番５－４０３号,,13,103,1070052,,,,,,,2015-10-05,1,,,,,,0
276027,3010405012792,11,1,2018-06-06,2016-04-05,一般社団法人内臓マッサージ協会,,399,東京都,港区,南青山５丁目１７番２号シドニービル５０２号,,13,103,1070062,,,,,,,2015-10-05,1,,,,,ナイゾウマッサージキョウカイ,0
276028,3010405012801,12,1,2018-05-02,2016-05-11,一般財団法人クリステルヴィアンサンブル,,399,東京都,港区,南青山２丁目２９－９南青山リハイム６０８号,,13,103,1070062,,,,,,,2015-10-05,1,,,,,クリステルヴィアンサンブル,0
276029,3010405012818,01,0,2015-10-26,2015-10-05,一般社団法人アジア人留学就労支援センター,,399,東京都,港区,赤坂３丁目１２番７号花岡ビル３階,,13,103,1070052,,,,,,,2015-10-05,1,,,,,,0
276030,3010405012826,21,0,2017-10-31,2017-10-25,一般社団法人軽井沢ホールディングス,,399,東京都,港区,元赤坂１丁目１番８号株式会社赤坂国際会計内,,13,103,1070051,,,2017-10-25,01,,,2015-10-05,1,,,,,,0
276031,3010405012834,21,0,2019-04-17,2019-04-04,一般社団法人シニア・バリュー・ホールディングス,,399,東京都,港区,虎ノ門４丁目３番１号城山トラストタワー３３階,,13,103,1050001,,,2019-04-04,01,,,2015-10-05,1,,,,,シニアテンバリューテンホールディングス,0
276032,3010405012850,01,1,2018-08-20,2015-10-05,一般社団法人手のひらデトックス協会,,399,東京都,港区,三田４丁目６番１６号,,13,103,1080073,,,,,,,2015-10-05,1,,,,,テノヒラデトックスキョウカイ,0
276033,3010405012859,12,0,2020-04-24,2020-04-20,一般社団法人日本スポーツアナリスト協会,,399,東京都,渋谷区,松濤１丁目２８番２号,,13,113,1500046,,,,,,,2015-10-05,1,,,,,ニホンスポーツアナリストキョウカイ,0
276034,3010405012867,21,0,2019-10-11,2019-10-02,一般社団法人えがお相続相談室,,399,東京都,港区,高輪３丁目２４番２１号,,13,103,1080074,,,2019-10-02,01,,,2015-10-05,1,,,,,エガオソウゾクソウダンシツ,0
276035,3010405012891,12,1,2020-05-18,2017-11-01,一般社団法人シェア基金,,399,東京都,港区,芝２丁目１４番５号,,13,103,1050014,,,,,,,2015-10-05,1,,,,,シェアキキン,0
276036,3010405012900,01,0,2015-10-26,2015-10-05,一般社団法人全日本建立協会,,399,東京都,港区,麻布十番１丁目７番１号,,13,103,1060045,,,,,,,2015-10-05,1,,,,,,0
276037,3010405012909,01,0,2015-10-26,2015-10-05,ＡＩＡ６特定目的会社,,399,東京都,港区,赤坂２丁目１０番５号税理士法人赤坂国際会計事務所内,,13,103,1070052,,,,,,,2015-10-05,1,,,,,,0
276038,3010405012917,01,0,2015-10-26,2015-10-05,ＡＩＡ１４特定目的会社,,399,東京都,港区,赤坂２丁目１０番５号税理士法人赤坂国際会計事務所内,,13,103,1070052,,,,,,,2015-10-05,1,,,,,,0
276039,3010405012925,01,0,2015-10-26,2015-10-05,特許業務法人井澤国際特許事務所,,399,東京都,港区,西新橋３丁目７番１号,,13,103,1050003,,,,,,,2015-10-05,1,,,,,,0
276040,3010405012933,01,1,2018-10-04,2015-10-05,税理士法人ＡＳＣ,,399,東京都,港区,芝浦３丁目１６番４号,,13,103,1080023,,,,,,,2015-10-05,1,,,,,エーエスシー,0
276041,3010405012941,01,0,2015-10-26,2015-10-05,弁護士法人赤坂見附法律事務所,,399,東京都,港区,赤坂３丁目２１番５号三銀ビル４階,,13,103,1070052,,,,,,,2015-10-05,1,,,,,,0
276042,3010405012974,21,0,2016-01-22,2016-01-18,一般社団法人ＳＨ０３,,399,東京都,港区,元赤坂１丁目１番８号株式会社赤坂国際会計内,,13,103,1070051,,,2016-01-18,01,,,2015-10-05,1,,,,,,0
276043,3010405012999,01,0,2015-10-26,2015-10-05,一般社団法人森林資源高機能評価・活用推進協議会,,399,東京都,港区,六本木６丁目１５番２１号ハークス六本木ビル,,13,103,1060032,,,,,,,2015-10-05,1,,,,,,0
276044,3010405013007,21,0,2019-12-04,2019-11-27,一般社団法人システムズ・イノベーション,,399,東京都,港区,麻布台１丁目１１番１０号,,13,103,1060041,,,2019-11-27,01,,,2015-10-05,1,,,,,システムズイノベーション,0
276045,3010405013023,01,0,2015-10-26,2015-10-05,一般社団法人日本マーケティングコピー協会,,399,東京都,港区,虎ノ門３丁目２２番１１号,,13,103,1050001,,,,,,,2015-10-05,1,,,,,,0
276046,3010405013056,01,1,2018-11-19,2015-10-05,一般社団法人高度情報技術活用コンソーシアム,,399,東京都,品川区,南大井６丁目１７番７号,,13,109,1400013,,,,,,,2015-10-05,1,,,,,コウドジョウホウギジュツカツヨウコンソーシアム,0
276047,3010405013080,01,1,2018-10-18,2015-10-05,新橋税理士法人,,399,東京都,港区,西新橋１丁目１６番４号ノアックスビル２階,,13,103,1050003,,,,,,,2015-10-05,1,,,,,シンバシ,0
276048,3010405013089,12,1,2018-05-09,2018-04-25,一般社団法人無電柱化民間プロジェクト実行委員会,,399,東京都,港区,南青山１丁目１５番１８号リーラ乃木坂６階,,13,103,1070062,,,,,,,2015-10-05,1,,,,,ムデンチュウカミンカンプロジェクトジッコウイインカイ,0
276049,3010405013097,21,0,2019-10-23,2019-10-08,Ｒａｅｔｉａ特定目的会社,,399,東京都,港区,西新橋１丁目２番９号ＥＰコンサルティングサービス内,,13,103,1050003,,,2019-10-08,01,,,2015-10-05,1,,,,,ラエティア,0
276050,3010405013106,12,0,2019-10-02,2019-09-19,ＮＰＯ法人日本ルーマニア音楽協会,,399,東京都,港区,南麻布４丁目５番４８号－４,,13,103,1060047,,,,,,,2015-10-05,1,,,,,,0
276051,3010405013122,21,0,2017-12-15,2017-12-13,一般社団法人ＳＰＮＨＯＬＤＩＮＧ１,,399,東京都,千代田区,九段南２丁目２番１号,,13,101,1020074,,,2017-12-13,01,,,2015-10-05,1,,,,,,0
276052,3010405013130,01,0,2015-10-26,2015-10-05,一般社団法人日本教育科学協会,,399,東京都,港区,海岸１丁目１番１号,,13,103,1050022,,,,,,,2015-10-05,1,,,,,,0
276053,3010405013139,21,0,2017-08-16,2017-08-07,あすみが丘ホールディング２一般社団法人,,399,東京都,港区,虎ノ門３丁目２２番１０－２０１号,,13,103,1050001,,,2017-08-07,01,,,2015-10-05,1,,,,,,0
276054,3010405013147,21,0,2018-04-18,2018-04-03,大府ホールディング２一般社団法人,,399,東京都,港区,元赤坂１丁目１番７号,,13,103,1070051,,,2018-04-03,01,,,2015-10-05,1,,,,,オオブホールディングツー,0
276055,3010405013155,12,1,2018-12-04,2016-02-03,一般社団法人日本美容心理協会,,399,東京都,港区,麻布十番２丁目２０番１０号,,13,103,1060045,,,,,,,2015-10-05,1,,,,,ニホンビヨウシンリキョウカイ,0
276056,3010405013171,01,1,2018-05-01,2015-10-05,税理士法人ａｕｄｉｅｎｃｅ,,399,東京都,千代田区,大手町１丁目６番１号,,13,101,1000004,,,,,,,2015-10-05,1,,,,,オーディエンス,0
276057,3010405013188,12,1,2018-10-11,2018-10-01,一般社団法人ＧＤＰ１,,399,東京都,港区,虎ノ門３丁目２２番１０－２０１号,,13,103,1050001,,,,,,,2015-10-05,1,,,,,ジーディーピーワン,0
276058,3010405013196,01,1,2020-03-23,2015-10-05,一般社団法人ＨＣＩＣヘルスケア産業従事者協会,,399,東京都,港区,麻布台３丁目４番１８号,,13,103,1060041,,,,,,,2015-10-05,1,,,,,エイチシアイシヘルスケアサンギョウジュウジシャキョウカイ,0
276059,3010405013205,01,0,2015-10-28,2015-10-05,一般社団法人再生因子フォーラム,,399,東京都,世田谷区,成城６丁目１４番２３号スクエアハウス成城１０２,,13,112,1570066,,,,,,,2015-10-05,1,,,,,,0
276060,3010405013221,12,1,2018-08-28,2018-08-08,一般社団法人日本ファッション産業協議会,,399,東京都,中央区,日本橋２丁目８番６号太陽生命ひまわり日本橋ビル８階,,13,102,1030027,,,,,,,2015-10-05,1,,,,,ニホンファッションサンギョウキョウギカイ,0
276061,3010405013238,01,0,2015-10-26,2015-10-05,一般社団法人Ｃｉｔｉｅｓ＆Ｃｒａｆｔｓ協会,,399,東京都,港区,浜松町２丁目７番１５号,,13,103,1050013,,,,,,,2015-10-05,1,,,,,,0
276062,3010405013246,01,0,2015-10-26,2015-10-05,一般社団法人ドクターズハウス,,399,東京都,港区,六本木１丁目７番２８－１０３号,,13,103,1060032,,,,,,,2015-10-05,1,,,,,,0
276063,3010405013254,01,0,2015-10-28,2015-10-05,特定非営利活動法人育児サポートｄｏｕｃｅ．,,399,東京都,文京区,関口２丁目８番８－７０２号,,13,105,1120014,,,,,,,2015-10-05,1,,,,,,0
276064,3010405013270,01,0,2015-10-26,2015-10-05,一般社団法人日本伝統文化国際支援協会,,399,東京都,港区,赤坂１丁目４番１４号ダイヤモンドビル赤坂５階,,13,103,1070052,,,,,,,2015-10-05,1,,,,,,0
276065,3010405013279,01,1,2018-04-23,2015-10-05,Ａｄｒｉａ一般社団法人,,399,東京都,港区,虎ノ門３丁目２２番１０－２０１号,,13,103,1050001,,,,,,,2015-10-05,1,,,,,アドリア,0
276066,3010405013287,01,0,2015-10-26,2015-10-05,一般社団法人真実アカデミー,,399,東京都,港区,高輪４丁目２１番１号セントラル品川３０１,,13,103,1080074,,,,,,,2015-10-05,1,,,,,,0
276067,3010405013295,21,0,2016-12-13,2016-12-08,一般社団法人本町クロス,,399,東京都,新宿区,四谷２丁目９番地１５あると綜合事務所内,,13,104,1600004,,,2016-12-08,01,,,2015-10-05,1,,,,,,0
276068,3010405013304,01,1,2020-02-06,2015-10-05,一般社団法人日本朝礼協会,,399,東京都,港区,三田１丁目３番３３号,,13,103,1080073,,,,,,,2015-10-05,1,,,,,ニホンチョウレイキョウカイ,0
276069,3010405013320,01,1,2019-01-21,2015-10-05,一般財団法人兼高かおる基金,,399,東京都,港区,六本木３丁目１５番１０号,,13,103,1060032,,,,,,,2015-10-05,1,,,,,カネタカカオルキキン,0
276070,3010405013337,21,0,2017-08-24,2017-08-16,一般社団法人東松山商業開発,,399,東京都,港区,赤坂２丁目１０番５号税理士法人赤坂国際会計事務所内,,13,103,1070052,,,2017-08-16,01,,,2015-10-05,1,,,,,,0
276071,3010405013345,21,0,2019-10-09,2019-10-02,特許業務法人アイザック国際特許商標事務所,,399,東京都,渋谷区,渋谷３丁目１９番１号渋谷オミビル４Ｆ,,13,113,1500002,,,2019-10-02,01,,,2015-10-05,1,,,,,アイザックコクサイトッキョショウヒョウジムショ,0
276072,3010405013353,12,0,2016-06-16,2016-06-13,一般社団法人全日本自動車救援士協会,,399,東京都,港区,赤坂８丁目７番１５号,,13,103,1070052,,,,,,,2015-10-05,1,,,,,,0
276073,3010405013386,21,0,2016-09-30,2016-09-21,犬山特定目的会社,,399,東京都,港区,虎ノ門３丁目２２番１０－２０１号,,13,103,1050001,,,2016-09-21,01,,,2015-10-05,1,,,,,,0
276074,3010405013394,21,0,2018-11-12,2018-11-08,一般社団法人日本特産品促進協会,,399,東京都,港区,海岸１丁目２番２０号,,13,103,1050022,,,2018-11-08,01,,,2015-10-05,1,,,,,ニホントクサンヒンソクシンキョウカイ,0
276075,3010405013411,21,0,2019-01-30,2019-01-23,一般社団法人ひろしまハイビル２１,,399,東京都,港区,元赤坂１丁目１番７号,,13,103,1070051,,,2019-01-23,01,,,2015-10-05,1,,,,,ヒロシマハイビルニジュウイチ,0
276076,3010405013428,21,0,2016-10-19,2016-10-14,特定目的会社ＴＳＭＹ１７,,399,東京都,港区,元赤坂１丁目１番７号,,13,103,1070051,,,2016-10-14,01,,,2015-10-05,1,,,,,,0
276077,3010405013436,21,0,2016-04-22,2016-04-11,一般社団法人Ｚｕｓｈｉ,,399,東京都,港区,虎ノ門５丁目１番４号,,13,103,1050001,,,2016-04-11,01,,,2015-10-05,1,,,,,,0
276078,3010405013444,12,1,2019-06-12,2017-12-27,一般社団法人ウーマンイノベーション,,399,東京都,港区,赤坂６丁目６番２号３階,,13,103,1070052,,,,,,,2015-10-05,1,,,,,ウーマンイノベーション,0
276079,3010405013452,01,0,2015-10-26,2015-10-05,特許業務法人河野国際特許商標事務所,,399,東京都,港区,赤坂２丁目２番２１号,,13,103,1070052,,,,,,,2015-10-05,1,,,,,,0
276080,3010405013469,21,0,2017-07-06,2017-06-29,一般社団法人ＴＳＭＨ５,,399,東京都,港区,元赤坂１丁目１番７号,,13,103,1070051,,,2017-06-29,01,,,2015-10-05,1,,,,,,0
276081,3010405013477,01,1,2019-04-01,2015-10-05,一般社団法人ＴＳＭ１２４,,399,東京都,港区,元赤坂１丁目１番７号,,13,103,1070051,,,,,,,2015-10-05,1,,,,,ティーエスエムヒャクニジュウヨン,0
