518441,5010405014713,12,1,2018-04-20,2017-08-15,弁護士法人戸田綜合法律事務所,,399,東京都,港区,六本木３丁目１８番１２号ゲッツビル２階,,13,103,1060032,,,,,,,2016-04-20,1,,,,,トダソウゴウホウリツジムショ,0
518442,5010405014721,01,0,2016-04-26,2016-04-20,一般社団法人日本ティー＆ハーブ協会,,399,東京都,港区,南青山５丁目１７番２号シドニービル５０２号,,13,103,1070062,,,,,,,2016-04-20,1,,,,,,0
518443,5010405014738,01,1,2019-01-09,2016-04-22,医療法人社団優愛歯会,,399,東京都,港区,六本木６丁目７番１０号簗場ビル５階,,13,103,1060032,,,,,,,2016-04-22,1,,,,,ユウアイシカイ,0
518444,5010405014754,01,1,2018-04-13,2016-04-19,一般社団法人栗栖地域活性化基金,,399,東京都,港区,虎ノ門３丁目２２番１０－２０１号,,13,103,1050001,,,,,,,2016-04-19,1,,,,,クリスチイキカッセイカキキン,0
518445,5010405014770,01,0,2016-05-16,2016-05-10,一般社団法人ジャパンビジネスラボ・アカデミー,,399,東京都,港区,北青山３丁目１１番７号ＡＯビル１１階,,13,103,1070061,,,,,,,2016-05-10,1,,,,,,0
518446,5010405014787,11,1,2018-06-06,2016-12-15,ＧＬＰ新座特定目的会社,,399,東京都,港区,東新橋１丁目５番２号汐留シティセンター,,13,103,1050021,,,,,,,2016-05-11,1,,,,,ジーエルピーニイザ,0
518447,5010405014795,01,1,2018-07-10,2016-05-16,一般社団法人外国人雇用協議会,,399,東京都,港区,赤坂２丁目１２番２１－４０２号,,13,103,1070052,,,,,,,2016-05-16,1,,,,,ガイコクジンコヨウキョウギカイ,0
518448,5010405014829,01,0,2016-06-01,2016-05-26,一般社団法人ミスジャパンエージェンシー,,399,東京都,港区,西麻布４丁目１８番１号アザブウエスト２Ｆ,,13,103,1060031,,,,,,,2016-05-26,1,,,,,,0
518449,5010405014845,12,0,2017-02-14,2017-02-08,森総合税理士法人,,399,東京都,港区,浜松町２丁目６番２号浜松町２６２ビル４階,,13,103,1050013,,,,,,,2016-06-07,1,,,,,,0
518450,5010405014861,01,1,2019-10-09,2016-06-09,一般社団法人チャデモ協議会,,399,東京都,港区,新橋１丁目１８番２号,,13,103,1050004,,,,,,,2016-06-09,1,,,,,チャデモキョウギカイ,0
518451,5010405014878,01,0,2016-06-22,2016-06-16,一般社団法人日中医療通訳協会,,399,東京都,港区,赤坂２丁目１７番６５－３１２号,,13,103,1070052,,,,,,,2016-06-16,1,,,,,,0
518452,5010405014886,01,1,2018-04-09,2016-06-20,グレープ一般社団法人,,399,東京都,港区,虎ノ門３丁目２２番１０－２０１号,,13,103,1050001,,,,,,,2016-06-20,1,,,,,グレープ,0
518453,5010405014894,01,1,2019-05-27,2016-06-27,一般社団法人現場きれい推進協議会,,399,東京都,港区,虎ノ門２丁目５番４号,,13,103,1050001,,,,,,,2016-06-27,1,,,,,ゲンバキレイスイシンキョウギカイ,0
518454,5010405014936,11,0,2018-08-10,2018-08-02,一般社団法人ストレスマネジメント協会,,399,東京都,港区,南青山３丁目１２番１２号,,13,103,1070062,,,,,,,2016-07-07,1,,,,,ストレスマネジメントキョウカイ,0
518455,5010405014952,12,1,2018-05-29,2016-11-09,桜土地家屋調査士法人,,399,東京都,港区,西新橋３丁目２４番１０号,,13,103,1050003,,,,,,,2016-07-13,1,,,,,サクラ,0
518456,5010405014969,12,0,2020-02-12,2020-02-03,一般社団法人日本コインランドリー協会,,399,東京都,新宿区,西新宿１丁目２５－１,,13,104,1600023,,,,,,,2016-07-25,1,,,,,ニホンコインランドリーキョウカイ,0
518457,5010405014977,01,0,2016-07-29,2016-07-26,一般社団法人日本女性ライフデザイン協会,,399,東京都,港区,南青山４丁目１７番３３号,,13,103,1070062,,,,,,,2016-07-26,1,,,,,,0
518458,5010405014993,12,1,2019-11-29,2019-11-21,一般社団法人タイゴルフ＆ウェルネス振興協会,,399,東京都,港区,南青山３丁目１７番１４号,,13,103,1070062,,,,,,,2016-08-03,1,,,,,タイゴルフアンドウェルネスシンコウキョウカイ,0
518459,5010405015001,01,1,2018-08-10,2016-08-05,司法書士法人ＡＢＥＮＯ,,399,東京都,港区,虎ノ門３丁目１８番１２号ステュディオ虎ノ門４０８号室,,13,103,1050001,,,,,,,2016-08-05,1,,,,,アベノ,0
518460,5010405015026,01,0,2016-08-12,2016-08-08,一般社団法人日本国際支援機構,,399,東京都,港区,赤坂８丁目５番８号リージェンシー新坂１階,,13,103,1070052,,,,,,,2016-08-08,1,,,,,,0
518461,5010405015034,21,0,2019-06-27,2019-06-14,ライトハウスキャピタル５一般社団法人,,399,東京都,港区,六本木１丁目６番１号泉ガーデンタワー,,13,103,1060032,,,2019-06-14,01,,,2016-08-09,1,,,,,ライトハウスキャピタルファイブ,0
518462,5010405015042,01,1,2018-04-24,2016-08-18,一般社団法人Ｇｌｏｂａｌ８,,399,東京都,港区,港南２丁目１５番１号品川インターシティＡ棟２８階,,13,103,1080075,,,,,,,2016-08-18,1,,,,,グローバルエイト,0
518463,5010405015067,01,1,2018-06-22,2016-08-30,弁護士法人フォアフロント,,399,東京都,港区,虎ノ門３丁目２５番２号虎ノ門ＥＳビル８０２,,13,103,1050001,,,,,,,2016-08-30,1,,,,,フォアフロント,0
518464,5010405015100,12,0,2019-07-01,2019-06-26,一般社団法人日本ユーロアジア・パートナーズ,,399,東京都,千代田区,神田駿河台２丁目９番地３３,,13,101,1010062,,,,,,,2016-09-08,1,,,,,ニホンユーロアジアパートナーズ,0
518465,5010405015109,21,0,2020-01-14,2019-12-26,一般社団法人あかざけいぶの全国自立支援センター,,399,東京都,港区,元赤坂１丁目７番１０号元赤坂ビル９Ｆ,,13,103,1070051,,,2019-12-26,01,,,2016-09-08,1,,,,,アカザケイブノゼンコクジリツシエンセンター,0
518466,5010405015125,21,0,2020-02-04,2020-01-23,ＴＧＡ　Ｇｉｎｚａ１１５一般社団法人,,399,東京都,港区,虎ノ門３丁目２２番１０－２０１号,,13,103,1050001,,,2020-01-23,01,,,2016-09-09,1,,,,,ティージーエーギンザイチイチゴ,0
518467,5010405015141,11,1,2018-10-18,2016-12-26,一般社団法人ＳＳ,,399,東京都,港区,虎ノ門２丁目１０番１号ストラテジック・パートナーズ株式会社内,,13,103,1050001,,,,,,,2016-09-26,1,,,,,エスエス,0
518468,5010405015166,01,1,2018-11-19,2016-10-04,特定非営利活動法人５ｙｅａｒｓ,,399,東京都,港区,芝浦３丁目４番２号グランパークハイツ２６０４,,13,103,1080023,,,,,,,2016-10-04,1,,,,,ファイブイヤーズ,0
518469,5010405015174,01,0,2016-10-12,2016-10-06,一般社団法人セルフアウェイキングフェロー,,399,東京都,港区,白金台５丁目５番２－２０９号,,13,103,1080071,,,,,,,2016-10-06,1,,,,,,0
518470,5010405015182,12,1,2018-10-22,2018-10-11,ＡＣＥ税理士法人,,399,東京都,港区,芝５丁目１０番１４号,,13,103,1080014,,,,,,,2016-10-14,1,,,,,エース,0
518471,5010405015190,21,0,2019-06-14,2019-06-04,一般社団法人エスアイエム・オオモリ,,399,東京都,港区,赤坂２丁目１０番５号税理士法人赤坂国際会計事務所内,,13,103,1070052,,,2019-06-04,01,,,2016-10-07,1,,,,,エスアイエムオオモリ,0
518472,5010405015199,01,0,2016-10-25,2016-10-20,一般財団法人世界健康環境支援機構財団,,399,東京都,港区,南麻布２丁目２番１１号－３０２,,13,103,1060047,,,,,,,2016-10-20,1,,,,,,0
518473,5010405015216,21,0,2019-10-21,2019-10-08,特定目的会社だいち,,399,東京都,港区,六本木６丁目１０番１号六本木ヒルズ森タワー,,13,103,1060032,,,2019-10-08,01,,,2016-10-24,1,,,,,ダイチ,0
518474,5010405015224,01,1,2019-12-05,2016-10-25,一般社団法人交通事故被害者支援会議,,399,東京都,港区,虎ノ門１丁目１６番６号虎ノ門ラポートビルＵＣＦ７０３,,13,103,1050001,,,,,,,2016-10-25,1,,,,,コウツウジコヒガイシャシエンカイギ,0
518475,5010405015232,01,0,2016-11-08,2016-11-02,一般社団法人日本くすり教育研究所,,399,東京都,港区,西新橋２丁目８番１１号第７東洋海事ビル８階,,13,103,1050003,,,,,,,2016-11-02,1,,,,,,0
518476,5010405015240,01,1,2018-06-28,2016-11-01,相模原５ロジスティック特定目的会社,,399,東京都,港区,東新橋１丁目５番２号汐留シティセンター,,13,103,1050021,,,,,,,2016-11-01,1,,,,,サガミハラファイブロジスティック,0
518477,5010405015257,12,0,2019-07-12,2019-06-28,管路情報協同組合,,399,東京都,港区,西麻布３丁目１番２５号,,13,103,1060031,,,,,,,2016-11-08,1,,,,,カンロジョウホウ,0
518478,5010405015265,01,0,2016-11-15,2016-11-10,一般社団法人日本インドネシアグローバル協会,,399,東京都,港区,芝大門２丁目７番１号ハイリーフ芝大門１０５,,13,103,1050012,,,,,,,2016-11-10,1,,,,,,0
518479,5010405015273,01,0,2016-11-24,2016-11-18,一般社団法人スポーツ芸能文化振興協会,,399,東京都,港区,麻布十番２丁目７番５号,,13,103,1060045,,,,,,,2016-11-18,1,,,,,,0
518480,5010405015307,12,0,2017-11-13,2017-11-09,一般社団法人オールドリバー２,,399,東京都,渋谷区,広尾５丁目１４番２号,,13,113,1500012,,,,,,,2016-11-28,1,,,,,,0
518481,5010405015315,01,1,2020-02-19,2016-12-01,ひすい一般社団法人,,399,東京都,港区,北青山１丁目２番３号,,13,103,1070061,,,,,,,2016-12-01,1,,,,,ヒスイ,0
518482,5010405015323,11,1,2018-05-10,2017-01-30,一般社団法人釧路トリトウシ,,399,東京都,港区,虎ノ門３丁目２２番１０－２０１号,,13,103,1050001,,,,,,,2016-12-02,1,,,,,クシロトリトウシ,0
518483,5010405015331,12,0,2019-07-19,2019-07-02,一般社団法人オールウェイズ・ホールディングス・ジャパン,,399,東京都,港区,赤坂７丁目３番３７号プラース・カナダ１階ＣＡＰＩＴＡＬＴＡＸ株式会社内,,13,103,1070052,,,,,,,2016-12-02,1,,,,,オールウェイズホールディングスジャパン,0
518484,5010405015364,01,0,2016-12-26,2016-12-20,一般社団法人日本グリーフセラピー協会,,399,東京都,港区,南青山２丁目２番１５号ＷｉｎＡｏｙａｍａビルＵＣＦ９階,,13,103,1070062,,,,,,,2016-12-20,1,,,,,,0
518485,5010405015380,12,1,2018-04-13,2017-12-05,東京ＡＳＥＡＮパートナーズ協同組合,,399,東京都,港区,新橋３丁目６番５号万善ビル３階,,13,103,1050004,,,,,,,2016-12-22,1,,,,,トウキョウアセアンパートナーズ,0
518486,5010405015389,11,0,2019-02-28,2019-02-22,特定非営利活動法人国際教育支援協会,,399,東京都,豊島区,池袋２丁目５５番１０号東京日建工科専門学校内,,13,116,1710014,,,,,,,2016-12-28,1,,,,,コクサイキョウイクシエンキョウカイ,0
518487,5010405015397,01,1,2019-01-04,2017-01-10,一般社団法人アジア婦人友好会,,399,東京都,港区,赤坂８丁目１０番３２号アジア会館内,,13,103,1070052,,,,,,,2017-01-10,1,,,,,アジアフジンユウコウカイ,0
518488,5010405015406,11,0,2019-06-10,2019-05-29,公益財団法人ユニ・チャーム共振財団,,399,東京都,港区,三田３丁目５番２７号,,13,103,1080073,,,,,,,2017-01-12,1,,,,,ユニチャームキョウシンザイダン,0
518489,5010405015430,12,0,2017-07-24,2017-07-14,一般社団法人産業再生協議会,,399,東京都,台東区,日本堤１丁目６番８号,,13,106,1110021,,,,,,,2017-02-20,1,,,,,,0
518490,5010405015439,01,1,2019-04-02,2017-01-24,一般社団法人ＳＨ００９,,399,東京都,港区,虎ノ門３丁目２２番１０－２０１号,,13,103,1050001,,,,,,,2017-01-24,1,,,,,エスエイチゼロゼロナイン,0
518491,5010405015447,12,0,2018-07-13,2018-07-10,一般社団法人国際ビジネス支援協会,,399,東京都,中央区,日本橋人形町１丁目２番１２号ＷＡＲＭＬＩＧＨＴＢＬＤ．３Ｆ,,13,102,1030013,,,,,,,2017-01-31,1,,,,,コクサイビジネスシエンキョウカイ,0
518492,5010405015455,12,0,2020-01-20,2020-01-06,外国人技能実習機構,,399,東京都,港区,海岸３丁目９番１５号ＬＯＯＰ－Ｘ,,13,103,1080022,,,,,,,2017-01-31,1,,,,,ガイコクジンギノウジッシュウキコウ,0
518493,5010405015463,12,1,2019-04-25,2018-02-01,特許業務法人勝沼国際特許事務所,,399,東京都,港区,西麻布１丁目１５番７号,,13,103,1060031,,,,,,,2017-02-06,1,,,,,カツヌマコクサイトッキョジムショ,0
518494,5010405015488,12,0,2019-06-10,2019-06-04,ＮＰＯ法人ひまわり,,399,東京都,台東区,根岸３丁目１４番１３号,,13,106,1100003,,,,,,,2017-02-16,1,,,,,ヒマワリ,0
518495,5010405015496,01,1,2019-05-22,2017-02-15,一般社団法人Ｙｏｇｏｓａｗａ　Ｆｏｕｎｄａｔｉｏｎ,,399,東京都,港区,南青山５丁目３番１０号Ｆｒｏｍ１ｓｔ３０３,,13,103,1070062,,,,,,,2017-02-15,1,,,,,ヨゴサワファウンデーション,0
518496,5010405015505,21,0,2019-06-27,2019-06-14,ライトハウスキャピタル９一般社団法人,,399,東京都,港区,六本木１丁目６番１号泉ガーデンタワー,,13,103,1060032,,,2019-06-14,01,,,2017-02-17,1,,,,,ライトハウスキャピタルナイン,0
518497,5010405015513,12,0,2018-04-11,2018-04-05,一般社団法人Ｎｅｘｔ　Ｃｏｍｍｏｎｓ　Ｌａｂ,,399,東京都,渋谷区,神宮前６丁目２７－４東武第二ビル２階,,13,113,1500001,,,,,,,2017-02-21,1,,,,,ネクストコモンズラボ,0
518498,5010405015521,01,1,2018-06-25,2017-02-24,一般社団法人日本マルシェ協会,,399,東京都,港区,高輪２丁目１６番４号,,13,103,1080074,,,,,,,2017-02-24,1,,,,,ニホンマルシェキョウカイ,0
518499,5010405015538,21,0,2020-02-18,2020-02-13,一般社団法人ＳＨ０１０,,399,東京都,港区,虎ノ門３丁目２２番１０－２０１号,,13,103,1050001,,,2020-02-13,01,,,2017-02-28,1,,,,,エスエイチゼロワンゼロ,0
518500,5010405015546,12,0,2019-08-07,2019-08-02,一般社団法人国産生ハム普及協会,,399,東京都,中央区,日本橋大伝馬町１２－９,,13,102,1030011,,,,,,,2017-03-08,1,,,,,コクサンナマハムフキュウキョウカイ,0
518501,5010405015554,01,1,2019-01-08,2017-03-03,一般社団法人Ｔｈｉｎｋｉｎｇ　Ｅｎｔｅｒｔａｉｎｍｅｎｔｓ,,399,東京都,港区,高輪１丁目１２番１０号,,13,103,1080074,,,,,,,2017-03-03,1,,,,,シンキングエンターテインメンツ,0
518502,5010405015562,01,1,2018-06-11,2017-03-08,医療法人社団純慶会,,399,東京都,港区,南青山１丁目１番１号新青山ビル西館３階３５９区,,13,103,1070062,,,,,,,2017-03-08,1,,,,,ジュンケイカイ,0
518503,5010405015579,01,1,2018-10-30,2017-03-14,医療法人社団いわきたえこレディースクリニック,,399,東京都,港区,新橋１丁目１８番１９号キムラヤオオツカビル３階,,13,103,1050004,,,,,,,2017-03-14,1,,,,,イワキタエコレディースクリニック,0
518504,5010405015587,01,0,2017-03-21,2017-03-15,Ｎｏ．１社会保険労務士法人,,399,東京都,港区,新橋２丁目１３番８号新橋東和ビル４階,,13,103,1050004,,,,,,,2017-03-15,1,,,,,,0
518505,5010405015595,12,1,2019-07-19,2019-07-02,一般社団法人竹芝エリアマネジメント,,399,東京都,港区,海岸１丁目１６番１号,,13,103,1050022,,,,,,,2017-03-22,1,,,,,タケシバエリアマネジメント,0
518506,5010405015604,21,0,2019-03-01,2019-02-25,一般社団法人Ｓａｒｕｓｈｉｍａ,,399,東京都,港区,虎ノ門５丁目１番４号,,13,103,1050001,,,2019-02-25,01,,,2017-03-21,1,,,,,サルシマ,0
518507,5010405015612,01,1,2018-05-08,2017-03-23,ＡＰ　ＪＮＲＰ特定目的会社,,399,東京都,港区,虎ノ門３丁目２２番１０－２０１号,,13,103,1050001,,,,,,,2017-03-23,1,,,,,エーピージェイエヌアールピー,0
518508,5010405015620,12,1,2019-11-08,2019-10-21,一般社団法人上質な教育協会,,399,東京都,港区,麻布十番２丁目２番４－４０２号,,13,103,1060045,,,,,,,2017-03-27,1,,,,,ジョウシツナキョウイクキョウカイ,0
518509,5010405015629,01,0,2017-03-30,2017-03-27,一般社団法人レオニ,,399,東京都,港区,新橋４丁目３０番６号京急中はらビル５階,,13,103,1050004,,,,,,,2017-03-27,1,,,,,,0
518510,5010405015637,01,0,2017-04-11,2017-04-06,一般社団法人イヴォルブアート＆デザインジャパン,,399,東京都,港区,南青山１丁目２３番１３号,,13,103,1070062,,,,,,,2017-04-06,1,,,,,,0
518511,5010405015645,21,0,2017-07-11,2017-07-03,一般社団法人日本３色英語協会,,399,東京都,港区,赤坂７丁目３番３７号プラース・カナダ１階,,13,103,1070052,,,2017-07-03,01,,,2017-04-05,1,,,,,,0
518512,5010405015653,21,0,2019-05-29,2019-05-17,一般社団法人ハウジングプランナー協会,,399,東京都,港区,芝大門２丁目９番１６号,,13,103,1050012,,,2019-05-17,01,,,2017-04-18,1,,,,,ハウジングプランナーキョウカイ,0
518513,5010405015661,01,0,2017-04-14,2017-04-11,一般社団法人リブランディング協会,,399,東京都,港区,浜松町２丁目２番１５号,,13,103,1050013,,,,,,,2017-04-11,1,,,,,,0
518514,5010405015678,01,0,2017-04-18,2017-04-13,ＲＷ久喜２一般社団法人,,399,東京都,港区,赤坂２丁目１０番５号税理士法人赤坂国際会計事務所内,,13,103,1070052,,,,,,,2017-04-13,1,,,,,,0
518515,5010405015686,01,0,2017-04-28,2017-04-25,一般社団法人日本身体障害者アーチェリー連盟,,399,東京都,港区,赤坂１丁目２－２日本財団ビル４階パラリンピックサポートセンター内,,13,103,1070052,,,,,,,2017-04-25,1,,,,,,0
518516,5010405015694,21,0,2019-02-20,2019-02-14,Ｆｅｌｉｃｉｔａｓ特定目的会社,,399,東京都,港区,元赤坂１丁目１番７号,,13,103,1070051,,,2019-02-14,01,,,2017-04-20,1,,,,,フェリシタス,0
518517,5010405015703,11,0,2019-09-12,2019-09-02,一般社団法人ジャパングッドリレーションアカデミー,,399,東京都,港区,南青山５丁目１２番６号英ビル３Ｆ,,13,103,1070062,,,,,,,2017-05-01,1,,,,,ジャパングッドリレーションアカデミー,0
518518,5010405015711,12,0,2019-06-05,2019-05-31,一般社団法人Ｌｉｖｉｎｇ　Ａｎｙｗｈｅｒｅ,,399,東京都,調布市,深大寺元町１丁目１１－１－２Ｆ,,13,208,1820017,,,,,,,2017-05-02,1,,,,,リビングエニウェア,0
518519,5010405015736,01,1,2019-04-18,2017-05-12,一般社団法人七戸南地域活性化基金,,399,東京都,港区,虎ノ門３丁目２２番１０－２０１号,,13,103,1050001,,,,,,,2017-05-12,1,,,,,シチノヘミナミチイキカッセイカキキン,0
518520,5010405015744,01,0,2017-05-19,2017-05-16,一般社団法人数理暦学協会,,399,東京都,港区,南青山２丁目２番１５号ウィン青山９４２,,13,103,1070062,,,,,,,2017-05-16,1,,,,,,0
518521,5010405015752,01,1,2019-10-08,2017-05-11,一般社団法人建設プロジェクト運営方式協議会,,399,東京都,港区,虎ノ門４丁目３番１号,,13,103,1050001,,,,,,,2017-05-11,1,,,,,ケンセツプロジェクトウンエイホウシキキョウギカイ,0
518522,5010405015769,01,0,2017-05-25,2017-05-22,一般社団法人防災バルーン協会,,399,東京都,港区,新橋６丁目１８番３号,,13,103,1050004,,,,,,,2017-05-22,1,,,,,,0
518523,5010405015777,01,1,2018-06-04,2017-05-24,Ｗｉｎｄｓｏｒ特定目的会社,,399,東京都,港区,虎ノ門５丁目１番４号,,13,103,1050001,,,,,,,2017-05-24,1,,,,,ウィンザー,0
518524,5010405015793,01,0,2017-06-01,2017-05-29,一般財団法人子どもの翼,,399,東京都,港区,高輪１丁目２－１６－６Ｆ,,13,103,1080074,,,,,,,2017-05-29,1,,,,,,0
518525,5010405015802,01,0,2017-06-06,2017-06-01,一般社団法人ジャパンパートナーズストレッチ協会,,399,東京都,港区,赤坂６丁目１８番１１号ストーリア赤坂１０３,,13,103,1070052,,,,,,,2017-06-01,1,,,,,,0
518526,5010405015810,01,0,2017-06-05,2017-05-31,一般社団法人ユーラシア国際映画祭,,399,東京都,港区,新橋５丁目１５－５交通ビル５階,,13,103,1050004,,,,,,,2017-05-31,1,,,,,,0
518527,5010405015819,01,0,2017-06-14,2017-06-09,一般社団法人粘膜免疫学研究会,,399,東京都,港区,高輪４丁目６番１５－３０５号室,,13,103,1080074,,,,,,,2017-06-09,1,,,,,,0
518528,5010405015835,01,0,2017-06-12,2017-06-07,ＧＳＳＧ　Ｓｏｌａｒ　Ｊａｐａｎ　Ｈｏｌｄｉｎｇｓ１一般社団法人,,399,東京都,港区,虎ノ門３丁目２２番１０―２０１号,,13,103,1050001,,,,,,,2017-06-07,1,,,,,,0
518529,5010405015868,12,1,2020-01-21,2020-01-08,一般社団法人アルベルティ協会,,399,東京都,港区,南青山７丁目８番１５号,,13,103,1070062,,,,,,,2017-06-26,1,,,,,アルベルティキョウカイ,0
518530,5010405015901,01,0,2017-07-14,2017-07-11,一般社団法人超人スポーツ協会,,399,東京都,港区,赤坂４丁目３番２６号,,13,103,1070052,,,,,,,2017-07-11,1,,,,,,0
518531,5010405015918,11,0,2018-05-10,2018-04-26,一般財団法人有森記念財団,,399,東京都,港区,三田２丁目３番３４－１５０４号,,13,103,1080073,,,,,,,2017-07-18,1,,,,,アリモリキネンザイダン,0
518532,5010405015934,01,1,2019-07-11,2017-07-20,大阪ホールディング１一般社団法人,,399,東京都,港区,虎ノ門３丁目２２番１０－２０１号,,13,103,1050001,,,,,,,2017-07-20,1,,,,,オオサカホールディングワン,0
518533,5010405015942,01,1,2019-06-24,2017-07-28,一般社団法人パイロットナミキヒデユキ奨学支援機構,,399,東京都,港区,高輪３丁目１１番１－５０５号,,13,103,1080074,,,,,,,2017-07-28,1,,,,,パイロットナミキヒデユキショウガクシエンキコウ,0
518534,5010405015950,12,0,2018-11-08,2018-11-06,一般社団法人スマートエネルギー住宅普及促進協会,,399,東京都,中央区,日本橋２丁目１番１７号丹生ビル２階,,13,102,1030027,,,,,,,2017-08-01,1,,,,,スマートエネルギージュウタクフキュウソクシンキョウカイ,0
518535,5010405015975,21,0,2018-10-22,2018-10-12,一般社団法人日比英語教育協会,,399,東京都,港区,赤坂１丁目１１番２８号ユニゾ赤坂一丁目ビル１０階,,13,103,1070052,,,2018-10-12,01,,,2017-08-07,1,,,,,ニチヒエイゴキョウイクキョウカイ,0
518536,5010405015983,01,0,2017-08-10,2017-08-07,一般社団法人ＰＡＤアカデミー,,399,東京都,港区,西新橋２丁目３４番７号三須ビル,,13,103,1050003,,,,,,,2017-08-07,1,,,,,,0
518537,5010405015991,01,0,2017-08-17,2017-08-14,一般社団法人ローカルソリューションズ,,399,東京都,港区,芝浦３丁目４番２号,,13,103,1080023,,,,,,,2017-08-14,1,,,,,,0
518538,5010405016008,12,0,2019-09-17,2019-09-12,一般社団法人文字起こし活用推進協議会,,399,東京都,千代田区,九段北１丁目１４番１６号,,13,101,1020073,,,,,,,2017-08-25,1,,,,,モジオコシカツヨウスイシンキョウギカイ,0
518539,5010405016024,01,1,2018-05-08,2017-08-29,医療法人社団ハクナマタタ,,399,東京都,港区,高輪１丁目５番２１号ルート高輪ビル４階,,13,103,1080074,,,,,,,2017-08-29,1,,,,,ハクナマタタ,0
518540,5010405016032,01,1,2018-06-07,2017-09-04,ＫＲＤ丸屋町開発特定目的会社,,399,東京都,港区,元赤坂１丁目１番７号,,13,103,1070051,,,,,,,2017-09-04,1,,,,,ケーアールディマルヤチョウカイハツ,0
518541,5010405016040,01,1,2018-11-01,2017-09-06,一般社団法人耐震住宅１００パーセント実行委員会,,399,東京都,港区,港南１丁目７番１８号,,13,103,1080075,,,,,,,2017-09-06,1,,,,,タイシンジュウタクヒャクパーセントジッコウイインカイ,0
518542,5010405016065,01,1,2018-09-12,2017-09-15,一般社団法人グローバル人材開発機構,,399,東京都,港区,赤坂２丁目１７番５０－６０８号,,13,103,1070052,,,,,,,2017-09-15,1,,,,,グローバルジンザイカイハツキコウ,0
518543,5010405016081,11,0,2019-08-29,2019-08-15,一般社団法人エグゼクティブプレゼンス,,399,東京都,港区,高輪３丁目２５番２２号,,13,103,1080074,,,,,,,2017-09-25,1,,,,,エグゼクティブプレゼンス,0
518544,5010405016098,11,0,2018-07-18,2018-07-04,メディカルアセット投資法人,,399,東京都,港区,赤坂１丁目１２番３２号,,13,103,1070052,,,,,,,2017-09-25,1,,,,,メディカルアセット,0
518545,5010405016107,01,1,2019-12-04,2017-10-02,一般社団法人ＳＨ０１２,,399,東京都,港区,虎ノ門３丁目２２番１０－２０１号,,13,103,1050001,,,,,,,2017-10-02,1,,,,,エスエイチゼロワンツー,0
518546,5010405016115,01,0,2017-10-13,2017-10-10,クールジャパン機構労働組合,,399,東京都,港区,六本木６丁目１０番１号六本木ヒルズ森タワー１７階,,13,103,1060032,,,,,,,2017-10-10,1,,,,,,0
518547,5010405016123,01,1,2018-12-19,2017-10-10,医療法人社団幸宣会,,399,東京都,港区,虎ノ門１丁目１５番１１号虎ノ門林ビルディング２階,,13,103,1050001,,,,,,,2017-10-10,1,,,,,コウセンカイ,0
518548,5010405016131,01,1,2018-05-08,2017-10-13,一般社団法人Ｇｅｍｓｔｏｎｅ,,399,東京都,港区,芝４丁目７番１号西山ビル４階,,13,103,1080014,,,,,,,2017-10-13,1,,,,,ジェムストーン,0
518549,5010405016156,01,1,2018-04-24,2017-10-16,オリンピア１特定目的会社,,399,東京都,港区,元赤坂１丁目１番７－１００６号,,13,103,1070051,,,,,,,2017-10-16,1,,,,,オリンピアイチ,0
