22857,2010405010005,11,0,2016-12-06,2016-12-05,一般社団法人汐留福祉会,,399,北海道,釧路市,文苑４丁目６４番２号,,01,206,0850063,,,,,,,2015-10-05,1,,,,,,0
91127,5010405013780,12,1,2018-10-24,2016-11-24,一般社団法人インターナショナル・マインド・コミュニケーション,,399,北海道,札幌市清田区,清田十条３丁目６番５５号,,01,110,0040840,,,,,,,2015-10-05,1,,,,,インターナショナルマインドコミュニケーション,0
159600,8010405018190,12,0,2020-02-19,2020-02-14,一般社団法人唐神基金,,399,北海道,札幌市中央区,大通西４丁目１番地,,01,101,0600042,,,,,,,2019-10-29,1,,,,,カラカミキキン,0
19501,6010405010629,12,0,2017-07-14,2017-06-30,一般社団法人日本ろうあ者卓球協会,,399,青森県,弘前市,大字桜林町７番２号桜ハイツ２号館１０２号室,,02,202,0368222,,,,,,,2015-10-05,1,,,,,,0
25015,9010405015377,12,0,2018-10-11,2018-10-03,一般社団法人国際毛髪科学協会,,399,秋田県,秋田市,新屋比内町６４－１４,,05,201,0101636,,,,,,,2016-12-22,1,,,,,コクサイモウハツカガクキョウカイ,0
23,1010405010146,12,1,2020-02-20,2018-02-13,一般社団法人ユーソニアン,,399,山形県,山形市,七日町１丁目２番４２号ＴＡＮＲＯＫＵスクエア３階,,06,201,9900042,,,,,,,2015-10-05,1,,,,,ユーソニアン,0
29593,5010405015249,12,0,2017-11-10,2017-11-06,一般社団法人みらいちいきラボ,,399,福島県,相馬市,塚ノ町１丁目２番１号１０２号室,,07,209,9760015,,,,,,,2016-11-08,1,,,,,,0
44459,7010405010693,11,0,2016-01-28,2016-01-21,一般社団法人あすびと福島,,399,福島県,南相馬市,原町区泉字前向１５番地,,07,212,9750023,,,,,,,2015-10-05,1,,,,,,0
59228,9010405010709,12,0,2016-12-14,2016-12-08,一般社団法人Ｓｔａｎｄ　ｆｏｒ　ｍｏｔｈｅｒｓ,,399,福島県,郡山市,日和田町字西中島１４－１,,07,203,9630534,,,,,,,2015-10-05,1,,,,,,0
36894,5010405012469,12,0,2017-06-12,2017-06-06,石狩超電導・直流送電システム技術研究組合,,399,茨城県,東茨城郡大洗町,成田町２２０５,,08,309,3111313,,,,,,,2015-10-05,1,,,,,,0
7553,2010405016258,12,0,2019-09-24,2019-09-19,一般社団法人ドローン女性雇用促進協会,,399,栃木県,小山市,大字喜沢３３１－２,,09,208,3230014,,,,,,,2017-11-28,1,,,,,ドローンジョセイコヨウソクシンキョウカイ,0
22817,4010405011348,12,0,2018-04-25,2018-04-23,一般社団法人ＪＡＰＡＮ絵本よみきかせ協会,,399,群馬県,前橋市,大手町１丁目１３番６号江州商事第６ビル２階,,10,201,3710026,,,,,,,2015-10-05,1,,,,,ジャパンエホンヨミキカセキョウカイ,0
22818,4010405011488,12,0,2016-03-10,2016-03-08,一般社団法人虎ノ門インベストメント,,399,群馬県,高崎市,飯塚町１７５４－１０,,10,202,3700069,,,,,,,2015-10-05,1,,,,,,0
38056,6010405017582,12,0,2020-04-15,2020-04-07,一般社団法人瑞,,399,群馬県,前橋市,上細井町１８３４番地４,,10,201,3710051,,,,,,,2019-04-02,1,,,,,ズイ,0
25348,2010405011168,12,0,2017-01-06,2016-12-27,一般社団法人日本イランスーフィーズム文化研究会－マフダビエ,,399,埼玉県,越谷市,川柳町４丁目１４番１号,,11,222,3430827,,,,,,,2015-10-05,1,,,,,,0
50396,3010405013031,12,0,2017-08-18,2017-08-15,一般社団法人日本コワーキング協会,,399,埼玉県,川口市,大字安行慈林４４８番２５号,,11,203,3340071,,,,,,,2015-10-05,1,,,,,,0
50397,3010405014541,12,0,2020-04-21,2020-04-16,一般社団法人地方活性化政策協議会,,399,埼玉県,入間郡越生町,大字大満５１７番地,,11,327,3500423,,,,,,,2016-02-17,1,,,,,チホウカッセイカセイサクキョウギカイ,0
75432,4010405010201,12,1,2019-08-19,2017-05-12,ＩＴＣ協同組合,,399,埼玉県,所沢市,寿町８番１６号,,11,208,3591122,,,,,,,2015-10-05,1,,,,,アイティシー,0
75433,4010405016306,12,0,2020-03-13,2020-03-10,一般社団法人日本美術工藝協会,,399,埼玉県,富士見市,上沢２丁目１０番７号,,11,235,3540034,,,,,,,2017-12-13,1,,,,,ニホンビジュツコウゲイキョウカイ,0
100594,5010405010712,12,0,2018-05-14,2018-05-08,一般社団法人都市経済研究所,,399,埼玉県,川口市,仲町１８番１１－１１０号,,11,203,3320022,,,,,,,2015-10-05,1,,,,,トシケイザイケンキュウジョ,0
150423,7010405017904,12,0,2020-05-13,2020-05-01,一般社団法人エンディングノート普及促進センター,,399,埼玉県,東松山市,箭弓町３丁目２番２１号,,11,212,3550028,,,,,,,2019-07-29,1,,,,,エンディングンートフキュウソクシンセンター,0
200537,9010405011186,12,0,2016-03-14,2016-03-09,一般社団法人テンポラリーゲームオペレーション,,399,埼玉県,川口市,戸塚２丁目４－１,,11,203,3330811,,,,,,,2015-10-05,1,,,,,,0
200538,9010405013166,12,0,2017-12-07,2017-12-01,一般社団法人ジャパンエキスポ,,399,埼玉県,ふじみ野市,大井中央４丁目１６番１７－１０１号,,11,245,3560058,,,,,,,2015-10-05,1,,,,,,0
185,1010405011004,12,1,2019-05-20,2017-01-06,一般社団法人心の絆プロジェクト,,399,千葉県,千葉市花見川区,さつきが丘２丁目４番地２,,12,102,2620014,,,,,,,2015-10-05,1,,,,,ココロノキズナプロジェクト,0
186,1010405012761,21,0,2019-04-23,2019-04-10,一般社団法人うつ病・認知症コンソーシアム,,399,千葉県,千葉市花見川区,さつきが丘２丁目４番地２,,12,102,2620014,,,2019-04-10,01,,,2015-10-05,1,,,,,ウツビョウニンチショウコンソーシアム,0
21995,2010405016605,12,0,2019-01-28,2019-01-21,一般社団法人テイクアスマイル,,399,千葉県,我孫子市,本町２丁目２番１０号三共関東ビル３階,,12,222,2701151,,,,,,,2018-04-09,1,,,,,テイクアスマイル,0
43828,3010405013329,12,1,2018-11-16,2017-04-07,一般社団法人ＣＯＰＤ啓発プロジェクト,,399,千葉県,千葉市花見川区,さつきが丘２丁目４番地２,,12,102,2620014,,,,,,,2015-10-05,1,,,,,シーオーピーディーケイハツプロジェクト,0
43829,3010405015416,12,0,2019-02-14,2019-02-08,一般社団法人道徳とマナー協会,,399,千葉県,我孫子市,南新木２丁目２０番２号,,12,222,2701119,,,,,,,2017-01-17,1,,,,,ドウトクトマナーキョウカイ,0
65518,4010405014986,12,0,2017-04-26,2017-04-21,一般社団法人住環境微生物対策機構,,399,千葉県,船橋市,東船橋４丁目３０番８号サンビレッジ３０７号室,,12,204,2730002,,,,,,,2016-08-02,1,,,,,,0
65519,4010405016025,11,0,2018-02-28,2018-02-20,一般社団法人潜在意識心理学協会,,399,千葉県,市川市,八幡３丁目１３番１２号,,12,203,2720021,,,,,,,2017-09-01,1,,,,,,0
87232,5010405012733,12,0,2020-02-06,2020-01-21,公益社団法人ＪＡＰＡＮ　ｏｆ　ＡＳＩＡ,,399,千葉県,成田市,並木町２１６番地７フラットバリー２階,,12,211,2860045,,,,,,,2015-10-05,1,,,,,ジャパンオブアジア,0
109058,6010405016378,12,0,2019-02-15,2019-02-12,一般社団法人３ＤＦ　ＩＮＳＴＩＴＵＴＥ,,399,千葉県,長生郡一宮町,一宮３１６１番地１,,12,421,2994301,,,,,,,2018-01-18,1,,,,,スリーディーエフインスティテュート,0
130765,7010405014133,12,0,2016-03-11,2016-03-08,勝浦串浜ソーラー一般社団法人,,399,千葉県,木更津市,かずさ鎌足１丁目８番地１,,12,206,2920818,,,,,,,2015-10-05,1,,,,,,0
152525,8010405013357,12,0,2019-08-05,2019-07-31,一般社団法人弥生,,399,千葉県,柏市,弥生町８番９号,,12,217,2770015,,,,,,,2015-10-05,1,,,,,ヤヨイ,0
174401,9010405012928,01,1,2018-07-04,2015-10-05,一般社団法人グローバル・プロフェッショナル・ネットワーク,,399,千葉県,市川市,市川１丁目１２番２２号市川ビル,,12,203,2720034,,,,,,,2015-10-05,1,,,,,グローバルプロフェッショナルネットワーク,0
33804,1010405010006,01,0,2015-10-26,2015-10-05,公益財団法人大倉和親記念財団,,399,東京都,港区,海岸１丁目２番２０号汐留ビルディング２４階,,13,103,1050022,,,,,,,2015-10-05,1,,,,,,0
33805,1010405010014,01,0,2015-10-26,2015-10-05,一般社団法人ヨーロッパ鉄道協会,,399,東京都,港区,白金台３丁目２番１６－１０２号,,13,103,1080071,,,,,,,2015-10-05,1,,,,,,0
33806,1010405010022,12,0,2018-12-21,2018-12-19,特定非営利活動法人ふるさとテレビ,,399,東京都,文京区,本郷５丁目３２番２号,,13,105,1130033,,,,,,,2015-10-05,1,,,,,フルサトテレビ,0
33807,1010405010030,01,1,2018-09-21,2015-10-05,医療法人社団順幸会,,399,東京都,港区,赤坂２丁目３番５号赤坂スターゲートプラザ２階,,13,103,1070052,,,,,,,2015-10-05,1,,,,,ジュンコウカイ,0
33808,1010405010063,21,0,2019-08-19,2019-08-02,一般社団法人就労履歴登録機構,,399,東京都,港区,海岸１丁目２番３号,,13,103,1050022,,,2019-08-02,01,,,2015-10-05,1,,,,,シュウロウリレキトウロクキコウ,0
33809,1010405010071,21,0,2016-05-24,2016-05-19,一般社団法人リキッドファイブ,,399,東京都,港区,北青山３丁目５番８号,,13,103,1070061,,,2016-05-19,01,,,2015-10-05,1,,,,,,0
33810,1010405010096,01,1,2018-11-08,2015-10-05,公益財団法人公益推進協会,,399,東京都,港区,新橋６丁目７番９号新橋アイランドビル２階,,13,103,1050004,,,,,,,2015-10-05,1,,,,,コウエキスイシンキョウカイ,0
33811,1010405010105,12,0,2019-03-07,2019-03-05,一般社団法人日本動物保護センター,,399,東京都,中央区,新川２丁目１１番１－９０６号,,13,102,1040033,,,,,,,2015-10-05,1,,,,,ニホンドウブツホゴセンター,0
33812,1010405010113,01,0,2015-10-26,2015-10-05,社会保険労務士法人ビークライン,,399,東京都,港区,東新橋２丁目１０番１０号,,13,103,1050021,,,,,,,2015-10-05,1,,,,,,0
33813,1010405010121,01,1,2018-04-02,2015-10-05,公益財団法人ジャパン・スタッドブック・インターナショナル,,399,東京都,港区,新橋４丁目５番４号,,13,103,1050004,,,,,,,2015-10-05,1,,,,,ジャパンスタッドブックインターナショナル,0
33814,1010405010138,12,0,2020-01-14,2020-01-09,公益社団法人国際厚生事業団,,399,東京都,中央区,銀座７丁目１７番１４号,,13,102,1040061,,,,,,,2015-10-05,1,,,,,コクサイコウセイジギョウダン,0
33815,1010405010154,21,0,2017-10-20,2017-10-12,Ｓａｚａｅ特定目的会社,,399,東京都,港区,虎ノ門３丁目２２番１０－２０１号,,13,103,1050001,,,2017-10-12,01,,,2015-10-05,1,,,,,,0
33816,1010405010170,12,1,2019-11-26,2017-08-23,一般社団法人日本医療福祉セントラルキッチン協会,,399,東京都,港区,西新橋１丁目１２番３号西新橋ＴＭビル８階,,13,103,1050003,,,,,,,2015-10-05,1,,,,,ニホンイリョウフクシセントラルキッチンキョウカイ,0
33817,1010405010179,01,0,2015-10-26,2015-10-05,一般社団法人東京話し方教室,,399,東京都,港区,港南２丁目１２番２８－２７０３号,,13,103,1080075,,,,,,,2015-10-05,1,,,,,,0
33818,1010405010187,01,1,2018-11-12,2015-10-05,司法書士法人中央法務事務所,,399,東京都,港区,南青山５丁目１０番２号,,13,103,1070062,,,,,,,2015-10-05,1,,,,,チュウオウホウムジムショ,0
33819,1010405010195,21,0,2017-06-20,2017-06-13,特定非営利活動法人日本の心オーケストラ,,399,東京都,港区,西麻布１丁目１１番１０号ビルマーサ２０４号室,,13,103,1060031,,,2017-06-13,01,,,2015-10-05,1,,,,,,0
33820,1010405010204,01,0,2015-10-26,2015-10-05,特定非営利活動法人夢さがしプロジェクト,,399,東京都,港区,南青山２丁目２４番５号ビューロ青山１０２号室,,13,103,1070062,,,,,,,2015-10-05,1,,,,,,0
33821,1010405010220,01,1,2018-04-18,2015-10-05,一般社団法人東京ラーニングアカデミー,,399,東京都,港区,高輪３丁目１０番４号ブレスド高輪１０１,,13,103,1080074,,,,,,,2015-10-05,1,,,,,トウキョウラーニングアカデミー,0
33822,1010405010237,01,0,2015-10-26,2015-10-05,一般社団法人真和,,399,東京都,港区,六本木１丁目９番３５－１３０１号,,13,103,1060032,,,,,,,2015-10-05,1,,,,,,0
33823,1010405010253,12,0,2018-03-12,2018-03-07,マンゴスチン一般社団法人,,399,東京都,千代田区,丸の内３丁目１番１号東京共同会計事務所内,,13,101,1000005,,,,,,,2015-10-05,1,,,,,,0
33824,1010405010261,11,1,2019-05-13,2017-01-23,医療法人社団建部会,,399,東京都,港区,六本木４丁目１２番１１号竹岡ビル６階,,13,103,1060032,,,,,,,2015-10-05,1,,,,,タテベカイ,0
33825,1010405010278,01,0,2015-10-26,2015-10-05,一般社団法人共創推進機構,,399,東京都,港区,三田３丁目４番６号－３０６,,13,103,1080073,,,,,,,2015-10-05,1,,,,,,0
33826,1010405010286,12,0,2019-05-28,2019-05-24,一般社団法人日本スポーツチア＆ダンス連盟,,399,東京都,新宿区,四谷１丁目１８番地１２,,13,104,1600004,,,,,,,2015-10-05,1,,,,,ニホンスポーツチアアンドダンスレンメイ,0
33827,1010405010294,01,0,2015-10-26,2015-10-05,一般社団法人全国室内ペット飼育認定協会,,399,東京都,港区,新橋２丁目９番５号,,13,103,1050004,,,,,,,2015-10-05,1,,,,,,0
33828,1010405010303,01,0,2015-10-26,2015-10-05,一般社団法人日韓文化交流協議会,,399,東京都,港区,赤坂３丁目１３番４号,,13,103,1070052,,,,,,,2015-10-05,1,,,,,,0
28,1010405010328,01,1,2020-06-01,2015-10-05,公益財団法人米日カウンシル－ジャパン,,399,東京都,千代田区,紀尾井町４番１号ニューオータニガーデンコート１２Ｆ,,13,101,1020094,,,,,,,2015-10-05,1,,,,,ベイニチカウンシルージャパン,0
33830,1010405010336,01,1,2019-07-22,2015-10-05,一般財団法人建設経済研究所,,399,東京都,港区,西新橋３丁目２５番３３号,,13,103,1050003,,,,,,,2015-10-05,1,,,,,ケンセツケイザイケンキュウショ,0
33831,1010405010344,12,0,2018-12-11,2018-12-07,一般社団法人全国避難設備工業会,,399,東京都,中央区,築地３丁目１２番２号築地高野ビル４階,,13,102,1040045,,,,,,,2015-10-05,1,,,,,ゼンコクヒナンセツビコウギョウカイ,0
33832,1010405010352,12,0,2018-09-25,2018-09-18,公益社団法人日本工学会,,399,東京都,港区,赤坂９丁目６番４１号,,13,103,1070052,,,,,,,2015-10-05,1,,,,,ニホンコウガッカイ,0
33833,1010405010360,01,1,2018-06-14,2015-10-05,一般社団法人全国特定法面保護協会,,399,東京都,港区,新橋５丁目７番１２号丸石新橋ビル３階,,13,103,1050004,,,,,,,2015-10-05,1,,,,,ゼンコクトクテイノリメンホゴキョウカイ,0
33834,1010405010369,01,1,2018-06-25,2015-10-05,公益社団法人日本パブリックリレーションズ協会,,399,東京都,港区,六本木６丁目２番３１号六本木ヒルズノースタワー５Ｆ,,13,103,1060032,,,,,,,2015-10-05,1,,,,,ニホンパブリックリレーションズキョウカイ,0
33835,1010405010377,11,1,2018-08-16,2016-06-09,一般社団法人日本アド・コンテンツ制作協会,,399,東京都,港区,新橋２丁目１３番５号鈴木ビル３階,,13,103,1050004,,,,,,,2015-10-05,1,,,,,ニホンアドコンテンツセイサクキョウカイ,0
33836,1010405010385,01,1,2018-06-22,2015-10-05,一般社団法人日本エスコフィエ協会,,399,東京都,港区,芝５丁目１３番１１号,,13,103,1080014,,,,,,,2015-10-05,1,,,,,ニホンエスコフィエキョウカイ,0
33837,1010405010393,01,1,2018-07-13,2015-10-05,公益財団法人マリンスポーツ財団,,399,東京都,港区,三田３丁目１４番１０号,,13,103,1080073,,,,,,,2015-10-05,1,,,,,マリンスポーツザイダン,0
33838,1010405010402,01,1,2018-06-26,2015-10-05,一般社団法人日本橋梁建設協会,,399,東京都,港区,西新橋１丁目６番１１号,,13,103,1050003,,,,,,,2015-10-05,1,,,,,ニホンキョウリョウケンセツキョウカイ,0
33839,1010405010410,12,0,2020-02-27,2020-02-25,一般財団法人流通システム開発センター,,399,東京都,港区,南青山１丁目１番１号新青山ビル東館９階,,13,103,1070062,,,,,,,2015-10-05,1,,,,,リュウツウシステムカイハツセンター,0
33840,1010405010419,01,1,2018-09-12,2015-10-05,一般社団法人東京都小学校ピーティーエー協議会,,399,東京都,港区,東新橋２丁目２番１０号,,13,103,1050021,,,,,,,2015-10-05,1,,,,,トウキョウトショウガッコウピーティーエーキョウギカイ,0
33841,1010405010427,12,1,2018-05-02,2016-11-22,公益財団法人南葵育英会,,399,東京都,中央区,銀座２丁目６番１２号大倉本館内外施設工業株式会社内,,13,102,1040061,,,,,,,2015-10-05,1,,,,,ナンキイクエイカイ,0
33842,1010405010435,01,1,2018-09-13,2015-10-05,一般財団法人日本自動車研究所,,399,東京都,港区,芝大門１丁目１番３０号,,13,103,1050012,,,,,,,2015-10-05,1,,,,,ニホンジドウシャケンキュウジョ,0
33843,1010405010443,01,1,2018-07-13,2015-10-05,一般社団法人火力原子力発電技術協会,,399,東京都,港区,芝２丁目３１番１５号,,13,103,1050014,,,,,,,2015-10-05,1,,,,,カリョクゲンシリョクハツデンギジュツキョウカイ,0
33844,1010405010451,01,1,2018-07-18,2015-10-05,公益社団法人日本広告写真家協会,,399,東京都,港区,白金台３丁目１５番１号白金台シティハウス２Ｆ,,13,103,1080071,,,,,,,2015-10-05,1,,,,,ニホンコウコクシャシンカキョウカイ,0
33845,1010405010476,01,1,2019-09-30,2015-10-05,公益社団法人全日本郷土芸能協会,,399,東京都,港区,六本木４丁目３番６号,,13,103,1060032,,,,,,,2015-10-05,1,,,,,ゼンニホンキョウドゲイノウキョウカイ,0
33846,1010405010484,01,1,2018-05-25,2015-10-05,一般社団法人アフリカ協会,,399,東京都,港区,西新橋３丁目２３番６号,,13,103,1050003,,,,,,,2015-10-05,1,,,,,アフリカキョウカイ,0
33847,1010405010501,01,1,2018-08-02,2015-10-05,一般社団法人日本ベアリング工業会,,399,東京都,港区,芝公園３丁目５番８号,,13,103,1050011,,,,,,,2015-10-05,1,,,,,ニホンベアリングコウギョウカイ,0
33848,1010405010518,01,1,2018-07-27,2015-10-05,公益財団法人菊池美術財団,,399,東京都,港区,虎ノ門４丁目１番３５号,,13,103,1050001,,,,,,,2015-10-05,1,,,,,キクチビジュツザイダン,0
33849,1010405010526,01,1,2018-07-02,2015-10-05,公益財団法人日本学生航空連盟,,399,東京都,港区,新橋１丁目１８番２号明宏ビル本館５階,,13,103,1050004,,,,,,,2015-10-05,1,,,,,ニホンガクセイコウクウレンメイ,0
33850,1010405010534,01,1,2018-07-20,2015-10-05,一般財団法人日本ウエザリングテストセンター,,399,東京都,港区,芝公園１丁目１番１１号,,13,103,1050011,,,,,,,2015-10-05,1,,,,,ニホンウエザリングテストセンター,0
33851,1010405010542,01,1,2019-07-31,2015-10-05,公益財団法人ブルーシー・アンド・グリーンランド財団,,399,東京都,港区,虎ノ門３丁目４番１０号,,13,103,1050001,,,,,,,2015-10-05,1,,,,,ブルーシーアンドグリーンランドザイダン,0
33852,1010405010550,01,1,2018-09-12,2015-10-05,公益財団法人日本動物愛護協会,,399,東京都,港区,南青山１丁目１５番１５号,,13,103,1070062,,,,,,,2015-10-05,1,,,,,ニホンドウブツアイゴキョウカイ,0
33853,1010405010559,12,1,2018-07-30,2016-04-06,公益財団法人川本・森奨学財団,,399,東京都,港区,芝浦３丁目１８番２１号第二吾妻ビル,,13,103,1080023,,,,,,,2015-10-05,1,,,,,カワモトモリショウガクザイダン,0
33854,1010405010567,01,1,2018-07-31,2015-10-05,公益財団法人中央果実協会,,399,東京都,港区,赤坂１丁目９番１３号,,13,103,1070052,,,,,,,2015-10-05,1,,,,,チュウオウカジツキョウカイ,0
33855,1010405010575,01,1,2018-07-18,2015-10-05,一般社団法人日本港湾福利厚生協会,,399,東京都,港区,新橋６丁目１１番１０号,,13,103,1050004,,,,,,,2015-10-05,1,,,,,ニホンコウワンフクリコウセイキョウカイ,0
33856,1010405010583,01,1,2018-07-05,2015-10-05,公益財団法人中島記念国際交流財団,,399,東京都,港区,六本木６丁目１０番１号,,13,103,1060032,,,,,,,2015-10-05,1,,,,,ナカジマキネンコクサイコウリュウザイダン,0
33857,1010405010591,01,1,2019-07-30,2015-10-05,公益社団法人日本診療放射線技師会,,399,東京都,港区,浜松町２丁目４番１号世界貿易センタービル３１階,,13,103,1050013,,,,,,,2015-10-05,1,,,,,ニホンシンリョウホウシャセンギシカイ,0
33858,1010405010600,01,1,2018-07-10,2015-10-05,公益財団法人三菱ＵＦＪ技術育成財団,,399,東京都,港区,芝２丁目４番３号,,13,103,1050014,,,,,,,2015-10-05,1,,,,,ミツビシユーエフジェイギジュツイクセイザイダン,0
33859,1010405010609,01,1,2018-07-06,2015-10-05,一般社団法人日本鉄道車両機械技術協会,,399,東京都,港区,西新橋１丁目１９番４号,,13,103,1050003,,,,,,,2015-10-05,1,,,,,ニホンテツドウシャリョウキカイギジュツキョウカイ,0
33860,1010405010617,01,1,2019-01-17,2015-10-05,公益財団法人国際文化会館,,399,東京都,港区,六本木５丁目１１番１６号,,13,103,1060032,,,,,,,2015-10-05,1,,,,,コクサイブンカカイカン,0
33861,1010405010625,01,1,2018-08-03,2015-10-05,一般社団法人日本光学硝子工業会,,399,東京都,港区,芝公園３丁目５番８号,,13,103,1050011,,,,,,,2015-10-05,1,,,,,ニホンコウガクガラスコウギョウカイ,0
33862,1010405010633,01,0,2015-10-26,2015-10-05,一般社団法人東日本学生航空連盟,,399,東京都,港区,新橋１丁目１８番２号,,13,103,1050004,,,,,,,2015-10-05,1,,,,,,0
33863,1010405010641,12,0,2017-04-28,2017-04-26,特定非営利活動法人ボランティア活動推進国際協議会日本,,399,東京都,目黒区,祐天寺１丁目９番８号,,13,110,1530052,,,,,,,2015-10-05,1,,,,,,0
33864,1010405010658,01,1,2018-07-23,2015-10-05,一般財団法人特別支援教育士資格認定協会,,399,東京都,港区,高輪３丁目２４番１８号高輪エンパイヤビル８Ｆ,,13,103,1080074,,,,,,,2015-10-05,1,,,,,トクベツシエンキョウイクシシカクニンテイキョウカイ,0
33865,1010405010666,01,1,2019-04-26,2015-10-05,一般財団法人メガ・ブルーバード,,399,東京都,港区,六本木６丁目１０番１号,,13,103,1060032,,,,,,,2015-10-05,1,,,,,メガブルーバード,0
33866,1010405010674,01,0,2015-10-26,2015-10-05,一般社団法人日本ラバーアート協会,,399,東京都,港区,西新橋２丁目１９番４号,,13,103,1050003,,,,,,,2015-10-05,1,,,,,,0
33867,1010405010699,01,1,2018-08-02,2015-10-05,一般社団法人日米協会,,399,東京都,港区,赤坂１丁目１１番２８号,,13,103,1070052,,,,,,,2015-10-05,1,,,,,ニチベイキョウカイ,0
33868,1010405010716,21,0,2016-07-19,2016-07-04,ＴＪプロパティーズ特定目的会社,,399,東京都,港区,虎ノ門３丁目２２番１０－２０１号,,13,103,1050001,,,2016-07-04,01,,,2015-10-05,1,,,,,,0
33869,1010405010724,01,0,2015-10-26,2015-10-05,一般社団法人日本レイキセラピスト協会,,399,東京都,港区,南青山５丁目１８番４号,,13,103,1070062,,,,,,,2015-10-05,1,,,,,,0
33870,1010405010740,01,0,2015-10-26,2015-10-05,医療法人社団大輝会,,399,東京都,港区,新橋６丁目２０番１号,,13,103,1050004,,,,,,,2015-10-05,1,,,,,,0
33871,1010405010765,01,0,2015-10-26,2015-10-05,特定非営利活動法人地域から国を変える会,,399,東京都,港区,南青山２丁目１９番３号サザンキャッスルビル２階,,13,103,1070062,,,,,,,2015-10-05,1,,,,,,0
33872,1010405010773,01,0,2015-10-26,2015-10-05,一般社団法人日本アイブロウ協会,,399,東京都,港区,西新橋１丁目１８番８号,,13,103,1050003,,,,,,,2015-10-05,1,,,,,,0
33873,1010405010781,21,0,2018-05-25,2018-05-16,一般社団法人地域先端医療教育検討推進会議,,399,東京都,渋谷区,富ヶ谷１丁目９番５号Ｆ．Ｔ．ビル２Ｆ,,13,113,1510063,,,2018-05-16,01,,,2015-10-05,1,,,,,チイキセンタンイリョウキョウイクケントウスイシンカイギ,0
33874,1010405010848,12,0,2018-11-16,2018-11-05,一般社団法人健康経済分析機構,,399,東京都,港区,南青山２丁目２番１５号ウィン青山９４２,,13,103,1070062,,,,,,,2015-10-05,1,,,,,,0
33875,1010405010856,01,1,2018-07-27,2015-10-05,一般社団法人エナジーエクスプローラー,,399,東京都,港区,元赤坂１丁目１番７号,,13,103,1070051,,,,,,,2015-10-05,1,,,,,エナジーエクスプローラー,0
33876,1010405010897,21,0,2018-07-11,2018-07-02,一般社団法人生涯ささえ隊,,399,東京都,港区,六本木１丁目８番７号ＭＦＰＲ六本木麻布台ビル１１階,,13,103,1060032,,,2018-07-02,01,,,2015-10-05,1,,,,,ショウガイササエタイ,0
33877,1010405010906,01,0,2015-10-26,2015-10-05,一般社団法人東洋医学家庭療法研究会,,399,東京都,港区,南麻布３丁目１１番４０号,,13,103,1060047,,,,,,,2015-10-05,1,,,,,,0
33878,1010405010914,12,0,2019-10-01,2019-09-26,一般社団法人不動産取引推進協会,,399,東京都,文京区,湯島３丁目３４番６号湯島スクウェアビル３階,,13,105,1130034,,,,,,,2015-10-05,1,,,,,フドウサントリヒキスイシンキョウカイ,0
