761147,7010405017862,01,0,2019-08-02,2019-07-30,一般社団法人未来の食卓,,399,東京都,港区,六本木３丁目１６番２６号,,13,103,1060032,,,,,,,2019-07-30,1,,,,,ミライノショクタク,0
761148,7010405017870,01,0,2019-07-31,2019-07-26,一般社団法人格付研究センター,,399,東京都,港区,元赤坂１丁目５番２０－７０９号,,13,103,1070051,,,,,,,2019-07-26,1,,,,,カクヅケケンキュウセンター,0
761149,7010405017912,01,0,2019-08-15,2019-08-09,一般社団法人メディカルブローアカデミー,,399,東京都,港区,西麻布１丁目７番１号トリニティビル３Ｆ,,13,103,1060031,,,,,,,2019-08-09,1,,,,,メディカルブローアカデミー,0
761150,7010405017929,01,0,2019-08-14,2019-08-08,一般社団法人なんば駅前ホテル,,399,東京都,港区,元赤坂１丁目１番７号,,13,103,1070051,,,,,,,2019-08-08,1,,,,,ナンバエキマエホテル,0
761151,7010405017937,01,1,2019-09-11,2019-08-19,税理士法人福井・林財産コンサルタンツ,,399,東京都,港区,虎ノ門３丁目１８番１２号ステュディオ虎ノ門１００１号,,13,103,1050001,,,,,,,2019-08-19,1,,,,,フクイハヤシザイサンコンサルタンツ,0
761152,7010405017961,01,0,2019-08-20,2019-08-15,一般社団法人太平洋航空運送協会,,399,東京都,港区,芝浦１丁目４番１１号,,13,103,1050023,,,,,,,2019-08-15,1,,,,,タイヘイヨウコウクウウンソウキョウカイ,0
761153,7010405017986,01,0,2019-09-02,2019-08-28,一般社団法人在日ウズベキスタン青年協会,,399,東京都,港区,高輪２丁目１－５２,,13,103,1080074,,,,,,,2019-08-28,1,,,,,ザイニチウズベキスタンセイネンキョウカイ,0
761154,7010405017994,01,0,2019-08-23,2019-08-20,一般社団法人ＯＪ　ＭＦ,,399,東京都,港区,虎ノ門３丁目２２番１０－２０１号,,13,103,1050001,,,,,,,2019-08-20,1,,,,,オージェーエムエフ,0
761155,7010405018002,01,0,2019-09-04,2019-08-30,特定目的会社ＬＥＧＡＬ１,,399,東京都,港区,元赤坂１丁目１番７号,,13,103,1070051,,,,,,,2019-08-30,1,,,,,リーガルワン,0
761156,7010405018010,01,0,2019-09-05,2019-09-02,一般社団法人事業承継ＣＯＭＰＬＵＳ,,399,東京都,港区,高輪３丁目２４番２１号,,13,103,1080074,,,,,,,2019-09-02,1,,,,,ジギョウショウケイコムプラス,0
761157,7010405018027,01,0,2019-09-06,2019-09-03,大阪キャピタル３一般社団法人,,399,東京都,港区,六本木１丁目６番１号泉ガーデンタワー,,13,103,1060032,,,,,,,2019-09-03,1,,,,,オオサカキャピタルスリー,0
761158,7010405018035,01,0,2019-09-10,2019-09-05,特定非営利活動法人日本国際文化育英会,,399,東京都,港区,芝大門２丁目６番８号中島ビル２階,,13,103,1050012,,,,,,,2019-09-05,1,,,,,,0
761159,7010405018043,11,0,2019-10-16,2019-10-10,Ｅｖｅｒ　Ｇｌｏｒｙ　Ｐｒｏｐｅｒｔｙ一般社団法人,,399,東京都,港区,虎ノ門３丁目２２番１０－２０１号,,13,103,1050001,,,,,,,2019-09-06,1,,,,,エバーグローリープロパティ,0
761160,7010405018051,12,0,2020-03-13,2020-03-11,一般社団法人日本フューチャーラーナーズ協会,,399,東京都,千代田区,一番町８番地住友不動産一番町ビル４階,,13,101,1020082,,,,,,,2019-09-12,1,,,,,ニホンフューチャーラーナーズキョウカイ,0
761161,7010405018076,01,0,2019-09-24,2019-09-18,一般社団法人日本建物配管調査診断協会,,399,東京都,港区,新橋６丁目５番４－１００９号,,13,103,1050004,,,,,,,2019-09-18,1,,,,,ニホンタテモノハイカンチョウサシンダンキョウカイ,0
761162,7010405018084,01,0,2019-09-20,2019-09-17,特定目的会社御堂筋開発,,399,東京都,港区,六本木６丁目１０番１号六本木ヒルズ森タワー,,13,103,1060032,,,,,,,2019-09-17,1,,,,,ミドウスジカイハツ,0
761163,7010405018118,01,0,2019-10-08,2019-10-03,一般社団法人エネルギー５,,399,東京都,港区,虎ノ門３丁目２２番１０－２０１号,,13,103,1050001,,,,,,,2019-10-03,1,,,,,エネルギーゴ,0
761164,7010405018134,01,0,2019-10-17,2019-10-11,一般社団法人大連外国語大学日本校友会,,399,東京都,港区,赤坂３丁目６番６号,,13,103,1070052,,,,,,,2019-10-11,1,,,,,ダイレンガイコクゴダイガクニホンコウユウカイ,0
761165,7010405018150,01,1,2019-11-01,2019-10-17,一般財団法人日本医療推進財団,,399,東京都,港区,西新橋１丁目２番９号日比谷セントラルビルＢ１,,13,103,1050003,,,,,,,2019-10-17,1,,,,,ニホンイリョウスイシンザイダン,0
761166,7010405018167,01,0,2019-10-18,2019-10-15,一般社団法人ＰＦＩ開発支援機構,,399,東京都,港区,六本木３丁目２番１号,,13,103,1060032,,,,,,,2019-10-15,1,,,,,ピーエフアイカイハツシエンキコウ,0
761167,7010405018175,11,0,2019-11-19,2019-11-14,東品川オフィス特定目的会社,,399,東京都,港区,六本木１丁目６番１号泉ガーデンタワー１２階,,13,103,1060032,,,,,,,2019-10-17,1,,,,,ヒガシシナガワオフィス,0
761168,7010405018191,01,0,2019-10-25,2019-10-21,一般社団法人Ｊａｐａｎ　Ａｓｓｏｃｉａｔｉｏｎ　ｆｏｒ　Ｍｕｓｉｃ　Ｅｄｕｃａｔｉｏｎ　Ｐｒｏｇｒａｍ,,399,東京都,港区,浜松町２丁目２番１５号,,13,103,1050013,,,,,,,2019-10-21,1,,,,,ジャパンアソシエーションフォーミュージックエデュケーションプログラム,0
761169,7010405018200,01,0,2019-11-06,2019-11-01,一般社団法人グローバル技術資源アカデミー,,399,東京都,港区,赤坂９丁目１番７号,,13,103,1070052,,,,,,,2019-11-01,1,,,,,グローバルギジュツシゲンアカデミー,0
761170,7010405018209,01,0,2019-11-01,2019-10-29,一般社団法人Ｋａｔａｓｅ　Ｎｉｓｈｉ,,399,東京都,港区,虎ノ門５丁目１番４号,,13,103,1050001,,,,,,,2019-10-29,1,,,,,カタセニシ,0
761171,7010405018217,01,0,2019-11-13,2019-11-08,一般社団法人Ｔｈｉｎｋ　Ｔｈｅ　ＤＡＹ,,399,東京都,港区,南青山６丁目１５番１３号,,13,103,1070062,,,,,,,2019-11-08,1,,,,,シンクザデイ,0
761172,7010405018225,01,0,2019-11-11,2019-11-06,松戸一般社団法人,,399,東京都,港区,虎ノ門３丁目２２番１０－２０１号,,13,103,1050001,,,,,,,2019-11-06,1,,,,,マツド,0
761173,7010405018241,01,0,2019-11-18,2019-11-13,一般社団法人ウーマンフロンティア,,399,東京都,港区,北青山２丁目７番１３号プラセオ青山ビル３階,,13,103,1070061,,,,,,,2019-11-13,1,,,,,ウーマンフロンティア,0
761174,7010405018266,01,0,2019-11-27,2019-11-22,一般社団法人銀座環境会議,,399,東京都,港区,三田４丁目１９番２１－４０１号,,13,103,1080073,,,,,,,2019-11-22,1,,,,,ギンザカンキョウカイギ,0
761175,7010405018274,12,0,2020-02-28,2020-02-26,一般社団法人日中新時代研究センター,,399,東京都,中央区,日本橋馬喰町１丁目６番１４号日本橋一平堂ビル６階,,13,102,1030002,,,,,,,2019-11-25,1,,,,,ニッチュウシンジダイケンキュウセンター,0
761176,7010405018282,11,0,2020-03-31,2020-03-25,一般社団法人全国第三者承継推進協会,,399,東京都,港区,浜松町２丁目２番１５号浜松町ダイヤビル２Ｆ,,13,103,1050013,,,,,,,2019-12-02,1,,,,,ゼンコクダイサンシャショウケイスイシンキョウカイ,0
761177,7010405018290,01,0,2019-12-05,2019-12-03,一般社団法人通電火災予防協会,,399,東京都,港区,高輪４丁目１番１８号高輪ビル２階,,13,103,1080074,,,,,,,2019-12-03,1,,,,,ツウデンカサイヨボウキョウカイ,0
761178,7010405018299,01,0,2019-12-04,2019-12-02,表参道インベストメント一般社団法人,,399,東京都,港区,元赤坂１丁目１番７号,,13,103,1070051,,,,,,,2019-12-02,1,,,,,オモテサンドウインベストメント,0
761179,7010405018308,01,0,2019-12-18,2019-12-16,一般社団法人国際産学官交流機構,,399,東京都,港区,芝浦４丁目１６番１４－２１０３号,,13,103,1080023,,,,,,,2019-12-16,1,,,,,コクサイサンガクカンコウリュウキコウ,0
761180,7010405018316,01,0,2019-12-16,2019-12-12,一般社団法人心臓血管外科振興会,,399,東京都,港区,白金４丁目５番５号,,13,103,1080072,,,,,,,2019-12-12,1,,,,,シンゾウケッカンゲカシンコウカイ,0
761181,7010405018340,01,0,2019-12-20,2019-12-18,一般社団法人この星の芸術協会,,399,東京都,港区,六本木６丁目５番２４号ｃｏｍｐｌｅｘ６６５，二階シュウゴアーツ内,,13,103,1060032,,,,,,,2019-12-18,1,,,,,コノホシノゲイジュツキョウカイ,0
761182,7010405018349,01,0,2020-01-06,2019-12-26,一般社団法人日本アレルギー克服米普及協会,,399,東京都,港区,西新橋３丁目２５番８号,,13,103,1050003,,,,,,,2019-12-26,1,,,,,ニホンアレルギーコクフクマイフキュウキョウカイ,0
761183,7010405018357,01,0,2019-12-25,2019-12-23,一般社団法人ＴＲＮ１,,399,東京都,港区,虎ノ門３丁目２２番１０－２０１号,,13,103,1050001,,,,,,,2019-12-23,1,,,,,ティーアールエヌワン,0
761184,7010405018365,01,0,2020-01-07,2019-12-27,一般社団法人Ｍａｔｔｙ協会,,399,東京都,港区,白金台５丁目２２番１１号,,13,103,1080071,,,,,,,2019-12-27,1,,,,,マティキョウカイ,0
761185,7010405018373,01,0,2020-01-06,2019-12-26,一般社団法人ノース・マウンテン,,399,東京都,港区,元赤坂１丁目１番７号,,13,103,1070051,,,,,,,2019-12-26,1,,,,,ノースマウンテン,0
761186,7010405018381,01,0,2020-01-14,2020-01-09,一般社団法人日中健康産業協会,,399,東京都,港区,東新橋２丁目１０番１０号６Ｆ,,13,103,1050021,,,,,,,2020-01-09,1,,,,,ニッチュウケンコウサンギョウキョウカイ,0
761187,7010405018398,12,0,2020-04-06,2020-03-31,一般社団法人配慮者支援協会,,399,東京都,杉並区,和田３丁目４１番１８－１０７号,,13,115,1660012,,,,,,,2020-01-20,1,,,,,ハイリョシャシエンキョウカイ,0
761188,7010405018415,01,1,2020-02-04,2020-01-22,弁護士法人鳳和虎ノ門法律事務所,,399,東京都,港区,虎ノ門５丁目２番７号,,13,103,1050001,,,,,,,2020-01-22,1,HOUWA Toranomon Law Office,Tokyo,"DOI building 4th floor,5-2-7,Toranomon, Minato ku",,ホウワトラノモンホウリツジムショ,0
761189,7010405018431,01,0,2020-01-23,2020-01-23,一般社団法人ハーバー,,399,東京都,港区,虎ノ門３丁目２２番１０－２０１号,,13,103,1050001,,,,,,,2020-01-23,1,,,,,ハーバー,0
761190,7010405018456,01,0,2020-02-04,2020-02-04,梅新ホールディング２一般社団法人,,399,東京都,港区,虎ノ門３丁目２２番１０－２０１号,,13,103,1050001,,,,,,,2020-02-04,1,,,,,ウメシンホールディングツー,0
761191,7010405018472,01,0,2020-02-04,2020-02-04,一般社団法人フルール,,399,東京都,港区,虎ノ門３丁目２２番１０－２０１号,,13,103,1050001,,,,,,,2020-02-04,1,,,,,フルール,0
761192,7010405018489,01,0,2020-02-12,2020-02-12,一般社団法人ビーエヌ,,399,東京都,港区,芝４丁目７番６号芝ビルディング７０４号,,13,103,1080014,,,,,,,2020-02-12,1,,,,,ビーエヌ,0
761193,7010405018497,01,0,2020-02-07,2020-02-07,一般社団法人エスエイチ１２,,399,東京都,港区,元赤坂１丁目１番８号株式会社赤坂国際会計内,,13,103,1070051,,,,,,,2020-02-07,1,,,,,エスエイチジュウニ,0
761194,7010405018506,01,0,2020-02-18,2020-02-18,一般社団法人日本自動販売協会,,399,東京都,港区,新橋５丁目３２番地の２,,13,103,1050004,,,,,,,2020-02-18,1,,,,,ニホンジドウハンバイキョウカイ,0
761195,7010405018514,01,0,2020-02-20,2020-02-20,一般社団法人かけはし,,399,東京都,港区,赤坂４丁目３－４,,13,103,1070052,,,,,,,2020-02-20,1,,,,,カケハシ,0
761196,7010405018522,01,0,2020-02-19,2020-02-19,一般社団法人ヒガシウエノ,,399,東京都,港区,赤坂２丁目１０番５号税理士法人赤坂国際会計事務所内,,13,103,1070052,,,,,,,2020-02-19,1,,,,,ヒガシウエノ,0
761197,7010405018530,01,0,2020-02-19,2020-02-19,特定目的会社ベンチャーＢ,,399,東京都,港区,虎ノ門３丁目２２番１０－２０１号,,13,103,1050001,,,,,,,2020-02-19,1,,,,,ベンチャービー,0
761198,7010405018539,01,0,2020-02-20,2020-02-20,一般社団法人ＨＤＧ１５,,399,東京都,港区,虎ノ門３丁目２２番１０－２０１号,,13,103,1050001,,,,,,,2020-02-20,1,,,,,エイチディージーワンファイブ,0
761199,7010405018555,01,0,2020-03-03,2020-03-03,一般財団法人ＮＯＢＬＥＳＳＥ　ＯＢＬＩＧＥ　Ｃ＆Ｍ,,399,東京都,港区,六本木３丁目７番１号ＴＨＥ・ＲＯＰＰＯＮＧＩ・ＴＯＫＹＯ８０５,,13,103,1060032,,,,,,,2020-03-03,1,,,,,ノブレスオブリージュシーアンドエム,0
761200,7010405018563,01,0,2020-03-04,2020-03-04,ＮＥＣファシリティーズ労働組合,,399,東京都,港区,芝２丁目３１番２５号ＮＥＣ別館内,,13,103,1050014,,,,,,,2020-03-04,1,,,,,エヌイーシーファシリティーズ,0
761201,7010405018571,01,0,2020-03-10,2020-03-10,一般社団法人日本メイクリスニングセーフ協会,,399,東京都,港区,芝公園１丁目１番１２号芝公園電気ビルディング１階,,13,103,1050011,,,,,,,2020-03-10,1,,,,,ニホンメイクリスニングセーフキョウカイ,0
761202,7010405018588,01,0,2020-03-10,2020-03-10,一般社団法人Ｋａｍｏｇａｗａ　Ｈｏｔｅｌ　Ａｓｓｅｔ　Ｈｏｌｄｉｎｇ,,399,東京都,港区,元赤坂１丁目１番８号株式会社赤坂国際会計内,,13,103,1070051,,,,,,,2020-03-10,1,,,,,カモガワホテルアセットホールディング,0
761203,7010405018596,01,0,2020-03-16,2020-03-16,一般社団法人建築都市科学検査機構,,399,東京都,港区,海岸１丁目１番１号,,13,103,1050022,,,,,,,2020-03-16,1,,,,,ケンチクトシカガクケンサキコウ,0
761204,7010405018605,01,0,2020-03-13,2020-03-13,一般社団法人ＨＤＧ１９,,399,東京都,港区,虎ノ門３丁目２２番１０－２０１号,,13,103,1050001,,,,,,,2020-03-13,1,,,,,エイチディージーワンナイン,0
761205,7010405018621,01,0,2020-03-24,2020-03-24,医療法人社団晃誠会,,399,東京都,港区,新橋３丁目１番１０号石井ビル２階,,13,103,1050004,,,,,,,2020-03-24,1,,,,,コウセイカイ,0
761206,7010405018638,01,0,2020-04-01,2020-04-01,一般社団法人ベジテラピー協会,,399,東京都,港区,高輪３丁目２３番１４号,,13,103,1080074,,,,,,,2020-04-01,1,,,,,ベジテラピーキョウカイ,0
761207,7010405018646,01,0,2020-04-02,2020-04-02,弁護士法人Ｆｉｅｌｄ－Ｒ,,399,東京都,港区,六本木４丁目２番３５号,,13,103,1060032,,,,,,,2020-04-02,1,,,,,フィールドアール,0
761208,7010405018654,01,0,2020-04-10,2020-04-10,エミライン社会保険労務士法人,,399,東京都,港区,西麻布１丁目３番１６号池田ビル,,13,103,1060031,,,,,,,2020-04-10,1,,,,,エミライン,0
761209,7010405018662,01,0,2020-04-07,2020-04-07,一般社団法人ＯＭＵＲＯ８８,,399,東京都,港区,虎ノ門３丁目１８番１２号,,13,103,1050001,,,,,,,2020-04-07,1,,,,,オムロエイティエイト,0
761210,7010405018670,01,0,2020-04-21,2020-04-21,一般社団法人Ｈａｎａｕｔａｂｉｔｏ,,399,東京都,港区,南青山５丁目１７番２号,,13,103,1070062,,,,,,,2020-04-21,1,,,,,ハナウタビト,0
761211,7010405018679,01,0,2020-04-07,2020-04-07,一般社団法人おだしプロジェクト,,399,東京都,港区,北青山２丁目１２番４２－１０３号,,13,103,1070061,,,,,,,2020-04-07,1,,,,,オダシプロジェクト,0
761212,7010405018687,01,0,2020-04-08,2020-04-08,千代田プロパティ一般社団法人,,399,東京都,港区,六本木１丁目６番１号泉ガーデンタワー,,13,103,1060032,,,,,,,2020-04-08,1,,,,,,0
761213,7010405018720,01,0,2020-04-28,2020-04-28,一般社団法人ＲＪパワージェネレーション,,399,東京都,港区,西新橋１丁目２番９号メンターキャピタル税理士法人内,,13,103,1050003,,,,,,,2020-04-28,1,,,,,アールジェイパワージェネレーション,0
881713,8010405010016,12,1,2018-10-11,2018-10-01,特定非営利活動法人日本フロアホッケー連盟,,399,東京都,港区,白金台５丁目２２番１１号,,13,103,1080071,,,,,,,2015-10-05,1,,,,,ニホンフロアホッケーレンメイ,0
881714,8010405010024,11,1,2018-05-15,2016-02-01,一般社団法人ＮＯＷＳ,,399,東京都,千代田区,神田神保町１丁目１２番地神保町一丁目ビル１階,,13,101,1010051,,,,,,,2015-10-05,1,,,,,ナウズ,0
881715,8010405010032,01,0,2015-10-26,2015-10-05,特定非営利活動法人セーフティフード栄養研究所１００ｋｃａｌユニバーサルデザイン,,399,東京都,中央区,銀座７丁目１３番地６号サガミビル２階,,13,102,1040061,,,,,,,2015-10-05,1,,,,,,0
881716,8010405010057,12,1,2019-09-25,2016-12-12,一般社団法人アジアデンタルフォーラム,,399,東京都,文京区,本郷２丁目２５番６号ニューライトビル２０４号室,,13,105,1130033,,,,,,,2015-10-05,1,,,,,アジアデンタルフォーラム,0
881717,8010405010081,01,1,2019-09-02,2015-10-05,一般社団法人ジャパンクリエイティブ,,399,東京都,港区,南青山６丁目１１番８号,,13,103,1070062,,,,,,,2015-10-05,1,,,,,ジャパンクリエイティブ,0
881718,8010405010098,01,1,2018-06-18,2015-10-05,公益財団法人山路ふみ子文化財団,,399,東京都,港区,元赤坂１丁目１番７号赤坂モートサイド１２０１号,,13,103,1070051,,,,,,,2015-10-05,1,,,,,ヤマジフミコブンカザイダン,0
881719,8010405010107,12,1,2019-04-17,2017-03-10,一般社団法人リキッドセブン,,399,東京都,港区,北青山２丁目７番２８号,,13,103,1070061,,,,,,,2015-10-05,1,,,,,リキッドセブン,0
881720,8010405010115,01,1,2018-05-02,2015-10-05,一般社団法人日本自動車販売協会連合会,,399,東京都,港区,芝大門１丁目１番３０号,,13,103,1050012,,,,,,,2015-10-05,1,,,,,ニホンジドウシャハンバイキョウカイレンゴウカイ,0
881721,8010405010148,21,0,2016-12-13,2016-12-07,一般財団法人日本移動通信システム協会,,399,東京都,港区,芝浦４丁目６番８号住友不動産田町ファーストビル,,13,103,1080023,,,2016-12-07,01,,,2015-10-05,1,,,,,,0
881722,8010405010156,01,1,2019-10-11,2015-10-05,一般社団法人Ｅａｓｔ　Ａｓｉａ　Ｒｅｓｏｒｔｓ,,399,東京都,港区,元赤坂１丁目１番７号,,13,103,1070051,,,,,,,2015-10-05,1,,,,,イーストアジアリゾーツ,0
881723,8010405010164,21,0,2019-12-05,2019-11-29,一般社団法人Ｍａｒｑｕｉｓ　ＬＨ,,399,東京都,港区,虎ノ門３丁目２２番１０－２０１号,,13,103,1050001,,,2019-11-29,01,,,2015-10-05,1,,,,,マーキスエルエイチ,0
881724,8010405010172,01,1,2018-07-10,2015-10-05,一般社団法人全国漁業就業者確保育成センター,,399,東京都,港区,赤坂１丁目９番１３号,,13,103,1070052,,,,,,,2015-10-05,1,,,,,ゼンコクギョギョウシュウギョウシャカクホイクセイセンター,0
881725,8010405010180,12,1,2018-05-01,2017-07-06,オパール・ピー・イー特定目的会社,,399,東京都,千代田区,霞が関３丁目２番５号,,13,101,1000013,,,,,,,2015-10-05,1,,,,,オパールピーイー,0
881726,8010405010197,11,0,2020-05-12,2020-04-07,医療法人社団ｓｙｕｓｕｉｋａｉ,,399,東京都,港区,新橋２丁目１８番３号胡萩堂ビル５階,,13,103,1050004,,,,,,,2015-10-05,1,,,,,シュウスイカイ,0
881727,8010405010206,01,1,2020-03-02,2015-10-05,シティタワー品川管理組合法人,,399,東京都,港区,港南４丁目２番７号,,13,103,1080075,,,,,,,2015-10-05,1,,,,,シティタワーシナガワ,0
881728,8010405010214,01,1,2018-09-25,2015-10-05,一般財団法人阿部博幸記念財団,,399,東京都,港区,元赤坂１丁目５番２０号,,13,103,1070051,,,,,,,2015-10-05,1,,,,,アベヒロユキキネンザイダン,0
881729,8010405010230,01,1,2018-10-30,2015-10-05,ＮＥＣフィールディング労働組合,,399,東京都,港区,三田１丁目４番２８号,,13,103,1080073,,,,,,,2015-10-05,1,,,,,エヌイーシーフィールディング,0
881730,8010405010255,12,0,2016-07-27,2016-07-12,特定非営利活動法人油濁防除研究会,,399,東京都,港区,芝２丁目５番６号芝スクエアビル８階モリタ宮田工業株式会社東京営業所内,,13,103,1050014,,,,,,,2015-10-05,1,,,,,,0
881731,8010405010263,12,1,2018-05-17,2015-10-28,一般社団法人日本航空宇宙学会,,399,東京都,中央区,日本橋室町４丁目１番２１号,,13,102,1030022,,,,,,,2015-10-05,1,,,,,ニホンコウクウウチュウガッカイ,0
881732,8010405010271,11,0,2020-05-14,2020-05-07,一般財団法人医療基金会,,399,東京都,港区,芝大門２丁目１２－６－３０１,,13,103,1050012,,,,,,,2015-10-05,1,,,,,イリョウキキンカイ,0
881733,8010405010288,01,0,2015-10-26,2015-10-05,一般社団法人ＩＩＢＡ日本支部,,399,東京都,港区,六本木４丁目１番４号黒崎ビル８階株式会社ソルパック内,,13,103,1060032,,,,,,,2015-10-05,1,,,,,,0
881734,8010405010296,01,0,2015-10-26,2015-10-05,一般社団法人ヤングバラエティ,,399,東京都,港区,浜松町１丁目９番１１号浜松町５５ビル７階,,13,103,1050013,,,,,,,2015-10-05,1,,,,,,0
881735,8010405010321,01,0,2015-10-28,2015-10-05,日本ボウリング場事業協同組合,,399,東京都,品川区,南品川２丁目２番１０号南品川Ｎビル３階,,13,109,1400004,,,,,,,2015-10-05,1,,,,,,0
881736,8010405010338,21,0,2019-06-25,2019-06-03,一般社団法人コンクリートパイル建設技術協会,,399,東京都,港区,浜松町２丁目７番１５号日本工築２号館,,13,103,1050013,,,2019-06-03,11,6010405017772,令和１年６月３日東京都港区浜松町二丁目７番１５号日本工築２号館一般社団法人コンクリートポール・パイル協会（9010405010337）と合併して東京都港区浜松町二丁目７番１５号一般社団法人コンクリートパイル・ポール協会（6010405017772）を設立し解散,2015-10-05,1,,,,,コンクリートパイルケンセツギジュツキョウカイ,0
881737,8010405010346,01,1,2018-07-18,2015-10-05,一般社団法人全国ビスケット協会,,399,東京都,港区,新橋６丁目９番５号,,13,103,1050004,,,,,,,2015-10-05,1,,,,,ゼンコクビスケットキョウカイ,0
881738,8010405010354,12,0,2019-09-19,2019-09-13,公益財団法人石橋財団,,399,東京都,中央区,京橋１丁目７番２号,,13,102,1040031,,,,,,,2015-10-05,1,,,,,イシバシザイダン,0
881739,8010405010362,01,1,2018-06-13,2015-10-05,公益社団法人農業農村工学会,,399,東京都,港区,新橋５丁目３４番４号,,13,103,1050004,,,,,,,2015-10-05,1,,,,,ノウギョウノウソンコウガッカイ,0
881740,8010405010370,11,1,2018-04-16,2017-01-05,公益財団法人日本台湾交流協会,,399,東京都,港区,六本木３丁目１６番３３号青葉六本木ビル７階,,13,103,1060032,,,,,,,2015-10-05,1,,,,,ニホンタイワンコウリュウキョウカイ,0
881741,8010405010379,01,1,2018-05-09,2015-10-05,公益財団法人民間放送教育協会,,399,東京都,港区,六本木６丁目９番１号,,13,103,1060032,,,,,,,2015-10-05,1,,,,,ミンカンホウソウキョウイクキョウカイ,0
881742,8010405010387,01,0,2015-10-26,2015-10-05,公益社団法人東京都港区麻布赤坂歯科医師会,,399,東京都,港区,南青山１丁目１５番２号,,13,103,1070062,,,,,,,2015-10-05,1,,,,,,0
881743,8010405010395,01,1,2018-08-06,2015-10-05,一般社団法人シルバーサービス振興会,,399,東京都,港区,西新橋３丁目２５番３３号,,13,103,1050003,,,,,,,2015-10-05,1,,,,,シルバーサービスシンコウカイ,0
881744,8010405010404,01,1,2019-05-17,2015-10-05,公益社団法人全国柔道整復学校協会,,399,東京都,港区,浜松町１丁目６番２号丸神ビル１階,,13,103,1050013,,,,,,,2015-10-05,1,,,,,ゼンコクジュドウセイフクガッコウキョウカイ,0
881745,8010405010412,01,1,2018-06-14,2015-10-05,一般財団法人アジア会館,,399,東京都,港区,赤坂８丁目１０番３２号,,13,103,1070052,,,,,,,2015-10-05,1,,,,,アジアカイカン,0
881746,8010405010420,01,1,2018-06-27,2015-10-05,公益社団法人日本ボウリング場協会,,399,東京都,品川区,南品川２丁目２番１０号南品川Ｎビル３階,,13,109,1400004,,,,,,,2015-10-05,1,,,,,ニホンボウリングジョウキョウカイ,0
881747,8010405010429,12,0,2019-01-09,2018-12-27,一般社団法人日本インテリアファブリックス協会,,399,東京都,港区,芝大門２丁目１番１７号,,13,103,1050012,,,,,,,2015-10-05,1,,,,,ニホンインテリアファブリックスキョウカイ,0
881748,8010405010437,01,1,2018-07-06,2015-10-05,一般財団法人国際貿易投資研究所,,399,東京都,中央区,築地１丁目４番５号,,13,102,1040045,,,,,,,2015-10-05,1,,,,,コクサイボウエキトウシケンキュウショ,0
881749,8010405010445,12,1,2018-06-28,2017-10-19,公益財団法人たばこ総合研究センター,,399,東京都,墨田区,横川１丁目１６番３号,,13,107,1300003,,,,,,,2015-10-05,1,,,,,タバコソウゴウケンキュウセンター,0
