290149,3010705000423,01,1,2018-04-25,2015-10-05,学校法人東京滋慶学園,,399,東京都,大田区,大森北１丁目１８番２号,,13,111,1430016,,,,,,,2015-10-05,1,,,,,トウキョウジケイガクエン,0
290150,3010705000431,01,1,2018-06-25,2015-10-05,社会福祉法人三徳会,,399,東京都,品川区,中延１丁目８番７号,,13,109,1420053,,,,,,,2015-10-05,1,,,,,サントクカイ,0
290151,3010705000448,01,1,2018-06-19,2015-10-05,荏原ドライクリーニング協同組合,,399,東京都,品川区,小山４丁目７番４号,,13,109,1420062,,,,,,,2015-10-05,1,,,,,エバラドライクリーニング,0
290152,3010705000464,01,0,2015-10-28,2015-10-05,京南金属加工協同組合,,399,東京都,品川区,東大井２丁目２５番９号,,13,109,1400011,,,,,,,2015-10-05,1,,,,,,0
290153,3010705000497,01,1,2018-06-22,2015-10-05,協同組合大東京文具チェーン,,399,東京都,品川区,東大井６丁目１番１０号,,13,109,1400011,,,,,,,2015-10-05,1,,,,,ダイトウキョウブングチェーン,0
290154,3010705000514,01,1,2018-10-03,2015-10-05,品川朝鮮人商工協同組合,,399,東京都,品川区,東大井５丁目２５番２１号,,13,109,1400011,,,,,,,2015-10-05,1,,,,,シナガワチョウセンジンショウコウ,0
290155,3010705000522,01,0,2015-10-28,2015-10-05,品川テクノ協同組合,,399,東京都,品川区,東大井２丁目７番７号,,13,109,1400011,,,,,,,2015-10-05,1,,,,,,0
290156,3010705000547,01,1,2018-08-16,2015-10-05,イトーピア五反田マンション管理組合法人,,399,東京都,品川区,西五反田８丁目１０番１４号,,13,109,1410031,,,,,,,2015-10-05,1,,,,,イトーピアゴタンダマンション,0
290157,3010705000588,01,0,2015-10-28,2015-10-05,荏原町商店街振興組合,,399,東京都,品川区,中延５丁目６番１６号,,13,109,1420053,,,,,,,2015-10-05,1,,,,,,0
290158,3010705000596,01,1,2019-06-20,2015-10-05,不動前駅通り商店街振興組合,,399,東京都,品川区,西五反田５丁目１番１９号,,13,109,1410031,,,,,,,2015-10-05,1,,,,,フドウマエエキドウリ,0
290159,3010705000605,01,1,2018-10-15,2015-10-05,戸越銀座商栄会商店街振興組合,,399,東京都,品川区,平塚３丁目４番１号,,13,109,1420051,,,,,,,2015-10-05,1,,,,,トゴシギンザショウエイカイ,0
290160,3010705000613,12,0,2020-02-06,2020-02-03,特定非営利活動法人子ども未来研究所,,399,東京都,港区,白金台４丁目７－４白金台ＳＴビル３階,,13,103,1080071,,,,,,,2015-10-05,1,,,,,コドモミライケンキュウジョ,0
290161,3010705000638,01,0,2015-10-28,2015-10-05,品川交通従業員労働組合,,399,東京都,品川区,東品川３丁目５１番地,,13,109,1400002,,,,,,,2015-10-05,1,,,,,,0
290162,3010705000646,01,0,2015-10-28,2015-10-05,全日本電機・電子・情報関連産業労働組合連合会明電舎労働組合,,399,東京都,品川区,大崎２丁目５番１５号,,13,109,1410032,,,,,,,2015-10-05,1,,,,,,0
290163,3010705000654,01,0,2015-10-28,2015-10-05,津止合金工業労働組合,,399,東京都,品川区,南品川５丁目２４２番地前田初江方,,13,109,1400004,,,,,,,2015-10-05,1,,,,,,0
290164,3010705000662,01,1,2020-02-27,2015-10-05,東京帝産労働組合,,399,東京都,品川区,東品川４丁目１０番２３号,,13,109,1400002,,,,,,,2015-10-05,1,,,,,トウキョウテイサン,0
290165,3010705000687,01,0,2015-10-28,2015-10-05,立正大学教養部教員組合,,399,東京都,品川区,大崎４丁目２番１６号立正大学内,,13,109,1410032,,,,,,,2015-10-05,1,,,,,,0
290166,3010705000695,01,0,2015-10-28,2015-10-05,日本労働組合総評議会全国金属労働組合東京地方本部東京日通自動車工業支部,,399,東京都,品川区,東品川４丁目１１番２４号,,13,109,1400002,,,,,,,2015-10-05,1,,,,,,0
290167,3010705000704,12,0,2017-05-25,2017-05-23,特定非営利活動法人健康科学研究開発センター,,399,東京都,板橋区,舟渡１丁目８－１４－３０６号,,13,119,1740041,,,,,,,2015-10-05,1,,,,,,0
290168,3010705000753,01,1,2019-05-21,2015-10-05,医療法人社団双壽會,,399,東京都,品川区,戸越３丁目１番２号イマールビル２階２０２号室,,13,109,1420041,,,,,,,2015-10-05,1,,,,,ソウジュカイ,0
290169,3010705000786,01,1,2018-06-01,2015-10-05,医療法人社団こだま会,,399,東京都,品川区,荏原１丁目１４番１号シェヌー桐ヶ谷１階,,13,109,1420063,,,,,,,2015-10-05,1,,,,,コダマカイ,0
290170,3010705000811,21,0,2018-01-31,2018-01-30,特定非営利活動法人日本ハウスケア協会,,399,東京都,品川区,荏原３丁目８番２１号,,13,109,1420063,,,2018-01-30,21,,,2015-10-05,1,,,,,,0
290171,3010705000836,01,1,2019-02-04,2015-10-05,医療法人社団二葉会,,399,東京都,品川区,東五反田２丁目２番１６号,,13,109,1410022,,,,,,,2015-10-05,1,,,,,フタバカイ,0
290172,3010705000869,01,1,2019-05-24,2015-10-05,ＩＭＡＧＩＣＡ労働組合,,399,東京都,品川区,東五反田２丁目１４番１号,,13,109,1410022,,,,,,,2015-10-05,1,,,,,イマジカ,0
290173,3010705000877,21,0,2020-03-04,2020-02-19,特定非営利活動法人国際アマチュア無線ボランティアズ,,399,東京都,品川区,西五反田４丁目２０番２号,,13,109,1410031,,,2020-02-19,01,,,2015-10-05,1,,,,,コクサイアマチュアムセンボランティアズ,0
290174,3010705000885,01,0,2015-10-28,2015-10-05,特定非営利活動法人生体機構制御研究会,,399,東京都,品川区,戸越１丁目７番１号戸越ＮＩビル株式会社計算力学研究センター内,,13,109,1420041,,,,,,,2015-10-05,1,,,,,,0
290175,3010705000910,12,0,2016-10-31,2016-10-27,特定非営利活動法人日本てまり文化振興協会,,399,東京都,台東区,元浅草２丁目８番４号,,13,106,1110041,,,,,,,2015-10-05,1,,,,,,0
290176,3010705000935,12,0,2017-08-04,2017-07-27,特定非営利活動法人子育て品川,,399,東京都,品川区,小山台１丁目２８番４号,,13,109,1420061,,,,,,,2015-10-05,1,,,,,,0
290177,3010705000968,21,0,2017-01-24,2017-01-23,東日本ハウジングインテリア協同組合,,399,東京都,品川区,東品川４丁目１２番１１号２５０４号,,13,109,1400002,,,2017-01-23,21,,,2015-10-05,1,,,,,,0
290178,3010705000976,01,1,2018-08-06,2015-10-05,特定非営利活動法人日本ホームスクール支援協会,,399,東京都,品川区,北品川５丁目１２番４号,,13,109,1410001,,,,,,,2015-10-05,1,,,,,ニホンホームスクールシエンキョウカイ,0
290179,3010705000984,01,1,2018-08-17,2015-10-05,医療法人社団尽徳会,,399,東京都,品川区,東大井２丁目２６番３号１階,,13,109,1400011,,,,,,,2015-10-05,1,,,,,ジントクカイ,0
290180,3010705001000,01,1,2018-08-15,2015-10-05,特定非営利活動法人健康麻将全国会,,399,東京都,品川区,西五反田２丁目４番２号,,13,109,1410031,,,,,,,2015-10-05,1,,,,,ケンコウマージャンゼンコクカイ,0
290181,3010705001009,01,1,2018-06-04,2015-10-05,協同組合フレッシュフーズサプライ,,399,東京都,品川区,大崎１丁目６番４号,,13,109,1410032,,,,,,,2015-10-05,1,,,,,フレッシュフーズザプライ,0
290182,3010705001017,01,1,2019-06-04,2015-10-05,特定非営利活動法人デジタル・フォレンジック研究会,,399,東京都,品川区,東五反田１丁目４番１号ハニー五反田第２ビル,,13,109,1410022,,,,,,,2015-10-05,1,,,,,デジタルフォレンジックケンキュウカイ,0
290183,3010705001033,01,0,2015-10-28,2015-10-05,医療法人社団静英会,,399,東京都,品川区,戸越５丁目１０番１８号ファムスビル１階,,13,109,1420041,,,,,,,2015-10-05,1,,,,,,0
290184,3010705001058,01,1,2019-05-21,2015-10-05,特定非営利活動法人ウーヴ,,399,東京都,品川区,中延６丁目２番１８号,,13,109,1420053,,,,,,,2015-10-05,1,,,,,,0
290185,3010705001066,01,0,2015-10-28,2015-10-05,特定非営利活動法人日本機能食品・環境ホルモン検査認証センター,,399,東京都,品川区,東品川２丁目２－２５サンウッド品川天王洲タワー＃３０１,,13,109,1400002,,,,,,,2015-10-05,1,,,,,,0
290186,3010705001074,01,0,2015-10-28,2015-10-05,パレス後楽園管理組合法人,,399,東京都,品川区,東五反田１丁目９番７号株式会社ブレーンファーム内,,13,109,1410022,,,,,,,2015-10-05,1,,,,,,0
290187,3010705001124,01,0,2015-10-28,2015-10-05,ＷＡＳ事業協同組合,,399,東京都,品川区,上大崎３丁目３番９－４０３号,,13,109,1410021,,,,,,,2015-10-05,1,,,,,,0
290188,3010705001165,12,0,2019-01-16,2019-01-11,特定非営利活動法人日本プレゼンテーション協会,,399,東京都,千代田区,麹町１丁目６－９ＤＩＫ麹町ビル５Ｆ,,13,101,1020083,,,,,,,2015-10-05,1,,,,,ニッポンプレゼンテーションキョウカイ,0
290189,3010705001207,01,0,2015-10-28,2015-10-05,特定非営利活動法人日パ・ウェルフェアー・アソシエーシヨン,,399,東京都,品川区,上大崎２丁目１３番３５号ＫＩビル８０３号,,13,109,1410021,,,,,,,2015-10-05,1,,,,,,0
290190,3010705001223,01,1,2019-11-05,2015-10-05,三井金属鉱業労働組合連合会,,399,東京都,品川区,大崎１丁目１１番１号,,13,109,1410032,,,,,,,2015-10-05,1,,,,,ミツイキンゾクコウギョウ,0
290191,3010705001231,01,0,2015-10-28,2015-10-05,特定非営利活動法人地域支援ネットかもめ,,399,東京都,品川区,大井７丁目８番１７号,,13,109,1400014,,,,,,,2015-10-05,1,,,,,,0
290192,3010705001248,12,0,2015-11-04,2015-10-30,特定非営利活動法人景観デザイン支援機構,,399,東京都,台東区,駒形１丁目５番６号,,13,106,1110043,,,,,,,2015-10-05,1,,,,,,0
290193,3010705001256,01,1,2019-09-20,2015-10-05,医療法人社団仁医尾島会,,399,東京都,品川区,東品川４丁目１２番８号品川シーサイドイーストタワー１階,,13,109,1400002,,,,,,,2015-10-05,1,,,,,ジンイオジマカイ,0
290194,3010705001272,01,1,2020-02-03,2015-10-05,医療法人社団友徳発心会,,399,東京都,品川区,大崎４丁目１番２号ウィン第２五反田ビル４階,,13,109,1410032,,,,,,,2015-10-05,1,,,,,ユウトクホッシンカイ,0
290195,3010705001322,01,1,2019-11-21,2015-10-05,一般社団法人しながわ観光協会,,399,東京都,品川区,大井１丁目１４番１号,,13,109,1400014,,,,,,,2015-10-05,1,,,,,シナガワカンコウキョウカイ,0
290196,3010705001330,01,0,2015-10-28,2015-10-05,特定非営利活動法人日本靈氣療法協会,,399,東京都,品川区,西五反田８丁目２番５号有宏ビル４Ｆ,,13,109,1410031,,,,,,,2015-10-05,1,,,,,,0
290197,3010705001339,01,0,2015-10-28,2015-10-05,特定非営利活動法人ライフ,,399,東京都,品川区,西五反田５丁目２６番３号フェルトベルク３０９,,13,109,1410031,,,,,,,2015-10-05,1,,,,,,0
290198,3010705001347,01,0,2015-10-28,2015-10-05,特定非営利活動法人救急医療情報協会,,399,東京都,品川区,東五反田１丁目１３番１２号ＣＯＩ五反田ビル４Ｆ,,13,109,1410022,,,,,,,2015-10-05,1,,,,,,0
290199,3010705001355,21,0,2015-12-14,2015-12-09,特定非営利活動法人防疫環境管理工業会,,399,東京都,品川区,大崎１丁目２番地３号,,13,109,1410032,,,2015-12-09,01,,,2015-10-05,1,,,,,,0
290200,3010705001396,12,1,2020-04-22,2016-10-04,巴工業労働組合,,399,東京都,品川区,北品川５丁目５番１５号大崎ブライトコア巴工業株式会社内,,13,109,1410001,,,,,,,2015-10-05,1,,,,,トモエコウギョウ,0
290201,3010705001413,12,1,2018-04-10,2016-08-19,一般社団法人日本保険仲立人協会,,399,東京都,中央区,日本橋本石町３丁目３番５号三友常盤橋ビル,,13,102,1030021,,,,,,,2015-10-05,1,,,,,ニホンホケンナカダチニンキョウカイ,0
290202,3010705001421,01,0,2015-10-28,2015-10-05,一般社団法人日中経済リンク協会,,399,東京都,品川区,北品川１丁目１０番２号,,13,109,1400001,,,,,,,2015-10-05,1,,,,,,0
290203,3010705001438,01,0,2015-10-28,2015-10-05,特許業務法人ＳＳＩＮＰＡＴ,,399,東京都,品川区,西五反田７丁目１３番６号,,13,109,1410031,,,,,,,2015-10-05,1,,,,,,0
290204,3010705001446,01,1,2018-07-10,2015-10-05,医療法人社団冠心会,,399,東京都,品川区,北品川５丁目４番１２号,,13,109,1410001,,,,,,,2015-10-05,1,,,,,カンシンカイ,0
290205,3010705001454,01,0,2015-10-28,2015-10-05,ＴＲＦ１号特定目的会社,,399,東京都,品川区,東五反田１丁目１３番１２号,,13,109,1410022,,,,,,,2015-10-05,1,,,,,,0
290206,3010705001470,21,0,2020-05-18,2020-05-14,特定非営利活動法人大森夢会議,,399,東京都,品川区,南大井３丁目１７番１０号３Ｆ,,13,109,1400013,,,2020-05-14,01,,,2015-10-05,1,,,,,オオモリユメカイギ,0
290207,3010705001479,01,0,2015-10-28,2015-10-05,特定非営利活動法人ＡＳＩＡ　ＹＯＵＴＨ　ＬＥＡＤＥＲＳＨＩＰ　ＦＯＲＵＭ,,399,東京都,品川区,西品川２丁目２番６号スカイコート・ヴァンテアン品川５０２,,13,109,1410033,,,,,,,2015-10-05,1,,,,,,0
290208,3010705001487,01,0,2015-10-28,2015-10-05,特定非営利活動法人地球再生計画,,399,東京都,品川区,荏原１丁目２３番３号,,13,109,1420063,,,,,,,2015-10-05,1,,,,,,0
290209,3010705001495,01,0,2015-10-28,2015-10-05,一般社団法人建築都市科学検査機構,,399,東京都,品川区,上大崎２丁目１０番３４号,,13,109,1410021,,,,,,,2015-10-05,1,,,,,,0
290210,3010705001512,01,1,2018-12-25,2015-10-05,一般社団法人インターホン工業会,,399,東京都,品川区,大崎３丁目１番５号－２０５号室,,13,109,1410032,,,,,,,2015-10-05,1,,,,,インターホンコウギョウカイ,0
290211,3010705001529,21,0,2016-07-13,2016-07-06,一般社団法人ＭＲ対策推進室,,399,東京都,品川区,東五反田１丁目２０番７号,,13,109,1410022,,,2016-07-06,01,,,2015-10-05,1,,,,,,0
290212,3010705001537,01,0,2015-10-28,2015-10-05,特定非営利活動法人Ｓｐａｃｅ　Ｅｎｇｉｎｅｅｒ,,399,東京都,品川区,西五反田８丁目２番６号クリオ五反田６０１,,13,109,1410031,,,,,,,2015-10-05,1,,,,,,0
290213,3010705001545,12,0,2020-03-17,2020-03-13,特定非営利活動法人美術ファンクラブ,,399,東京都,世田谷区,上祖師谷４丁目３８番３号（株）テモアン内,,13,112,1570065,,,,,,,2015-10-05,1,,,,,ビジュツファンクラブ,0
290214,3010705001553,12,1,2019-12-04,2015-10-26,特定非営利活動法人エコストア推進機構,,399,東京都,港区,芝４丁目５番１１号,,13,103,1080014,,,,,,,2015-10-05,1,,,,,エコストアスイシンキコウ,0
290215,3010705001561,01,1,2019-06-07,2015-10-05,特定非営利活動法人日本・中国看護師交流協会,,399,東京都,北区,十条仲原３丁目９番１０号,,13,117,1140031,,,,,,,2015-10-05,1,,,,,ニホンチュウゴクカンゴシコウリュウキョウカイ,0
290216,3010705001586,01,0,2015-10-28,2015-10-05,特定非営利活動法人ハッピーステージ,,399,東京都,品川区,東品川２丁目５番６天王洲ビュータワー第２０１３号室,,13,109,1400002,,,,,,,2015-10-05,1,,,,,,0
290217,3010705001594,01,1,2019-04-16,2015-10-05,一般社団法人日本Ｗｅｂ協会,,399,東京都,新宿区,新宿１丁目９番４号中公ビル３Ｆ,,13,104,1600022,,,,,,,2015-10-05,1,,,,,ニホンウェブキョウカイ,0
290218,3010705001603,01,0,2015-10-28,2015-10-05,特定非営利活動法人ささゆりの会,,399,東京都,品川区,東大井２丁目１９番３号,,13,109,1400011,,,,,,,2015-10-05,1,,,,,,0
290219,3010705001628,21,0,2018-06-15,2018-06-08,特定非営利活動法人東京映像メディア研究会,,399,東京都,品川区,八潮５丁目３番１１－１００９号,,13,109,1400003,,,2018-06-08,01,,,2015-10-05,1,,,,,トウキョウエイゾウメディアケンキュウカイ,0
290220,3010705001636,12,1,2018-07-18,2016-02-09,一般社団法人ビルディング・オートメーション協会,,399,東京都,品川区,北品川５丁目５番１５号,,13,109,1410001,,,,,,,2015-10-05,1,,,,,ビルディングオートメーションキョウカイ,0
290221,3010705001652,01,1,2018-07-10,2015-10-05,公益財団法人微生物化学研究会,,399,東京都,品川区,上大崎３丁目１４番２３号,,13,109,1410021,,,,,,,2015-10-05,1,,,,,ビセイブツカガクケンキュウカイ,0
290222,3010705001685,01,0,2015-10-28,2015-10-05,一般社団法人日華芸術文化交流協会,,399,東京都,品川区,上大崎１丁目１２番１７号,,13,109,1410021,,,,,,,2015-10-05,1,,,,,,0
290223,3010705001693,12,0,2020-02-12,2020-02-06,一般社団法人日本パラリンピアンズ協会,,399,東京都,港区,赤坂１丁目２番２号日本財団ビル内,,13,103,1070052,,,,,,,2015-10-05,1,,,,,ニホンパラリンピアンズキョウカイ,0
290224,3010705001702,12,0,2018-11-06,2018-11-01,特定非営利活動法人コモンスフィア,,399,東京都,渋谷区,千駄ヶ谷３丁目５２番５号,,13,113,1510051,,,,,,,2015-10-05,1,,,,,コモンスフィア,0
290225,3010705001710,01,0,2015-10-28,2015-10-05,特定非営利活動法人広域連携医療福祉システム支援機構,,399,東京都,品川区,北品川１丁目１３番７号長栄ビル３階コアーズ株式会社内,,13,109,1400001,,,,,,,2015-10-05,1,,,,,,0
290226,3010705001727,12,1,2018-05-18,2016-07-11,特定非営利活動法人日本チョウ類保全協会,,399,東京都,品川区,大井４丁目１番５－２０１,,13,109,1400014,,,,,,,2015-10-05,1,,,,,ニホンチョウルイホゼンキョウカイ,0
290227,3010705001735,12,1,2018-08-03,2015-11-06,特定非営利活動法人クロスフィールズ,,399,東京都,品川区,西五反田３丁目８－３町原ビル４Ｆ,,13,109,1410031,,,,,,,2015-10-05,1,,,,,クロスフィールズ,0
290228,3010705001743,01,0,2015-10-28,2015-10-05,一般社団法人家族の手共済会,,399,東京都,品川区,八潮５丁目３番８号,,13,109,1400003,,,,,,,2015-10-05,1,,,,,,0
290229,3010705001751,01,0,2015-10-26,2015-10-05,一般社団法人住まい文化研究会,,399,東京都,千代田区,飯田橋４丁目４番８号東京中央ビル４階,,13,101,1020072,,,,,,,2015-10-05,1,,,,,,0
290230,3010705001768,01,1,2019-09-12,2015-10-05,キヤノンＩＴソリューションズ労働組合,,399,東京都,品川区,東品川２丁目４番１１号,,13,109,1400002,,,,,,,2015-10-05,1,,,,,キヤノンアイティソリューションズ,0
290231,3010705001776,01,1,2019-10-08,2015-10-05,医療法人社団南七星会,,399,東京都,品川区,小山６丁目４番１４号メディケア西小山６Ｆ,,13,109,1420062,,,,,,,2015-10-05,1,,,,,ナナセイカイ,0
290232,3010705001784,12,0,2018-09-06,2018-09-04,一般財団法人日本プロスピーカー協会,,399,東京都,江東区,有明３丁目７番１８号,,13,108,1350063,,,,,,,2015-10-05,1,,,,,ニホンプロスピーカーキョウカイ,0
290233,3010705001792,01,1,2018-07-03,2015-10-05,一般財団法人ドレスメーカー服飾教育振興会,,399,東京都,品川区,上大崎４丁目６番１９号,,13,109,1410021,,,,,,,2015-10-05,1,,,,,ドレスメーカーフクショクキョウイクシンコウカイ,0
290234,3010705001801,01,1,2018-12-05,2015-10-05,一般社団法人品川区医師会,,399,東京都,品川区,北品川３丁目７番２５号,,13,109,1400001,,,,,,,2015-10-05,1,,,,,シナガワクイシカイ,0
290235,3010705001818,01,1,2018-12-04,2015-10-05,医療法人社団有珠会,,399,東京都,品川区,荏原２丁目１７番１９号武蔵小山グランドハイツ１階,,13,109,1420063,,,,,,,2015-10-05,1,,,,,アリスカイ,0
290236,3010705001826,01,1,2018-07-18,2015-10-05,一般社団法人ニュー・パブリック・ワークス,,399,東京都,品川区,西大井３丁目６番１６号１０２,,13,109,1400015,,,,,,,2015-10-05,1,,,,,ニューパブリックワークス,0
290237,3010705001842,11,0,2019-08-22,2019-08-15,一般社団法人全国中小企業経営組織基盤向上支援認定事業者連合会,,399,東京都,品川区,東五反田５丁目２２番１１号,,13,109,1410022,,,,,,,2015-10-05,1,,,,,,0
290238,3010705001850,01,0,2015-10-28,2015-10-05,一般財団法人ラテン文化サロン,,399,東京都,品川区,上大崎２丁目２０番４号,,13,109,1410021,,,,,,,2015-10-05,1,,,,,,0
290239,3010705001867,01,0,2015-10-28,2015-10-05,医療法人社団麗星会,,399,東京都,品川区,大崎１丁目２０番３号イマス大崎ビル２階,,13,109,1410032,,,,,,,2015-10-05,1,,,,,,0
290240,3010705001891,12,0,2017-12-27,2017-12-11,特定非営利活動法人夢の地図,,399,東京都,品川区,大井３丁目１７番８号大井本通りビル,,13,109,1400014,,,,,,,2015-10-05,1,,,,,,0
290241,3010705001900,01,1,2018-11-13,2015-10-05,一般財団法人国際生活環境研究財団,,399,東京都,品川区,西五反田７丁目２２番１７号ＴＯＣビル７階,,13,109,1410031,,,,,,,2015-10-05,1,,,,,コクサイセイカツカンキョウケンキュウザイダン,0
290242,3010705001933,01,0,2015-10-28,2015-10-05,医療法人社団すずき歯科医院,,399,東京都,品川区,小山５丁目６番９号アーバニティ武蔵小山１階,,13,109,1420062,,,,,,,2015-10-05,1,,,,,,0
290243,3010705001941,01,1,2020-01-08,2015-10-05,一般財団法人ＩＣ齋藤育英会,,399,東京都,品川区,南大井６丁目２２番７号,,13,109,1400013,,,,,,,2015-10-05,1,,,,,,0
290244,3010705001990,12,1,2018-08-13,2016-04-28,一般社団法人さきほ,,399,東京都,渋谷区,恵比寿４丁目５番２５号,,13,113,1500013,,,,,,,2015-10-05,1,,,,,サキホ,0
290245,3010705002007,12,1,2019-05-17,2016-05-02,リサイクルブランド流通協同組合,,399,東京都,港区,赤坂６丁目１４番３号,,13,103,1070052,,,,,,,2015-10-05,1,,,,,リサイクルブランドリュウツウ,0
290246,3010705002015,12,1,2019-11-07,2016-11-29,特定非営利活動法人Ｓｉ’ｓ,,399,東京都,板橋区,板橋２丁目６４番１０号新生ビル３０６号室,,13,119,1730004,,,,,,,2015-10-05,1,,,,,シーズ,0
290247,3010705002048,01,0,2015-10-26,2015-10-05,一般社団法人ジャパンショッピングツーリズム協会,,399,東京都,港区,西新橋３丁目６番２号西新橋企画ビルディング３階,,13,103,1050003,,,,,,,2015-10-05,1,,,,,,0
290248,3010705002056,01,0,2015-10-28,2015-10-05,特定非営利活動法人八潮ハーモニー,,399,東京都,品川区,八潮５丁目４番１７－１１０８号,,13,109,1400003,,,,,,,2015-10-05,1,,,,,,0
290249,3010705002064,01,1,2018-04-04,2015-10-05,一般社団法人日本臨床微生物学会,,399,東京都,品川区,西五反田１丁目２６－２五反田サンハイツ１２０９,,13,109,1410031,,,,,,,2015-10-05,1,,,,,ニホンリンショウビセイブツガッカイ,0
290250,3010705002097,12,0,2019-09-10,2019-09-04,特定非営利活動法人キャリア・ラボラトリー,,399,東京都,港区,高輪４丁目５番２号センプレ高輪６０２,,13,103,1080074,,,,,,,2015-10-05,1,,,,,キャリアラボラトリー,0
290251,3010705002106,01,0,2015-10-28,2015-10-05,一般社団法人日本・ガーナ経済文化交流会,,399,東京都,品川区,東五反田１丁目１０－９ＳＴビル６Ｆ,,13,109,1410022,,,,,,,2015-10-05,1,,,,,,0
290252,3010705002114,01,0,2015-10-28,2015-10-05,特定非営利活動法人日本公共利益研究所,,399,東京都,杉並区,上荻４丁目２番５号,,13,115,1670043,,,,,,,2015-10-05,1,,,,,,0
290253,3010705002130,01,1,2019-06-19,2015-10-05,特定非営利活動法人品川女性起業家交流会－しなｊｏｂ,,399,東京都,品川区,南品川５丁目１０番４３号ゼームス坂タナカハイツ１階２０１号室,,13,109,1400004,,,,,,,2015-10-05,1,,,,,シナガワジョセイキギョウカコウリュウカイシナジョブ,0
290254,3010705002139,01,1,2018-10-03,2015-10-05,医療法人社団結和,,399,東京都,品川区,小山６丁目３番９号ウエストヴィレッジビルディング４階,,13,109,1420062,,,,,,,2015-10-05,1,,,,,ユウワ,0
290255,3010705002163,01,1,2018-05-15,2015-10-05,一般社団法人日本インターネット報道協会,,399,東京都,品川区,上大崎２丁目２４番１８号ストークマンション目黒４０１日本ビデオニュース気付,,13,109,1410021,,,,,,,2015-10-05,1,,,,,ニホンインターネットホウドウキョウカイ,0
290256,3010705002188,01,1,2018-07-06,2015-10-05,一般社団法人日本音楽健康協会,,399,東京都,品川区,北品川５丁目５番２６号,,13,109,1410001,,,,,,,2015-10-05,1,,,,,ニホンオンガクケンコウキョウカイ,0
290257,3010705002205,12,0,2019-01-18,2019-01-11,医療法人社団Ｌｏｔｕｓ,,399,東京都,品川区,大崎２丁目９番１号大崎ウエストシティタワーズＳＢ１０１,,13,109,1410032,,,,,,,2015-10-05,1,,,,,ロータス,0
290258,3010705002213,21,0,2020-01-23,2020-01-10,一般社団法人介護給付適正化推進協議会,,399,東京都,品川区,大崎１丁目１１番１号ゲートシティ大崎ウエストタワー２１階トーテックアメニティ株式会社内,,13,109,1410032,,,2020-01-10,01,,,2015-10-05,1,,,,,カイゴキュウフテキセイカスイシンキョウギカイ,0
290259,3010705002238,12,0,2019-04-19,2019-04-16,次世代海洋資源調査技術研究組合,,399,東京都,文京区,大塚１丁目５番２１号（株式会社地球科学総合研究所内）,,13,105,1120012,,,,,,,2015-10-05,1,,,,,ジセダイカイヨウシゲンチョウサ,0
