775050,7010705000535,01,0,2015-10-28,2015-10-05,東京エス・エヌ食品流通協同組合,,399,東京都,品川区,東中延２丁目９番１６号,,13,109,1420052,,,,,,,2015-10-05,1,,,,,,0
775051,7010705000543,01,1,2018-07-23,2015-10-05,管理組合法人クレールメゾン品川,,399,東京都,品川区,東大井１丁目１３番１２号,,13,109,1400011,,,,,,,2015-10-05,1,,,,,クレールメゾンシナガワ,0
775052,7010705000551,01,0,2015-10-28,2015-10-05,セブンスターマンション第３大森管理組合法人,,399,東京都,品川区,南大井６丁目１９番４号,,13,109,1400013,,,,,,,2015-10-05,1,,,,,,0
775053,7010705000576,01,1,2019-12-10,2015-10-05,昭和大学生活協同組合,,399,東京都,品川区,旗の台１丁目５番８号,,13,109,1420064,,,,,,,2015-10-05,1,,,,,,0
775054,7010705000584,01,1,2018-04-18,2015-10-05,武蔵小山商店街振興組合,,399,東京都,品川区,小山３丁目２３番５号,,13,109,1420062,,,,,,,2015-10-05,1,,,,,ムサシコヤマショウテンガイシンコウクミアイ,0
775055,7010705000592,01,1,2018-06-18,2015-10-05,大井一本橋商店街振興組合,,399,東京都,品川区,大井１丁目２０番２５号,,13,109,1400014,,,,,,,2015-10-05,1,,,,,オオイイッポンバシ,0
775056,7010705000601,01,1,2019-04-18,2015-10-05,戸越銀座銀六商店街振興組合,,399,東京都,品川区,豊町１丁目４番１４号,,13,109,1420042,,,,,,,2015-10-05,1,,,,,トゴシギンザギンロク,0
775057,7010705000642,12,0,2018-05-10,2018-05-02,ソニー中央労働組合,,399,東京都,港区,港南２丁目１２番３３号品川キャナルビル５Ｆ,,13,103,1080075,,,,,,,2015-10-05,1,,,,,ソニーチュウオウ,0
775058,7010705000650,01,0,2015-10-28,2015-10-05,全国金属産業労働組合同盟タイコー労働組合,,399,東京都,品川区,中延６丁目１０番１３号株式会社大興電機製作所,,13,109,1420053,,,,,,,2015-10-05,1,,,,,,0
775059,7010705000667,12,1,2018-07-26,2018-07-18,全日本鉄道労働組合総連合会,,399,東京都,品川区,西五反田３丁目２番１３号目黒さつきビル,,13,109,1410031,,,,,,,2015-10-05,1,,,,,ゼンニホンテツドウソウレンゴウカイ,0
775060,7010705000675,12,1,2018-09-28,2016-09-16,ニコン労働組合,,399,東京都,港区,港南２丁目１５番３号品川インターシティＣ棟,,13,103,1080075,,,,,,,2015-10-05,1,,,,,ニコン,0
775061,7010705000683,01,0,2015-10-28,2015-10-05,星製藥労働組合,,399,東京都,品川区,西大崎一丁目３２６番地,,13,109,1400000,,,,,,,2015-10-05,1,,,,,,1
775062,7010705000691,01,0,2015-10-28,2015-10-05,日本高周波鋼業北品川工場労働組合,,399,東京都,品川区,東五反田２丁目１６番８号日本高周波鋼業株式会社品川工場内,,13,109,1410022,,,,,,,2015-10-05,1,,,,,,0
775063,7010705000700,01,1,2020-04-27,2015-10-05,城南信用金庫,,399,東京都,品川区,西五反田７丁目２番３号,,13,109,1410031,,,,,,,2015-10-05,1,,,,,ジョウナンシンヨウキンコ,0
775064,7010705000725,01,1,2019-11-08,2015-10-05,日本税理士会連合会,,399,東京都,品川区,大崎１丁目１１番８号,,13,109,1410032,,,,,,,2015-10-05,1,,,,,ニホンゼイリシカイレンゴウカイ,0
775065,7010705000741,01,1,2018-07-24,2015-10-05,特定非営利活動法人エヌピーオーもやい,,399,東京都,品川区,西大井６丁目９番３号,,13,109,1400015,,,,,,,2015-10-05,1,,,,,エヌピーオーモヤイ,0
775066,7010705000758,01,1,2018-10-04,2015-10-05,医療法人社団燦歯会,,399,東京都,品川区,西五反田４丁目３１番２１号ガーデンコーポ不動前１０３号,,13,109,1410031,,,,,,,2015-10-05,1,,,,,サンシカイ,0
775067,7010705000774,01,0,2015-10-28,2015-10-05,月窓院,,399,東京都,品川区,上大崎１丁目５番１３号,,13,109,1410021,,,,,,,2015-10-05,1,,,,,,0
775068,7010705000816,01,1,2018-12-04,2015-10-05,特定非営利活動法人日本アマチュアムエタイ連盟,,399,東京都,品川区,西五反田２丁目２３番１号スペースエリア飯嶋７階ジャパンメディカルアーツ株式会社内,,13,109,1410031,,,,,,,2015-10-05,1,,,,,ニホンアマチュアムエタイレンメイ,0
775069,7010705000849,01,0,2015-10-28,2015-10-05,特定非営利活動法人どりいみんぐ,,399,東京都,品川区,大崎２丁目６番１２号エクタスビル１Ｆ,,13,109,1410032,,,,,,,2015-10-05,1,,,,,,0
775070,7010705000857,01,0,2015-10-28,2015-10-05,セブンスターマンション第五大森管理組合法人,,399,東京都,品川区,南大井６丁目２４番１号１階管理室,,13,109,1400013,,,,,,,2015-10-05,1,,,,,,0
775071,7010705000865,01,1,2018-06-15,2015-10-05,特定非営利活動法人ふれあいの家－おばちゃんち,,399,東京都,品川区,北品川２丁目２８番１９号,,13,109,1400001,,,,,,,2015-10-05,1,,,,,フレアイノイエオバチャンチ,0
775072,7010705000881,01,0,2015-10-28,2015-10-05,菱和パレス島津山管理組合法人,,399,東京都,品川区,東五反田１丁目２－４１,,13,109,1410022,,,,,,,2015-10-05,1,,,,,,0
775073,7010705000898,01,1,2018-06-27,2015-10-05,一般社団法人日本砕石協会,,399,東京都,品川区,西五反田２丁目１２番１９号,,13,109,1410031,,,,,,,2015-10-05,1,,,,,ニホンサイセキキョウカイ,0
775074,7010705000915,01,1,2018-10-01,2015-10-05,特定非営利活動法人しなやかネット,,399,東京都,品川区,旗の台４丁目８番１０号,,13,109,1420064,,,,,,,2015-10-05,1,,,,,シナヤカネット,0
775075,7010705000931,01,1,2018-09-27,2015-10-05,日立ソリューションズ労働組合,,399,東京都,品川区,東品川４丁目１２番６号,,13,109,1400002,,,,,,,2015-10-05,1,,,,,ヒタチソリューションズ,0
775076,7010705000948,01,1,2018-07-18,2015-10-05,医療法人社団創星会,,399,東京都,品川区,旗の台５丁目１４番３号ラピュータ１階,,13,109,1420064,,,,,,,2015-10-05,1,,,,,ソウセイカイ,0
775077,7010705000980,01,1,2018-11-28,2015-10-05,医療法人社団燦燦会,,399,東京都,品川区,中延２丁目９番２２号１階,,13,109,1420053,,,,,,,2015-10-05,1,,,,,サンサンカイ,0
775078,7010705000997,01,0,2015-10-28,2015-10-05,特定非営利活動法人全国鉄道利用者会議,,399,東京都,品川区,旗の台４丁目４番２０号,,13,109,1420064,,,,,,,2015-10-05,1,,,,,,0
775079,7010705001005,01,1,2018-07-09,2015-10-05,特定非営利活動法人テラ・コーポレーション,,399,東京都,品川区,北品川５丁目８番１５－２１８号,,13,109,1410001,,,,,,,2015-10-05,1,,,,,テラコーポレーション,0
775080,7010705001013,01,0,2015-10-28,2015-10-05,特定非営利活動法人東海道品川宿,,399,東京都,品川区,北品川２丁目１１番１１－２Ｆ号,,13,109,1400001,,,,,,,2015-10-05,1,,,,,,0
775081,7010705001038,12,0,2017-07-14,2017-07-07,特定非営利活動法人さつき会,,399,東京都,大田区,西蒲田８丁目３番８号シャトレー西蒲田２１０号室,,13,111,1440051,,,,,,,2015-10-05,1,,,,,,0
775082,7010705001046,01,1,2018-07-03,2015-10-05,特定非営利活動法人内モンゴルフフホト市等との民間交流を進める会,,399,東京都,品川区,豊町４丁目１５番７－２０１号,,13,109,1420042,,,,,,,2015-10-05,1,,,,,ウチモンゴルフフホトシトウトノミンカンコウリュウヲススメルカイ,0
775083,7010705001062,01,1,2019-01-11,2015-10-05,医療法人社団孝徳会,,399,東京都,品川区,東大井５丁目１４番１１号サンフラワー１階,,13,109,1400011,,,,,,,2015-10-05,1,,,,,コウトクカイ,0
775084,7010705001070,01,1,2018-05-30,2015-10-05,一般社団法人舗装コンサルタント協会,,399,東京都,品川区,東品川３丁目３２番２０号,,13,109,1400002,,,,,,,2015-10-05,1,,,,,ホソウコンサルタントキョウカイ,0
775085,7010705001095,01,1,2019-05-31,2015-10-05,医療法人社団歯舞会,,399,東京都,品川区,南大井６丁目２６番２号大森ベルポートＢ館１階,,13,109,1400013,,,,,,,2015-10-05,1,,,,,シマイカイ,0
775086,7010705001104,01,1,2019-08-13,2015-10-05,特定非営利活動法人日本ヘアエピテーゼ協会,,399,東京都,品川区,東品川２丁目２番２５号,,13,109,1400002,,,,,,,2015-10-05,1,,,,,ニホンヘアエピテーゼキョウカイ,0
775087,7010705001120,01,0,2015-10-28,2015-10-05,特定非営利活動法人ツカサ農業体験学校,,399,東京都,品川区,東五反田５丁目２２番３７号,,13,109,1410022,,,,,,,2015-10-05,1,,,,,,0
775088,7010705001129,01,0,2015-10-28,2015-10-05,税理士法人ヘルムズ,,399,東京都,品川区,西五反田８丁目１番２号,,13,109,1410031,,,,,,,2015-10-05,1,,,,,,0
775089,7010705001145,01,1,2019-09-13,2015-10-05,医療法人社団安清会,,399,東京都,品川区,中延５丁目８番１９号１階,,13,109,1420053,,,,,,,2015-10-05,1,,,,,アンセイカイ,0
775090,7010705001211,01,0,2015-10-28,2015-10-05,社会保険労務士法人斎藤マネジメントオフィス・アンジェロ,,399,東京都,品川区,上大崎２丁目１５番１９号,,13,109,1410021,,,,,,,2015-10-05,1,,,,,,0
775091,7010705001236,12,1,2018-07-18,2018-07-05,特定非営利活動法人日本ＵＡＥ青少年児童育成交流協力会,,399,東京都,港区,芝浦１丁目１番１号浜松町ビルディングアブダビ石油株式会社内,,13,103,1050023,,,,,,,2015-10-05,1,,,,,ニホンユーエーイーセイショウネンジドウイクセイコウリュウキョウリョクカイ,0
775092,7010705001244,01,0,2015-10-28,2015-10-05,特定非営利活動法人グループＥＶＡＨ,,399,東京都,品川区,南大井３丁目２０番１４号大森ヒラノビル１０２,,13,109,1400013,,,,,,,2015-10-05,1,,,,,,0
775093,7010705001269,01,0,2015-10-28,2015-10-05,医療法人社団東京ライフクリニック,,399,東京都,品川区,平塚３丁目１３番１６号ヴェローナ戸越銀座４０２号室,,13,109,1420051,,,,,,,2015-10-05,1,,,,,,0
775094,7010705001285,01,0,2015-10-28,2015-10-05,日本基幹産業労働組合連合会トピー工業労働組合,,399,東京都,品川区,東五反田１丁目１０番４号,,13,109,1410022,,,,,,,2015-10-05,1,,,,,,0
775095,7010705001302,01,1,2020-03-06,2015-10-05,ＪＴＢマネジメントサービス労働組合,,399,東京都,品川区,東品川２丁目３－１１,,13,109,1400002,,,,,,,2015-10-05,1,,,,,,0
775096,7010705001310,01,0,2015-10-28,2015-10-05,目黒西口マンション２号館管理組合法人,,399,東京都,品川区,上大崎２丁目２４番１１号,,13,109,1410021,,,,,,,2015-10-05,1,,,,,,0
775097,7010705001343,01,0,2015-10-28,2015-10-05,特定非営利活動法人日本箸道協会,00052090,399,東京都,品川区,旗の台３丁目７番１２号,,13,109,1420064,,,,,,,2015-10-05,1,,,,,,0
775098,7010705001368,01,1,2018-06-07,2015-10-05,特定非営利活動法人Ｔｉｄｅ　Ｓｏｕｎｄ　Ａｓｓｏｃｉａｔｉｏｎ,,399,東京都,品川区,東品川２丁目６番１０号,,13,109,1400002,,,,,,,2015-10-05,1,,,,,タイドサウンドアソシエイション,0
775099,7010705001384,12,1,2018-08-15,2016-03-07,特定非営利活動法人ボルネオ保全トラスト・ジャパン,,399,東京都,品川区,東品川１丁目２５番８号東京サラヤビル２階,,13,109,1400002,,,,,,,2015-10-05,1,,,,,ボルネオホゼントラストジャパン,0
775100,7010705001459,01,0,2015-10-28,2015-10-05,一般社団法人日本デザインコンサルタント協会,,399,東京都,品川区,東五反田５丁目２５番１９号,,13,109,1410022,,,,,,,2015-10-05,1,,,,,,0
775101,7010705001467,01,0,2015-10-28,2015-10-05,特定非営利活動法人みらい,,399,東京都,品川区,南大井６丁目７番１３－６０１号,,13,109,1400013,,,,,,,2015-10-05,1,,,,,,0
775102,7010705001475,01,1,2019-09-03,2015-10-05,特定非営利活動法人品川ケア協議会,,399,東京都,品川区,南品川４丁目１１番１－４０３号,,13,109,1400004,,,,,,,2015-10-05,1,,,,,シナガワケアキョウギカイ,0
775103,7010705001483,01,0,2015-10-28,2015-10-05,特定非営利活動法人コーチ道,,399,東京都,品川区,上大崎２丁目２４番１８－９０３号,,13,109,1410021,,,,,,,2015-10-05,1,,,,,,0
775104,7010705001500,01,0,2015-10-26,2015-10-05,特許業務法人むつきパートナーズ,,399,東京都,中央区,築地４丁目１番１号,,13,102,1040045,,,,,,,2015-10-05,1,,,,,,0
775105,7010705001509,01,0,2015-10-28,2015-10-05,一般社団法人日本採寸協会,,399,東京都,品川区,上大崎２丁目１５番１９号,,13,109,1410021,,,,,,,2015-10-05,1,,,,,,0
775106,7010705001517,01,1,2019-03-01,2015-10-05,医療法人Ａｖｅｃ　Ｖｏｕｓ,,399,東京都,品川区,大井１丁目４９番１２号ライオンズマンション大井２階,,13,109,1400014,,,,,,,2015-10-05,1,,,,,アヴェクヴー,0
775107,7010705001525,21,0,2018-09-19,2018-09-04,一般財団法人日本経済教育センター,,399,東京都,品川区,東五反田１丁目１０番７号,,13,109,1410022,,,2018-09-04,11,3011405001967,平成３０年９月１日東京都板橋区大山町１５番地１１号一般社団法人日本経済教育センター（3011405001967）に合併し解散,2015-10-05,1,,,,,ニホンケイザイキョウイクセンター,0
775108,7010705001533,01,0,2015-10-28,2015-10-05,特定非営利活動法人ＯＡＳＩＳ　ＪＡＰＡＮ,,399,東京都,品川区,東五反田１丁目２番８号,,13,109,1410022,,,,,,,2015-10-05,1,,,,,,0
775109,7010705001558,12,0,2019-08-16,2019-08-07,一般社団法人日本ＮＬＰ能力開発協会,,399,東京都,品川区,西五反田１丁目７番１号,,13,109,1410031,,,,,,,2015-10-05,1,,,,,ニホンエヌエルピーノウリョクカイハツキョウカイ,0
775110,7010705001566,01,0,2015-10-28,2015-10-05,特定非営利活動法人Ｃｈａｏｓ,,399,東京都,品川区,平塚２丁目７番９号,,13,109,1420051,,,,,,,2015-10-05,1,,,,,,0
775111,7010705001582,01,0,2015-10-28,2015-10-05,一般社団法人日本コロニヘーヴ協会,,399,東京都,品川区,西五反田５丁目６番地４１号,,13,109,1410031,,,,,,,2015-10-05,1,,,,,,0
775112,7010705001590,12,0,2018-02-09,2018-02-05,一般社団法人国際感食協会,,399,東京都,港区,北青山３丁目６番７号青山パラシオタワー１１階,,13,103,1070061,,,,,,,2015-10-05,1,,,,,,0
775113,7010705001599,01,1,2018-09-07,2015-10-05,特定非営利活動法人ＩＣＴ救助隊,,399,東京都,品川区,荏原５丁目５番３号三恵荘１０２号室,,13,109,1420063,,,,,,,2015-10-05,1,,,,,アイシーティーキュウジョタイ,0
775114,7010705001608,01,0,2015-10-28,2015-10-05,一般社団法人日本ワイヤーアートデザイン協会,,399,東京都,品川区,西五反田２丁目１０番８号,,13,109,1410031,,,,,,,2015-10-05,1,,,,,,0
775115,7010705001624,01,0,2015-10-28,2015-10-05,特定非営利活動法人防災標識ネットワーク,,399,東京都,品川区,南大井６丁目４番２２号,,13,109,1400013,,,,,,,2015-10-05,1,,,,,,0
775116,7010705001632,01,1,2019-06-06,2015-10-05,一般財団法人日本スポーツ振興会,,399,東京都,江東区,有明１丁目３番３３号,,13,108,1350063,,,,,,,2015-10-05,1,,,,,ニホンスポーツシンコウカイ,0
775117,7010705001640,01,1,2019-12-25,2015-10-05,公益社団法人労務管理教育センター,,399,東京都,品川区,上大崎２丁目２５番２号,,13,109,1410021,,,,,,,2015-10-05,1,,,,,,0
775118,7010705001657,12,1,2020-04-24,2018-08-21,行政書士法人きずな東京,,399,東京都,品川区,東大井１丁目２０番６号,,13,109,1400011,,,,,,,2015-10-05,1,,,,,,0
775119,7010705001673,01,0,2015-10-28,2015-10-05,一般社団法人プロトン国際総合研究所,,399,東京都,品川区,西五反田１丁目２５番１号ＫＡＮＯビル３Ｆ,,13,109,1410031,,,,,,,2015-10-05,1,,,,,,0
775120,7010705001698,01,0,2015-10-28,2015-10-05,特定非営利活動法人グッドヘルスジャパン,,399,東京都,品川区,上大崎２丁目１３番３２号富田ビル７０１号室,,13,109,1410021,,,,,,,2015-10-05,1,,,,,,0
775121,7010705001715,01,1,2019-11-18,2015-10-05,一般社団法人日本優良建築物整備振興協会,,399,東京都,品川区,東五反田１丁目１０番４号,,13,109,1410022,,,,,,,2015-10-05,1,,,,,ニホンユウリョウケンチクブツセイビシンコウキョウカイ,0
775122,7010705001723,01,0,2015-10-28,2015-10-05,一般社団法人日中経済交流促進協会,,399,東京都,品川区,西五反田２丁目４番２号,,13,109,1410031,,,,,,,2015-10-05,1,,,,,,0
775123,7010705001731,21,0,2016-04-13,2016-04-05,特定非営利活動法人ディジタルシネマ・コンソーシアム,,399,東京都,新宿区,西新宿７丁目７番３０号有限会社ビジョンブリッジ方,,13,104,1600023,,,2016-04-05,01,,,2015-10-05,1,,,,,,0
775124,7010705001764,21,0,2019-09-27,2019-09-20,特定非営利活動法人アジア太平洋地域文化促進会,,399,東京都,品川区,大崎３丁目２０番１０号,,13,109,1410032,,,2019-09-20,01,,,2015-10-05,1,,,,,アジアタイヘイヨウチイキブンカソクシンカイ,0
775125,7010705001772,12,0,2018-05-02,2018-04-24,特定非営利活動法人ＮＯＵＶＥ,,399,東京都,目黒区,八雲４丁目１５－１８－２０１,,13,110,1520023,,,,,,,2015-10-05,1,,,,,ヌーヴ,0
775126,7010705001780,01,1,2018-05-11,2015-10-05,公益社団法人日本分析化学会,,399,東京都,品川区,西五反田１丁目２６番２号五反田サンハイツ内,,13,109,1410031,,,,,,,2015-10-05,1,,,,,ニホンブンセキカガクカイ,0
775127,7010705001797,01,1,2019-06-27,2015-10-05,公益財団法人中谷医工計測技術振興財団,,399,東京都,品川区,大崎１丁目２番２号アートヴィレッジ大崎セントラルタワー,,13,109,1410032,,,,,,,2015-10-05,1,,,,,ナカタニイコウケイソクギジュツシンコウザイダン,0
775128,7010705001806,01,1,2018-06-18,2015-10-05,公益社団法人全国病院理学療法協会,,399,東京都,品川区,大崎３丁目６番２１号,,13,109,1410032,,,,,,,2015-10-05,1,,,,,ゼンコクビョウインリガクリョウホウキョウカイ,0
775129,7010705001814,01,0,2015-10-28,2015-10-05,特定非営利活動法人雅楽友の会,,399,東京都,品川区,荏原１丁目６番１０号,,13,109,1420063,,,,,,,2015-10-05,1,,,,,,0
775130,7010705001822,01,0,2015-10-28,2015-10-05,マンション南目黒苑管理組合法人,,399,東京都,品川区,上大崎４丁目６番１６号,,13,109,1410021,,,,,,,2015-10-05,1,,,,,,0
775131,7010705001855,01,0,2015-10-28,2015-10-05,一般社団法人高齢者住宅推進機構,,399,東京都,品川区,八潮５丁目３番８号,,13,109,1400003,,,,,,,2015-10-05,1,,,,,,0
775132,7010705001871,12,0,2019-07-01,2019-06-25,医療法人社団優紀会,,399,東京都,品川区,東大井５丁目２１番９号１階,,13,109,1400011,,,,,,,2015-10-05,1,,,,,ユウキカイ,0
775133,7010705001888,01,0,2015-10-28,2015-10-05,ＩＴＬ労働組合,,399,東京都,品川区,大崎３丁目６番６号ＩＢＪＬ東芝リース株式会社内,,13,109,1410032,,,,,,,2015-10-05,1,,,,,,0
775134,7010705001896,01,0,2015-10-28,2015-10-05,品川地区労働組合協議会,,399,東京都,品川区,大崎２丁目７番５号,,13,109,1410032,,,,,,,2015-10-05,1,,,,,,0
775135,7010705001905,01,0,2015-10-28,2015-10-05,みどりの風,,399,東京都,品川区,上大崎３丁目３－９－７１７,,13,109,1410021,,,,,,,2015-10-05,1,,,,,,0
775136,7010705001921,01,0,2015-10-28,2015-10-05,一般社団法人日本ビジネス心理カウンセラー協会,,399,東京都,品川区,西五反田２丁目１１番１１号ヒルトップ五反田ハイツ５０２,,13,109,1410031,,,,,,,2015-10-05,1,,,,,,0
775137,7010705001987,01,0,2015-10-28,2015-10-05,特定非営利活動法人ボンドジャパン,,399,東京都,品川区,北品川５丁目１２番１号２階,,13,109,1410001,,,,,,,2015-10-05,1,,,,,,0
775138,7010705001995,01,0,2015-10-28,2015-10-05,特定非営利活動法人日本・東南アジア技術推進協議会,,399,東京都,品川区,南大井３丁目２０番１号ライオンズマンション大森第５－１０１,,13,109,1400013,,,,,,,2015-10-05,1,,,,,,0
775139,7010705002011,12,0,2018-12-27,2018-12-20,一般社団法人日本フルート協会,,399,東京都,品川区,上大崎３丁目３番９号,,13,109,1410021,,,,,,,2015-10-05,1,,,,,ニホンフルートキョウカイ,0
775140,7010705002036,12,0,2020-03-03,2020-02-28,一般社団法人協働プラットフォーム,,399,東京都,千代田区,内神田２丁目１２番１号,,13,101,1010047,,,,,,,2015-10-05,1,,,,,キョウドウプラットフォーム,0
775141,7010705002060,01,0,2015-10-28,2015-10-05,特定非営利活動法人Ｓａｌｔ　Ｏｆ　Ｔｈｅ　Ｅａｒｔｈ,,399,東京都,品川区,東五反田２丁目８番３号長瀬ビル５階,,13,109,1410022,,,,,,,2015-10-05,1,,,,,,0
775142,7010705002085,01,1,2018-06-13,2015-10-05,日本安全振興協同組合,,399,東京都,品川区,南品川６丁目３番６号,,13,109,1400004,,,,,,,2015-10-05,1,,,,,ニホンアンゼンシンコウ,0
775143,7010705002110,01,1,2020-04-27,2015-10-05,一般社団法人動物補完代替医療協会,,399,東京都,大田区,東雪谷３丁目２８番１２号－４０３号,,13,111,1450065,,,,,,,2015-10-05,1,,,,,ドウブツホカンダイタイイリョウキョウカイ,0
775144,7010705002119,01,0,2015-10-28,2015-10-05,一般社団法人ＲＤＲＤサポーターズ,,399,東京都,品川区,南品川１丁目２番１４号リバーサイドビラ２０３号室,,13,109,1400004,,,,,,,2015-10-05,1,,,,,,0
775145,7010705002151,01,0,2015-10-28,2015-10-05,一般社団法人宇検厳島神社碇佐渡知主に祈願する会,,399,東京都,品川区,東五反田５丁目２８番９号五反田第三花谷ビル,,13,109,1410022,,,,,,,2015-10-05,1,,,,,,0
775146,7010705002176,22,1,2018-08-01,2018-07-20,一般社団法人ＪＦＫファウンデーションオブジャパン,,399,東京都,品川区,上大崎２丁目２４番１８－３０１号,,13,109,1410021,,,,,,,2015-10-05,1,,,,,ジェイエフケイファウンデーションオブジャパン,0
775147,7010705002218,01,1,2018-09-04,2015-10-05,一般社団法人国際工芸交流機構,,399,東京都,品川区,西五反田２丁目１０番８号,,13,109,1410031,,,,,,,2015-10-05,1,,,,,コクサイコウゲイコウリュウキコウ,0
775148,7010705002226,01,0,2015-10-28,2015-10-05,特定非営利活動法人日本実用化通信協会,,399,東京都,品川区,東五反田５丁目２３－１第２五反田不二越ビル３階,,13,109,1410022,,,,,,,2015-10-05,1,,,,,,0
775149,7010705002250,01,0,2015-10-28,2015-10-05,一般財団法人最先端技術育成支援機構,,399,東京都,品川区,東大井３丁目７－８サン・ルピナス４０２号室,,13,109,1400011,,,,,,,2015-10-05,1,,,,,,0
775150,7010705002259,01,0,2015-10-28,2015-10-05,一般社団法人国際マタニティ・カウンセリング協会,,399,東京都,品川区,東品川２丁目５番６－１８０７号,,13,109,1400002,,,,,,,2015-10-05,1,,,,,,0
775151,7010705002267,01,1,2018-07-04,2015-10-05,一般社団法人地域資源活用の会,,399,東京都,品川区,西五反田２丁目２９番５号,,13,109,1410031,,,,,,,2015-10-05,1,,,,,チイキシゲンカツヨウノカイ,0
775152,7010705002291,01,0,2015-10-28,2015-10-05,一般社団法人日本クラフト作家協会,,399,東京都,品川区,西五反田２丁目１３番１－５０６号,,13,109,1410031,,,,,,,2015-10-05,1,,,,,,0
775153,7010705002317,01,1,2019-06-17,2015-10-05,一般社団法人ユー・アー・エンゼル,,399,東京都,品川区,平塚２丁目３番８号,,13,109,1420051,,,,,,,2015-10-05,1,,,,,ユーアーエンゼル,0
775154,7010705002325,12,1,2018-06-14,2017-08-22,一般社団法人アドバンスト・ビジネス創造協会,,399,東京都,品川区,東五反田１丁目７－１１アイオス五反田アネックス６０１号室,,13,109,1410022,,,,,,,2015-10-05,1,,,,,アドバンストビジネスソウゾウキョウカイ,0
775155,7010705002358,21,0,2017-03-16,2017-03-13,一般社団法人順縁養生会,,399,東京都,品川区,東品川３丁目５番２号,,13,109,1400002,,,2017-03-13,01,,,2015-10-05,1,,,,,,0
775156,7010705002366,01,0,2015-11-06,2015-10-30,一般社団法人リンパデトックス協会,,399,東京都,品川区,上大崎２丁目２４番１８号ストークマンション目黒５０２,,13,109,1410021,,,,,,,2015-10-30,1,,,,,,0
775157,7010705002374,01,0,2015-11-18,2015-11-12,特定非営利活動法人ＳＡＢＩＡブラジル文化,,399,東京都,品川区,西五反田２丁目２４番７－８０４号,,13,109,1410031,,,,,,,2015-11-12,1,,,,,,0
775158,7010705002382,01,0,2015-11-25,2015-11-18,弁護士法人品川国際法律事務所,,399,東京都,品川区,東五反田４丁目７－２７,,13,109,1410022,,,,,,,2015-11-18,1,,,,,,0
775159,7010705002390,01,1,2020-01-30,2015-12-16,ウイニングブリッジ協同組合,,399,東京都,品川区,南大井３丁目２８番１１号,,13,109,1400013,,,,,,,2015-12-16,1,,,,,ウイニングブリッジ,0
775160,7010705002399,21,0,2019-08-14,2019-08-06,一般社団法人Ｔｈｅ　Ｓｔｏｒｙ　ｏｆ　Ｌｉｆｅ,,399,東京都,品川区,北品川１丁目９番７号トップルーム品川１０１５,,13,109,1400001,,,2019-08-06,01,,,2016-01-19,1,,,,,ザストーリーオブライフ,0
775161,7010705002408,21,0,2017-06-01,2017-05-29,社会保険労務士法人セルプランニング,,399,東京都,品川区,上大崎２丁目１５番１９号ＭＧ目黒駅前９１４号室,,13,109,1410021,,,2017-05-29,01,,,2016-01-28,1,,,,,,0
