532498,5010705001634,01,0,2015-10-28,2015-10-05,一般社団法人エリア・イノベーション・アライアンス,,399,東京都,品川区,大崎２丁目４－６ＡＩＡビル,,13,109,1410032,,,,,,,2015-10-05,1,,,,,,0
532499,5010705001642,11,0,2020-04-21,2020-04-13,一般社団法人品川区薬剤師会,,399,東京都,品川区,中延２丁目４番２号,,13,109,1420053,,,,,,,2015-10-05,1,,,,,シナガワクヤクザイシカイ,0
532500,5010705001650,12,1,2018-06-28,2018-01-12,一般財団法人国際アイティー財団,,399,東京都,千代田区,平河町２丁目１３番１２号,,13,101,1020093,,,,,,,2015-10-05,1,,,,,コクサイアイティーザイダン,0
532501,5010705001659,01,0,2015-10-28,2015-10-05,一般社団法人投資被害救済センター,,399,東京都,品川区,西五反田２丁目７番１１号Ｉｎｔｅｘビル４Ｆ,,13,109,1410031,,,,,,,2015-10-05,1,,,,,,0
532502,5010705001675,12,1,2018-08-29,2018-08-23,医療法人社団秀徹会,,399,東京都,品川区,上大崎３丁目１番１号目黒セントラルスクエア商業ゾーン２０４－３,,13,109,1410021,,,,,,,2015-10-05,1,,,,,シュウテツカイ,0
532503,5010705001683,01,1,2019-06-26,2015-10-05,特定非営利活動法人地球野外塾,,399,東京都,品川区,中延４丁目８番７号,,13,109,1420053,,,,,,,2015-10-05,1,,,,,チキュウヤガイジュク,0
532504,5010705001691,01,0,2015-10-28,2015-10-05,一般社団法人インターナショナル・エシカル・ハッカー・エンジニア・コンソーシアム,,399,東京都,品川区,北品川４丁目７番３５号,,13,109,1400001,,,,,,,2015-10-05,1,,,,,,0
532505,5010705001700,12,0,2019-01-25,2019-01-23,ＮＰＯ法人全国Ｇ空間情報技術研究会,,399,東京都,中央区,築地５丁目６番４号,,13,102,1040045,,,,,,,2015-10-05,1,,,,,ゼンコクジイクウカンジョウホウギジュツケンキュウカイ,0
532506,5010705001709,01,0,2015-10-26,2015-10-05,一般社団法人アーキナショナルアカデミー,,399,東京都,港区,高輪１丁目５番４号,,13,103,1080074,,,,,,,2015-10-05,1,,,,,,0
532507,5010705001717,01,0,2015-10-28,2015-10-05,一般社団法人チームエジソン,,399,東京都,品川区,上大崎３丁目１番４号,,13,109,1410021,,,,,,,2015-10-05,1,,,,,,0
532508,5010705001725,01,0,2015-10-28,2015-10-05,一般社団法人くらしとしごと生活者フォーラム,,399,東京都,品川区,大崎２丁目９番２号大崎ウエストシティタワーズＷ－６１１,,13,109,1410032,,,,,,,2015-10-05,1,,,,,,0
532509,5010705001733,01,0,2015-10-28,2015-10-05,特定非営利活動法人水の安全を確保する会,,399,東京都,品川区,中延５丁目８番１号河本ビル３階,,13,109,1420053,,,,,,,2015-10-05,1,,,,,,0
532510,5010705001758,01,1,2018-10-30,2015-10-05,一般社団法人日本カラオケフィットネス協会,,399,東京都,品川区,戸越６丁目９番５号,,13,109,1420041,,,,,,,2015-10-05,1,,,,,ニホンカラオケフィットネスキョウカイ,0
532511,5010705001766,12,0,2018-03-12,2018-03-02,一般社団法人たてもの保全ＮＥＴ,,399,東京都,品川区,西五反田７丁目１番９号五反田ＨＳビル２階,,13,109,1410031,,,,,,,2015-10-05,1,,,,,,0
532512,5010705001774,01,1,2018-04-02,2015-10-05,医療法人社団桜愛会,,399,東京都,品川区,東五反田２丁目１０番１号パークタワーグランスカイ２０２,,13,109,1410022,,,,,,,2015-10-05,1,,,,,オウアイカイ,0
532513,5010705001782,01,1,2018-08-14,2015-10-05,一般財団法人品川ビジネスクラブ,,399,東京都,品川区,北品川５丁目５番１５号,,13,109,1410001,,,,,,,2015-10-05,1,,,,,シナガワビジネスクラブ,0
532514,5010705001790,01,1,2018-06-25,2015-10-05,一般財団法人工学舎育英会,,399,東京都,品川区,西大井４丁目１１番１６号,,13,109,1400015,,,,,,,2015-10-05,1,,,,,コウガクシャイクエイカイ,0
532515,5010705001799,01,1,2018-06-26,2015-10-05,公益財団法人品川文化振興事業団,,399,東京都,品川区,西大井１丁目４番２５号,,13,109,1400015,,,,,,,2015-10-05,1,,,,,シナガワブンカシンコウジギョウダン,0
532516,5010705001808,01,1,2019-08-02,2015-10-05,公益財団法人日本民謡協会,,399,東京都,品川区,南品川６丁目８番２０号,,13,109,1400004,,,,,,,2015-10-05,1,,,,,ニホンミンヨウキョウカイ,0
532517,5010705001816,01,1,2018-06-07,2015-10-05,一般社団法人庄,,399,東京都,品川区,中延４丁目１６番２２号,,13,109,1420053,,,,,,,2015-10-05,1,,,,,ショウ,0
532518,5010705001824,01,0,2015-10-28,2015-10-05,一般社団法人国際ＮＧＯナチュラル・ステップ・ジャパン,,399,東京都,品川区,上大崎１丁目１番４号ミルーム白金台１０２号,,13,109,1410021,,,,,,,2015-10-05,1,,,,,,0
532519,5010705001832,01,1,2018-06-19,2015-10-05,一般財団法人神林伊賀育英会,,399,東京都,品川区,旗の台６丁目３０番１０号,,13,109,1420064,,,,,,,2015-10-05,1,,,,,カミバヤシイガイクエイカイ,0
532520,5010705001857,01,1,2018-10-09,2015-10-05,一般財団法人テレコムエンジニアリングセンター,,399,東京都,品川区,八潮５丁目７番２号,,13,109,1400003,,,,,,,2015-10-05,1,,,,,テレコムエンジニアリングセンター,0
532521,5010705001898,11,0,2016-07-14,2016-07-08,一般社団法人インターナショナルマインドセットケアアソシエーション,,399,東京都,品川区,東五反田３丁目１８番３号,,13,109,1410022,,,,,,,2015-10-05,1,,,,,,0
532522,5010705001915,01,0,2015-10-28,2015-10-05,一般社団法人価値創造推進機構,,399,東京都,品川区,西五反田１丁目１８番９号,,13,109,1410031,,,,,,,2015-10-05,1,,,,,,0
532523,5010705001931,01,1,2019-12-02,2015-10-05,医療法人社団ＳＳＣ,,399,東京都,品川区,大崎２丁目１番１号ＴｈｉｎｋＰａｒｋＴｏｗｅｒ３階,,13,109,1410032,,,,,,,2015-10-05,1,,,,,エスエスシー,0
532524,5010705001972,01,1,2019-06-12,2015-10-05,一般社団法人日本輸入車整備推進協会,,399,東京都,品川区,旗の台２丁目１０番１５号,,13,109,1420064,,,,,,,2015-10-05,1,,,,,ニホンユニュウシャセイビスイシンキョウカイ,0
532525,5010705001980,01,0,2015-10-28,2015-10-05,一般社団法人イノベーション・デザイン・ラボ,,399,東京都,荒川区,西日暮里５丁目１４番４号ＫＹビル８Ｆ,,13,118,1160013,,,,,,,2015-10-05,1,,,,,,0
532526,5010705002005,01,0,2015-10-28,2015-10-05,一般財団法人キッズファースト,,399,東京都,品川区,東五反田１丁目１８番３号,,13,109,1410022,,,,,,,2015-10-05,1,,,,,,0
532527,5010705002046,21,0,2018-12-19,2018-12-13,一般社団法人グローバル人材育成研究会,,399,東京都,品川区,大井７丁目４番２８号,,13,109,1400014,,,2018-12-13,01,,,2015-10-05,1,,,,,グローバルジンザイイクセイケンキュウカイ,0
532528,5010705002070,01,1,2019-01-10,2015-10-05,東芝テックソリューションサービス労働組合,,399,東京都,品川区,東五反田２丁目１７番２号オーバルコート大崎マークイースト内,,13,109,1410022,,,,,,,2015-10-05,1,,,,,トウシバテックソリューションサービス,0
532529,5010705002087,01,0,2015-10-28,2015-10-05,特定非営利活動法人ユニックス,,399,東京都,品川区,西五反田１丁目２１－８ＫＳＳ五反田ビル８Ｆ,,13,109,1410031,,,,,,,2015-10-05,1,,,,,,0
532530,5010705002095,01,1,2018-07-27,2015-10-05,行政書士法人登録サポート,,399,東京都,品川区,東大井１丁目１２番１４号,,13,109,1400011,,,,,,,2015-10-05,1,,,,,トウロクサポート,0
532531,5010705002104,01,0,2015-10-28,2015-10-05,一般社団法人ＮＳＭ,,399,東京都,品川区,西五反田６丁目３－６－４０３,,13,109,1410031,,,,,,,2015-10-05,1,,,,,,0
532532,5010705002120,01,1,2019-03-29,2015-10-05,医療法人社団聖恒会,,399,東京都,品川区,南品川３丁目６番３０号柳下ビル１階,,13,109,1400004,,,,,,,2015-10-05,1,,,,,セイコウカイ,0
532533,5010705002129,01,1,2018-07-11,2015-10-05,医療法人社団慶繁会,,399,東京都,品川区,小山台１丁目２４番１号石井ハイム１階,,13,109,1420061,,,,,,,2015-10-05,1,,,,,ケイハンカイ,0
532534,5010705002137,12,1,2018-07-06,2017-06-06,一般社団法人インターナショナル・ハート・ジャーナル刊行会,,399,東京都,港区,芝浦１丁目１番１号,,13,103,1050023,,,,,,,2015-10-05,1,,,,,インターナショナルハートジャーナルカンコウカイ,0
532535,5010705002153,12,1,2018-10-16,2016-01-19,一般社団法人就職活動総合研究所,,399,東京都,豊島区,高田３丁目１６番９号,,13,116,1710033,,,,,,,2015-10-05,1,,,,,シュウショクカツドウソウゴウケンキュウジョ,0
532536,5010705002161,12,1,2019-09-09,2016-07-27,一般社団法人建設職人甲子園,,399,東京都,文京区,本郷３丁目３番１１号,,13,105,1130033,,,,,,,2015-10-05,1,,,,,ケンセツショクニンコウシエン,0
532537,5010705002178,01,0,2015-10-28,2015-10-05,あかね協同組合,,399,東京都,品川区,大崎３丁目６番２１号,,13,109,1410032,,,,,,,2015-10-05,1,,,,,,0
532538,5010705002186,21,0,2019-01-10,2019-01-08,一般社団法人ウエルネスライフデザイン,,399,東京都,中央区,銀座８丁目１６番１０号,,13,102,1040061,,,2019-01-08,01,,,2015-10-05,1,,,,,ウエルネスライフデザイン,0
532539,5010705002228,12,1,2018-05-08,2017-03-16,一般社団法人ＡＯ　Ｊａｐａｎ,,399,東京都,港区,六本木６丁目１５番２１号,,13,103,1060032,,,,,,,2015-10-05,1,,,,,エーオージャパン,0
532540,5010705002244,12,0,2016-03-23,2016-03-17,ソラーレ社会保険労務士法人,,399,東京都,品川区,東大井５丁目１４番１１号,,13,109,1400011,,,,,,,2015-10-05,1,,,,,,0
532541,5010705002252,01,1,2019-01-04,2015-10-05,一般社団法人Ｔ．Ｍ．Ｃ．Ｎ,,399,東京都,品川区,西五反田３丁目７番９号,,13,109,1410031,,,,,,,2015-10-05,1,,,,,,0
532542,5010705002269,01,1,2019-01-11,2015-10-05,医療法人社団良保会,,399,東京都,品川区,南大井６丁目２４番９号興産大森ビル４階,,13,109,1400013,,,,,,,2015-10-05,1,,,,,ヨシホカイ,0
532543,5010705002310,01,0,2015-10-28,2015-10-05,一般社団法人日本フルーツ酵素協会,,399,東京都,品川区,北品川４丁目８－３３御殿山ハウス４１１号室,,13,109,1400001,,,,,,,2015-10-05,1,,,,,,0
532544,5010705002319,01,0,2015-10-28,2015-10-05,特定非営利活動法人国際病院認証支援機構,,399,東京都,品川区,東五反田４丁目１番１７号東京医療保健大学学事顧問室,,13,109,1410022,,,,,,,2015-10-05,1,,,,,,0
532545,5010705002335,01,1,2019-05-24,2015-10-05,一般社団法人しんきん安心サポート,,399,東京都,品川区,西五反田７丁目２番３号,,13,109,1410031,,,,,,,2015-10-05,1,,,,,,0
532546,5010705002343,01,1,2019-11-29,2015-10-05,医療法人社団城南すこやか会,,399,東京都,品川区,旗の台３丁目１４番９号旗の台駅前レジデンス１階,,13,109,1420064,,,,,,,2015-10-05,1,,,,,ジョウナンスコヤカカイ,0
532547,5010705002351,01,0,2015-10-28,2015-10-05,一般社団法人ホットジェネレーション,,399,東京都,品川区,西五反田５丁目２８番１１－１０２号,,13,109,1410031,,,,,,,2015-10-05,1,,,,,,0
532548,5010705002384,01,0,2015-12-01,2015-11-25,一般社団法人シニアコンシェルジュ協会,,399,東京都,品川区,南大井１丁目１７番７－８０３号,,13,109,1400013,,,,,,,2015-11-25,1,,,,,,0
532549,5010705002392,12,1,2018-06-05,2018-01-04,成長支援社会保険労務士法人,,399,東京都,千代田区,神田猿楽町２丁目６番１０号,,13,101,1010064,,,,,,,2015-12-22,1,,,,,セイチョウシエン,0
532550,5010705002401,01,1,2018-08-10,2016-01-22,一般社団法人東京ビジネス倶楽部,,399,東京都,品川区,旗の台２丁目１０番９号ロイヤルヒルズ５０３,,13,109,1420064,,,,,,,2016-01-22,1,,,,,トウキョウビジネスクラブ,0
532551,5010705002426,01,0,2016-03-16,2016-03-10,一般社団法人グローバルＭ＆Ａアドバイザー協会,,399,東京都,品川区,東五反田５丁目１０番５－１０２号,,13,109,1410022,,,,,,,2016-03-10,1,,,,,,0
532552,5010705002434,01,1,2019-07-04,2016-04-08,一般社団法人日本負荷検定機構,,399,東京都,品川区,北品川１丁目１０番６号,,13,109,1400001,,,,,,,2016-04-08,1,,,,,ニホンフカケンテイキコウ,0
532553,5010705002442,01,0,2016-04-27,2016-04-21,一般社団法人営業力推進協会,,399,東京都,品川区,西五反田７丁目２２番１７号ＴＯＣビル４階,,13,109,1410031,,,,,,,2016-04-21,1,,,,,,0
532554,5010705002459,01,1,2019-12-27,2016-05-26,日立ソリューションズ・クリエイト労働組合,,399,東京都,品川区,東品川４丁目１２番６号,,13,109,1400002,,,,,,,2016-05-26,1,,,,,ヒタチソリューションズクリエイト,0
532555,5010705002483,01,1,2018-07-19,2016-07-04,一般社団法人ＩｏＴサービス連携協議会,,399,東京都,品川区,西五反田２丁目１２番３号第一誠実ビル９階,,13,109,1410031,,,,,,,2016-07-04,1,,,,,アイオーティーサービスレンケイキョウギカイ,0
532556,5010705002491,01,0,2016-07-19,2016-07-13,一般社団法人ファミリズム,,399,東京都,品川区,東大井３丁目２０－４ワイハウスサイド２Ｆ,,13,109,1400011,,,,,,,2016-07-13,1,,,,,,0
532557,5010705002500,01,1,2018-08-30,2016-08-16,管理組合法人プレジデントハイツ五反田,,399,東京都,品川区,西五反田２丁目１３番１号,,13,109,1410031,,,,,,,2016-08-16,1,,,,,プレジデントハイツゴタンダ,0
532558,5010705002509,01,1,2019-11-22,2016-09-05,医療法人社団ＨＳ会,,399,東京都,品川区,大井１丁目４４番７号ピュア大井町１０１,,13,109,1400014,,,,,,,2016-09-05,1,,,,,エイチエスカイ,0
532559,5010705002517,01,0,2016-10-19,2016-10-14,一般社団法人ｍｉｎｏｒｕｓ,,399,東京都,品川区,大崎３丁目１番５号ルミネ五反田第二ビル６０２号室,,13,109,1410032,,,,,,,2016-10-14,1,,,,,,0
532560,5010705002541,12,0,2019-09-17,2019-09-11,特定非営利活動法人東京臨海部活性化機構,,399,東京都,港区,高輪１丁目２７番３７－３９０４号,,13,103,1080074,,,,,,,2016-11-29,1,,,,,,0
532561,5010705002574,01,1,2019-09-12,2017-03-06,医療法人社団あおよこ皮膚科クリニック,,399,東京都,品川区,南品川２丁目１７番２４号フルカワビル２階,,13,109,1400004,,,,,,,2017-03-06,1,,,,,アオヨコヒフカクリニック,0
532562,5010705002582,12,1,2018-10-05,2017-07-04,特定非営利活動法人日本メディカルコンシェルジュ協会,,399,東京都,港区,芝４丁目９番１号,,13,103,1080014,,,,,,,2017-03-29,1,,,,,ニホンメディカルコンシェルジュキョウカイ,0
532563,5010705002590,01,0,2017-04-18,2017-04-13,一般社団法人金属アレルギー協会,,399,東京都,品川区,旗の台４丁目９番１号,,13,109,1420064,,,,,,,2017-04-13,1,,,,,,0
532564,5010705002608,01,0,2017-06-09,2017-06-06,一般社団法人日本ＩＴ融合型高度人材育成支援機構,,399,東京都,品川区,西五反田７丁目７番２号,,13,109,1410031,,,,,,,2017-06-06,1,,,,,,0
532565,5010705002624,01,0,2017-07-07,2017-07-04,一般社団法人なんとかせんと会,,399,東京都,品川区,大井３丁目２１番１４－１０３号,,13,109,1400014,,,,,,,2017-07-04,1,,,,,,0
532566,5010705002632,01,1,2019-10-24,2017-07-28,一般社団法人カトレアシェヴ,,399,東京都,品川区,大井４丁目１番２号,,13,109,1400014,,,,,,,2017-07-28,1,,,,,カトレアシェヴ,0
532567,5010705002640,12,1,2018-07-04,2017-10-23,社会福祉法人空のいろ,,399,東京都,品川区,西品川１丁目２８番１４号,,13,109,1410033,,,,,,,2017-08-01,1,,,,,ソラノイロ,0
532568,5010705002649,21,0,2018-10-22,2018-10-18,一般社団法人家と地盤の安心協議会,,399,東京都,品川区,東五反田１丁目７番１１号,,13,109,1410022,,,2018-10-18,01,,,2017-08-21,1,,,,,イエトジバンノアンシンキョウギカイ,0
532569,5010705002657,01,1,2019-12-16,2017-08-29,医療法人社団恵芳会,,399,東京都,品川区,北品川６丁目７番２９号ガーデンシティ品川御殿山１階１１０,,13,109,1410001,,,,,,,2017-08-29,1,,,,,ケイホウカイ,0
532570,5010705002665,01,1,2018-04-24,2017-09-07,医療法人社団裕正会,,399,東京都,品川区,西大井１丁目４番２５号コア・スターレ西大井第一ビル２階,,13,109,1400015,,,,,,,2017-09-07,1,,,,,ユウセイカイ,0
532571,5010705002681,12,0,2018-12-25,2018-12-18,税理士法人ユープラス,,399,東京都,港区,高輪３丁目１０番２号,,13,103,1080074,,,,,,,2017-10-11,1,,,,,ユープラス,0
532572,5010705002698,01,0,2017-12-06,2017-12-01,一般社団法人松下教育研究所,,399,東京都,品川区,上大崎３丁目１４番３５号,,13,109,1410021,,,,,,,2017-12-01,1,,,,,,0
532573,5010705002715,12,1,2018-07-04,2018-06-26,一般社団法人日本社員教育高度化機構,,399,東京都,品川区,大崎３丁目５－２エステージ大崎ビル６Ｆ,,13,109,1410032,,,,,,,2018-01-16,1,,,,,ニホンシャインキョウイクコウドカキコウ,0
532574,5010705002723,01,0,2018-01-26,2018-01-23,一般社団法人ＩＣＴリハビリテーション研究会,,399,東京都,品川区,平塚１丁目１３番１０号クレストフォルム戸越６０５,,13,109,1420051,,,,,,,2018-01-23,1,,,,,,0
532575,5010705002748,01,0,2018-04-06,2018-04-03,ＪＳ社会保険労務士法人,,399,東京都,品川区,西五反田２丁目２４番９号五反田Ｎビル９階,,13,109,1410031,,,,,,,2018-04-03,1,,,,,ジェイエス,0
532576,5010705002756,12,0,2020-05-08,2020-04-30,一般社団法人マナティー研究所,,399,東京都,中央区,新富２丁目８－５ライオンズ東銀座レジデンス８０３号,,13,102,1040041,,,,,,,2018-05-08,1,,,,,マナティーケンキュウジョ,0
532577,5010705002764,12,0,2018-06-13,2018-06-07,一般社団法人全日本講師連盟,,399,東京都,品川区,東五反田１丁目１３－１２いちご五反田ビルＪＢＳ五反田１０３１号室,,13,109,1410022,,,,,,,2018-05-07,1,,,,,ゼンニッポンコウシレンメイ,0
532578,5010705002780,01,0,2018-06-25,2018-06-20,一般社団法人リ・クリエイトアジア,,399,東京都,品川区,南品川４丁目５番９号,,13,109,1400004,,,,,,,2018-06-20,1,,,,,リクリエイトアジア,0
532579,5010705002789,01,0,2018-07-12,2018-07-09,特定非営利活動法人マンション管理総合支援センター,,399,東京都,品川区,大井６丁目１７番１１号,,13,109,1400014,,,,,,,2018-07-09,1,,,,,マンションカンリソウゴウシエンセンター,0
532580,5010705002822,01,0,2018-09-04,2018-08-30,一般財団法人ＷＩＫ－Ｊａｐａｎ,,399,東京都,品川区,旗の台２丁目８番２１－６０４号,,13,109,1420064,,,,,,,2018-08-30,1,,,,,ウィックジャパン,0
532581,5010705002830,01,0,2018-09-10,2018-09-05,特定非営利活動法人そとぼーよ,,399,東京都,品川区,八潮５丁目４番２１－３０５号,,13,109,1400003,,,,,,,2018-09-05,1,,,,,ソトボーヨ,0
532582,5010705002839,01,0,2018-09-28,2018-09-25,一般財団法人皇学会,,399,東京都,品川区,北品川３丁目１１番１３号,,13,109,1400001,,,,,,,2018-09-25,1,,,,,コウガクカイ,0
532583,5010705002847,01,0,2018-10-22,2018-10-17,一般社団法人Ｗｒｉｔｅ　Ｏｆｆ　Ｐｒｏｊｅｃｔ,,399,東京都,品川区,戸越３丁目４番１８号,,13,109,1420041,,,,,,,2018-10-17,1,,,,,ライトオフプロジェクト,0
532584,5010705002863,01,0,2018-11-22,2018-11-19,一般社団法人全国企業主導型保育事業協会,,399,東京都,品川区,東五反田５丁目２２番３７号,,13,109,1410022,,,,,,,2018-11-19,1,,,,,ゼンコクキギョウシュドウガタホイクジギョウキョウカイ,0
532585,5010705002871,01,0,2018-11-29,2018-11-26,一般社団法人社会環境保安協会,,399,東京都,品川区,大井１丁目１０番１号,,13,109,1400014,,,,,,,2018-11-26,1,,,,,シャカイカンキョウホアンキョウカイ,0
532586,5010705002896,01,1,2020-03-10,2019-02-01,一般社団法人Ｎａｔｉｏｎａｌ　Ｃｈｅｓｓ　Ｓｏｃｉｅｔｙ　ｏｆ　Ｊａｐａｎ,,399,東京都,品川区,大井４丁目１８番２５－７０１号,,13,109,1400014,,,,,,,2019-02-01,1,,,,,ナショナルチェスソサイエティオブジャパン,0
532587,5010705002913,01,0,2019-03-25,2019-03-19,一般社団法人ままれぼ出版局,,399,東京都,品川区,北品川１丁目９番７号トップルーム品川１０１５号,,13,109,1400001,,,,,,,2019-03-19,1,,,,,ママレボシュッパンキョク,0
532588,5010705002946,01,0,2019-07-04,2019-07-01,一般社団法人若き血,,399,東京都,品川区,東五反田２丁目１０番２号,,13,109,1410022,,,,,,,2019-07-01,1,,,,,ワカキチ,0
532589,5010705002954,01,0,2019-07-29,2019-07-24,一般社団法人日本美髪協会,,399,東京都,品川区,上大崎２丁目１５番１９号ＭＧ目黒駅前１１０３号,,13,109,1410021,,,,,,,2019-07-24,1,,,,,ニホンビハツキョウカイ,0
532590,5010705002962,01,0,2019-08-16,2019-08-13,一般社団法人新しい贈与論,,399,東京都,品川区,上大崎２丁目１０番１１号アビティ目黒１１０,,13,109,1410021,,,,,,,2019-08-13,1,,,,,アタラシイゾウヨロン,0
532591,5010705002987,01,0,2019-10-28,2019-10-23,一般社団法人チベット・ヒマラヤ文化会館,,399,東京都,品川区,西五反田２丁目１２番１５号,,13,109,1410031,,,,,,,2019-10-23,1,,,,,チベットヒマラヤブンカカイカン,0
532592,5010705002995,01,0,2019-11-01,2019-10-29,一般社団法人キャンプジャパン・クルマ旅推進協会,,399,東京都,品川区,南大井３丁目２６番５号２階,,13,109,1400013,,,,,,,2019-10-29,1,,,,,キャンプジャパンクルマタビスイシンキョウカイ,0
532593,5010705003003,01,0,2019-11-28,2019-11-25,一般社団法人空間デザイン心理学協会,,399,東京都,品川区,大崎１丁目１８番２－８０１号,,13,109,1410032,,,,,,,2019-11-25,1,,,,,クウカンデザインシンリガクキョウカイ,0
532594,5010705003011,01,0,2020-01-14,2020-01-14,一般社団法人ペアリド英語ペアリーディング協会,,399,東京都,品川区,北品川１丁目９番７号ＴＯＰＲＯＯＭ品川１０１５,,13,109,1400001,,,,,,,2020-01-14,1,,,,,ペアリドエイゴペアリーディングキョウカイ,0
532595,5010705003028,01,0,2020-02-12,2020-02-12,一般社団法人麻布メディカル＆ヘルスケアサポート協会,,399,東京都,品川区,東品川１丁目８番１－１００３号,,13,109,1400002,,,,,,,2020-02-12,1,,,,,アザブメディカルアンドヘルスケアサポートキョウカイ,0
532596,5010705003036,01,0,2020-02-27,2020-02-27,特定非営利活動法人ＯｌｕＯｌｕ,,399,東京都,品川区,南品川４丁目５番２号,,13,109,1400004,,,,,,,2020-02-27,1,,,,,オルオル,0
532597,5010705003044,01,1,2020-04-06,2020-03-18,一般社団法人ＧＩＶＥＲ,,399,東京都,品川区,南品川２丁目２番５号ペガソ２１南品川ビル２階,,13,109,1400004,,,,,,,2020-03-18,1,,,,,,0
532598,5010705003052,01,0,2020-04-09,2020-04-09,特定非営利活動法人城南・風景とまちづくりクラブ,,399,東京都,品川区,旗の台６丁目１０番２号,,13,109,1420064,,,,,,,2020-04-09,1,,,,,ジョウナンフウケイトマチヅクリクラブ,0
653634,6010705000008,01,0,2015-10-28,2015-10-05,公益社団法人東京都荏原歯科医師会,,399,東京都,品川区,中延１丁目４番１５号荏原歯科医師会館,,13,109,1420053,,,,,,,2015-10-05,1,,,,,,0
653635,6010705000016,12,1,2019-06-27,2017-07-03,一般社団法人荏原法人会,,399,東京都,品川区,中延２丁目１５番７号,,13,109,1420053,,,,,,,2015-10-05,1,,,,,エバラホウジンカイ,0
653636,6010705000024,01,0,2015-10-28,2015-10-05,一般社団法人荏原青色申告会,,399,東京都,品川区,西中延１丁目２番４号,,13,109,1420054,,,,,,,2015-10-05,1,,,,,,0
653637,6010705000049,01,1,2018-08-14,2015-10-05,一般財団法人三水会,,399,東京都,品川区,大崎２丁目５番１５号,,13,109,1410032,,,,,,,2015-10-05,1,,,,,サンスイカイ,0
653638,6010705000057,01,1,2018-06-26,2015-10-05,公益財団法人昭和池田記念財団,,399,東京都,品川区,戸越５丁目１７番１４号,,13,109,1420041,,,,,,,2015-10-05,1,,,,,ショウワイケダキネンザイダン,0
653639,6010705000081,01,1,2020-03-30,2015-10-05,一般財団法人六行会,,399,東京都,品川区,北品川２丁目３２番３号,,13,109,1400001,,,,,,,2015-10-05,1,,,,,リッコウカイ,0
653640,6010705000098,01,1,2019-04-15,2015-10-05,公益財団法人ＪＡＬ財団,,399,東京都,品川区,東品川２丁目４番１１号,,13,109,1400002,,,,,,,2015-10-05,1,,,,,,0
653641,6010705000107,01,0,2015-10-28,2015-10-05,稲荷神社,,399,東京都,品川区,大井２丁目１６番１４号,,13,109,1400014,,,,,,,2015-10-05,1,,,,,,0
653642,6010705000115,01,0,2015-10-28,2015-10-05,大井蔵王権現神社,,399,東京都,品川区,大井１丁目１４番８号,,13,109,1400014,,,,,,,2015-10-05,1,,,,,,0
653643,6010705000123,01,0,2015-10-28,2015-10-05,海徳寺,,399,東京都,品川区,南品川１丁目２番１０号,,13,109,1400004,,,,,,,2015-10-05,1,,,,,,0
