349785,3012705001079,01,0,2015-10-30,2015-10-05,解脱報恩感謝會田無支部,,399,東京都,西東京市,田無町２７３４番地,,13,229,2020000,,,,,,,2015-10-05,1,,,,,,0
349786,3012705001087,01,0,2015-10-30,2015-10-05,心靈界教団本聽小山教會,00066784,399,東京都,東村山市,野口１６２８番地,,13,213,1890000,,,,,,,2015-10-05,1,,,,,,0
349787,3012705001095,01,0,2015-10-30,2015-10-05,日枝神社,,399,東京都,小平市,小川３０３番地,,13,211,1870000,,,,,,,2015-10-05,1,,,,,,0
349788,3012705001203,01,1,2018-05-08,2015-10-05,医療法人社団愛生堂,,399,東京都,東村山市,秋津町５丁目３６番地３７、１階,,13,213,1890001,,,,,,,2015-10-05,1,,,,,アイセイドウ,0
349789,3012705001228,01,0,2015-10-30,2015-10-05,特定非営利活動法人ナチュラルフェローズ,,399,東京都,西東京市,保谷町３丁目１８番２５号エルガーデン２０８号,,13,229,2020015,,,,,,,2015-10-05,1,,,,,,0
349790,3012705001236,01,1,2018-06-05,2015-10-05,特定非営利活動法人生活企画ジェフリー,,399,東京都,西東京市,南町４丁目１３番２６号,,13,229,1880012,,,,,,,2015-10-05,1,,,,,セイカツキカクジェフリー,0
349791,3012705001252,01,1,2019-07-09,2015-10-05,特定非営利活動法人西東京花の会,,399,東京都,西東京市,田無町４丁目２１番８－１０３号小山田方,,13,229,1880011,,,,,,,2015-10-05,1,,,,,ニシトウキョウハナノカイ,0
349792,3012705001285,01,1,2016-04-22,2015-10-05,ＮＰＯ法人日本セキュリティ研究所,,399,東京都,東久留米市,東本町４－６,,13,222,2030014,,,,,,,2015-10-05,1,,,,,,0
349793,3012705001293,01,0,2015-10-30,2015-10-05,特定非営利活動法人生活支援グループ夢来夢来,,399,東京都,東久留米市,南町４丁目１０番２６号,,13,222,2030031,,,,,,,2015-10-05,1,,,,,,0
349794,3012705001302,01,1,2018-06-27,2015-10-05,学校法人自由学園,,399,東京都,東久留米市,学園町１丁目８番１５号,,13,222,2030021,,,,,,,2015-10-05,1,,,,,ジユウガクエン,0
349795,3012705001310,01,0,2015-10-30,2015-10-05,ワコーレ花小金井管理組合法人,,399,東京都,小平市,花小金井南町２丁目１７番２号,,13,211,1870003,,,,,,,2015-10-05,1,,,,,,0
349796,3012705001319,21,0,2017-04-13,2017-04-07,特定非営利活動法人子育てコラボひまわり,,399,東京都,西東京市,田無町４丁目１１番２号,,13,229,1880011,,,2017-04-07,01,,,2015-10-05,1,,,,,,0
349797,3012705001335,01,0,2015-10-30,2015-10-05,特定非営利活動法人ＩＧＣ,,399,東京都,小平市,喜平町１丁目５番１０号,,13,211,1870044,,,,,,,2015-10-05,1,,,,,,0
349798,3012705001376,12,0,2019-10-11,2019-10-07,税理士法人みらい,,399,東京都,西東京市,ひばりが丘北３丁目４番１号みらいビル,,13,229,2020002,,,,,,,2015-10-05,1,,,,,ミライ,0
349799,3012705001392,01,1,2020-02-03,2015-10-05,一般社団法人日本てんかん学会,,399,東京都,小平市,小川東町４丁目６番１５号,,13,211,1870031,,,,,,,2015-10-05,1,,,,,ニホンテンカンガッカイ,0
349800,3012705001401,01,1,2019-03-01,2015-10-05,医療法人社団三碧会,,399,東京都,西東京市,谷戸町３丁目２３番１号Ｋ－ｆｌａｔ１階,,13,229,1880001,,,,,,,2015-10-05,1,,,,,サンペキカイ,0
349801,3012705001426,12,1,2018-05-23,2016-04-18,特定非営利活動法人地域ケアさぽーと研究所,,399,東京都,小平市,小川西町４丁目３４－２,,13,211,1870035,,,,,,,2015-10-05,1,,,,,チイキケアサポートケンキュウジョ,0
349802,3012705001434,01,0,2015-10-30,2015-10-05,ビューティークリエイターズ協同組合,,399,東京都,東村山市,久米川町１丁目３７番地２７,,13,213,1890003,,,,,,,2015-10-05,1,,,,,,0
349803,3012705001450,01,1,2018-05-30,2015-10-05,特定非営利活動法人西東京市体育協会,,399,東京都,西東京市,中町１丁目５番１号西東京市スポーツセンター内,,13,229,2020013,,,,,,,2015-10-05,1,,,,,ニシトウキョウシタイイクキョウカイ,0
349804,3012705001459,01,1,2018-07-03,2015-10-05,特定非営利活動法人ヒューマンウェルネス研究所,,399,東京都,西東京市,南町２丁目２番５号,,13,229,1880012,,,,,,,2015-10-05,1,,,,,ヒューマンウェルネスケンキュウジョ,0
349805,3012705001475,01,1,2020-01-24,2015-10-05,無限責任中間法人ニュー・グローバル・アメリカ,,399,東京都,清瀬市,松山１丁目６番１２号清瀬グリーンマンション１０５号室,,13,221,2040022,,,,,,,2015-10-05,1,,,,,,0
349806,3012705001491,01,0,2015-10-30,2015-10-05,宗教法人滝山聖書バプテスト教会,,399,東京都,東久留米市,滝山７丁目３番１６号,,13,222,2030033,,,,,,,2015-10-05,1,,,,,,0
349807,3012705001509,01,1,2019-04-01,2015-10-05,むさしのｉタウン四季の街団地管理組合法人,,399,東京都,東村山市,本町３丁目２２番地２１,,13,213,1890014,,,,,,,2015-10-05,1,,,,,ムサシノアイタウンシキノマチ,0
349808,3012705001525,01,0,2015-10-30,2015-10-05,特定非営利活動法人シニアライフ・サポート協会,,399,東京都,西東京市,田無町５丁目３番４－１０２号,,13,229,1880011,,,,,,,2015-10-05,1,,,,,,0
349809,3012705001533,01,1,2018-10-17,2015-10-05,医療法人社団Ｓｏｌ,,399,東京都,西東京市,下保谷４丁目１２番２１号リベルタ・ヴィラ１階,,13,229,2020004,,,,,,,2015-10-05,1,,,,,エスオーエル,0
349810,3012705001541,01,0,2015-10-30,2015-10-05,特定非営利活動法人就活ニューエイジ,,399,東京都,東久留米市,幸町３丁目１０番２９号,,13,222,2030052,,,,,,,2015-10-05,1,,,,,,0
349811,3012705001558,01,0,2015-10-30,2015-10-05,医療法人社団明邦会,,399,東京都,東村山市,久米川町３丁目３番地４,,13,213,1890003,,,,,,,2015-10-05,1,,,,,,0
349812,3012705001566,01,1,2019-09-17,2015-10-05,特定非営利活動法人東久留米ふれあいの街,,399,東京都,東久留米市,滝山４丁目２番２７号滝山センターパーク会館二階,,13,222,2030033,,,,,,,2015-10-05,1,,,,,ヒガシクルメフレアイノマチ,0
349813,3012705001574,01,1,2018-06-05,2015-10-05,特定非営利活動法人清瀬のつぼみ,,399,東京都,清瀬市,中清戸３丁目４３８番地１,,13,221,2040012,,,,,,,2015-10-05,1,,,,,キヨセノツボミ,0
349814,3012705001582,01,1,2018-06-27,2015-10-05,特定非営利活動法人西都虹の会,,399,東京都,清瀬市,上清戸２丁目１番４２号,,13,221,2040013,,,,,,,2015-10-05,1,,,,,サイトニジノカイ,0
349815,3012705001590,01,1,2018-06-18,2015-10-05,認定特定非営利活動法人Ｔｅａｃｈ　Ｆｏｒ　Ｊａｐａｎ,,399,東京都,港区,新橋６丁目１８番３号中村ビル４階,,13,103,1050004,,,,,,,2015-10-05,1,,,,,ティーチフォージャパン,0
349816,3012705001599,01,0,2015-10-30,2015-10-05,一般社団法人日本トライフットボール協会,,399,東京都,小平市,学園東町１丁目２番３３号,,13,211,1870043,,,,,,,2015-10-05,1,,,,,,0
349817,3012705001608,01,1,2019-01-28,2015-10-05,公益社団法人日本医学協会,,399,東京都,清瀬市,松山２丁目１番７－２０２号,,13,221,2040022,,,,,,,2015-10-05,1,,,,,ニホンイガクキョウカイ,0
349818,3012705001624,01,1,2020-05-22,2015-10-05,特定非営利活動法人まちかど保健室,,399,東京都,西東京市,谷戸町３丁目３番３６号,,13,229,1880001,,,,,,,2015-10-05,1,,,,,マチカドホケンシツ,0
349819,3012705001632,01,1,2018-12-20,2015-10-05,医療法人社団晴英会,,399,東京都,西東京市,東町３丁目１３番１９－２Ｆ２Ｇ号ソレイユ保谷２階,,13,229,2020012,,,,,,,2015-10-05,1,,,,,セイエイカイ,0
349820,3012705001649,01,1,2018-07-12,2015-10-05,公益財団法人報農会,,399,東京都,小平市,花小金井南町１丁目１２番１１号ＢＬＯＳＳＯＭみさと,,13,211,1870003,,,,,,,2015-10-05,1,,,,,ホウノウカイ,0
349821,3012705001657,01,0,2015-10-30,2015-10-05,一般社団法人クラッシュジャパン,,399,東京都,東久留米市,新川町１丁目２－１２松川プレイス１０５号,,13,222,2030013,,,,,,,2015-10-05,1,,,,,,0
960,3012705001665,21,0,2020-06-03,2020-06-01,特定非営利活動法人障がい者職業支援飛行機雲,,399,東京都,小平市,美園町１丁目１２番１３－１０３号,,13,211,1870041,,,2020-06-01,01,,,2015-10-05,1,,,,,ショウガイシャショクギョウシエンヒコウキグモ,0
349823,3012705001681,01,0,2015-10-30,2015-10-05,特定非営利活動法人社会福祉健康センター,,399,東京都,清瀬市,下清戸２丁目５６１番地１９,,13,221,2040011,,,,,,,2015-10-05,1,,,,,,0
349824,3012705001698,01,1,2018-06-29,2015-10-05,公益社団法人東村山市体育協会,,399,東京都,東村山市,久米川町３丁目３０番地５,,13,213,1890003,,,,,,,2015-10-05,1,,,,,ヒガシムラヤマシタイイクキョウカイ,0
349825,3012705001707,01,1,2018-05-22,2015-10-05,一般社団法人日本民生文化協会,,399,東京都,東久留米市,本町３丁目３番２１号,,13,222,2030053,,,,,,,2015-10-05,1,,,,,ニホンミンセイブンカキョウカイ,0
349826,3012705001715,01,1,2018-07-11,2015-10-05,一般社団法人小平市薬剤師会,,399,東京都,小平市,美園町３丁目１番８号,,13,211,1870041,,,,,,,2015-10-05,1,,,,,コダイラシヤクザイシカイ,0
349827,3012705001723,01,1,2020-03-27,2015-10-05,一般社団法人東京都清瀬市歯科医師会,,399,東京都,清瀬市,上清戸２丁目６番６－２０５号,,13,221,2040013,,,,,,,2015-10-05,1,,,,,トウキョウトキヨセシシカイシカイ,0
349828,3012705001756,01,1,2018-06-27,2015-10-05,医療法人社団桜陽緑会,,399,東京都,東村山市,栄町１丁目１３番地１,,13,213,1890013,,,,,,,2015-10-05,1,,,,,オウヨウリョクカイ,0
349829,3012705001772,12,1,2019-12-05,2019-11-27,一般社団法人清瀬市薬剤師会,,399,東京都,清瀬市,松山２丁目１番５号,,13,221,2040022,,,,,,,2015-10-05,1,,,,,キヨセシヤクザイシカイ,0
349830,3012705001780,01,1,2018-06-14,2015-10-05,医療法人社団明葵会,,399,東京都,西東京市,東町３丁目１４番１９号保谷光風レジデンス１階,,13,229,2020012,,,,,,,2015-10-05,1,,,,,メイキカイ,0
349831,3012705001797,12,1,2018-05-02,2018-03-16,特定非営利活動法人子どもと文化のエヌピーオー東村山子ども劇場,,399,東京都,東村山市,本町２丁目１９番地６１,,13,213,1890014,,,,,,,2015-10-05,1,,,,,コドモトブンカノエヌピーオーヒガシムラヤマコドモゲキジョウ,0
349832,3012705001814,01,1,2018-05-16,2015-10-05,特定非営利活動法人高齢者在宅介護支援センター,,399,東京都,清瀬市,松山１丁目１２番１５号,,13,221,2040022,,,,,,,2015-10-05,1,,,,,コウレイシャザイタクカイゴシエンセンター,0
349833,3012705001822,01,1,2019-07-03,2015-10-05,一般社団法人ベアホープ,,399,東京都,東久留米市,東本町３番地１７号和合ビル２階,,13,222,2030014,,,,,,,2015-10-05,1,,,,,ベアホープ,0
349834,3012705001839,01,1,2019-01-29,2015-10-05,医療法人社団佳朋会,,399,東京都,西東京市,南町５丁目９番１７号,,13,229,1880012,,,,,,,2015-10-05,1,,,,,カホウカイ,0
349835,3012705001847,12,1,2018-07-05,2017-11-15,一般財団法人多磨の杜,,399,東京都,東村山市,青葉町２丁目３１番６,,13,213,1890002,,,,,,,2015-10-05,1,,,,,タマノモリ,0
349836,3012705001871,01,1,2020-02-06,2015-10-05,一般社団法人たけのこ,,399,東京都,清瀬市,竹丘２丁目２２番１号,,13,221,2040023,,,,,,,2015-10-05,1,,,,,タケノコ,0
349837,3012705001888,01,0,2015-10-30,2015-10-05,一般社団法人ｉ－ＳＴＡＧＥ,,399,東京都,小平市,中島町３２番４号,,13,211,1870033,,,,,,,2015-10-05,1,,,,,,0
349838,3012705001896,01,1,2018-04-09,2015-10-05,医療法人社団恵輝会,,399,東京都,東久留米市,滝山５丁目３番６号,,13,222,2030033,,,,,,,2015-10-05,1,,,,,ケイキカイ,0
349839,3012705001913,01,1,2018-05-18,2015-10-05,特定非営利活動法人市民後見サポートセンター和,,399,東京都,小平市,小川町１丁目１６８番地１,,13,211,1870032,,,,,,,2015-10-05,1,,,,,シミンコウケンサポートセンターナゴミ,0
349840,3012705001921,01,1,2019-09-12,2015-10-05,一般社団法人日本フォトロゲイニング協会,,399,東京都,東村山市,青葉町３丁目２７番地５９,,13,213,1890002,,,,,,,2015-10-05,1,,,,,ニホンフォトロゲイニングキョウカイ,0
349841,3012705001946,01,1,2019-07-02,2016-02-05,一般社団法人アニマリア,,399,東京都,小平市,鈴木町１丁目３６８番地の２２,,13,211,1870011,,,,,,,2016-02-05,1,,,,,アニマリア,0
349842,3012705001954,01,1,2018-06-13,2016-03-03,医療法人社団哲富会,,399,東京都,清瀬市,松山１丁目２番２３号オバタビル２階,,13,221,2040022,,,,,,,2016-03-03,1,,,,,テツトミカイ,0
349843,3012705001962,01,0,2016-04-21,2016-04-15,一般社団法人真康会,,399,東京都,東久留米市,本町３丁目３番２０号,,13,222,2030053,,,,,,,2016-04-15,1,,,,,,0
349844,3012705001970,12,1,2018-10-15,2016-07-08,ＮＰＯ法人小平こども劇場,,399,東京都,小平市,仲町４８８番地３,,13,211,1870042,,,,,,,2016-06-14,1,,,,,コダイラコドモゲキジョウ,0
349845,3012705001979,01,0,2016-09-20,2016-09-14,一般社団法人小平ＦＭネットワーク,,399,東京都,小平市,鈴木町１丁目１８３番地の１０,,13,211,1870011,,,,,,,2016-09-14,1,,,,,,0
349846,3012705001987,01,1,2019-01-09,2016-11-10,一般社団法人働き方改革推進協会,,399,東京都,小平市,上水南町３丁目１５番２６号,,13,211,1870021,,,,,,,2016-11-10,1,,,,,ハタラキカタカイカクスイシンキョウカイ,0
349847,3012705001995,01,1,2020-04-06,2017-01-18,一般財団法人岩田文化事業財団,,399,東京都,小平市,天神町３丁目１０番３号,,13,211,1870004,,,,,,,2017-01-18,1,,,,,イワタブンカジギョウザイダン,0
349848,3012705002003,01,1,2018-08-14,2017-02-16,一般社団法人ＫＳカンパニー,,399,東京都,西東京市,田無町４丁目２４番４号,,13,229,1880011,,,,,,,2017-02-16,1,,,,,ケーエスカンパニー,0
349849,3012705002011,12,1,2018-10-01,2018-09-27,一般社団法人すだち,,399,東京都,小平市,学園東町１丁目９番１５号,,13,211,1870043,,,,,,,2017-03-29,1,,,,,スダチ,0
349850,3012705002028,01,0,2017-07-19,2017-07-13,一般社団法人アニマル・リテラシー総研,,399,東京都,清瀬市,竹丘３丁目４番２５号,,13,221,2040023,,,,,,,2017-07-13,1,,,,,,0
349851,3012705002044,01,0,2017-10-18,2017-10-13,社会保険労務士法人ＨＲＤユナイテッドオフィス,,399,東京都,東村山市,富士見町１丁目２番地３２オーベル小川レジデンス８０５,,13,213,1890024,,,,,,,2017-10-13,1,,,,,,0
349852,3012705002060,01,1,2018-07-03,2018-01-30,社会福祉法人小平晴風会,,399,東京都,小平市,小川町１丁目４９７番地９,,13,211,1870032,,,,,,,2018-01-30,1,,,,,コダイラセイフウカイ,0
349853,3012705002069,01,1,2018-11-21,2018-02-28,医療法人社団向日葵,,399,東京都,西東京市,新町４丁目６番７号グレンドーラ１階,,13,229,2020023,,,,,,,2018-02-28,1,,,,,ヒマワリ,0
349854,3012705002085,01,0,2018-05-18,2018-05-15,一般社団法人国際幼児体育協会,,399,東京都,西東京市,泉町２丁目１９番３号,,13,229,2020011,,,,,,,2018-05-15,1,,,,,コクサイヨウジタイイクキョウカイ,0
349855,3012705002093,01,0,2018-07-10,2018-07-05,特定非営利活動法人Ｌｉｎｏ,,399,東京都,東村山市,野口町２丁目２１番地１ハイホーム東村山２０１,,13,213,1890022,,,,,,,2018-07-05,1,,,,,リノ,0
349856,3012705002102,01,0,2018-09-11,2018-09-06,一般社団法人日本国際複合芸術協会,,399,東京都,西東京市,北原町３丁目５－１トラスティ田無Ⅱ１３７号,00114406,13,229,1880003,,,,,,,2018-09-06,1,,,,,ニホンコクサイフクゴウゲイジュツキョウカイ,0
349857,3012705002119,01,0,2018-12-21,2018-12-18,一般社団法人サンテ,,399,東京都,小平市,鈴木町１丁目４１０番地,,13,211,1870011,,,,,,,2018-12-18,1,,,,,サンテ,0
349858,3012705002127,01,0,2019-02-25,2019-02-20,一般社団法人日本アロマボディワーカー協会,,399,東京都,東村山市,栄町２丁目２４番地４１－３０１,,13,213,1890013,,,,,,,2019-02-20,1,,,,,ニホンアロマボディワーカーキョウカイ,0
349859,3012705002143,01,0,2019-04-24,2019-04-19,一般社団法人ｔｈｉｎｃｔｈ,,399,東京都,小平市,小川東町５丁目１９番３４－２１０号,,13,211,1870031,,,,,,,2019-04-19,1,,,,,シンクス,0
349860,3012705002151,01,0,2019-05-21,2019-05-16,一般社団法人婚活支援士認定協会,,399,東京都,小平市,上水南町３丁目４番３４号,,13,211,1870021,,,,,,,2019-05-16,1,,,,,コンカツシエンシニンテイキョウカイ,0
349861,3012705002168,01,0,2019-09-11,2019-09-06,医療法人社団宇都宮レディースクリニック,,399,東京都,清瀬市,元町１丁目４番２６号清瀬パークホームズ１階,,13,221,2040021,,,,,,,2019-09-06,1,,,,,ウツノミヤレディースクリニック,0
349862,3012705002184,01,0,2020-01-09,2020-01-07,一般社団法人きよせ１００歳時代,,399,東京都,清瀬市,下清戸３丁目５８番３２号片岡宅,,13,221,2040011,,,,,,,2020-01-07,1,,,,,キヨセヒャクサイジダイ,0
349863,3012705002192,01,0,2020-03-06,2020-03-06,一般社団法人ＪＷＣリハビリテーションマネジメント協会,,399,東京都,東村山市,久米川町４丁目４２番地４,,13,213,1890003,,,,,,,2020-03-06,1,,,,,ジェイダブリューシーリハビリテーションマネジメントキョウカイ,0
349864,3012705002201,01,0,2020-03-31,2020-03-31,一般社団法人こみゅと小平,,399,東京都,小平市,花小金井５丁目４９番１６号,,13,211,1870002,,,,,,,2020-03-31,1,,,,,コミュトコダイラ,0
470858,4012705000014,01,0,2015-10-30,2015-10-05,財団法人糧食研究会,,399,東京都,東村山市,栄町１丁目２１番地３,,13,213,1890013,,,,,,,2015-10-05,1,,,,,,0
470859,4012705000055,01,1,2018-04-13,2015-10-05,東久留米市土地開発公社,,399,東京都,東久留米市,本町３丁目３番１号東久留米市役所内,,13,222,2030053,,,,,,,2015-10-05,1,,,,,ヒガシクルメシ,0
470860,4012705000063,01,1,2018-04-13,2015-10-05,東京みらい農業協同組合,,399,東京都,東久留米市,幸町３丁目７番２号,,13,222,2030052,,,,,,,2015-10-05,1,,,,,トウキョウミライ,0
470861,4012705000071,01,1,2018-05-31,2015-10-05,学校法人白梅学園,,399,東京都,小平市,小川町１丁目８３０番地,,13,211,1870032,,,,,,,2015-10-05,1,,,,,シラウメガクエン,0
470862,4012705000088,01,1,2018-07-20,2015-10-05,学校法人啓倫学園,,399,東京都,小平市,小川東町５丁目２１番１４号,,13,211,1870031,,,,,,,2015-10-05,1,,,,,ケイリンガクエン,0
470863,4012705000096,01,1,2019-12-12,2015-10-05,学校法人精心学園,,399,東京都,東村山市,諏訪町２丁目１４番地１,,13,213,1890021,,,,,,,2015-10-05,1,,,,,セイシンガクエン,0
470864,4012705000105,01,1,2018-06-27,2015-10-05,社会福祉法人信愛報恩会,,399,東京都,清瀬市,梅園２丁目５番９号,,13,221,2040024,,,,,,,2015-10-05,1,,,,,シンアイホウオンカイ,0
470865,4012705000113,01,1,2018-07-02,2015-10-05,社会福祉法人こぶしの会,,399,東京都,小平市,鈴木町１丁目１４８番地１,,13,211,1870011,,,,,,,2015-10-05,1,,,,,コブシノカイ,0
470866,4012705000121,01,1,2018-06-22,2015-10-05,社会福祉法人村山苑,,399,東京都,東村山市,富士見町２丁目７番地５,,13,213,1890024,,,,,,,2015-10-05,1,,,,,ムラヤマエン,0
470867,4012705000138,01,1,2018-06-22,2015-10-05,社会福祉法人緑友会,,399,東京都,小平市,小川西町２丁目３５番２号,,13,211,1870035,,,,,,,2015-10-05,1,,,,,リョクユウカイ,0
470868,4012705000146,01,1,2018-07-02,2015-10-05,社会福祉法人椎の木会,,399,東京都,清瀬市,野塩４丁目２３０番１,,13,221,2040004,,,,,,,2015-10-05,1,,,,,シイノキカイ,0
470869,4012705000154,21,0,2019-11-21,2019-11-12,ブリヂストン小平生活協同組合,,399,東京都,小平市,小川東町１丁目１８番１５号,,13,211,1870031,,,2019-11-12,01,,,2015-10-05,1,,,,,ブリヂストンコダイラ,0
470870,4012705000162,01,0,2015-10-30,2015-10-05,企業組合トウビ,,399,東京都,東村山市,萩山町１丁目３９番地１１,,13,213,1890012,,,,,,,2015-10-05,1,,,,,,0
470871,4012705000170,01,1,2018-07-12,2015-10-05,西東京商工会,,399,東京都,西東京市,南町５丁目６番１８号,,13,229,1880012,,,,,,,2015-10-05,1,,,,,ニシトウキョウ,0
470872,4012705000187,21,0,2020-01-10,2020-01-09,東都電気機器工業協同組合,,399,東京都,東村山市,久米川町２丁目５番地５６,,13,213,1890003,,,2020-01-09,21,,,2015-10-05,1,,,,,,0
470873,4012705000204,01,1,2019-04-16,2015-10-05,多摩住宅協同組合,,399,東京都,東村山市,野口町２丁目１番地６,,13,213,1890022,,,,,,,2015-10-05,1,,,,,タマジュウタク,0
470874,4012705000212,12,0,2019-10-11,2019-10-03,社会医療法人社団愛有会,,399,東京都,東村山市,本町４丁目７番地１４,,13,213,1890014,,,,,,,2015-10-05,1,,,,,アイユウカイ,0
470875,4012705000229,01,1,2018-08-23,2015-10-05,医療法人社団菱成会,,399,東京都,東村山市,栄町２丁目１０番地２４,,13,213,1890013,,,,,,,2015-10-05,1,,,,,リョウセイカイ,0
470876,4012705000237,01,0,2015-10-30,2015-10-05,医療法人社団新生会,,399,東京都,清瀬市,中里５丁目２番８号清瀬ハイコーポ１階１１４号室,,13,221,2040003,,,,,,,2015-10-05,1,,,,,,0
470877,4012705000245,01,1,2019-11-21,2015-10-05,医療法人社団育友会,,399,東京都,小平市,美園町２丁目３番２０号,,13,211,1870041,,,,,,,2015-10-05,1,,,,,イクユウカイ,0
470878,4012705000253,01,1,2018-05-15,2015-10-05,医療法人社団浅谷眼科,,399,東京都,東村山市,本町３丁目８番地４３,,13,213,1890014,,,,,,,2015-10-05,1,,,,,アサタニガンカ,0
470879,4012705000261,01,1,2018-11-06,2015-10-05,医療法人社団皐月会,,399,東京都,西東京市,田無町４丁目１７番１８号ドミール田無１階１号,,13,229,1880011,,,,,,,2015-10-05,1,,,,,サツキカイ,0
470880,4012705000286,01,1,2018-06-29,2015-10-05,医療法人社団新新会,,399,東京都,東村山市,青葉町２丁目２７番１号,,13,213,1890002,,,,,,,2015-10-05,1,,,,,シンシンカイ,0
470881,4012705000294,01,1,2018-09-05,2015-10-05,医療法人社団仁明会,,399,東京都,西東京市,保谷町３丁目２４番２号,,13,229,2020015,,,,,,,2015-10-05,1,,,,,ジンメイカイ,0
470882,4012705000303,01,1,2018-08-16,2015-10-05,医療法人社団仲谷クリニック,,399,東京都,小平市,学園東町３丁目３番３６号１階,,13,211,1870043,,,,,,,2015-10-05,1,,,,,ナカヤクリニック,0
470883,4012705000336,01,0,2015-10-30,2015-10-05,圓通寺,,399,東京都,清瀬市,下宿２丁目５２１番地,,13,221,2040001,,,,,,,2015-10-05,1,,,,,,0
470884,4012705000344,01,0,2015-10-30,2015-10-05,熊野宮,,399,東京都,小平市,仲町３６１番地,,13,211,1870042,,,,,,,2015-10-05,1,,,,,,0
470885,4012705000352,01,0,2015-10-30,2015-10-05,真教寺,,399,東京都,西東京市,ひばりが丘４丁目１番１５号,,13,229,2020001,,,,,,,2015-10-05,1,,,,,,0
470886,4012705000360,01,0,2015-10-30,2015-10-05,白山神社,,399,東京都,清瀬市,下宿３丁目１３８３番地２,,13,221,2040001,,,,,,,2015-10-05,1,,,,,,0
470887,4012705000369,01,1,2019-06-26,2015-10-05,西武柳沢キリスト教会,,399,東京都,西東京市,柳沢２丁目１１番１３号,,13,229,2020022,,,,,,,2015-10-05,1,,,,,セイブヤギサワキリストキョウカイ,0
470888,4012705000377,01,0,2015-10-30,2015-10-05,長源寺,,399,東京都,清瀬市,下清戸４丁目４０６番地,,13,221,2040011,,,,,,,2015-10-05,1,,,,,,0
470889,4012705000385,01,0,2015-10-30,2015-10-05,天神社,,399,東京都,東久留米市,柳窪４丁目１５番１６号,,13,222,2030044,,,,,,,2015-10-05,1,,,,,,0
470890,4012705000402,01,0,2015-10-30,2015-10-05,天理教山都一分教会,00058553,399,東京都,西東京市,保谷町１丁目５番３０号,,13,229,2020015,,,,,,,2015-10-05,1,,,,,,0
470891,4012705000410,01,0,2015-10-30,2015-10-05,日本基督教団清瀬信愛教会,00058554,399,東京都,清瀬市,梅園２丁目５番１５号,,13,221,2040024,,,,,,,2015-10-05,1,,,,,,0
470892,4012705000419,01,0,2015-10-30,2015-10-05,日本キリスト教会小平教会,,399,東京都,小平市,仲町２４３番地５,,13,211,1870042,,,,,,,2015-10-05,1,,,,,,0
470893,4012705000427,01,0,2015-10-30,2015-10-05,宗教法人氷川神社,,399,東京都,西東京市,東伏見２丁目６番１３号,,13,229,2020021,,,,,,,2015-10-05,1,,,,,,0
470894,4012705000435,01,0,2015-10-30,2015-10-05,東村山キリスト教会,,399,東京都,東村山市,本町３丁目９番地９５,,13,213,1890014,,,,,,,2015-10-05,1,,,,,,0
470895,4012705000443,01,1,2019-08-22,2015-10-05,寳壽院,,399,東京都,小平市,鈴木町１丁目１２９番地,,13,211,1870011,,,,,,,2015-10-05,1,,,,,ホウジュイン,0
470896,4012705000451,01,0,2015-10-30,2015-10-05,八幡神社,,399,東京都,清瀬市,野塩３丁目６８番地,,13,221,2040004,,,,,,,2015-10-05,1,,,,,,0
