592300,5012705002034,01,0,2017-08-22,2017-08-17,特定非営利活動法人勤労者福祉事業団,,399,東京都,小平市,大沼町２丁目４８番９号アドリーム小平５０１,,13,211,1870001,,,,,,,2017-08-17,1,,,,,,0
592301,5012705002042,12,0,2018-04-12,2018-04-05,社会保険労務士法人クオリティ・ワン,,399,東京都,新宿区,西新宿７丁目９番１８号,,13,104,1600023,,,,,,,2017-10-12,1,,,,,クオリティワン,0
592302,5012705002067,01,1,2018-06-26,2018-02-28,医療法人社団颯凌会,,399,東京都,西東京市,東町４丁目１４番１８号かえでビル２階Ｂ,,13,229,2020012,,,,,,,2018-02-28,1,,,,,ソウリョウカイ,0
592303,5012705002075,01,0,2018-04-09,2018-04-04,一般社団法人全国きもの街づくり協議会,,399,東京都,西東京市,富士町１丁目７番６２－６０１号,,13,229,2020014,,,,,,,2018-04-04,1,,,,,ゼンコクキモノマチヅクリキョウギカイ,0
592304,5012705002083,01,0,2018-05-08,2018-05-01,特定非営利活動法人アフリカみらい,,399,東京都,西東京市,保谷町３丁目２３番４号,,13,229,2020015,,,,,,,2018-05-01,1,,,,,アフリカミライ,0
592305,5012705002091,01,0,2018-06-22,2018-06-19,一般社団法人生き直し,,399,東京都,西東京市,北原町２丁目１５番２号,,13,229,1880003,,,,,,,2018-06-19,1,,,,,イキナオシ,0
592306,5012705002100,01,0,2018-09-04,2018-08-30,医療法人社団南国桜,,399,東京都,西東京市,下保谷４丁目１１番１０号カーサ西東京１階,,13,229,2020004,,,,,,,2018-08-30,1,,,,,ナンゴクザクラ,0
592307,5012705002109,01,0,2018-10-22,2018-10-17,一般社団法人ＺＥＮ,,399,東京都,西東京市,ひばりが丘北３丁目４番１１号,,13,229,2020002,,,,,,,2018-10-17,1,,,,,ゼン,0
592308,5012705002117,01,0,2018-12-11,2018-12-06,特定非営利活動法人成年後見支援センターのぞみ,,399,東京都,清瀬市,野塩５丁目２９１番地２ハミングバード２０３,,13,221,2040004,,,,,,,2018-12-06,1,,,,,セイネンコウケンシエンセンターノゾミ,0
592309,5012705002133,01,0,2019-03-06,2019-03-01,医療法人社団花楓会,,399,東京都,西東京市,田無町４丁目１１番７－１０１号カーサエストゥペンダ,,13,229,1880011,,,,,,,2019-03-01,1,,,,,カフウカイ,0
592310,5012705002141,01,0,2019-04-04,2019-04-01,一般社団法人ファッション産業技術継承協会,,399,東京都,西東京市,芝久保町４丁目１５番５８号,,13,229,1880014,,,,,,,2019-04-01,1,,,,,ファッションサンギョウギジュツケイショウキョウカイ,0
592311,5012705002158,01,0,2019-06-17,2019-06-12,一般社団法人リアル・コンサベーション,,399,東京都,東久留米市,前沢２丁目１－３５,,13,222,2030032,,,,,,,2019-06-12,1,,,,,リアルコンサベーション,0
1530,5012705002174,11,0,2020-05-29,2020-05-21,ＤＭＵ総合研究所,,399,東京都,台東区,台東１丁目７番８号東京ネクタイ会館３階,,13,106,1100016,,,,,,,2019-10-17,1,,,,,ディーエムユーソウゴウケンキュウジョ,0
592313,5012705002182,01,0,2019-12-18,2019-12-16,一般社団法人東京ケアネット,,399,東京都,東村山市,栄町２丁目９番地３２晃正ビル３０１号,,13,213,1890013,,,,,,,2019-12-16,1,,,,,トウキョウケアネット,0
592314,5012705002190,01,0,2020-02-28,2020-02-28,一般社団法人ぽろんのいえ,,399,東京都,西東京市,泉町４丁目５番４号,,13,229,2020011,,,,,,,2020-02-28,1,,,,,ポロンノイエ,0
713348,6012705000029,01,1,2020-04-16,2015-10-05,一般財団法人オペラアーツ振興財団,,399,東京都,小平市,仲町５０２番地,,13,211,1870042,,,,,,,2015-10-05,1,,,,,オペラアーツシンコウザイダン,0
713349,6012705000053,01,1,2019-09-06,2015-10-05,小平市土地開発公社,,399,東京都,小平市,小川町２丁目１３３３番地,,13,211,1870032,,,,,,,2015-10-05,1,,,,,コダイラシ,0
713350,6012705000078,01,1,2018-06-05,2015-10-05,学校法人荒畑学園,,399,東京都,小平市,上水本町４丁目２１番１号,,13,211,1870022,,,,,,,2015-10-05,1,,,,,アラハタガクエン,0
713351,6012705000086,01,1,2018-06-18,2015-10-05,学校法人粕谷学園,,399,東京都,清瀬市,下清戸５丁目７９１番地１４,,13,221,2040011,,,,,,,2015-10-05,1,,,,,カスヤガクエン,0
713352,6012705000094,01,1,2018-06-08,2015-10-05,学校法人野澤学園,,399,東京都,東村山市,廻田町２丁目１４番地１,,13,213,1890025,,,,,,,2015-10-05,1,,,,,ノザワガクエン,0
713353,6012705000103,01,1,2018-06-28,2015-10-05,社会福祉法人久留米みのり保育園,,399,東京都,東久留米市,大門町１丁目３番４号,,13,222,2030011,,,,,,,2015-10-05,1,,,,,クルメミノリホイクエン,0
713354,6012705000111,01,1,2018-06-25,2015-10-05,社会福祉法人東京アフターケア協会,,399,東京都,清瀬市,松山２丁目１８番２号,,13,221,2040022,,,,,,,2015-10-05,1,,,,,トウキョウアフターケアキョウカイ,0
713355,6012705000128,01,1,2018-06-25,2015-10-05,社会福祉法人正和会,,399,東京都,小平市,天神町２丁目６番１号,,13,211,1870004,,,,,,,2015-10-05,1,,,,,セイワカイ,0
713356,6012705000136,01,1,2018-06-15,2015-10-05,社会福祉法人悠遊,,399,東京都,西東京市,泉町３丁目１５番２８号,,13,229,2020011,,,,,,,2015-10-05,1,,,,,ユウユウ,0
713357,6012705000144,01,1,2018-07-03,2015-10-05,社会福祉法人イリアンソス,,399,東京都,東久留米市,下里２丁目７番１８号,,13,222,2030043,,,,,,,2015-10-05,1,,,,,イリアンソス,0
713358,6012705000169,01,1,2018-06-15,2015-10-05,小平商工会,,399,東京都,小平市,小川町２丁目１２６８番地,,13,211,1870032,,,,,,,2015-10-05,1,,,,,コダイラ,0
713359,6012705000177,12,0,2019-07-17,2019-07-09,多摩東部トラック協同組合,,399,東京都,東村山市,青葉町１丁目２２番２号,,13,213,1890002,,,,,,,2015-10-05,1,,,,,タマトウブトラック,0
713360,6012705000202,01,1,2018-04-09,2015-10-05,東多摩再資源化事業協同組合,,399,東京都,東村山市,久米川町１丁目１６番地１８,,13,213,1890003,,,,,,,2015-10-05,1,,,,,ヒガシタマサイシゲンカ,0
713361,6012705000210,01,1,2018-06-13,2015-10-05,清瀬旭が丘分譲団地管理組合法人,,399,東京都,清瀬市,旭が丘２丁目２番９号,,13,221,2040002,,,,,,,2015-10-05,1,,,,,キヨセアサヒガオカブンジョウダンチ,0
713362,6012705000219,21,0,2016-12-13,2016-12-05,医療法人社団光友会,,399,東京都,東村山市,萩山町３丁目２６番地１６,,13,213,1890012,,,2016-12-05,11,3013105001108,平成２８年１２月１日東京都青梅市長淵五丁目１０８６番地医療法人社団幸悠会（3013105001108）に合併し解散,2015-10-05,1,,,,,,0
713363,6012705000227,01,1,2018-09-21,2015-10-05,医療法人社団伸生会,,399,東京都,小平市,花小金井１丁目１２番地の２花小金井プリンスマンション２０２,,13,211,1870002,,,,,,,2015-10-05,1,,,,,シンセイカイ,0
713364,6012705000235,01,1,2019-01-07,2015-10-05,医療法人社団慶真会,,399,東京都,小平市,花小金井１丁目２番２０号金城ビル２階,,13,211,1870002,,,,,,,2015-10-05,1,,,,,ケイシンカイ,0
713365,6012705000243,01,1,2018-11-13,2015-10-05,医療法人社団天真会,,399,東京都,東村山市,栄町２丁目８番地丸鈴ビル二階,,13,213,1890013,,,,,,,2015-10-05,1,,,,,テンシンカイ,0
713366,6012705000251,21,0,2019-05-08,2019-04-24,医療法人社団泰和会,,399,東京都,小平市,花小金井４丁目３９番地１０号本間ビル２階,,13,211,1870002,,,2019-04-24,01,,,2015-10-05,1,,,,,,0
713367,6012705000268,01,1,2018-10-18,2015-10-05,医療法人社団けやき会,,399,東京都,清瀬市,元町１丁目８番アーク清瀬３階,,13,221,2040021,,,,,,,2015-10-05,1,,,,,ケヤキカイ,0
713368,6012705000276,01,1,2018-07-25,2015-10-05,医療法人社団秀宏会,,399,東京都,東久留米市,本町１丁目１番１１号,,13,222,2030053,,,,,,,2015-10-05,1,,,,,シュウコウカイ,0
713369,6012705000284,01,1,2018-06-12,2015-10-05,医療法人社団唐和会,,399,東京都,東村山市,本町２丁目１２番地６,,13,213,1890014,,,,,,,2015-10-05,1,,,,,トウワカイ,0
713370,6012705000292,01,0,2015-10-30,2015-10-05,医療法人社団希望会,,399,東京都,東村山市,恩多町３丁目３７番地３３高橋ビル１Ｆ,,13,213,1890011,,,,,,,2015-10-05,1,,,,,,0
713371,6012705000301,21,0,2016-12-26,2016-12-20,医療法人社団和清会,,399,東京都,清瀬市,元町１丁目１番１３号メース清瀬１０１号,,13,221,2040021,,,2016-12-20,01,,,2015-10-05,1,,,,,,0
713372,6012705000318,01,0,2015-10-30,2015-10-05,稲荷神社,,399,東京都,小平市,鈴木町１丁目５１０番地,,13,211,1870011,,,,,,,2015-10-05,1,,,,,,0
713373,6012705000334,01,0,2015-10-30,2015-10-05,圓龍寺,,399,東京都,東村山市,萩山町１丁目４番地１９,,13,213,1890012,,,,,,,2015-10-05,1,,,,,,0
713374,6012705000342,01,0,2015-10-30,2015-10-05,金山神社,,399,東京都,東村山市,廻田町４丁目１２番地１,,13,213,1890025,,,,,,,2015-10-05,1,,,,,,0
713375,6012705000350,01,0,2015-10-30,2015-10-05,猿田彦神社,,399,東京都,東村山市,野口町１丁目８番地１７,,13,213,1890022,,,,,,,2015-10-05,1,,,,,,0
713376,6012705000359,01,0,2015-10-30,2015-10-05,照恩寺,,399,東京都,小平市,美園町３丁目２３番２０号,,13,211,1870041,,,,,,,2015-10-05,1,,,,,,0
713377,6012705000367,01,0,2015-10-30,2015-10-05,泉藏院,,399,東京都,小平市,大沼町２丁目６７３番地,,13,211,1870001,,,,,,,2015-10-05,1,,,,,,0
713378,6012705000375,01,0,2015-10-30,2015-10-05,大善院,,399,東京都,東村山市,野口町４丁目１６番地１,,13,213,1890022,,,,,,,2015-10-05,1,,,,,,0
713379,6012705000400,11,1,2019-02-07,2016-07-05,天理教谷幸分教会,,399,東京都,東村山市,萩山町１丁目４番地３,,13,213,1890012,,,,,,,2015-10-05,1,,,,,テンリキョウタニユキブンキョウカイ,0
713380,6012705000409,01,0,2015-10-30,2015-10-05,日蓮宗田無妙本教会,,399,東京都,西東京市,田無町２丁目４番１号,,13,229,1880011,,,,,,,2015-10-05,1,,,,,,0
713381,6012705000425,01,0,2015-10-30,2015-10-05,東伏見稻荷神社,,399,東京都,西東京市,東伏見１丁目５番３８号,,13,229,2020021,,,,,,,2015-10-05,1,,,,,,0
713382,6012705000433,01,0,2015-10-30,2015-10-05,氷川神社,,399,東京都,東村山市,秋津町４丁目１３番地１,,13,213,1890001,,,,,,,2015-10-05,1,,,,,,0
713383,6012705000441,01,0,2015-10-30,2015-10-05,平安院,,399,東京都,小平市,仲町６７６番地,,13,211,1870042,,,,,,,2015-10-05,1,,,,,,0
713384,6012705000458,01,1,2018-11-06,2015-10-05,医療法人社団昇平会,,399,東京都,東久留米市,金山町２丁目１９番８号,,13,222,2030003,,,,,,,2015-10-05,1,,,,,ショウヘイカイ,0
713385,6012705000474,01,0,2015-10-30,2015-10-05,日立製作所労働組合武蔵支部,,399,東京都,小平市,上水本町５丁目２０番１号,,13,211,1870022,,,,,,,2015-10-05,1,,,,,,0
713386,6012705000499,01,1,2018-07-23,2015-10-05,特定非営利活動法人自立生活企画,,399,東京都,西東京市,田無町５丁目６番２０号第２和光ビル２０２,,13,229,1880011,,,,,,,2015-10-05,1,,,,,ジリツセイカツキカク,0
713387,6012705000508,01,1,2019-01-10,2015-10-05,医療法人社団ヒマワリ会,,399,東京都,西東京市,南町３丁目２２番８号１階２階,,13,229,1880012,,,,,,,2015-10-05,1,,,,,ヒマワリカイ,0
713388,6012705000516,01,1,2018-07-11,2015-10-05,グリーンタウン清戸団地管理組合法人,,399,東京都,清瀬市,下清戸１丁目１７番地,,13,221,2040011,,,,,,,2015-10-05,1,,,,,グリーンタウンキヨトダンチ,0
713389,6012705000524,01,1,2018-06-29,2015-10-05,特定非営利活動法人ポケット,,399,東京都,西東京市,芝久保町４丁目２２番５号,,13,229,1880014,,,,,,,2015-10-05,1,,,,,ポケット,0
713390,6012705000532,01,0,2015-10-30,2015-10-05,特定非営利活動法人福祉移送サービスの会,,399,東京都,清瀬市,中里５丁目１０３番地１７,,13,221,2040003,,,,,,,2015-10-05,1,,,,,,0
713391,6012705000540,01,1,2018-08-29,2015-10-05,特定非営利活動法人ケアサポートファミリー,,399,東京都,東久留米市,新川町１丁目５番２号,,13,222,2030013,,,,,,,2015-10-05,1,,,,,ケアサポートファミリー,0
713392,6012705000549,01,1,2018-04-13,2015-10-05,医療法人社団尚誠会,,399,東京都,東久留米市,下里２丁目８番２１号,,13,222,2030043,,,,,,,2015-10-05,1,,,,,ショウセイカイ,0
713393,6012705000557,12,0,2016-07-04,2016-06-16,特定非営利活動法人ふれあいアカデミー,,399,東京都,小平市,上水本町６丁目５番８の２０４号,,13,211,1870022,,,,,,,2015-10-05,1,,,,,,0
713394,6012705000565,11,1,2019-07-24,2015-12-28,特定非営利活動法人ゆう,,399,東京都,東久留米市,南町４丁目９番２１号,,13,222,2030031,,,,,,,2015-10-05,1,,,,,ユウ,0
713395,6012705000573,01,1,2018-11-27,2015-10-05,医療法人社団祐靖会,,399,東京都,小平市,小川東町１８０８番地の１０（１階）,,13,211,1870031,,,,,,,2015-10-05,1,,,,,ユウセイカイ,0
713396,6012705000581,01,1,2019-06-13,2015-10-05,企業組合ワーカーズ・コレクティブグレイン,,399,東京都,東村山市,栄町２丁目３９番地２６,,13,213,1890013,,,,,,,2015-10-05,1,,,,,ワーカーズコレクティブグレイン,0
713397,6012705000607,12,0,2017-12-20,2017-12-12,特定非営利活動法人アジア植林友好協会,,399,東京都,西東京市,住吉町４丁目１６番１号,,13,229,2020005,,,,,,,2015-10-05,1,,,,,,0
713398,6012705000615,01,0,2015-10-30,2015-10-05,特定非営利活動法人アリアンテ,,399,東京都,東久留米市,本町３丁目１１番１１号大寿荘２０１号室,,13,222,2030053,,,,,,,2015-10-05,1,,,,,,0
713399,6012705000623,01,1,2018-06-20,2015-10-05,社会福祉法人ネット,,399,東京都,東村山市,廻田町３丁目１６番地８,,13,213,1890025,,,,,,,2015-10-05,1,,,,,ネット,0
713400,6012705000631,01,1,2018-08-02,2015-10-05,特定非営利活動法人みのり会,,399,東京都,東村山市,恩多町３丁目４３番地６みのり荘１,,13,213,1890011,,,,,,,2015-10-05,1,,,,,ミノリカイ,0
713401,6012705001084,01,0,2015-10-30,2015-10-05,扶桑教天國日教會,,399,東京都,東村山市,野口１６６４番地,,13,213,1890000,,,,,,,2015-10-05,1,,,,,,0
713402,6012705001092,01,0,2015-10-30,2015-10-05,保谷消費生活協同組合,,399,東京都,西東京市,保谷町大字下保谷２８３番地,,13,229,2020000,,,,,,,2015-10-05,1,,,,,,1
713403,6012705001209,12,0,2018-05-01,2018-04-26,特定非営利活動法人能楽普及集団鶴亀座,,399,東京都,文京区,根津２丁目２０番３－９０１号,,13,105,1130031,,,,,,,2015-10-05,1,,,,,ノウガクフキュウシュウダンツルカメザ,0
713404,6012705001225,01,1,2018-11-13,2015-10-05,医療法人社団山本・前田記念会,,399,東京都,東久留米市,中央町５丁目１３番３４号,,13,222,2030054,,,,,,,2015-10-05,1,,,,,ヤマモトマエダキネンカイ,0
713405,6012705001233,01,1,2018-06-07,2015-10-05,特定非営利活動法人アトリエ・パンセ,,399,東京都,小平市,上水本町２丁目９番１２号,,13,211,1870022,,,,,,,2015-10-05,1,,,,,アトリエパンセ,0
713406,6012705001258,01,1,2018-09-28,2015-10-05,特定非営利活動法人きよせスポーツクラブ,,399,東京都,清瀬市,上清戸２丁目５番４１号,,13,221,2040013,,,,,,,2015-10-05,1,,,,,キヨセスポーツクラブ,0
713407,6012705001266,01,1,2018-06-05,2015-10-05,社会福祉法人つむぎ,,399,東京都,小平市,小川東町４丁目２番１号小平元気村おがわ東,,13,211,1870031,,,,,,,2015-10-05,1,,,,,ツムギ,0
713408,6012705001282,01,1,2018-07-02,2015-10-05,特定非営利活動法人いたわり,,399,東京都,小平市,学園東町１丁目６番１３号オオサワビル５０１号室,,13,211,1870043,,,,,,,2015-10-05,1,,,,,イタワリ,0
713409,6012705001290,01,1,2018-06-18,2015-10-05,医療法人社団啓厚会,,399,東京都,西東京市,東町２丁目１４番１２号パラツィーナ保谷１０１号,,13,229,2020012,,,,,,,2015-10-05,1,,,,,ケイコウカイ,0
713410,6012705001308,01,0,2015-10-30,2015-10-05,特定非営利活動法人アジア環境保全機構,,399,東京都,西東京市,東伏見２丁目６番２２号,,13,229,2020021,,,,,,,2015-10-05,1,,,,,,0
713411,6012705001316,01,1,2018-11-21,2015-10-05,医療法人社団千秋会,,399,東京都,小平市,栄町２丁目３番７号,,13,211,1870034,,,,,,,2015-10-05,1,,,,,センシュウカイ,0
713412,6012705001324,01,1,2019-06-11,2015-10-05,アセアン市場開発事業協同組合,,399,東京都,台東区,東上野３丁目２８番７号,,13,106,1100015,,,,,,,2015-10-05,1,,,,,アセアンシジョウカイハツ,0
713413,6012705001340,12,1,2018-05-31,2016-06-09,特定非営利活動法人地域福祉ネット・結,,399,東京都,東久留米市,南沢３丁目１３番７号,,13,222,2030023,,,,,,,2015-10-05,1,,,,,チイキフクシネットユイ,0
713414,6012705001349,01,0,2015-10-30,2015-10-05,特定非営利活動法人ＥＢＳ協会,,399,東京都,東久留米市,東本町３番地１７号和合ビル３階,,13,222,2030014,,,,,,,2015-10-05,1,,,,,,0
713415,6012705001357,01,0,2015-10-30,2015-10-05,特定非営利活動法人ＰＰＫネット,,399,東京都,小平市,花小金井南町１丁目１０番２３号,,13,211,1870003,,,,,,,2015-10-05,1,,,,,,0
713416,6012705001365,01,1,2018-06-05,2015-10-05,特定非営利活動法人子どもアミーゴ西東京,,399,東京都,西東京市,西原町１丁目５番１３号－１０１,,13,229,1880004,,,,,,,2015-10-05,1,,,,,コドモアミーゴニシトウキョウ,0
713417,6012705001373,01,1,2018-08-23,2015-10-05,学校法人花小金井学園,,399,東京都,小平市,花小金井２丁目９番１１号,,13,211,1870002,,,,,,,2015-10-05,1,,,,,ハナコガネイガクエン,0
713418,6012705001381,21,0,2016-03-16,2016-03-14,特定非営利活動法人自立生活支援センター歩歩,,399,東京都,練馬区,豊玉上２丁目２７番２３号グランピア練馬１０１号,,13,120,1760011,,,2016-03-14,01,,,2015-10-05,1,,,,,,0
713419,6012705001398,12,1,2018-11-27,2016-11-10,西東京レッカー事業協同組合,,399,東京都,町田市,能ヶ谷６丁目３番９号神蔵ハイツⅡＡ号,00108404,13,209,1950053,,,,,,,2015-10-05,1,,,,,ニシトウキョウレッカー,0
713420,6012705001407,21,0,2016-03-17,2016-03-16,特定非営利活動法人日本伝統文化振興・映像保存協会,,399,東京都,東村山市,青葉町３丁目４６番地１８,,13,213,1890002,,,2016-03-16,01,,,2015-10-05,1,,,,,,0
713421,6012705001431,01,1,2018-10-17,2015-10-05,医療法人社団刀圭会,,399,東京都,小平市,喜平町３丁目２番地の５,,13,211,1870044,,,,,,,2015-10-05,1,,,,,トウケイカイ,0
713422,6012705001448,12,1,2020-04-23,2015-10-16,特定非営利活動法人住まいる,,399,東京都,練馬区,東大泉７丁目３４番２８号,,13,120,1780063,,,,,,,2015-10-05,1,,,,,スマイル,0
713423,6012705001456,01,1,2019-03-15,2015-10-05,医療法人社団よつ葉会,,399,東京都,小平市,花小金井南町１丁目２６番３５号アクティオス１０１号室,,13,211,1870003,,,,,,,2015-10-05,1,,,,,ヨツバカイ,0
713424,6012705001464,12,0,2018-10-16,2018-10-12,特定非営利活動法人東京住宅バリアフリー推進センター,,399,東京都,大田区,田園調布２丁目１８番４号,,13,111,1450071,,,,,,,2015-10-05,1,,,,,トウキョウジュウタクバリアフリースイシンセンター,0
713425,6012705001472,01,1,2018-04-19,2015-10-05,医療法人社団順洋会,,399,東京都,清瀬市,元町１丁目８番３０号,,13,221,2040021,,,,,,,2015-10-05,1,,,,,ジュンヨウカイ,0
713426,6012705001480,01,1,2018-10-05,2015-10-05,医療法人社団マーキュリー会,,399,東京都,東村山市,富士見町３丁目１３番１４号サミット２階,,13,213,1890024,,,,,,,2015-10-05,1,,,,,マーキュリーカイ,0
713427,6012705001489,01,1,2019-06-11,2015-10-05,西東京市清掃事業協同組合,,399,東京都,西東京市,東町２丁目１５番２５号サンライズハウス２０１号,,13,229,2020012,,,,,,,2015-10-05,1,,,,,ニシトウキョウシセイソウ,0
713428,6012705001497,12,1,2020-05-19,2020-05-11,特定非営利活動法人ソーシャライズ,,399,東京都,東村山市,本町３丁目６番地１,,13,213,1890014,,,,,,,2015-10-05,1,,,,,ソーシャライズ,0
713429,6012705001506,01,1,2018-05-10,2015-10-05,医療法人社団誠優会,,399,東京都,東村山市,野口町２丁目４番地３５オアシスＡ号室,,13,213,1890022,,,,,,,2015-10-05,1,,,,,セイユウカイ,0
713430,6012705001514,01,1,2018-07-13,2015-10-05,特定非営利活動法人エイズワクチン開発協会,,399,東京都,清瀬市,上清戸２丁目１２番３６号,,13,221,2040013,,,,,,,2015-10-05,1,,,,,エイズワクチンカイハツキョウカイ,0
713431,6012705001530,01,1,2018-07-10,2015-10-05,特定非営利活動法人稲門寺子屋西東京,,399,東京都,西東京市,保谷町５丁目４番Ｂ－６０９号,,13,229,2020015,,,,,,,2015-10-05,1,,,,,トウモンテラコヤニシトウキョウ,0
713432,6012705001539,01,1,2018-10-22,2015-10-05,モナーク東久留米管理組合法人,,399,東京都,東久留米市,東本町３番１６号,,13,222,2030014,,,,,,,2015-10-05,1,,,,,モナークヒガシクルメ,0
713433,6012705001547,01,1,2018-08-15,2015-10-05,特定非営利活動法人新小平さくら保育園,,399,東京都,小平市,小川町２丁目１９９１番地の７,,13,211,1870032,,,,,,,2015-10-05,1,,,,,シンコダイラサクラホイクエン,0
713434,6012705001555,01,1,2018-10-11,2015-10-05,特定非営利活動法人ｔｎｃ中小企業支援センター,,399,東京都,西東京市,芝久保町２丁目２番１５－５１０号,,13,229,1880014,,,,,,,2015-10-05,1,,,,,ティーエヌシーチュウショウキギョウシエンセンター,0
713435,6012705001563,01,1,2017-01-20,2015-10-05,国立研究開発法人国立精神・神経医療研究センター,,399,東京都,小平市,小川東町４丁目１番１号,,13,211,1870031,,,,,,,2015-10-05,1,,,,,,0
713436,6012705001571,01,0,2015-10-30,2015-10-05,特定非営利活動法人こぶし福祉会,,399,東京都,東久留米市,金山町２丁目１９番１９号,,13,222,2030003,,,,,,,2015-10-05,1,,,,,,0
713437,6012705001596,01,1,2018-06-15,2015-10-05,特定非営利活動法人小平シニアネットクラブ,,399,東京都,小平市,小川東町１丁目３４番１４－２０２号,,13,211,1870031,,,,,,,2015-10-05,1,,,,,コダイラシニアネットクラブ,0
713438,6012705001613,12,0,2019-06-14,2019-06-10,医療法人社団有明会,,399,東京都,東村山市,恩多町３丁目２２番地４０,,13,213,1890011,,,,,,,2015-10-05,1,,,,,アリアケカイ,0
713439,6012705001621,01,1,2019-05-24,2015-10-05,公益社団法人東久留米市シルバー人材センター,,399,東京都,東久留米市,下里４丁目１番４４号,,13,222,2030043,,,,,,,2015-10-05,1,,,,,ヒガシクルメシシルバージンザイセンター,0
713440,6012705001646,01,1,2018-09-13,2015-10-05,特定非営利活動法人東京カウンセル,,399,東京都,西東京市,富士町２丁目１番２８号,,13,229,2020014,,,,,,,2015-10-05,1,,,,,トウキョウカウンセル,0
713441,6012705001662,01,0,2015-10-30,2015-10-05,一般社団法人ＫＲＣ,,399,東京都,小平市,花小金井南町２丁目８番４号嘉悦大学・桧森研究室,,13,211,1870003,,,,,,,2015-10-05,1,,,,,,0
713442,6012705001670,01,0,2015-10-30,2015-10-05,一般社団法人日本煙突石綿除去適正化協会,,399,東京都,西東京市,栄町２丁目８番１８号,,13,229,2020006,,,,,,,2015-10-05,1,,,,,,0
713443,6012705001679,01,1,2018-06-15,2015-10-05,一般社団法人ＫＵＲＵＭＥ　Ｂｉｂｌｅ　Ｆｅｌｌｏｗｓｈｉｐ,,399,東京都,東久留米市,新川町１丁目２番１４号,,13,222,2030013,,,,,,,2015-10-05,1,,,,,クルメバイブルフェローシップ,0
713444,6012705001687,01,0,2015-10-30,2015-10-05,特定非営利活動法人グリーンコミュニティ,,399,東京都,小平市,小川町１丁目３７５番地,,13,211,1870032,,,,,,,2015-10-05,1,,,,,,0
713445,6012705001695,01,1,2018-05-17,2015-10-05,一般財団法人山根奨学基金,,399,東京都,小平市,津田町２丁目１番１号津田塾大学内,,13,211,1870025,,,,,,,2015-10-05,1,,,,,ヤマネショウガクキキン,0
713446,6012705001704,12,0,2019-04-12,2019-04-08,一般社団法人全国精神保健福祉連絡協議会,,399,東京都,北区,田端１丁目２７番１－３２１号,,13,117,1140014,,,,,,,2015-10-05,1,,,,,ゼンコクセイシンホケンフクシレンラクキョウギカイ,0
713447,6012705001720,01,0,2015-10-30,2015-10-05,特定非営利活動法人アジアキッズスポーツ協会,,399,東京都,西東京市,東町５丁目８番１号,,13,229,2020012,,,,,,,2015-10-05,1,,,,,,0
713448,6012705001729,01,1,2018-04-09,2015-10-05,プラウドシーズン花小金井団地管理組合法人,,399,東京都,小平市,花小金井１丁目４３番１５号,,13,211,1870002,,,,,,,2015-10-05,1,,,,,プラウドシーズンハナコガネイダンチ,0
713449,6012705001745,01,0,2015-10-30,2015-10-05,特定非営利活動法人ラマーミトゥルの会,,399,東京都,西東京市,芝久保町３丁目２６番１３号,,13,229,1880014,,,,,,,2015-10-05,1,,,,,,0
