834593,7012705001521,01,1,2019-06-04,2015-10-05,特定非営利活動法人イブジャパン,,399,東京都,小平市,栄町３丁目５番２３号,,13,211,1870034,,,,,,,2015-10-05,1,,,,,イブジャパン,0
834594,7012705001538,01,0,2015-10-30,2015-10-05,特定非営利活動法人キングダム,,399,東京都,清瀬市,松山１丁目２７番６号岡田ビル１階,,13,221,2040022,,,,,,,2015-10-05,1,,,,,,0
834595,7012705001546,01,0,2015-10-30,2015-10-05,特定非営利活動法人福祉集団炎,,399,東京都,小平市,小川東町４丁目３番萩山団地２－１１４号,,13,211,1870031,,,,,,,2015-10-05,1,,,,,,0
834596,7012705001554,01,1,2018-06-29,2015-10-05,社会福祉法人すぎのこ,,399,東京都,東久留米市,大門町２丁目１３番１１号,,13,222,2030011,,,,,,,2015-10-05,1,,,,,スギノコ,0
834597,7012705001562,01,1,2018-06-04,2015-10-05,学校法人しらぎく学園,,399,東京都,東村山市,恩多町５丁目１７番地１４,,13,213,1890011,,,,,,,2015-10-05,1,,,,,シラギクガクエン,0
834598,7012705001570,01,0,2015-10-30,2015-10-05,一般社団法人清瀬文化スポーツ事業団,,399,東京都,清瀬市,松山１丁目３４番１４号,,13,221,2040022,,,,,,,2015-10-05,1,,,,,,0
834599,7012705001579,01,0,2015-10-30,2015-10-05,一般社団法人国際総合武道学館,,399,東京都,小平市,たかの台４０番９号,,13,211,1870024,,,,,,,2015-10-05,1,,,,,,0
834600,7012705001587,21,0,2019-05-29,2019-05-15,医療法人社団亮愛会,,399,東京都,東村山市,栄町１丁目４番２３久米川ステーションヒルズ２階,,13,213,1890013,,,2019-05-15,01,,,2015-10-05,1,,,,,リョウアイカイ,0
834601,7012705001612,01,1,2019-03-04,2015-10-05,医療法人社団椎野会,,399,東京都,清瀬市,元町１丁目８番１９号アーク清瀬１階,,13,221,2040021,,,,,,,2015-10-05,1,,,,,シイノカイ,0
834602,7012705001620,21,0,2016-10-03,2016-09-30,特定非営利活動法人れっつＬＴＤ,,399,東京都,小平市,小川町１丁目８４５番１風舎４０５号,,13,211,1870032,,,2016-09-30,01,,,2015-10-05,1,,,,,,0
834603,7012705001629,12,0,2019-03-27,2019-03-25,公益社団法人西東京市シルバー人材センター,,399,東京都,西東京市,富士町１丁目７番６９号,,13,229,2020014,,,,,,,2015-10-05,1,,,,,ニシトウキョウシシルバージンザイセンター,0
834604,7012705001637,01,1,2018-06-01,2015-10-05,特定非営利活動法人こだいら自由遊びの会,,399,東京都,小平市,小川町１丁目４４５番地の１ガーデンハイツ小平１－６０７号,,13,211,1870032,,,,,,,2015-10-05,1,,,,,コダイラジユウアソビノカイ,0
834605,7012705001645,01,0,2015-10-30,2015-10-05,特定非営利活動法人康寧会,,399,東京都,小平市,津田町２丁目３番３号,,13,211,1870025,,,,,,,2015-10-05,1,,,,,,0
834606,7012705001653,01,1,2018-04-26,2015-10-05,一般社団法人日本歯科矯正専門医学会,,399,東京都,西東京市,富士町４丁目１３番２５号シーリン東伏見２階,,13,229,2020014,,,,,,,2015-10-05,1,,,,,ニホンシカキョウセイセンモンイガッカイ,0
834607,7012705001661,01,1,2018-10-04,2015-10-05,医療法人社団あおぞら,,399,東京都,東村山市,秋津町４丁目３１番１６号,,13,213,1890001,,,,,,,2015-10-05,1,,,,,アオゾラ,0
834608,7012705001678,01,1,2018-04-19,2015-10-05,一般社団法人清風の会,,399,東京都,清瀬市,上清戸２丁目６番１３号,,13,221,2040013,,,,,,,2015-10-05,1,,,,,セイフウノカイ,0
834609,7012705001686,01,0,2015-10-30,2015-10-05,一般社団法人東京法医学鑑定研究支援センター,,399,東京都,西東京市,向台町６丁目１８番４３号,,13,229,1880013,,,,,,,2015-10-05,1,,,,,,0
834610,7012705001694,01,1,2018-07-12,2015-10-05,一般財団法人全国建設研修センター,,399,東京都,小平市,喜平町２丁目１番２号,,13,211,1870044,,,,,,,2015-10-05,1,,,,,ゼンコクケンセツケンシュウセンター,0
834611,7012705001703,01,1,2018-06-18,2015-10-05,学校法人なみき学園,,399,東京都,小平市,仲町３０６番地の３,,13,211,1870042,,,,,,,2015-10-05,1,,,,,ナミキガクエン,0
834612,7012705001711,01,1,2018-07-25,2015-10-05,特定非営利活動法人緩和ケアサポートグループ,,399,東京都,東久留米市,本町１丁目１３番１号コンフォール東久留米４０２号室,,13,222,2030053,,,,,,,2015-10-05,1,,,,,カンワケアサポートグループ,0
834613,7012705001744,01,1,2018-06-28,2015-10-05,一般社団法人いやなが保育園,,399,東京都,小平市,仲町５６３番地,,13,211,1870042,,,,,,,2015-10-05,1,,,,,イヤナガホイクエン,0
834614,7012705001785,12,0,2016-12-28,2016-12-27,特定非営利活動法人シェモア,,399,東京都,西東京市,保谷町５丁目１４番１５号,,13,229,2020015,,,,,,,2015-10-05,1,,,,,,0
834615,7012705001810,12,0,2017-03-31,2017-03-24,特定非営利活動法人夢スユア,,399,東京都,西東京市,泉町２丁目１７番１８号ＮＫビル２０３号,,13,229,2020011,,,,,,,2015-10-05,1,,,,,,0
834616,7012705001819,01,1,2020-04-06,2015-10-05,一般社団法人生産，物流現場カイゼン研究会,,399,東京都,清瀬市,下清戸１丁目１７番地２５－２０２号,,13,221,2040011,,,,,,,2015-10-05,1,,,,,セイサンブツリュウゲンバカイゼンケンキュウカイ,0
834617,7012705001835,01,1,2019-01-04,2015-10-05,医療法人社団Ｅ＆Ｂ,,399,東京都,小平市,花小金井１丁目８番６号ビッグアロービル２階,,13,211,1870002,,,,,,,2015-10-05,1,,,,,イーアンドビー,0
834618,7012705001843,01,1,2018-06-27,2015-10-05,一般社団法人東村山市薬剤師会,,399,東京都,東村山市,栄町２丁目４番地４,,13,213,1890013,,,,,,,2015-10-05,1,,,,,ヒガシムラヤマシヤクザイシカイ,0
834619,7012705001851,12,0,2020-02-27,2020-02-21,一般財団法人社会医学振興財団,,399,東京都,文京区,本郷２丁目１番１号順天堂大学医学部公衆衛生学教室,,13,105,1130033,,,,,,,2015-10-05,1,,,,,シャカイイガクシンコウザイダン,0
834620,7012705001868,01,1,2018-06-01,2015-10-05,医療法人社団慧悠会,,399,東京都,清瀬市,松山１丁目１２番１４号シャルマン清瀬２階,,13,221,2040022,,,,,,,2015-10-05,1,,,,,ケイユウカイ,0
834621,7012705001876,01,1,2018-07-09,2015-10-05,一般社団法人わざわ座,,399,東京都,東村山市,本町２丁目２２番地１１,,13,213,1890014,,,,,,,2015-10-05,1,,,,,ワザワザ,0
834622,7012705001884,01,1,2018-06-28,2015-10-05,社会福祉法人林檎の木,,399,東京都,東村山市,恩多町１丁目５５番地７,,13,213,1890011,,,,,,,2015-10-05,1,,,,,リンゴノキ,0
834623,7012705001892,01,1,2018-06-19,2015-10-05,医療法人社団福慈会,,399,東京都,西東京市,富士町４丁目１４番１号リヴェールＲＸ１．２階,,13,229,2020014,,,,,,,2015-10-05,1,,,,,フクジカイ,0
834624,7012705001926,12,1,2018-05-15,2016-03-18,一般財団法人飯田財団,,399,東京都,西東京市,保谷町２丁目１番４号,,13,229,2020015,,,,,,,2015-10-05,1,,,,,イイダザイダン,0
834625,7012705001934,11,0,2017-02-03,2017-02-01,一般社団法人総合型地域スポーツクラブ東京・清瀬ＶＡＬＩＡＮＴ,,399,東京都,清瀬市,下清戸２丁目４８８－１,,13,221,2040011,,,,,,,2015-10-05,1,,,,,,0
834626,7012705001950,01,1,2019-08-20,2016-02-25,一般社団法人一糸座,,399,東京都,小平市,学園西町１丁目２３番２３号,,13,211,1870045,,,,,,,2016-02-25,1,,,,,イッシザ,0
834627,7012705001967,01,0,2016-05-31,2016-05-25,一般社団法人Ｆｏｕｒ　Ｎｉｎｅ　Ｇｒｏｕｐ,,399,東京都,清瀬市,元町１丁目４番２６号清瀬パーク・ホームズ８０２号,,13,221,2040021,,,,,,,2016-05-25,1,,,,,,0
834628,7012705001975,01,1,2018-11-16,2016-08-30,医療法人社団野苺会,,399,東京都,小平市,仲町６５２番地の１,,13,211,1870042,,,,,,,2016-08-30,1,,,,,ノイチゴカイ,0
834629,7012705001983,01,0,2016-10-20,2016-10-17,一般社団法人Ｂｅａｕｔｉｆｕｌ　Ｌｉｆｅ，Ｂｏｄｙ＆ｍｉｎｄ,,399,東京都,西東京市,芝久保町２丁目１４番１５号,,13,229,1880014,,,,,,,2016-10-17,1,,,,,,0
834630,7012705001991,11,0,2016-12-21,2016-12-15,一般社団法人ＨＡＬＡＬ　ＷＯＲＬＤ　ＪＡＰＡＮ,,399,東京都,小平市,中島町１８番２号,,13,211,1870033,,,,,,,2016-12-07,1,,,,,,0
834631,7012705002008,01,0,2017-03-23,2017-03-17,社会保険労務士法人サムライＯｆｆｉｃｅ,,399,東京都,小平市,小川西町４丁目３０番５号,,13,211,1870035,,,,,,,2017-03-17,1,,,,,,0
834632,7012705002016,11,0,2019-05-17,2019-05-13,一般社団法人ＥｄｕＱ国際ナチュラルタッチ協会,,399,東京都,西東京市,保谷町４丁目４番２２号,,13,229,2020015,,,,,,,2017-04-19,1,,,,,エデュキュウコクサイナチュラルタッチキョウカイ,0
834633,7012705002040,01,1,2018-10-11,2017-10-02,一般社団法人清瀬中村本家,,399,東京都,清瀬市,中里４丁目１１３２番地,,13,221,2040003,,,,,,,2017-10-02,1,,,,,キヨセナカムラホンケ,0
834634,7012705002057,01,0,2017-12-25,2017-12-20,ＮＰＯ法人ことり保育室,,399,東京都,東村山市,野口町３丁目１３番地１５,,13,213,1890022,,,,,,,2017-12-20,1,,,,,,0
834635,7012705002073,01,1,2019-01-04,2018-03-07,医療法人社団藤原会,,399,東京都,西東京市,ひばりが丘北４丁目８番４号,,13,229,2020002,,,,,,,2018-03-07,1,,,,,フジワラカイ,0
834636,7012705002081,01,0,2018-04-26,2018-04-23,医療法人社団有実会,,399,東京都,西東京市,東町６丁目６番１０号西東京メディカルモールＢ区分,,13,229,2020012,,,,,,,2018-04-23,1,,,,,ユウジツカイ,0
834637,7012705002098,01,0,2018-08-14,2018-08-09,一般社団法人中小企業技術振興センター,,399,東京都,小平市,学園東町１丁目１３番７号２Ｆ,,13,211,1870043,,,,,,,2018-08-09,1,,,,,チュウショウキギョウギジュツシンコウセンター,0
834638,7012705002115,01,0,2018-11-20,2018-11-15,一般社団法人０才からの音楽会,,399,東京都,小平市,小川西町３丁目１０番１０号,,13,211,1870035,,,,,,,2018-11-15,1,,,,,ゼロサイカラノオンガクカイ,0
834639,7012705002123,01,0,2019-02-13,2019-02-07,セキュレアガーデンひばりが丘団地管理組合法人,,399,東京都,西東京市,ひばりが丘３丁目４番２３－７号,,13,229,2020001,,,,,,,2019-02-07,1,,,,,セキュレアガーデンヒバリガオカ,0
834640,7012705002131,01,0,2019-03-06,2019-03-01,医療法人社団Ｈ．Ｆ．Ｄ．,,399,東京都,東久留米市,幸町５丁目５番５号メゾンアイエス１階,,13,222,2030052,,,,,,,2019-03-01,1,,,,,エイチエフディ,0
834641,7012705002148,01,0,2019-05-15,2019-05-10,一般社団法人日本国際交流発展促進協会,,399,東京都,小平市,学園東町４１４番地の１４,,13,211,1870043,,,,,,,2019-05-10,1,,,,,ニホンコクサイコウリュウハッテンソクシンキョウカイ,0
834642,7012705002156,01,0,2019-06-10,2019-06-05,一般社団法人ＭｙＳｔｙｌｅ,,399,東京都,清瀬市,中里３丁目９２６番地１５,,13,221,2040003,,,,,,,2019-06-05,1,,,,,マイスタイル,0
834643,7012705002164,01,0,2019-08-15,2019-08-09,一般社団法人ＴＨＥ　ＢＯＹＳ´　ＢＲＩＧＡＤＥ　ＩＮ　ＪＡＰＡＮ,,399,東京都,東久留米市,東本町３番１５号フレアコート３０１,,13,222,2030014,,,,,,,2019-08-09,1,,,,,ザボーイズブリゲードインジャパン,0
834644,7012705002180,01,0,2019-12-04,2019-12-02,一般財団法人海外人材教育支援機構,,399,東京都,西東京市,芝久保町２丁目２番１５－１０５号,,13,229,1880014,,,,,,,2019-12-02,1,,,,,カイガイジンザイキョウイクシエンキコウ,0
834645,7012705002197,01,0,2020-03-12,2020-03-12,医療法人社団愛正会,,399,東京都,東村山市,秋津町５丁目１３番地１４クリアティブプラザ２階,,13,213,1890001,,,,,,,2020-03-12,1,,,,,アイセイカイ,0
834646,7012705002206,01,0,2020-05-19,2020-05-19,一般社団法人日本こども服おさがり協会,,399,東京都,清瀬市,中清戸１丁目４５３番地３,,13,221,2040012,,,,,,,2020-05-19,1,,,,,ニホンコドモフクオサガリキョウカイ,0
955416,8012705000068,01,1,2018-07-03,2015-10-05,学校法人なでしこ学園,,399,東京都,東久留米市,東本町８番１４号,,13,222,2030014,,,,,,,2015-10-05,1,,,,,ナデシコガクエン,0
955417,8012705000076,01,1,2018-06-01,2015-10-05,学校法人誉学園,,399,東京都,西東京市,北町３丁目６番１０号,,13,229,2020003,,,,,,,2015-10-05,1,,,,,ホマレガクエン,0
955418,8012705000084,01,1,2018-06-05,2015-10-05,学校法人河野学園,,399,東京都,小平市,上水新町１丁目５番１５号,,13,211,1870023,,,,,,,2015-10-05,1,,,,,カワノガクエン,0
955419,8012705000092,01,1,2018-04-13,2015-10-05,学校法人法水学園,,399,東京都,清瀬市,中里４丁目１１５８番地の５,,13,221,2040003,,,,,,,2015-10-05,1,,,,,ホッスイガクエン,0
955420,8012705000118,01,1,2018-06-27,2015-10-05,社会福祉法人希望会,,399,東京都,小平市,花小金井１丁目２６番１０号,,13,211,1870002,,,,,,,2015-10-05,1,,,,,キボウカイ,0
955421,8012705000126,01,1,2018-06-27,2015-10-05,社会福祉法人小松福祉会,,399,東京都,小平市,花小金井南町２丁目１２番５号,,13,211,1870003,,,,,,,2015-10-05,1,,,,,コマツフクシカイ,0
955422,8012705000134,01,1,2018-06-22,2015-10-05,社会福祉法人東村山けやき会,,399,東京都,東村山市,青葉町３丁目３０番地７,,13,213,1890002,,,,,,,2015-10-05,1,,,,,ヒガシムラヤマケヤキカイ,0
955423,8012705000142,01,1,2018-07-03,2015-10-05,社会福祉法人都心会,,399,東京都,西東京市,栄町３丁目６番２号,,13,229,2020006,,,,,,,2015-10-05,1,,,,,トシンカイ,0
955424,8012705000150,01,1,2020-05-12,2015-10-05,シチズン生活協同組合,,399,東京都,西東京市,田無町６丁目１番１２号,,13,229,1880011,,,,,,,2015-10-05,1,,,,,シチズンセイカツキョウドウクミアイ,0
955425,8012705000183,01,1,2018-07-03,2015-10-05,ひばりが丘団地北商店街協同組合,,399,東京都,西東京市,ひばりが丘２丁目８番１５号,,13,229,2020001,,,,,,,2015-10-05,1,,,,,ヒバリガオカダンチキタショウテンガイ,0
955426,8012705000209,01,1,2019-12-20,2015-10-05,ルミエール田無管理組合法人,,399,東京都,西東京市,緑町１丁目２番４号,,13,229,1880002,,,,,,,2015-10-05,1,,,,,ルミエールタナシ,0
955427,8012705000217,01,1,2018-06-04,2015-10-05,医療法人社団恵友会,,399,東京都,東村山市,青葉町３丁目２９番地１,,13,213,1890002,,,,,,,2015-10-05,1,,,,,ケイユウカイ,0
955428,8012705000233,01,1,2018-04-02,2015-10-05,医療法人社団翔英会,,399,東京都,西東京市,泉町１丁目１１番１４号上宿ビル１階,,13,229,2020011,,,,,,,2015-10-05,1,,,,,ショウエイカイ,0
955429,8012705000241,01,1,2018-08-01,2015-10-05,医療法人社団常樹会,,399,東京都,小平市,花小金井１丁目３番２８号,,13,211,1870002,,,,,,,2015-10-05,1,,,,,ジョウジュカイ,0
955430,8012705000258,01,1,2018-06-12,2015-10-05,医療法人社団一雅会,,399,東京都,西東京市,向台町３丁目６番１０号,,13,229,1880013,,,,,,,2015-10-05,1,,,,,イチガカイ,0
955431,8012705000266,01,1,2018-06-06,2015-10-05,医療法人社団雅心会,,399,東京都,東久留米市,金山町２丁目８番３号,,13,222,2030003,,,,,,,2015-10-05,1,,,,,ガシンカイ,0
955432,8012705000282,01,1,2018-11-27,2015-10-05,医療法人社団国手会,,399,東京都,西東京市,富士町４丁目１６番８号野口ビル１階,,13,229,2020014,,,,,,,2015-10-05,1,,,,,コクシュカイ,0
955433,8012705000290,01,1,2018-08-17,2015-10-05,医療法人社団曙新泉会,,399,東京都,西東京市,泉町１丁目１１番１４号上宿ビル１階,,13,229,2020011,,,,,,,2015-10-05,1,,,,,アケボノシンセンカイ,0
955434,8012705000299,01,1,2018-12-18,2015-10-05,医療法人社団高野会,,399,東京都,小平市,小川西町２丁目２５番２０号,,13,211,1870035,,,,,,,2015-10-05,1,,,,,タカノカイ,0
955435,8012705000308,01,0,2015-10-30,2015-10-05,浅間神社,,399,東京都,東久留米市,浅間町３丁目７番１号,,13,222,2030012,,,,,,,2015-10-05,1,,,,,,0
955436,8012705000316,01,0,2015-10-30,2015-10-05,伊勢神社,,399,東京都,清瀬市,下清戸１丁目２７１番地,,13,221,2040011,,,,,,,2015-10-05,1,,,,,,0
955437,8012705000324,01,0,2015-10-30,2015-10-05,稲荷神社,,399,東京都,清瀬市,下宿２丁目３８９番地,,13,221,2040001,,,,,,,2015-10-05,1,,,,,,0
955438,8012705000332,01,0,2015-10-30,2015-10-05,稲荷神社,,399,東京都,清瀬市,上清戸２丁目３２番地,,13,221,2040013,,,,,,,2015-10-05,1,,,,,,0
955439,8012705000340,01,0,2015-10-30,2015-10-05,カトリック・クリスト・ロア修道会,,399,東京都,西東京市,保谷町４丁目１０番２６号,,13,229,2020015,,,,,,,2015-10-05,1,,,,,,0
955440,8012705000349,01,0,2015-10-30,2015-10-05,光明院,,399,東京都,東村山市,廻田町３丁目１２番地６,,13,213,1890025,,,,,,,2015-10-05,1,,,,,,0
955441,8012705000357,01,0,2015-10-30,2015-10-05,神明社,,399,東京都,東久留米市,中央町２丁目４番２６号,,13,222,2030054,,,,,,,2015-10-05,1,,,,,,0
955442,8012705000365,01,0,2015-10-30,2015-10-05,諏訪神社,,399,東京都,東村山市,諏訪町１丁目４番地３,,13,213,1890021,,,,,,,2015-10-05,1,,,,,,0
955443,8012705000373,01,0,2015-10-30,2015-10-05,大圓寺,,399,東京都,東久留米市,小山２丁目１０番１号,,13,222,2030051,,,,,,,2015-10-05,1,,,,,,0
955444,8012705000381,01,0,2015-10-30,2015-10-05,天理教牧之龍分教会,,399,東京都,西東京市,保谷町５丁目５番１５号,,13,229,2020015,,,,,,,2015-10-05,1,,,,,,0
955445,8012705000398,01,0,2015-10-30,2015-10-05,天理教東大典分教会,,399,東京都,東村山市,多摩湖町１丁目１３番地６４,,13,213,1890026,,,,,,,2015-10-05,1,,,,,,0
955446,8012705000407,01,0,2015-10-30,2015-10-05,クリスチャン文書伝道団,,399,東京都,東久留米市,本町４丁目１３番３４号,,13,222,2030053,,,,,,,2015-10-05,1,,,,,,0
955447,8012705000415,01,0,2015-10-30,2015-10-05,宗教法人日本基督教団小平学園教会,,399,東京都,小平市,学園西町２丁目２５番２０号,,13,211,1870045,,,,,,,2015-10-05,1,,,,,,0
955448,8012705000423,01,0,2015-10-30,2015-10-05,梅岩寺,,399,東京都,東村山市,久米川町５丁目２４番地６,,13,213,1890003,,,,,,,2015-10-05,1,,,,,,0
955449,8012705000431,01,0,2015-10-30,2015-10-05,氷川神社,,399,東京都,小平市,回田町１３６番地,,13,211,1870013,,,,,,,2015-10-05,1,,,,,,0
955450,8012705000448,01,0,2015-10-30,2015-10-05,宗教法人靈運院,,399,東京都,東村山市,富士見町５丁目１０番地５３,,13,213,1890024,,,,,,,2015-10-05,1,,,,,,0
955451,8012705000456,01,0,2015-10-30,2015-10-05,宝樹院,,399,東京都,西東京市,泉町２丁目７番２５号,,13,229,2020011,,,,,,,2015-10-05,1,,,,,,0
955452,8012705000464,01,1,2018-05-11,2015-10-05,明治薬科大学生活協同組合,,399,東京都,清瀬市,野塩２丁目５２２番地１,,13,221,2040004,,,,,,,2015-10-05,1,,,,,メイジヤッカダイガク,0
955453,8012705000472,01,0,2015-10-30,2015-10-05,日本労働組合総評議会全国金属労働組合朝比奈機械支部,,399,東京都,西東京市,柳沢２丁目１４番２１号朝比奈機械株式会社内,,13,229,2020022,,,,,,,2015-10-05,1,,,,,,0
955454,8012705000489,12,1,2018-05-18,2017-04-03,特定非営利活動法人西東京自立支援センター,,399,東京都,小平市,花小金井南町１丁目１４番２号,,13,211,1870003,,,,,,,2015-10-05,1,,,,,ニシトウキョウジリツシエンセンター,0
955455,8012705000497,01,0,2015-10-30,2015-10-05,特定非営利活動法人地域福祉ネットワーク第二こだま,,399,東京都,小平市,津田町１丁目１２番８号,,13,211,1870025,,,,,,,2015-10-05,1,,,,,,0
955456,8012705000506,01,0,2015-10-30,2015-10-05,特定非営利活動法人在宅福祉サービスステーション,,399,東京都,東久留米市,中央町３丁目１番６号,,13,222,2030054,,,,,,,2015-10-05,1,,,,,,0
955457,8012705000514,01,0,2015-10-30,2015-10-05,特定非営利活動法人多摩レイクサイドＦＭ,,399,東京都,東村山市,本町２丁目１２番地１３,,13,213,1890014,,,,,,,2015-10-05,1,,,,,,0
955458,8012705000522,11,1,2018-11-28,2017-12-01,医療法人社団宏知会,,399,東京都,小平市,鈴木町２丁目２４２番地の４,,13,211,1870011,,,,,,,2015-10-05,1,,,,,コウチカイ,0
955459,8012705000530,01,0,2015-10-30,2015-10-05,万行寺,,399,東京都,東村山市,恩多町２丁目２９番地９１,,13,213,1890011,,,,,,,2015-10-05,1,,,,,,0
955460,8012705000539,21,1,2016-12-19,2016-04-22,独立行政法人労働安全衛生総合研究所,,399,東京都,清瀬市,梅園１丁目４番６号,,13,221,2040024,,,2016-04-22,21,,,2015-10-05,1,,,,,,0
955461,8012705000547,01,1,2018-06-25,2015-10-05,特定非営利活動法人東村山子育て支援ネットワークすずめ,,399,東京都,東村山市,本町２丁目２２番地３,,13,213,1890014,,,,,,,2015-10-05,1,,,,,ヒガシムラヤマコソダテシエンネットワークスズメ,0
955462,8012705000563,01,0,2015-10-30,2015-10-05,特定非営利活動法人西東京パソコンわいわいクラブ,,399,東京都,西東京市,富士町４丁目３２番１０号,,13,229,2020014,,,,,,,2015-10-05,1,,,,,,0
955463,8012705000571,01,0,2015-10-30,2015-10-05,特定非営利活動法人ケン工房エヌピーオーセンター,,399,東京都,清瀬市,梅園２丁目１番１５号,,13,221,2040024,,,,,,,2015-10-05,1,,,,,,0
955464,8012705000588,01,0,2015-10-30,2015-10-05,特定非営利活動法人東京ユニ,,399,東京都,清瀬市,元町２丁目２１番３号,,13,221,2040021,,,,,,,2015-10-05,1,,,,,,0
955465,8012705000596,01,1,2018-09-20,2015-10-05,ライオンズガーデンひばりが丘学園町管理組合法人,,399,東京都,東久留米市,学園町１丁目１番９号,,13,222,2030021,,,,,,,2015-10-05,1,,,,,ライオンズガーデンヒバリガオカガクエンチョウ,0
955466,8012705000605,01,0,2015-10-30,2015-10-05,特定非営利活動法人清瀬こども劇場,,399,東京都,清瀬市,松山２丁目１９番６号けやき荘１０１,,13,221,2040022,,,,,,,2015-10-05,1,,,,,,0
955467,8012705000613,21,0,2020-03-18,2020-03-12,税理士法人三野輪会計事務所,,399,東京都,西東京市,柳沢５丁目１番１２号,,13,229,2020022,,,2020-03-12,01,,,2015-10-05,1,,,,,ミノワカイケイジムショ,0
955468,8012705000621,01,0,2015-10-30,2015-10-05,特定非営利活動法人電子地域活性化協会,,399,東京都,西東京市,住吉町３丁目１４番２９号,,13,229,2020005,,,,,,,2015-10-05,1,,,,,,0
955469,8012705000638,01,1,2019-01-28,2015-10-05,医療法人社団広香会,,399,東京都,西東京市,芝久保町３丁目３０番１６号１階,,13,229,1880014,,,,,,,2015-10-05,1,,,,,コウカカイ,0
955470,8012705000646,01,1,2019-02-08,2015-10-05,東村山市環境整備事業協同組合,,399,東京都,東村山市,恩多町１丁目１２番地３,,13,213,1890011,,,,,,,2015-10-05,1,,,,,ヒガシムラヤマシカンキョウセイビ,0
955471,8012705000654,21,0,2019-01-18,2019-01-17,特定非営利活動法人プロジェクトゲート,,399,東京都,西東京市,谷戸町３丁目１１番５号ベルトピアひばりが丘４０１号,,13,229,1880001,,,2019-01-17,21,,,2015-10-05,1,,,,,,0
955472,8012705000662,01,1,2018-10-15,2015-10-05,医療法人社団聖翔会,,399,東京都,東久留米市,下里２丁目８番２１号１階,,13,222,2030043,,,,,,,2015-10-05,1,,,,,セイショウカイ,0
955473,8012705001082,01,0,2015-10-30,2015-10-05,日本基督教團石岡記念教會,00066781,399,東京都,小平市,小平学園東区４４番地,,13,211,1870000,,,,,,,2015-10-05,1,,,,,,0
955474,8012705001090,01,0,2015-10-30,2015-10-05,淨牧院,,399,東京都,東久留米市,門前２７３番地,,13,222,2030000,,,,,,,2015-10-05,1,,,,,,0
955475,8012705001215,01,0,2015-10-30,2015-10-05,東京都豊島区職員労働組合新選組,,399,東京都,西東京市,東町５丁目１０番８号,,13,229,2020012,,,,,,,2015-10-05,1,,,,,,0
955476,8012705001231,01,0,2015-10-30,2015-10-05,特定非営利活動法人清瀬福祉移送センターせせらぎの会,,399,東京都,清瀬市,元町１丁目１３番地１６号フェローチェ清瀬５０２,,13,221,2040021,,,,,,,2015-10-05,1,,,,,,0
955477,8012705001264,01,1,2018-06-22,2015-10-05,社会福祉法人清澄,,399,東京都,清瀬市,上清戸２丁目５番４０号,,13,221,2040013,,,,,,,2015-10-05,1,,,,,キヨスミ,0
955478,8012705001280,01,1,2018-04-25,2015-10-05,特定非営利活動法人東久留米の水と景観を守る会,,399,東京都,東久留米市,滝山３丁目１番２～２０１,,13,222,2030033,,,,,,,2015-10-05,1,,,,,ヒガシクルメノミズトケイカンヲマモルカイ,0
955479,8012705001297,01,1,2018-07-05,2015-10-05,特定非営利活動法人東久留米市体育協会,,399,東京都,東久留米市,大門町２丁目１４番３７号東久留米市スポーツセンター内,,13,222,2030011,,,,,,,2015-10-05,1,,,,,ヒガシクルメシタイイクキョウカイ,0
955480,8012705001306,01,1,2019-06-25,2015-10-05,特定非営利活動法人エヌピーオーバース,,399,東京都,西東京市,田無町３丁目１０番９号,,13,229,1880011,,,,,,,2015-10-05,1,,,,,エヌピーオーバース,0
