1548,1430001020003,01,1,2018-12-05,2015-10-05,株式会社サッポロ・スタジオ,,301,北海道,札幌市中央区,南十三条西２３丁目５番１５号,,01,101,0640913,,,,,,,2015-10-05,1,,,,,サッポロスタジオ,0
1549,1430001020011,01,0,2015-10-30,2015-10-05,株式会社札幌ステンレス商会,,301,北海道,札幌市中央区,南十八条西７丁目２番３号,,01,101,0640918,,,,,,,2015-10-05,1,,,,,,0
1550,1430001020036,01,1,2019-05-29,2015-10-05,株式会社札商サービスセンター,,301,北海道,札幌市中央区,北一条西２丁目２番地１,,01,101,0600001,,,,,,,2015-10-05,1,,,,,サッショウサービスセンター,0
1551,1430001020044,01,1,2018-05-09,2015-10-05,株式会社サッポロ住宅職人センター,,301,北海道,札幌市白石区,本郷通３丁目南１番５号,,01,104,0030024,,,,,,,2015-10-05,1,,,,,サッポロジュウタクショクニンセンター,0
1552,1430001020052,01,1,2018-05-25,2015-10-05,株式会社札幌食品,,301,北海道,札幌市中央区,南十七条西９丁目１番２号,,01,101,0640917,,,,,,,2015-10-05,1,,,,,サッポロショクヒン,0
1553,1430001020077,01,1,2018-07-20,2015-10-05,札幌定温運輸株式会社,,301,北海道,札幌市西区,発寒十四条１４丁目１番１７号,,01,107,0630834,,,,,,,2015-10-05,1,,,,,サッポロテイオンウンユ,0
1554,1430001020093,01,1,2018-04-23,2015-10-05,株式会社札幌東急ホテルズ,,301,北海道,札幌市中央区,南四条西５丁目１番地,,01,101,0640804,,,,,,,2015-10-05,1,,,,,サッポロトウキュウホテルズ,0
1555,1430001020110,01,1,2019-05-17,2015-10-05,株式会社テー・イー・エス,,301,北海道,札幌市豊平区,美園二条５丁目２の１０,,01,105,0620002,,,,,,,2015-10-05,1,,,,,テーイーエス,0
1556,1430001020127,01,1,2018-07-06,2015-10-05,株式会社札幌電工,,301,北海道,札幌市白石区,川北２２９１番地,,01,104,0030859,,,,,,,2015-10-05,1,,,,,サッポロデンコウ,0
1557,1430001020143,01,0,2015-10-30,2015-10-05,札幌竹田機械販売株式会社,,301,北海道,札幌市豊平区,中の島一条６丁目３番１５号,,01,105,0620921,,,,,,,2015-10-05,1,,,,,,0
1558,1430001020151,01,1,2018-07-11,2015-10-05,株式会社札幌都市開発公社,,301,北海道,札幌市中央区,南二条東１丁目１番地１４,,01,101,0600052,,,,,,,2015-10-05,1,,,,,サッポロトシカイハツコウシャ,0
1559,1430001020168,01,1,2018-06-26,2015-10-05,株式会社札幌デンタル大通ラボ,,301,北海道,札幌市北区,北二十四条西２丁目４番１３号,,01,102,0010024,,,,,,,2015-10-05,1,,,,,サッポロデンタルオオドオリラボ,0
1560,1430001020184,01,0,2015-10-30,2015-10-05,札幌中央梱包株式会社,,301,北海道,札幌市厚別区,厚別東三条３丁目１４番４７号,,01,108,0040003,,,,,,,2015-10-05,1,,,,,,0
1561,1430001020192,11,0,2019-07-05,2019-07-01,株式会社エステイプロパティー,,301,北海道,札幌市中央区,南五条西１０丁目１０１１番１８,,01,101,0640805,,,,,,,2015-10-05,1,,,,,エステイプロパティー,0
1562,1430001020201,01,1,2019-11-26,2015-10-05,株式会社札幌トランジスター,,301,北海道,札幌市中央区,北五条西２１丁目４番１２号,,01,101,0600005,,,,,,,2015-10-05,1,,,,,サッポロトランジスター,0
1563,1430001020218,12,0,2020-04-28,2020-04-20,札幌中野冷機株式会社,,301,北海道,札幌市北区,新琴似三条７丁目８番１号,,01,102,0010903,,,,,,,2015-10-05,1,,,,,サッポロナカノレイキ,0
1564,1430001020234,01,1,2019-08-21,2015-10-05,サツポロ日昭自動車株式会社,,301,北海道,札幌市厚別区,厚別町小野幌２５１１番地１,,01,108,0040006,,,,,,,2015-10-05,1,,,,,サッポロニッショウジドウシャ,0
1565,1430001020250,12,1,2019-03-25,2017-03-07,札幌ベイ開発株式会社,,301,北海道,石狩市,船場町４３番１３,,01,235,0613378,,,,,,,2015-10-05,1,,,,,サッポロベイカイハツ,0
1566,1430001020267,21,0,2020-03-12,2020-03-05,マックスバリュ北海道株式会社,,301,北海道,札幌市中央区,北八条西２１丁目１番１０号,,01,101,0600008,,,2020-03-05,11,4430001015958,令和２年３月１日札幌市白石区本通二十一丁目南１番１０号イオン北海道株式会社（4430001015958）に合併し解散,2015-10-05,1,,,,,マックスバリュホッカイドウ,0
1567,1430001020275,01,1,2018-08-27,2015-10-05,札幌ホーム株式会社,,301,北海道,札幌市中央区,南一条西７丁目２０番地１,,01,101,0600061,,,,,,,2015-10-05,1,,,,,サッポロホーム,0
1568,1430001020291,01,0,2016-12-26,2016-12-20,株式会社札幌北央葬祭,,301,北海道,札幌市東区,北三十四条東２５丁目２番２２号,,01,103,0070834,,,,,,,2016-12-20,1,,,,,,0
1569,1430001020317,01,1,2019-02-26,2015-10-05,札幌ホンダ株式会社,,301,北海道,札幌市白石区,南郷通２０丁目北３番４３号,,01,104,0030023,,,,,,,2015-10-05,1,,,,,サッポロホンダ,0
1570,1430001020333,01,0,2015-10-30,2015-10-05,サッポロ物産株式会社,,301,北海道,札幌市白石区,平和通１６丁目南１番１号,,01,104,0030028,,,,,,,2015-10-05,1,,,,,,0
1571,1430001020341,01,0,2015-10-30,2015-10-05,株式会社札幌花材,,301,北海道,札幌市中央区,北二条東１２丁目９８番地３１,,01,101,0600032,,,,,,,2015-10-05,1,,,,,,0
1572,1430001020366,01,0,2015-10-30,2015-10-05,札幌プラントサービス株式会社,,301,北海道,札幌市白石区,菊水元町六条４丁目１番３２号,,01,104,0030826,,,,,,,2015-10-05,1,,,,,,0
1573,1430001020390,21,0,2020-04-09,2020-04-01,株式会社札幌マンションプラザ,,301,北海道,札幌市中央区,南三条西６丁目３番地２,,01,101,0600063,,,2020-04-01,11,8430001022273,令和２年４月１日札幌市中央区南三条西六丁目３番地２北海道建物株式会社（8430001022273）に合併し解散,2015-10-05,1,,,,,サッポロマンションプラザ,0
1574,1430001020399,21,0,2018-07-31,2018-07-26,札幌メッシュ工業株式会社,,301,北海道,札幌市豊平区,月寒東五条１８丁目４番５号,,01,105,0620055,,,2018-07-26,01,,,2015-10-05,1,,,,,サッポロメッシュコウギョウ,0
1575,1430001020408,01,0,2015-10-30,2015-10-05,株式会社札幌ミヤコ,,301,北海道,札幌市中央区,北六条西１１丁目２９番地,,01,101,0600006,,,,,,,2015-10-05,1,,,,,,0
1576,1430001020440,01,1,2020-05-12,2015-10-05,株式会社巴,,301,北海道,札幌市中央区,南十六条西１０丁目２番１８号,,01,101,0640916,,,,,,,2015-10-05,1,,,,,トモエ,0
1577,1430001020449,01,0,2015-10-30,2015-10-05,札幌山本美材株式会社,,301,北海道,札幌市豊平区,豊平三条１３丁目１番３号,,01,105,0620903,,,,,,,2015-10-05,1,,,,,,0
1578,1430001020457,01,1,2018-10-19,2015-10-05,札幌ワイヤリング株式会社,,301,北海道,札幌市手稲区,西宮の沢一条１丁目２番２０号,,01,109,0060001,,,,,,,2015-10-05,1,,,,,サッポロワイヤリング,0
1579,1430001020473,01,1,2020-05-19,2015-10-05,株式会社札幌ワシダ,,301,北海道,札幌市豊平区,豊平三条６丁目１番８号,,01,105,0620903,,,,,,,2015-10-05,1,,,,,サッポロワシダ,0
1580,1430001020481,01,1,2018-07-11,2015-10-05,札幌ラバトリー興業株式会社,,301,北海道,札幌市東区,北二十一条東１丁目４番２０号,,01,103,0650021,,,,,,,2015-10-05,1,,,,,サッポロラバトリーコウギョウ,0
1581,1430001020515,01,0,2015-10-30,2015-10-05,株式会社大和広告社,,301,北海道,札幌市中央区,南一条西５丁目５番地,,01,101,0600061,,,,,,,2015-10-05,1,,,,,,0
1582,1430001020531,12,0,2016-07-15,2016-07-05,株式会社ダイワ企画設計,,301,北海道,札幌市中央区,北二十条西１５丁目２番７号,,01,101,0600020,,,,,,,2015-10-05,1,,,,,,0
1583,1430001020548,01,0,2015-10-30,2015-10-05,株式会社大和エディック,,301,北海道,札幌市手稲区,金山二条４丁目２番１３号,,01,109,0060042,,,,,,,2015-10-05,1,,,,,,0
1584,1430001020556,01,0,2015-10-30,2015-10-05,株式会社オフィスキナミ,,301,北海道,札幌市中央区,北十条西２４丁目１番１－５０２号,,01,101,0600010,,,,,,,2015-10-05,1,,,,,,0
1585,1430001020580,01,0,2015-10-30,2015-10-05,中央運輸株式会社,,301,北海道,札幌市白石区,菊水元町七条４丁目５番２７号,,01,104,0030827,,,,,,,2015-10-05,1,,,,,,0
1586,1430001020606,01,1,2018-04-18,2015-10-05,株式会社中央葬儀社,,301,北海道,札幌市手稲区,前田二条１１丁目１３番３８号,,01,109,0060812,,,,,,,2015-10-05,1,,,,,チュウオウソウギシャ,0
1587,1430001020622,01,1,2019-08-02,2015-10-05,株式会社中央地建,,301,北海道,札幌市中央区,南二条西１０丁目１番地４,,01,101,0600062,,,,,,,2015-10-05,1,,,,,チュウオウチケン,0
1588,1430001020630,01,1,2020-04-06,2015-10-05,株式会社中央宅建,,301,北海道,札幌市中央区,南十一条西９丁目２番３号,,01,101,0640811,,,,,,,2015-10-05,1,,,,,チュウオウタッケン,0
1589,1430001020647,01,0,2015-10-30,2015-10-05,株式会社東洋,,301,北海道,札幌市西区,八軒十条西１２丁目２番３０号,,01,107,0630850,,,,,,,2015-10-05,1,,,,,,0
1590,1430001020688,01,1,2018-12-17,2015-10-05,東洋田園開発株式会社,,301,北海道,札幌市中央区,北六条西２２丁目２番７号,,01,101,0600006,,,,,,,2015-10-05,1,,,,,トウヨウデンエンカイハツ,0
1591,1430001020696,01,1,2019-07-25,2015-10-05,株式会社東洋特殊土木,,301,北海道,札幌市東区,北三十四条東１３丁目２番１５号,,01,103,0070834,,,,,,,2015-10-05,1,,,,,トウヨウトクシュドボク,0
1592,1430001020705,01,0,2015-10-30,2015-10-05,株式会社東洋フロンテイア,,301,北海道,札幌市豊平区,豊平四条３丁目１番１－１１１号,,01,105,0620904,,,,,,,2015-10-05,1,,,,,,0
1593,1430001020713,01,0,2015-10-30,2015-10-05,株式会社東洋ワールド,,301,北海道,札幌市中央区,南二条西９丁目１番２号サンケン札幌ビル６階,,01,101,0600062,,,,,,,2015-10-05,1,,,,,,0
1594,1430001020721,12,1,2019-06-19,2019-06-13,第一エステート株式会社,,301,北海道,札幌市中央区,南十二条西９丁目３番３４号,,01,101,0640912,,,,,,,2015-10-05,1,,,,,ダイイチエステート,0
1595,1430001020738,01,1,2019-07-05,2015-10-05,第三振興株式会社,,301,北海道,札幌市清田区,北野一条１丁目９番１号,,01,110,0040861,,,,,,,2015-10-05,1,,,,,ダイサンシンコウ,0
1596,1430001020746,01,1,2018-12-07,2015-10-05,株式会社第一カメラ,,301,北海道,札幌市白石区,東札幌五条２丁目１番２３号,,01,104,0030005,,,,,,,2015-10-05,1,,,,,ダイイチカメラ,0
1597,1430001020754,01,1,2018-08-15,2015-10-05,だいいちセントラルＥＣＭ株式会社,,301,北海道,札幌市厚別区,厚別中央三条２丁目１６番３９号,,01,108,0040053,,,,,,,2015-10-05,1,,,,,ダイイチセントラルイーシーエム,0
1598,1430001020762,11,0,2016-10-03,2016-09-27,宅商開発株式会社,,301,北海道,札幌市白石区,東札幌二条６丁目４番１５号,,01,104,0030002,,,,,,,2015-10-05,1,,,,,,0
1599,1430001020770,21,0,2017-07-13,2017-07-03,第一電波工業株式会社,,301,北海道,札幌市白石区,菊水元町三条４丁目３番１７号,,01,104,0030823,,,2017-07-03,11,8430001005575,平成２９年７月１日札幌市東区北四十六条東十九丁目１番１号株式会社シーエーブイ（8430001005575）に合併し解散,2015-10-05,1,,,,,,0
1600,1430001020779,01,0,2015-10-30,2015-10-05,第一ペット商事株式会社,,301,北海道,札幌市中央区,南十条西２０丁目１番３８号,,01,101,0640810,,,,,,,2015-10-05,1,,,,,,0
1601,1430001020787,11,1,2018-07-18,2015-11-02,株式会社アインホールディングス,,301,北海道,札幌市白石区,東札幌五条２丁目４番３０号,,01,104,0030005,,,,,,,2015-10-05,1,,,,,アインホールディングス,0
1602,1430001020829,12,1,2018-04-13,2016-10-11,日本高圧コンクリート株式会社,,301,北海道,札幌市中央区,北三条西３丁目１番地５４,,01,101,0600003,,,,,,,2015-10-05,1,,,,,ニホンコウアツコンクリート,0
1603,1430001020837,21,0,2017-01-04,2016-12-21,株式会社包括医療ケア公社,,301,北海道,札幌市中央区,南一条西９丁目１の２,,01,101,0600061,,,2016-12-21,21,,,2015-10-05,1,,,,,,0
1604,1430001020861,01,1,2019-04-17,2015-10-05,日本総合建設株式会社,,301,北海道,札幌市清田区,清田二条２丁目５番１０号,,01,110,0040842,,,,,,,2015-10-05,1,,,,,ニホンソウゴウケンセツ,0
1605,1430001020886,01,1,2018-06-25,2015-10-05,日本コムテック株式会社,,301,北海道,札幌市中央区,南八条西１３丁目３番６０号シーエムビル,,01,101,0640808,,,,,,,2015-10-05,1,,,,,ニホンコムテック,0
1606,1430001020952,01,0,2015-10-30,2015-10-05,株式会社エトワールハウス,,301,北海道,札幌市中央区,北二条西２４丁目２番３０号,,01,101,0640822,,,,,,,2015-10-05,1,,,,,,0
1607,1430001020977,01,0,2015-10-30,2015-10-05,株式会社日本庭園カルテイヴエイト,,301,北海道,札幌市南区,藤野五条４丁目６番１２号,,01,106,0612285,,,,,,,2015-10-05,1,,,,,,0
1608,1430001020985,01,1,2019-06-19,2015-10-05,日本データーコンサルタント株式会社,,301,北海道,札幌市中央区,北五条西１２丁目２番地,,01,101,0600005,,,,,,,2015-10-05,1,,,,,ニホンデーターコンサルタント,0
1609,1430001021001,01,0,2015-10-30,2015-10-05,日本特殊發熱体株式会社,,301,北海道,札幌市東区,北十八条東１８丁目１番地の２,,01,103,0650018,,,,,,,2015-10-05,1,,,,,,0
1610,1430001021026,01,1,2018-06-07,2015-10-05,日本ニューホランド株式会社,,301,北海道,札幌市中央区,北一条西１３丁目４番地,,01,101,0600001,,,,,,,2015-10-05,1,,,,,ニホンニューホランド,0
1611,1430001021091,01,0,2015-10-30,2015-10-05,株式会社日本薬局,,301,北海道,札幌市中央区,大通西７丁目２番地,,01,101,0600042,,,,,,,2015-10-05,1,,,,,,0
1612,1430001021100,01,1,2019-08-14,2015-10-05,日本雷電株式会社,,301,北海道,札幌市東区,北二十四条東１２丁目１番３４号,,01,103,0650024,,,,,,,2015-10-05,1,,,,,ニホンライデン,0
1613,1430001021109,01,1,2018-04-13,2015-10-05,ニッポンレンタカー北海道株式会社,,301,北海道,札幌市白石区,東札幌一条１丁目１番８号,,01,104,0030001,,,,,,,2015-10-05,1,,,,,ニッポンレンタカーホッカイドウ,0
1614,1430001021117,01,1,2019-06-07,2015-10-05,日本緑建株式会社,,301,北海道,札幌市清田区,清田二条２丁目１８番２号,,01,110,0040842,,,,,,,2015-10-05,1,,,,,ニホンリョクケン,0
1615,1430001021133,01,0,2015-10-30,2015-10-05,藤栄建設株式会社,,301,北海道,札幌市東区,北三十四条東９丁目３番１２号,,01,103,0070834,,,,,,,2015-10-05,1,,,,,,0
1616,1430001021141,01,1,2018-11-28,2015-10-05,株式会社藤井組,,301,北海道,札幌市南区,真駒内南町１丁目２番７号,,01,106,0050016,,,,,,,2015-10-05,1,,,,,フジイグミ,0
1617,1430001021158,01,1,2019-06-25,2015-10-05,株式会社藤井ビル,,301,北海道,札幌市中央区,大通西１１丁目４番地,,01,101,0600042,,,,,,,2015-10-05,1,,,,,フジイビル,0
1618,1430001021166,01,1,2019-04-23,2015-10-05,株式会社富士会館,,301,北海道,札幌市中央区,南五条西４丁目７番地,,01,101,0640805,,,,,,,2015-10-05,1,,,,,フジカイカン,0
1619,1430001021174,01,1,2020-01-28,2015-10-05,藤興産株式会社,,301,北海道,札幌市西区,琴似四条７丁目２番１１号,,01,107,0630814,,,,,,,2015-10-05,1,,,,,フジコウサン,0
1620,1430001021182,01,1,2018-08-14,2015-10-05,株式会社フジ・コーポレーション,,301,北海道,札幌市西区,八軒六条西３丁目１番７号,,01,107,0630846,,,,,,,2015-10-05,1,,,,,フジコーポレーション,0
1621,1430001021199,01,0,2015-10-30,2015-10-05,株式会社富士化成,,301,北海道,札幌市白石区,北郷三条９丁目３番１号,,01,104,0030833,,,,,,,2015-10-05,1,,,,,,0
1622,1430001021249,01,1,2018-08-29,2015-10-05,株式会社富士産業,,301,北海道,札幌市南区,藤野二条７丁目１番１０号,,01,106,0612282,,,,,,,2015-10-05,1,,,,,フジサンギョウ,0
1623,1430001021273,01,0,2015-10-30,2015-10-05,エビコー株式会社,,301,北海道,札幌市西区,二十四軒三条２丁目６番２１号,,01,107,0630803,,,,,,,2015-10-05,1,,,,,,0
1624,1430001021331,01,0,2015-10-30,2015-10-05,藤千代商事株式会社,,301,北海道,札幌市手稲区,曙一条１丁目４番８号,00088357,01,109,0060831,,,,,,,2015-10-05,1,,,,,,0
1625,1430001021356,01,1,2019-06-11,2015-10-05,富士見工業株式会社,,301,北海道,札幌市白石区,北郷一条８丁目７番２９号,,01,104,0030831,,,,,,,2015-10-05,1,,,,,フジミコウギョウ,0
1626,1430001021364,01,0,2015-10-30,2015-10-05,藤美食品株式会社,,301,北海道,札幌市白石区,菊水元町三条２丁目１番地,,01,104,0030823,,,,,,,2015-10-05,1,,,,,,0
1627,1430001021372,01,0,2015-10-30,2015-10-05,フジモトシール株式会社,,301,北海道,札幌市東区,北二十一条東１３丁目４番１３号,,01,103,0650021,,,,,,,2015-10-05,1,,,,,,0
1628,1430001021380,01,0,2015-10-30,2015-10-05,藤丸商事株式会社,,301,北海道,札幌市東区,北九条東８丁目４番１号,,01,103,0650009,,,,,,,2015-10-05,1,,,,,,0
1629,1430001021389,01,0,2015-10-30,2015-10-05,株式会社フジヤ小林,,301,北海道,札幌市中央区,北四条西１１丁目２６番地,,01,101,0600004,,,,,,,2015-10-05,1,,,,,,0
1630,1430001021406,01,0,2015-10-30,2015-10-05,株式会社藤和,,301,北海道,札幌市豊平区,美園九条６丁目３番１３号,,01,105,0620009,,,,,,,2015-10-05,1,,,,,,0
1631,1430001021414,01,1,2019-07-09,2015-10-05,富士レンタル株式会社,,301,北海道,札幌市東区,東雁来四条１丁目１番３７号,,01,103,0070824,,,,,,,2015-10-05,1,,,,,フジレンタル,0
1632,1430001021422,01,0,2015-10-30,2015-10-05,株式会社エムシーエス,,301,北海道,札幌市白石区,菊水元町八条３丁目１番３３号,,01,104,0030828,,,,,,,2015-10-05,1,,,,,,0
1633,1430001021430,12,0,2019-11-11,2019-11-05,北海塩業株式会社,,301,北海道,札幌市中央区,北一条西１６丁目１番地２７,,01,101,0600001,,,,,,,2015-10-05,1,,,,,,0
1634,1430001021447,01,0,2015-10-30,2015-10-05,北海解体株式会社,,301,北海道,札幌市白石区,菊水五条３丁目１番３号,,01,104,0030805,,,,,,,2015-10-05,1,,,,,,0
1635,1430001021463,01,0,2015-10-30,2015-10-05,北海健商株式会社,,301,北海道,札幌市豊平区,平岸五条１０丁目７番１号,,01,105,0620935,,,,,,,2015-10-05,1,,,,,,0
1636,1430001021471,01,0,2015-10-30,2015-10-05,株式会社北海教材社,,301,北海道,札幌市東区,北二十二条東１丁目３番５号,,01,103,0650022,,,,,,,2015-10-05,1,,,,,,0
1637,1430001021488,12,1,2019-12-16,2017-10-06,株式会社北海製鞄,00088362,301,北海道,札幌市東区,北十四条東１６丁目２番３５号,,01,103,0650014,,,,,,,2015-10-05,1,,,,,ホッカイセイホウ,0
1638,1430001021505,01,0,2015-10-30,2015-10-05,株式会社北海施設,,301,北海道,札幌市北区,拓北七条２丁目１０番１６号,,01,102,0028067,,,,,,,2015-10-05,1,,,,,,0
1639,1430001021513,01,1,2018-05-24,2015-10-05,北海澁澤物流株式会社,,301,北海道,札幌市白石区,中央三条４丁目３番４６号,,01,104,0030013,,,,,,,2015-10-05,1,,,,,ホッカイシブサワブツリュウ,0
1640,1430001021521,01,0,2015-10-30,2015-10-05,北海庭園株式会社,,301,北海道,札幌市白石区,東米里２０２８番地１,,01,104,0030876,,,,,,,2015-10-05,1,,,,,,0
1641,1430001021538,01,1,2020-05-19,2015-10-05,株式会社宗参宮殿会館,,301,北海道,札幌市中央区,大通西１５丁目３番地２６,,01,101,0600042,,,,,,,2015-10-05,1,,,,,シュウサングウデンカイカン,0
1642,1430001021546,01,1,2020-04-13,2015-10-05,北海トラベル株式会社,,301,北海道,札幌市東区,北二十四条東１丁目１番３５号,,01,103,0650024,,,,,,,2015-10-05,1,,,,,ホッカイトラベル,0
1643,1430001021579,01,0,2015-10-30,2015-10-05,株式会社北海谷米谷物産,,301,北海道,札幌市中央区,南三条東１丁目８番地,,01,101,0600053,,,,,,,2015-10-05,1,,,,,,0
1644,1430001021595,01,0,2015-10-30,2015-10-05,北海道ウォーターパーク開発機構株式会社,,301,北海道,札幌市中央区,北四条西７丁目１番地５札幌ホワイトビル,,01,101,0600004,,,,,,,2015-10-05,1,,,,,,0
1645,1430001021604,01,1,2018-05-11,2015-10-05,北海道衛生工業株式会社,,301,北海道,札幌市東区,丘珠町６４７番地５,,01,103,0070880,,,,,,,2015-10-05,1,,,,,ホッカイドウエイセイコウギョウ,0
1646,1430001021620,01,1,2020-02-03,2015-10-05,株式会社北海道アート社,,301,北海道,札幌市中央区,北四条西６丁目１番地,,01,101,0600004,,,,,,,2015-10-05,1,,,,,ホッカイドウアートシャ,0
1647,1430001021645,12,1,2018-12-11,2018-12-05,株式会社ユニテック,,301,北海道,札幌市中央区,宮の森二条１丁目７番２号宮の森ＫＬビル,,01,101,0640952,,,,,,,2015-10-05,1,,,,,ユニテック,0
1648,1430001021653,01,0,2015-10-30,2015-10-05,北海道エスター株式会社,,301,北海道,札幌市中央区,南二条西２２丁目１番４５号,,01,101,0640802,,,,,,,2015-10-05,1,,,,,,0
1649,1430001021686,01,0,2015-10-30,2015-10-05,株式会社北海道アピオ,,301,北海道,札幌市東区,北三十三条東１２丁目２番１７－１０３号,,01,103,0650033,,,,,,,2015-10-05,1,,,,,,0
1650,1430001021703,01,1,2018-06-12,2015-10-05,北海道オリオン株式会社,,301,北海道,札幌市白石区,本通１８丁目北３番６６号,,01,104,0030027,,,,,,,2015-10-05,1,,,,,ホッカイドウオリオン,0
1651,1430001021711,01,0,2015-10-30,2015-10-05,北海道アルテック株式会社,,301,北海道,札幌市東区,北三十五条東２８丁目１番３号,,01,103,0070835,,,,,,,2015-10-05,1,,,,,,0
1652,1430001021736,01,0,2015-10-30,2015-10-05,北海道海外炭開発供給株式会社,,301,北海道,札幌市中央区,北三条東３丁目１番地３０,,01,101,0600033,,,,,,,2015-10-05,1,,,,,,0
1653,1430001021752,01,1,2018-06-22,2015-10-05,北海道交通株式会社,,301,北海道,札幌市豊平区,平岸二条１６丁目２番１号,,01,105,0620932,,,,,,,2015-10-05,1,,,,,ホッカイドウコウツウ,0
1654,1430001021760,01,0,2015-10-30,2015-10-05,北海道船舶振興株式会社,,301,北海道,札幌市中央区,南三条西５丁目１番１号,,01,101,0600063,,,,,,,2015-10-05,1,,,,,,0
1655,1430001021777,01,0,2015-10-30,2015-10-05,株式会社北海道技研,,301,北海道,札幌市南区,真駒内柏丘６丁目４番５号,,01,106,0050022,,,,,,,2015-10-05,1,,,,,,0
1656,1430001021785,01,1,2018-04-18,2015-10-05,株式会社さっぽろテレビ塔,,301,北海道,札幌市中央区,大通西１丁目,,01,101,0600042,,,,,,,2015-10-05,1,,,,,サッポロテレビトウ,0
1657,1430001021810,01,1,2018-06-21,2015-10-05,北海道コンクリート工業株式会社,,301,北海道,札幌市中央区,北二条西２丁目４０番地,,01,101,0600002,,,,,,,2015-10-05,1,,,,,ホッカイドウコンクリートコウギョウ,0
1658,1430001021819,01,0,2015-10-30,2015-10-05,北海道化成株式会社,,301,北海道,札幌市東区,東雁来六条２丁目１番１号,,01,103,0070826,,,,,,,2015-10-05,1,,,,,,0
1659,1430001021827,01,1,2018-06-29,2015-10-05,株式会社北海道建設会館,,301,北海道,札幌市中央区,北四条西３丁目１番地,,01,101,0600004,,,,,,,2015-10-05,1,,,,,ホッカイドウケンセツカイカン,0
1660,1430001021843,01,1,2019-07-19,2015-10-05,株式会社北海道建築総合研究所,,301,北海道,札幌市中央区,北七条西２７丁目１番８号,,01,101,0600007,,,,,,,2015-10-05,1,,,,,ホッカイドウケンチクソウゴウケンキュウショ,0
1661,1430001021868,12,0,2019-07-26,2019-07-22,株式会社ＪＴＢ札幌ビジネスセンター,,301,北海道,札幌市中央区,北四条西５丁目１番地３,,01,101,0600004,,,,,,,2015-10-05,1,,,,,ジェイティービーサッポロビジネスセンター,0
1662,1430001021884,01,1,2019-06-26,2015-10-05,株式会社北海道キューブシステム,,301,北海道,札幌市中央区,北一条西７丁目４－４,,01,101,0600001,,,,,,,2015-10-05,1,,,,,ホッカイドウキューブシステム,0
1663,1430001021892,01,0,2015-10-30,2015-10-05,株式会社北海道カレン,,301,北海道,札幌市南区,澄川五条５丁目１６番１０号,,01,106,0050005,,,,,,,2015-10-05,1,,,,,,0
1664,1430001021901,01,0,2015-10-30,2015-10-05,北海道クレインゴルフ株式会社,,301,北海道,札幌市清田区,美しが丘三条６丁目４番２３号,,01,110,0040813,,,,,,,2015-10-05,1,,,,,,0
1665,1430001021934,21,0,2020-04-08,2020-04-01,株式会社北海道ジェイ・アール・エージェンシー,,301,北海道,札幌市東区,北六条東４丁目１番地４,,01,103,0600906,,,2020-04-01,11,4430001002295,令和２年４月１日札幌市東区北六条東四丁目１番地４（ＮＥ６．４ビル）株式会社ＪＲ北海道ソリューションズ（4430001002295）に合併し解散,2015-10-05,1,,,,,ホッカイドウジェイアールエージェンシー,0
1666,1430001021959,01,1,2018-04-04,2015-10-05,ＡＬＳＯＫ北海道株式会社,,301,北海道,札幌市北区,北七条西４丁目３番地１,,01,102,0600807,,,,,,,2015-10-05,1,,,,,アルソックホッカイドウ,0
