29586,7700150081374,01,1,2018-06-18,2017-03-02,津吉地区まちづくり運営協議会,,499,長崎県,平戸市,津吉町１２１２番地１,,42,207,8595512,,,,,,,2017-03-02,1,,,,,ツヨシチクマチヅクリウンエイキヨウギカイ,0
29587,7700150084757,01,1,2018-06-18,2017-08-17,宮田土地改良区,,499,長崎県,雲仙市,国見町土黒甲１０７９－１,,42,213,8591311,,,,,,,2017-08-17,1,,,,,ミヤダトチカイリヨウク,0
29588,7700150086737,01,1,2018-06-22,2017-12-21,式見地区ふれあいセンター,,499,長崎県,長崎市,式見町３５７番地,,42,201,8511137,,,,,,,2017-12-21,1,,,,,シキミチクフレアイセンター,0
29589,7700150088411,01,0,2018-04-18,2018-04-13,新大工町地区市街地再開発組合,,499,長崎県,長崎市,新大工町３番１０号３階,,42,201,8500017,,,,,,,2018-04-13,1,,,,,シンダイクマチチクシガイチサイカイハツクミアイ,0
37993,9700150087700,01,1,2018-06-22,2018-02-28,交通遺児者チャリティープロアマ大会実行委員会,,499,長崎県,大村市,富の原２丁目９１３－１,,42,205,8560806,,,,,,,2018-02-28,1,,,,,コウツウイジシヤチヤリテイープロアマタイカイジツコウイインカイ,0
37994,9700150088748,01,0,2018-06-04,2018-05-11,木鉢地区ふれあいセンター運営委員会,,499,長崎県,長崎市,木鉢町２丁目２２８,,42,201,8500076,,,,,,,2018-05-11,1,,,,,キバチチクフレアイセンターウンエイイインカイ,0
6919,1700150081710,11,0,2018-07-20,2018-06-28,いだてん玉名,,499,熊本県,玉名市,中１９３５－１山田新建材ビル１階,,43,206,8650064,,,,,,,2017-03-06,1,,,,,イダテンタマナ,0
784,2700150081346,12,0,2020-06-02,2020-04-01,熊本市南土地改良区,,499,熊本県,熊本市南区,奥古閑町２０３５,,43,104,8614125,,,,,,,2017-03-01,1,,,,,クマモトシミナミトチカイリヨウク,0
13778,2700150084209,01,1,2018-06-07,2017-06-30,第３６回全国デイ・ケア研究大会２０１７ｉｎ熊本,,499,熊本県,熊本市北区,山室６丁目８－１,,43,105,8600084,,,,,,,2017-06-30,1,,,,,ダイサンジユウロクカイゼンコクデイケアケンキユウタイカイニセンジユウシチインクマモト,0
13779,2700150089067,01,0,2018-06-01,2018-05-29,三角町土地改良区,,499,熊本県,宇城市,三角町戸馳５２０５,,43,213,8693203,,,,,,,2018-05-29,1,,,,,ミスミマチトチカイリヨウク,0
20670,3700150085486,01,1,2018-06-12,2017-10-04,鏡まちづくり協議会,,499,熊本県,八代市,鏡町内田１３３９番地１,,43,202,8694202,,,,,,,2017-10-04,1,,,,,カガミマチヅクリキヨウギカイ,0
27520,4700150084330,01,1,2018-06-13,2017-07-06,昭和まちづくり協議会,,499,熊本県,八代市,昭和明徴町７３０番地１,,43,202,8694722,,,,,,,2017-07-06,1,,,,,シヨウワマチヅクリキヨウギカイ,0
27521,4700150088629,01,0,2018-10-12,2018-05-01,熊本県へき地医療医師の会,,499,熊本県,上天草市,龍ヶ岳町高戸１４１９－１９,,43,212,8660202,,,,,,,2018-05-01,1,,,,,クマモトケンヘキチイリヨウイシノカイ,0
34424,5700150085996,01,1,2018-06-22,2017-11-09,熊本市暴走族根絶連絡協議会,,499,熊本県,熊本市中央区,手取本町１－１熊本市生活安全課内,,43,101,8600808,,,,,,,2017-11-09,1,,,,,クマモトシボウソウゾクコンゼツレンラクキヨウギカイ,0
34425,5700150087588,01,1,2018-06-22,2018-02-22,本田あきこ後援会「顕政会」,,499,熊本県,熊本市西区,花園７丁目１２－１６,,43,103,8600072,,,,,,,2018-02-22,1,,,,,ホンダアキココウエンカイケンセイカイ,0
41327,6700150088461,01,0,2018-04-20,2018-04-17,上熊本ハイツマンション建替組合,,499,熊本県,熊本市西区,上熊本２丁目１１番２１号,,43,103,8600079,,,,,,,2018-04-17,1,,,,,カミクマモトハイツマンシヨンタテカエクミアイ,0
48237,7700150081325,01,1,2018-06-18,2017-03-01,湯前町シニア生き活き社会参画のまちづくり協議会,,499,熊本県,球磨郡湯前町,１９８９－１,,43,506,8680600,,,,,,,2017-03-01,1,,,,,ユノマエマチシニアイキイキシヤカイサンカクノマチヅクリキヨウギカイ,0
48238,7700150087628,01,1,2018-06-22,2018-02-22,八代市人権問題啓発推進協議会,,499,熊本県,八代市,千丁町新牟田１５０２－１,,43,202,8694703,,,,,,,2018-02-22,1,,,,,ヤツシロシジンケンモンダイケイハツスイシンキヨウギカイ,0
48239,7700150088460,01,0,2018-05-17,2018-04-17,熊本北合志地区交通安全協会,,499,熊本県,熊本市北区,飛田４丁目１０番１９号,,43,105,8615514,,,,,,,2018-04-17,1,,,,,クマモトキタコウシチクコウツウアンゼンキヨウカイ,0
55123,8700150080656,01,1,2018-06-11,2017-02-10,下東漆田地域資源保全隊,,499,熊本県,人吉市,下漆田町２５７３－１,,43,203,8680822,,,,,,,2017-02-10,1,,,,,シモヒガシウルシダチイキシゲンホゼンタイ,0
55124,8700150083502,01,1,2018-05-08,2017-05-26,教良木土地改良区,,499,熊本県,上天草市,松島町教良木２７９６番地,,43,212,8616105,,,,,,,2017-05-26,1,,,,,キョウラギトチカイリョウク,0
55125,8700150084327,01,1,2018-06-19,2017-07-06,松高自治協議会,,499,熊本県,八代市,永碇町７５４番地２,,43,202,8660885,,,,,,,2017-07-06,1,,,,,マツタカジチキヨウギカイ,0
62042,9700150084796,01,1,2018-05-24,2017-08-17,南九州税理士会熊本県連合会,,499,熊本県,熊本市中央区,大江５丁目１７番５号,,43,101,8620971,,,,,,,2017-08-17,1,,,,,ミナミキュウシュウゼイリシカイクマモトケンレンゴウカイ,0
4711,1700150080349,01,1,2018-05-30,2017-01-26,国東地域産業雇用対策協議会,,499,大分県,国東市,国東町鶴川１３３４,,44,214,8730503,,,,,,,2017-01-26,1,,,,,クニサキチイキサンギョウコヨウタイサクキョウギカイ,0
4712,1700150083285,01,1,2018-06-05,2017-05-22,宇佐海軍航空隊跡保存会,,499,大分県,宇佐市,大字江須賀４０３５番地の２,,44,211,8720032,,,,,,,2017-05-22,1,,,,,ウサカイグンコウクウタイアトホゾンカイ,0
4713,1700150084028,01,0,2018-08-31,2017-06-21,きばる万葉工房,,499,大分県,竹田市,大字米納１１４９,,44,208,8780145,,,,,,,2017-06-21,1,,,,,キバルマンヨウコウボウ,0
9476,2700150080942,12,0,2020-05-15,2020-04-01,高江南３丁目自治会,,499,大分県,大分市,高江南３丁目３６－１１,,44,201,8701118,,,,,,,2017-02-17,1,,,,,タカエミナミサンチヨウメジチカイ,0
18915,4700150085411,01,1,2018-06-13,2017-09-26,あやめ台自治会,,499,大分県,日田市,大字有田９８５－４３,,44,204,8770000,,,,,,,2017-09-26,1,,,,,アヤメダイジチカイ,0
18916,4700150087440,01,1,2018-06-22,2018-02-15,川下山林共有,,499,大分県,日田市,大字川下高井町２７１,,44,204,8770067,,,,,,,2018-02-15,1,,,,,カワシタサンリンキヨウユウ,0
28432,6700150082150,01,1,2018-06-18,2017-04-04,大分県東九州新幹線整備推進期成会,,499,大分県,大分市,大手町３丁目１－１大分県庁交通政策課,,44,201,8700022,,,,,,,2017-04-04,1,,,,,オオイタケンヒガシキユウシユウシンカンセンセイビスイシンキセイカイ,0
28433,6700150087959,01,1,2018-06-22,2018-03-12,豊後大野市地域雇用創造協議会,,499,大分県,豊後大野市,三重町市場５７７ドルチェビル２Ｆ,,44,212,8797131,,,,,,,2018-03-12,1,,,,,ブンゴオオノシチイキコヨウソウゾウキヨウギカイ,0
37862,8700150080276,12,0,2019-03-05,2018-03-01,顔の見える日田材の家づくり等推進協議会,,499,大分県,日田市,大字東有田字新山２７７６－６,,44,204,8770000,,,,,,,2017-01-25,1,,,,,カオノミエルヒタザイノイエヅクリトウスイシンキヨウギカイ,0
37863,8700150081902,01,1,2018-06-19,2017-03-15,チーム２°Ｃおおいた協議会,,499,大分県,大分市,大字横尾３９０３－５,,44,201,8700126,,,,,,,2017-03-15,1,,,,,チームニドシーオオイタキヨウギカイ,0
42597,9700150081331,12,0,2018-10-02,2018-05-01,うすき農尊協同組合,,499,大分県,臼杵市,野津町大字西寒田２９８９番地,,44,206,8750237,,,,,,,2017-03-01,1,,,,,ウスキノウソンキヨウドウクミアイ,0
42598,9700150081991,01,1,2018-06-21,2017-03-16,国東半島宇佐地域世界農業遺産推進協議会,,499,大分県,大分市,大手町３丁目１－１大分県農林水産企画課内,,44,201,8700022,,,,,,,2017-03-16,1,,,,,クニサキハントウウサチイキセカイノウギヨウイサンスイシンキヨウギカイ,0
11510,3700150086427,01,1,2018-06-07,2017-12-11,第３５回国民文化祭宮崎県実行委員会、第２０回全国障害者芸術・文化祭実行委員会,,499,宮崎県,宮崎市,橘通東２丁目１０番１号,,45,201,8800805,,,,,,,2017-12-11,1,,,,,ダイサンジュウゴカイコクミンブンカサイミヤザキケンジッコウイインカイダイニジュッカイゼンコクショウガイシャゲイジュツブンカサイジッコウイインカイ,0
11511,3700150089256,01,0,2018-06-22,2018-06-07,庄内地区まちづくり協議会,,499,宮崎県,都城市,庄内町１２６９２番地,,45,202,8850114,,,,,,,2018-06-07,1,,,,,シヨウナイチクマチヅクリキヨウギカイ,0
15315,4700150085452,01,1,2018-05-01,2017-10-02,下野土地改良区,,499,宮崎県,西臼杵郡高千穂町,大字上野４９６３番地,,45,441,8821411,,,,,,,2017-10-02,1,,,,,シモノトチカイリョウク,0
19153,5700150085451,01,1,2018-05-01,2017-10-02,小又川土地改良区,,499,宮崎県,西臼杵郡高千穂町,大字上野４９６３番地,,45,441,8821411,,,,,,,2017-10-02,1,,,,,コマタカワトチカイリョウク,0
22994,6700150085450,01,1,2018-05-01,2017-10-02,神之水土地改良区,,499,宮崎県,西臼杵郡高千穂町,大字上野４９６３番地,,45,441,8821411,,,,,,,2017-10-02,1,,,,,カミノミズトチカイリョウク,0
26871,7700150080104,01,1,2018-05-30,2017-01-18,志和池中学校ＰＴＡ,,499,宮崎県,都城市,上水流町４３２３－１,,45,202,8851103,,,,,,,2017-01-18,1,,,,,シワチチュウガッコウピーティーエー,0
30713,8700150085449,01,1,2018-05-01,2017-10-02,黒口土地改良区,,499,宮崎県,西臼杵郡高千穂町,大字上野４９６３番地,,45,441,8821411,,,,,,,2017-10-02,1,,,,,クロクチトチカイリョウク,0
34578,9700150080523,01,1,2018-06-11,2017-02-03,丸野小学校ＰＴＡ,,499,宮崎県,都城市,野々美谷町２９４１番地,,45,202,8851104,,,,,,,2017-02-03,1,,,,,マルノショウガッコウピーティーエー,0
34579,9700150085448,01,1,2018-05-01,2017-10-02,浜之瀬土地改良区,,499,宮崎県,西臼杵郡高千穂町,大字上野４９６３番地,,45,441,8821411,,,,,,,2017-10-02,1,,,,,ハマノセトチカイリョウク,0
34580,9700150086578,01,1,2018-06-22,2017-12-14,宮崎アスレティックトレーナー協会,,499,宮崎県,宮崎市,大字浮田３３１３－１,,45,201,8802104,,,,,,,2017-12-14,1,,,,,ミヤザキアスレテイツクトレーナーキヨウカイ,0
5795,1700150080068,01,1,2018-06-05,2017-01-18,全日本国立医療労働組合鹿児島地区協議会,,499,鹿児島県,鹿児島市,易居町２－１有馬ビル２階,,46,201,8920815,,,,,,,2017-01-18,1,,,,,ゼンニホンコクリツイリヨウロウドウクミアイカゴシマチクキヨウギカイ,0
5796,1700150083871,01,1,2018-06-05,2017-06-13,瀬戸山自治会,,499,鹿児島県,肝属郡南大隅町,佐多伊座敷３３８３,,46,491,8932601,,,,,,,2017-06-13,1,,,,,セトヤマジチカイ,0
5797,1700150087385,01,1,2018-05-16,2018-02-15,千日町１・４番街区市街地再開発組合,,499,鹿児島県,鹿児島市,照国町３－２１第２大見ビル４０６号室,,46,201,8920841,,,,,,,2018-02-15,1,,,,,センニチチヨウイチヨンバンガイクシガイチサイカイハツクミアイ,0
5798,1700150087435,01,0,2018-04-19,2018-02-15,いちき串木野市職員厚生会,,499,鹿児島県,いちき串木野市,昭和通１３３番地１,,46,219,8960026,,,,,,,2018-02-15,1,,,,,イチキクシキノシシヨクインコウセイカイ,0
11604,2700150086898,01,1,2018-06-22,2017-12-28,伊仙町土地改良区,,499,鹿児島県,大島郡伊仙町,大字伊仙１８４２,,46,532,8918201,,,,,,,2017-12-28,1,,,,,イセンチヨウトチカイリヨウク,0
17390,3700150082871,01,1,2018-06-12,2017-05-08,財部町土地改良区,,499,鹿児島県,曽於市,財部町南俣１１２７５,,46,217,8994101,,,,,,,2017-05-08,1,,,,,タカラベチヨウトチカイリヨウク,0
17391,3700150087549,01,1,2018-06-22,2018-02-20,宇宿集落きょらの郷づくり会,,499,鹿児島県,奄美市,笠利町大字宇宿１６５－１,,46,222,8940501,,,,,,,2018-02-20,1,,,,,ウシユクシユウラクキヨラノサトヅクリカイ,0
23159,4700150083910,01,1,2018-05-08,2017-06-13,伊仙町土地改良区,,499,鹿児島県,大島郡伊仙町,大字馬根２７３,,46,532,8918326,,,,,,,2017-06-13,1,,,,,イセンチョウトチカイリョウク,0
34729,6700150080039,01,1,2018-06-15,2017-01-17,リーディングプロジェクト創造事業企画委員会,,499,鹿児島県,鹿児島市,鴨池新町１０－１（県庁生活・文化課内）,,46,201,8900064,,,,,,,2017-01-17,1,,,,,リーデイングプロジエクトソウゾウジギヨウキカクイインカイ,0
34730,6700150080170,01,1,2018-06-11,2017-01-20,大島地域青少年育成推進協議会,,499,鹿児島県,奄美市,名瀬永田町１７－３,,46,222,8940023,,,,,,,2017-01-20,1,,,,,オオシマチイキセイショウネンイクセイスイシンキョウギカイ,0
34731,6700150080575,01,1,2018-06-15,2017-02-06,鹿児島県ユニセフ協会,,499,鹿児島県,鹿児島市,東千石町１４－２－５階,,46,201,8920842,,,,,,,2017-02-06,1,,,,,カゴシマケンユニセフキヨウカイ,0
34732,6700150086960,01,1,2018-06-22,2018-01-09,いぶすき西郷どん実行委員会,,499,鹿児島県,指宿市,十町２４２４番地,,46,210,8910402,,,,,,,2018-01-09,1,,,,,イブスキセゴドンジツコウイインカイ,0
46346,8700150084797,01,1,2018-04-24,2017-08-17,錦江町まち・ひと・「ＭＩＲＡＩ」創生協議会,,499,鹿児島県,肝属郡錦江町,神川３３０６－４,,46,490,8932301,,,,,,,2017-08-17,1,,,,,キンコウチヨウマチヒトミライソウセイキヨウギカイ,0
52095,9700150080829,01,1,2018-06-21,2017-02-14,赤木名放課後児童クラブ,,499,鹿児島県,奄美市,笠利町大字中金久５２－６,,46,222,8940512,,,,,,,2017-02-14,1,,,,,アカキナホウカゴジドウクラブ,0
52096,9700150085258,01,1,2018-06-21,2017-09-20,大熊町内会,,499,鹿児島県,奄美市,名瀬大熊町１１－１３,,46,222,8940009,,,,,,,2017-09-20,1,,,,,ダイクマチヨウナイカイ,0
5621,1700150082270,01,1,2018-06-05,2017-04-07,恩納村赤土等流出防止対策地域協議会,,499,沖縄県,国頭郡恩納村,字恩納２４５１,,47,311,9040411,,,,,,,2017-04-07,1,,,,,オンナソンアカツチトウリユウシユツボウシタイサクチイキキヨウギカイ,0
11200,2700150081759,01,1,2018-06-07,2017-03-07,沖縄県立那覇工業高等学校ＰＴＡ,,499,沖縄県,浦添市,勢理客４丁目２２番１号,,47,208,9012122,,,,,,,2017-03-07,1,,,,,オキナワケンリツナハコウギヨウコウトウガツコウピーテイーエー,0
16815,3700150080446,01,1,2018-05-30,2017-02-02,沖縄県青年団協議会,,499,沖縄県,那覇市,久米２丁目１５－２３（沖縄県青年会館内）,,47,201,9000033,,,,,,,2017-02-02,1,,,,,オキナワケンセイネンダンキョウギカイ,0
22374,4700150082037,01,1,2018-06-13,2017-03-24,沖縄県知的障害者福祉協会,,499,沖縄県,沖縄市,知花６丁目３６番２号（楓葉館内）,,47,211,9042143,,,,,,,2017-03-24,1,,,,,オキナワケンチテキシヨウガイシヤフクシキヨウカイ,0
28006,5700150082143,01,1,2018-06-14,2017-03-31,グリーンプラザ愛知管理組合,,499,沖縄県,宜野湾市,愛知１丁目５－７－４０３,,47,205,9012206,,,,,,,2017-03-31,1,,,,,グリーンプラザアイチカンリクミアイ,0
33646,6700150083834,01,1,2018-06-18,2017-06-13,ゆいまーる学童クラブ運営委員会,,499,沖縄県,石垣市,字桃里１６８－５６,,47,207,9070241,,,,,,,2017-06-13,1,,,,,ユイマールガクドウクラブウンエイイインカイ,0
44923,8700150087115,01,1,2018-06-22,2018-01-25,沖縄県産業教育振興会,,499,沖縄県,那覇市,泉崎１丁目２－２（沖縄県庁１３階）,,47,201,9000021,,,,,,,2018-01-25,1,,,,,オキナワケンサンギヨウキヨウイクシンコウカイ,0
44924,8700150089235,01,1,2018-07-02,2018-06-07,沖縄市池原自治会,,499,沖縄県,沖縄市,池原１丁目２５番１５号,,47,211,9042141,,,,,,,2018-06-07,1,,,,,オキナワシイケハラジチカイ,0
50546,9700150080746,01,1,2018-06-21,2017-02-13,オナガ雄志後援会,,499,沖縄県,那覇市,字大道４９番地大幸ビル２階,,47,201,9020066,,,,,,,2017-02-13,1,,,,,オナガタケシコウエンカイ,0
50547,9700150082437,01,1,2018-06-21,2017-04-14,伊江土地改良区,,499,沖縄県,国頭郡伊江村,字東江上１７７０－１,,47,315,9050501,,,,,,,2017-04-14,1,,,,,イエトチカイリヨウク,0
727,1700150080002,13,0,2019-09-20,2019-09-17,シティバンク，エヌ・エイ,,401,東京都,千代田区,大手町１丁目１番１号,,13,101,1000004,アメリカ合衆国サウスダコタ州、スー・フォールズ、サウス・コーポレート・プレイス５８００,,,,,,2017-01-17,1,,,,,シテイバンクエヌエイ,0
728,1700150080200,01,1,2018-06-21,2017-01-24,Ｓｃｈｕｅｔｚ　ＧｍｂＨ　＆　Ｃｏ．　ＫＧａＡ,,401,,,,,,,,Ｓｃｈüｔｚｓｔｒａßｅ　１２，５６２４２　Ｓｅｌｔｅｒｓ，Ｇｅｒｍａｎｙ,00109038,,,,,2017-01-24,1,,,,,シユツツゲームベーハーアンドコーポレーシヨンカーゲーアーア,0
729,1700150080398,01,0,2017-02-01,2017-01-27,青島新和優品国際貿易有限公司,,401,大阪府,寝屋川市,成美町１番３７号,,27,215,5720046,中華人民共和国山東省青島市＿山区石嶺路３９号２号楼１００１室,00105942,,,,,2017-01-27,1,,,,,,0
730,1700150080654,01,1,2018-06-21,2017-02-10,ＯＲＡＮＧＥ　ＩＹＯ　Ｓ．Ａ．,,401,愛媛県,今治市,山路８３２－３株式会社伊予捺染　内,,38,202,7940072,１５ｔｈ　Ｆｌｏｏｒ　Ｂａｎｃｏ　Ｇｅｎｅｒａｌ　Ｔｏｗｅｒ，Ａｑｕｉｌｉｎｏ　ｄｅ　ｌａ　Ｇｕａｒｄｉａ　Ｓｔｒｅｅｔ，Ｍａｒｂｅｌｌａ，Ｐａｎａｍａ　Ｃｉｔｙ，Ｒｅｐｕｂｌｉｃ　ｏｆ　Ｐａｎａｍａ,,,,,,2017-02-10,1,,,,,オレンジイヨエスエー,0
731,1700150080745,12,0,2019-05-09,2018-10-25,ＢＥＩＧＥ　ＣＲＥＡＴＩＶＥ＆ＣＯ．，ＩＮＣ．,,401,東京都,港区,白金４丁目１２－１５フェリオ白金１０２号室,,13,103,1080072,アメリカ合衆国、ニューヨーク州、ブルックリン、ノース１１ストリート１８１番地４０６号室,,,,,,2017-02-13,1,,,,,ベージユクリエイテイブアンドシーオーインク,0
732,1700150081009,01,1,2018-06-21,2017-02-17,東莞市傑欧服飾有限公司,,401,東京都,千代田区,九段北１丁目１３－１九段中坂ビル７０１号室,,13,101,1020073,中華人民共和国広東省東莞市虎門鎮博頭工業路２５号４０２室,,,,,,2017-02-17,1,,,,,トウカンシケツオウフクシヨクユウゲンコウシ,0
733,1700150081090,01,1,2018-06-21,2017-02-20,ＫＣＥ　ＥＬＥＣＴＲＯＮＩＣＳ　ＰＵＢＬＩＣ　ＣＯＭＰＡＮＹ　ＬＩＭＩＴＥＤ,,401,東京都,文京区,後楽１丁目２－９,,13,105,1120004,７２－７２／１－３　Ｃｈａｌｏｎｇｋｒｕｎｇ　３１　Ａｌｌｅｙ，Ｌａｍｐｌａｔｅｗ　Ｓｕｂ－ｄｉｓｔｒｉｃｔ，Ｌａｔｋｒａｂａｎｇ　Ｄｉｓｔｒｉｃｔ，Ｂａｎｇｋｏｋ,,,,,,2017-02-20,1,,,,,ケーシーイーエレクトロニクスパブリツクカンパニーリミテツド,0
734,1700150081207,12,0,2018-12-05,2018-10-29,ＯＭＥＸ　ＩＮＴＥＲＮＡＴＩＯＮＡＬ株式会社,,401,千葉県,東金市,台方４０７番地１ハイツフレグランス１－１０１,,12,213,2830811,スリランカ、キャンディ、アクラナ、ドダンゴラ、第２３９／１,,,,,,2017-02-23,1,,,,,オメツクスインターナシヨナルカブシキガイシヤ,0
735,1700150081223,12,0,2018-12-20,2018-07-13,ムツミ・エンタープライズ・カナダ・リミテッド,,401,京都府,京都市中京区,河原町通二条上る清水町３４１番地,,26,104,6040911,カナダ　ブリティッシュコロンビア　リッチモンド　シェルロード２３３－２６８８,,,,,,2017-02-23,1,,,,,ムツミエンタープライズカナダリミテツド,0
736,1700150081405,11,0,2018-09-20,2018-07-11,蘇州人旺企業管理諮詢有限公司,,401,京都府,京都市下京区,西新屋敷上之町１４１番地Ｍｏｒｅ七条３０７号室,,26,106,6008826,中華人民共和国江蘇省蘇州市蘇州工業園区蘇州大道西８号中銀恵龍ビル１棟３１０５室,,,,,,2017-03-02,1,,,,,ソシユウレンワンキギヨウカンリシジユンユウゲンコウシ,0
737,1700150081512,01,1,2018-06-21,2017-03-03,ＵＮＩＣＯＲＮ　ＨＯＬＤＩＮＧＳ　ＬＩＭＩＴＥＤ,,401,北海道,虻田郡倶知安町,字山田１９５－１－１０１,,01,400,0440081,ＰＯ　Ｂｏｘ　２１７，Ａｐｉａ，Ｓａｍｏａ,,,,,,2017-03-03,1,,,,,ユニコーンホールデイングスリミテツド,0
738,1700150081520,01,1,2018-06-21,2017-03-03,Ｍａｙａｒｔ　Ｌｉｍｉｔｅｄ,,401,,,,,,,,１６／Ｆ，Ｖ　Ｈｅｕｎ　Ｂｕｉｌｄｉｎｇ，１３８　Ｑｕｅｅｎ’ｓ　Ｒｏａｄ，Ｃｅｎｔｒａｌ，Ｈｏｎｇ　Ｋｏｎｇ,,,,,,2017-03-03,1,,,,,メイヤルリミテツド,0
739,1700150081818,12,0,2019-06-18,2019-04-23,ＳＩＥＭＥＮＳ　ＧＡＭＥＳＡ　ＲＥＮＥＷＡＢＬＥ　ＥＮＥＲＧＹ　ＰＴＹ　ＬＴＤ,,401,東京都,千代田区,大手町１丁目５番１号大手町ファーストスクエア・ウエストタワー２Ｆ,,13,101,1000004,オーストラリア連邦、３１５３、ビクトリア州、ベイズウォーター、マウンテンハイウェイ８８５番地,,,,,,2017-03-13,1,,,,,シーメンスガメサリニユーアブルエナジーピーテイーワイエルテイーデイー,0
740,1700150081842,01,1,2018-06-21,2017-03-13,Ｔｒａｎｇｏ　Ｐｒｏｄｕｃｔｉｏｎ,,401,東京都,港区,芝浦４丁目１０番１－２７０２号,,13,103,1080023,フランス国グラベル３４７９０カデュセ通り１６２,,,,,,2017-03-13,1,,,,,トランゴプロダクシヨン,0
741,1700150081875,01,1,2018-06-21,2017-03-14,Ｊ．Ｓ．ＥＮＴＥＲＰＲＩＳＥＳ,,401,神奈川県,藤沢市,長後６１９番地ブルーハイツＡ２０１,,14,205,2520801,スリランカ民主社会主義共和国，カンディ，アクラナ，ワラガスヒンナ，Ｎｏ．３１５／２,,,,,,2017-03-14,1,,,,,ジエイエスエンタープライセス,0
742,1700150081891,01,1,2018-06-21,2017-03-15,ＳＥＮＴＲＩＸ　ＣＯＲＰＯＲＡＴＩＯＮ　ＬＩＭＩＴＥＤ,,401,北海道,虻田郡倶知安町,字山田１９５－１－３１５　６１０,,01,400,0440081,Ｒｏｏｍ　４０７，Ｈｏｕｓｔｏｎ　Ｃｅｎｔｒｅ，６３　Ｍｏｄｙ　Ｒｏａｄ，Ｔｓｉｍｓｈａｔｓｕｉ　Ｅａｓｔ，Ｋｏｗｌｏｏｎ，Ｈｏｎｇ　Ｋｏｎｇ．,,,,,,2017-03-15,1,,,,,セントリツクスコーポレーシヨンリミテツド,0
743,1700150081933,12,0,2019-09-26,2019-02-18,Ａｐｔｉｍ　Ｆｅｄｅｒａｌ　Ｓｅｒｖｉｃｅｓ　ＬＬＣ,,401,東京都,港区,虎ノ門５丁目１３番１号虎ノ門４０ＭＴビル７階,,13,103,1050001,アメリカ合衆国バージニア州アレクサンドリア、デューク・ストリート１７２５、スイート４００,,,,,,2017-03-15,1,,,,,アプテイムフエデラルサービシーズエルエルシー,0
744,1700150081958,12,0,2019-03-07,2018-08-10,Ｆｏｒｅｓｔ　Ｆｕｎｄｉｎｇ　ＬＬＣ,,401,東京都,江東区,豊洲６丁目２番３１－１９１７号,,13,108,1350061,アメリカ合衆国ネバダ州ラスベガス市イーストサハラアベニュー１８１０、スイート１２３,,,,,,2017-03-16,1,,,,,フオレストフアンデイングエルエルシー,0
745,1700150082015,01,1,2018-06-21,2017-03-17,アロハ・ミューズ・アンド・カンパニー・インコーポレーテッド,,401,東京都,中央区,銀座１丁目１５番７号ＭＡＣ銀座ビル３階,,13,102,1040061,アメリカ合衆国ハワイ州ホノルル市ユニオン・モール１１３６番３０１号,,,,,,2017-03-17,1,,,,,アロハミユーズアンドカンパニーインコーポレーテツド,0
746,1700150082279,01,1,2019-10-02,2017-04-10,有限会社グローバルパートナー,,401,沖縄県,中頭郡北谷町,字港８番地７,,47,326,9040114,クック諸島　ラロトンガ島アバルア、メインロード、ＡＮＺハウス　サウスパックトラストリミテッド,,,,,,2017-04-10,1,,,,,ユウゲンガイシヤグローバルパートナー,0
