4479,5700150087258,01,1,2018-04-18,2018-02-13,Ｉｗａｋｉ　Ｌａｎｄ　ＬＬＣ,,401,,,,,,,,１６７９　Ｓ．Ｄｕｐｏｎｔ　Ｈｗｙ．，Ｓｕｉｔｅ　１００　Ｄｏｖｅｒ　Ｄｅｌａｗａｒｅ　１９９０１,,,,,,2018-02-13,1,,,,,イワキランドエルエルシー,0
4480,5700150087456,01,1,2018-06-22,2018-02-20,ＮＡＱ　ＡＬＰＩＮＥ　ＰＴＥ．ＬＴＤ．,,401,,,,,,,,３８Ｂ　Ｃｉｒｃｕｌａｒ　Ｒｏａｄ　Ｓｉｎｇａｐｏｒｅ,,,,,,2018-02-20,1,,,,,ナツクアルパインピーテイーイーリミテツド,0
4481,5700150087464,01,1,2018-06-22,2018-02-20,Ｓｋｙｔｏ　Ｉｎｖｅｓｔｍｅｎｔ　Ｐｔｅ　Ｌｔｄ,,401,,,,,,,,６　Ｎａｐｉｅｒ　Ｒｏａｄ，＃０４－１０　Ｇｌｅｎｅａｇｌｅｓ　Ｍｅｄｉｃａｌ　Ｃｅｎｔｒｅ，Ｓｉｎｇａｐｏｒｅ　２５８４９９,,,,,,2018-02-20,1,,,,,スカイトーインベストメンツピーテイーエーリミテツド,0
4482,5700150087489,01,1,2018-06-22,2018-02-20,Ｎｉｐｐｏｎ－Ｔｈａｉ　Ｃｏｍｐａｎｙ　Ｌｉｍｉｔｅｄ,,401,東京都,中野区,中野５丁目５２番１５－８２０号,,13,114,1640001,タイ王国、バンコク市、クロンルアンエリア、クロンヌエンサブエリア、ビレッジ１６、３１／８５４,,,,,,2018-02-20,1,,,,,ニツポンタイカンパニーリミテツド,0
4483,5700150087654,13,0,2020-05-25,2020-05-13,オナリモン６４ジャパン・エルエルシー,,401,東京都,千代田区,丸の内１丁目８番３号丸の内トラストタワー本館２６階,,13,101,1000005,アメリカ合衆国デラウエア州ウィルミントン、オレンジ・ストリート１２０９、ナショナル・レジスタード・エージェント・インク内,,,,,,2018-02-27,1,,,,,オナリモンロクジユウヨンジヤパンエルエルシー,0
4484,5700150087662,01,1,2018-06-22,2018-02-27,揚州正道光電商貿有限公司,,401,兵庫県,尼崎市,東園田町３丁目４４－１４,,28,202,6610953,中華人民共和国江蘇省揚州市文昌西路４３号,,,,,,2018-02-27,1,,,,,ヨウシユウマサミチコウデンシヨウボウユウゲンコウシ,0
4485,5700150087943,01,1,2018-05-16,2018-03-09,Ａｓｃｅｎｄ　Ｐｅｒｆｏｒｍａｎｃｅ　Ｍａｔｅｒｉａｌｓ　Ｏｐｅｒａｔｉｏｎｓ　ＬＬＣ,,401,,,,,,,,１０１０　Ｔｒａｖｉｓ　Ｓｔｒｅｅｔ，Ｓｕｉｔｅ　９００，Ｈｏｕｓｔｏｎ，ＴＸ　７７００２，ＵＳＡ,,,,,,2018-03-09,1,,,,,アセンドパフオーマンスマテリアルズオペレーシヨンズエルエルシー,0
4486,5700150088033,13,0,2020-03-30,2020-03-25,株式会社　コーワグローバル,,401,東京都,千代田区,岩本町２丁目９番７号ＲＥＣビル５Ｆ,,13,101,1010032,大韓民国ソウル特別市麻浦区トンマク路３ギル５１、３０２号（西橋洞、ソジュビル）,,,,,,2018-03-15,1,,,,,カブシキガイシヤコーワグローバル,0
4487,5700150088058,01,1,2018-05-30,2018-03-15,ミリア・ツー・ホンコン・リミテッド,,401,東京都,港区,元赤坂１丁目１番７－１００６号,,13,103,1070051,中華人民共和国香港特別行政区セントラル、クィンズ・ロード１５、ザ・ランドマーク、エジンバラ・タワー３３階,,,,,,2018-03-15,1,,,,,ミリアツーホンコンリミテツド,0
4488,5700150088090,01,1,2018-06-20,2018-03-19,寧波興升国際船舶代理　有限公司,,401,千葉県,市川市,塩焼２丁目２番７３号,,12,203,2720114,中華人民共和国浙江省寧波高新区万特商務中心１号楼４－８室,,,,,,2018-03-19,1,,,,,ニンポーコウシヨウコクサイセンパクダイリユウゲンコウシ,0
4489,5700150088181,01,1,2018-06-22,2018-03-27,ＮＩＣＨＩ－ＩＮ　ＢＩＯ　ＳＣＩＥＮＣＥＳ　ＰＲＩＶＡＴＥ　ＬＩＭＩＴＥＤ,,401,,,,,,,,Ｂ６，１３　ＺＡＫＡＲＩＡＨ　ＣＯＬＯＮＹ　３ＲＤ　ＳＴＲＥＥＴ，ＣＨＯＯＬＡＩＭＥＤＵ，ＣＨＥＮＮＡＩ　ＴＡＭＩＬＮＡＤＵ－６０００９４,,,,,,2018-03-27,1,,,,,ニチインバイオサイエンスプライベートリミテツド,0
4490,5700150088479,01,0,2018-04-23,2018-04-18,ＧＡＬＡＸＹ　ＣＯＮＳＵＬＴＡＮＣＹ　ＬＩＭＩＴＥＤ,,401,,,,,,,,Ｒｏｏｍ　Ｃ１，５Ｆ／Ｈｏｎｇ　Ｎｉｎｇ　Ｂｕｉｌｄｉｎｇ，８３　ＨｏｎｇＮｉｎｇ　Ｒｏａｄ，　Ｋｗｕｎ　Ｔｏｎｇ，Ｋｏｗｌｏｏｎ，Ｈｏｎｇ　Ｋｏｎｇ,,,,,,2018-04-18,1,,,,,ギヤラクシーコンサルタンシーリミテツド,0
4491,5700150088487,01,0,2018-04-23,2018-04-18,ＳＨＩＦＴ　ＩＮＤＩＡ　ＰＲＩＶＡＴＥ　ＬＩＭＩＴＥＤ,,401,,,,,,,,４０４，Ｐｅｎｔａｇｏｎ　２，Ｍａｇａｒｐａｔｔａ　Ｃｉｔｙ，Ｈａｄａｐｓａｒ，Ｐｕｎｅ－４１１０２８，Ｍａｈａｒａｓｈｔｒａ，Ｉｎｄｉａ,,,,,,2018-04-18,1,,,,,シフトインデイアプライベートリミテツド,0
4492,5700150088586,01,0,2018-05-01,2018-04-25,セブ・エア・インク,,401,東京都,中央区,日本橋茅場町２丁目５番６号日本橋大江戸ビル７階,,13,102,1030025,フィリピン共和国セブ・シティ、オスメーニャ・ブールバード、ドンニャ・ホアニータ・マルケス・リム・ビルディング２階,,,,,,2018-04-25,1,,,,,セブエアインク,0
4493,5700150088925,01,1,2018-07-24,2018-05-23,フォーカスゲームス　日本事務所,,401,東京都,中央区,日本橋本町３丁目３－６ワカ末ビル７階,,13,102,1030023,中国上海市黄浦区打浦路１号金玉蘭広場１００４号室,00114013,,,,,2018-05-23,1,,,,,フオーカスゲームスニホンジムシヨ,0
4494,5700150089031,01,0,2018-05-30,2018-05-25,Ｐｒｅｃｉｏｕｓ　Ｗａｙ　Ｉｎｔｅｒｎａｔｉｏｎａｌ　ＬＴＤ．,,401,,,,,,,,４ｔｈ　ＦＬＯＯＲ　ＷＩＳＭＡ　ＣＯＮＣＯＲＤＥ，ＮＯ．２　ＪＡＬＡＮ　ＳＵＬＴＡＮ　ＩＳＭＡＩＬ，５０２５０　ＫＵＡＬＡ　ＬＵＭＰＵＲ．,,,,,,2018-05-25,1,,,,,プレシヤスウエイインターナシヨナル,0
4495,5700150089064,01,0,2018-06-01,2018-05-29,Ｅａｓｔｍｏｒｅ　Ｒｅｓｅａｒｃｈ　Ａｓｉａ，ＬＬＣ,,401,東京都,千代田区,丸の内１丁目８番３号丸の内トラストタワー２０階,,13,101,1000005,アメリカ合衆国１０００５、ニューヨーク州、ニューヨーク、ウォールストリート４０、１７階,,,,,,2018-05-29,1,,,,,イーストモアリサーチアジアエルエルシー,0
4496,5700150089205,01,0,2018-06-08,2018-06-05,Ｍ’Ｓ　ＤＥＳＩＧＮ　ＣＯ．，ＬＴＤ．,,401,千葉県,市川市,南行徳１丁目１９番５号らすーる行徳１００３,,12,203,2720138,タイ王国、バンコク、バンナー、バンナー、バンナートラッドロード、ソイバンナートラッド２５、１ＭＤタワー１９階、ルームナンバーＣ３、Ｅ、Ｆ,,,,,,2018-06-05,1,,,,,エムズデザインコーポレートリミテツド,0
4497,5700150089576,01,0,2018-06-28,2018-06-25,コンパニー・フィナンシエール・ドゥ・バロワ,,401,東京都,世田谷区,世田谷４丁目１４番３２－６０１号,,13,112,1540017,フランス共和国、マルゼヴィル市、ポール・ベール通り１１番,,,,,,2018-06-25,1,,,,,コンパニーフイナンシエールドウバロワ,0
4498,5700150089642,01,0,2018-07-02,2018-06-27,Ｄｅｓｉｇｎ　Ｉｎｔｅｒｖｅｎｔｉｏｎ　Ｐｔｅ．Ｌｔｄ．,,401,,,,,,,,７５Ｅ　ＬＯＥＷＥＮ　ＲＯＡＤ　＃７５Ｅ　ＴＡＮＧＬＩＮ　ＣＡＭＰ　ＳＩＮＧＡＰＯＲＥ,,,,,,2018-06-27,1,,,,,デザインインターベンシヨンピテイーイーリミテツド,0
4499,5700150089774,01,0,2018-07-02,2018-06-27,ＬａＳａｌｌｅ　Ｊａｐａｎ　Ｌｏｇｉｓｔｉｃｓ　Ⅲ　Ｓ１　Ｐｔｅ．Ｌｔｄ．,00113787,401,,,,,,,,９　ＲＡＦＦＬＥＳ　ＰＬＡＣＥ　＃３７－０１　ＲＥＰＵＢＬＩＣ　ＰＬＡＺＡ　ＳＩＮＧＡＰＯＲＥ,,,,,,2018-06-27,1,,,,,ラサールジヤパンロジステイクススリーエスワン,0
4500,5700150089865,01,0,2018-07-10,2018-07-05,Ｋａｗｉｃｋ　Ｉｎｖｅｓｔｍｅｎｔ　Ｌｉｍｉｔｅｄ,,401,,,,,,,,９Ｂ，Ｍｏｎｔｅｂｅｌｌｏ，Ｒｅｐｕｌｓｅ　Ｂａｙ　Ｒｏａｄ　４１，Ｈｏｎｇ　Ｋｏｎｇ,,,,,,2018-07-05,1,,,,,カウイツクインベストメントリミテツド,0
4501,5700150089873,01,0,2018-07-10,2018-07-05,ＦＬＯＷＥＬＬ　ＩＮＣ,,401,,,,,,,,Ｌｅ　Ｓａｎａｌｅｌｅ　Ｃｏｍｐｌｅｘ，Ｇｏｌｄ－Ｉｎ　Ｃｈａｍｂｅｒｓ，Ｖａｅａ　Ｓｔｒｅｅｔ，Ａｐｉａ，Ｓａｍｏａ,,,,,,2018-07-05,1,,,,,フロルウエルインク,0
4502,5700150089948,01,0,2018-07-11,2018-07-06,ＨＡＮＡＴＯＵＲ　ＳＥＲＶＩＣＥ　ＩＮＣ．,,401,,,,,,,,大韓民国ソウル市鍾路区仁寺洞５ギル４１,,,,,,2018-07-06,1,,,,,ハナツアーサービスインク,0
4503,5700150089997,01,0,2018-07-17,2018-07-11,Ｎｉｈｏｎｉｕｍ　Ｃａｐｉｔａｌ　Ｄｅｓｉｇｎａｔｅｄ　Ａｃｔｉｖｉｔｙ　Ｃｏｍｐａｎｙ,,401,東京都,千代田区,丸の内３丁目１番１号東京共同会計事務所内,,13,101,1000005,アイルランド、ダブリン２、モールスワース・ストリート３２,,,,,,2018-07-11,1,,,,,ニホニウムキヤピタルデシグネーテツドアクテイビテイーカンパニー,0
5388,6700150080088,01,1,2018-06-22,2017-01-18,Ｒｏｌｌ　Ｇｒｏｕｐ　Ｉｎｔｅｒｎａｔｉｏｎａｌ　Ｂ．Ｖ．,,401,神奈川県,横浜市西区,北幸２丁目５番１７号横浜ＮＳビル,,14,103,2200004,オランダ国・２９０９ＶＡ・カペレ・アーン・デン・エイセル・ファシナショ・ブレヴァール８８２,,,,,,2017-01-18,1,,,,,ロールグループインターナシヨナルビーヴイ,0
5389,6700150080138,12,1,2018-11-22,2018-02-27,Ｅａｔｏｎ　Ｖａｎｃｅ　Ａｓｉａ　Ｐａｃｉｆｉｃ　Ｌｔｄ．,,401,東京都,千代田区,大手町１丁目１番１号大手町パークビルディング,,13,101,1000004,英領ケイマン諸島、グランド・ケイマン、ジョージ・タウン、エルジン・アベニュー１９０、インタートラスト・コーポレート・サービス（ケイマン）・リミテッド内,,,,,,2017-01-20,1,,,,,イートンバンスアジアパシフイツクリミテツド,0
5390,6700150080410,01,1,2018-06-22,2017-01-27,Ｋ．Ｐ．ＡＧＥＮＣＩＥＳ,,401,茨城県,筑西市,西谷貝３６５－１天貝１－２,,08,227,3080054,スリランカ民主社会主義共和国ガルムールワ、マーダンペロード、グレースランドワッタ、ＮＯ．０５,,,,,,2017-01-27,1,,,,,ケイピーエージエンシーズ,0
5391,6700150080963,01,1,2018-06-22,2017-02-17,瀋陽悦民商貿有限公司,,401,東京都,江東区,東陽５丁目３１－２９－２０４,,13,108,1350016,中国瀋陽市于洪区黄河北大街１００－１号８５棟（１－３－１）,,,,,,2017-02-17,1,,,,,シンヨウエツミンシヨウボウユウゲンコウシ,0
5392,6700150080988,12,1,2018-07-03,2017-04-24,モリン・エックスポト・インポート・プライベート・リミテド,,401,群馬県,太田市,東別所町３０５－１,,10,205,3730815,ネパール連邦民主共和国カトマンズ市第３１区プタリサダク,,,,,,2017-02-17,1,,,,,モリンエックスポトインポートプライベートリミテド,0
5393,6700150081004,12,1,2019-03-26,2017-08-18,飛拓無限信息技術（北京）股份有限公司,00109252,401,東京都,港区,赤坂１丁目３番５号,,13,103,1070052,中華人民共和国北京市海淀区上地東里一区４号楼科貿大厦２０９号,,,,,,2017-02-17,1,,,,,フラクタリストペキンユウゲンコウジ,0
5394,6700150081053,01,1,2017-03-27,2017-02-20,Ｓｏｌａｃｅ　Ｃｏｒｐｏｒａｔｉｏｎ,,401,,,,,,,,５３５　ＬＥＧＧＥＴ　ＤＲＩＶＥ　３ＲＤ　ＦＬＯＯＲ　ＯＴＴＡＷＡ　ＯＮＴＡＲＩＯ　ＣＡＮＡＤＡ　Ｋ２Ｋ　３Ｂ８,,,,,,2017-02-20,1,,,,,,0
5395,6700150081086,01,1,2018-06-22,2017-02-20,ＰＰＦＡ　Ｊａｐａｎ　Ｐｒｅｆ　Ｉｎｖｅｓｔｏｒ　Ｐｔｅ．Ｌｔｄ．,,401,,,,,,,,０１８９６１、１２マリーナビュー　＃２１－０１、アジアスクエアタワー２,,,,,,2017-02-20,1,,,,,ピーピーエフエージヤパンピーアールイーエフインベスターピーテイーイーリミテツド,0
5396,6700150081136,01,1,2018-06-22,2017-02-22,Ｅｌｓｅｖｉｅｒ　Ｉｎｃ．,,401,,,,,,,,１２０９　Ｏｒａｎｇｅ　Ｓｔｒｅｅｔ，ｉｎ　ｔｈｅ　Ｃｉｔｙ　ｏｆ　Ｗｉｌｍｉｎｇｔｏｎ，Ｃｏｕｎｔｒｙ　ｏｆ　Ｎｅｗ　Ｃａｓｔｌｅ　Ｚｉｐ　Ｃｏｄｅ　１９８０１　Ｕ．Ｓ．Ａ．,,,,,,2017-02-22,1,,,,,エルゼビアインク,0
5397,6700150081268,01,1,2018-06-22,2017-02-24,株式会社　ラブコスメ,,401,大阪府,吹田市,片山町２丁目１１番５１－５０７号,,27,205,5640082,大韓民国ソウル特別市松坡区忠愍路６６、９階、Ｙ－９０３１（文井洞、ガーデンファイブ）,,,,,,2017-02-24,1,,,,,カブシキガイシヤラブコスメ,0
5398,6700150081466,12,1,2018-06-22,2017-03-27,ＵＳＨＡＲＡ　ＴＲＡＤＥ　ＣＥＮＴＲＥ,,401,千葉県,白井市,中２１７番７－Ｃ,,12,232,2701406,スリランカ民主社会主義共和国ジャエラウィーワラマワッタスハンダＮｏ：１４７／Ｂ,,,,,,2017-03-03,1,,,,,ウシヤラトレードセンター,0
5399,6700150081516,01,1,2018-06-22,2017-03-03,Ｇｏｌｄ　Ｙａｒｄ　Ｒｅｓｏｕｒｃｅｓ　Ｉｎｖｅｓｔｍｅｎｔｓ　Ｌｉｍｉｔｅｄ,,401,北海道,虻田郡倶知安町,字山田１９５－１－３１１,,01,400,0440081,Ｆｌａｔ　Ｂ，５／Ｆ．，Ｋｉｕ　Ｆｕ　Ｃｏｍｍｅｒｃｉａｌ　Ｂｕｉｌｄｉｎｇ，３００　Ｌｏｃｋｈａｒｔ　Ｒｏａｄ，Ｗａｎｃｈａｉ，ＨＯＮＧ　ＫＯＮＧ,,,,,,2017-03-03,1,,,,,ゴールドヤードリソースインベストメンツリミテツド,0
5400,6700150081706,01,1,2018-06-22,2017-03-06,ＳＨＡＮＴＨＩ　ＭＥＴＡＬ　ＩＮＤＵＳＴＲＩＥＳ　ＰＲＩＶＡＴＥ　ＬＩＭＩＴＥＤ,,401,茨城県,筑西市,直井７８１番地１,,08,227,3080803,スリランカ民主社会主義共和国ミヌワンゴダ、ボラゴダワッタ,,,,,,2017-03-06,1,,,,,シヤンテイメタルインダストリーズプライベートリミテツド,0
5401,6700150081904,01,1,2018-06-22,2017-03-15,プレミアワールドワイドインベストメンツリミテッド,,401,東京都,渋谷区,恵比寿西１丁目３６－２ＴＨＥ　ＣＯＮＯＥ　代官山９０８,,13,113,1500021,２４　Ｄｅ　Ｃａｓｔｒｏ　Ｓｔｒｅｅｔ，Ｗｉｃｋｈａｍｓ　Ｃａｙ　１　Ｒｏａｄ　Ｔｏｗｎ，Ｔｏｗｎ，Ｔｏｒｔｏｌａ　Ｂｒｉｔｉｓｈ　Ｖｉｒｇｉｎ　Ｉｓｌａｎｄ,,,,,,2017-03-15,1,,,,,プレミアワールドワイドインベストメンツリミテツド,0
5402,6700150082134,13,1,2018-06-12,2017-07-26,ＳＭ　ＬＩＮＥ　ＣＯＲＰＯＲＡＴＩＯＮ,,401,東京都,港区,芝３丁目４番１５号,,13,103,1050014,大韓民国ソウル特別市永登浦区国際金融路２ギル２５（汝矣島洞）,,,,,,2017-03-31,1,,,,,エスエムラインコーポレーシヨン,0
5403,6700150082209,01,1,2018-05-01,2017-04-05,星普工業株式会社,,401,千葉県,千葉市中央区,中央１丁目７－８シグマビル７階,,12,101,2600013,大韓民国仁川広域市西区佳佐洞５７０－７,,,,,,2017-04-05,1,,,,,ソンボコウギョウカブシキガイシャ,0
5404,6700150082282,01,1,2018-06-22,2017-04-10,Ｃｏｍｐｕｔａｃｅｎｔｅｒ（ＵＫ）ＬＩＭＩＴＥＤ,,401,,,,,,,,Ｈａｔｆｉｅｌｄ　Ａｖｅｎｕｅ，Ｈａｔｆｉｅｌｄ，Ｈｅｒｔｆｏｒｄｓｈｉｒｅ，ＡＬ１０　９ＴＷ　ＵＫ,,,,,,2017-04-10,1,,,,,コンピユータセンターユーケーリミテツド,0
5405,6700150082472,01,1,2018-06-22,2017-04-17,ＳＡＭＡＮ　ＫＡＶＩＮＤＩＭＡ　ＭＯＴＯＲＳ　ＴＲＡＤＩＮＧ,,401,茨城県,筑西市,神分３８５番地,,08,227,3080063,スリランカ民主社会主義共和国マラダンカダワライティカティヤ,,,,,,2017-04-17,1,,,,,サマンカヴインデイマモーターストレーデイング,0
5406,6700150082489,01,1,2018-06-22,2017-04-18,Ｔａｂｕｒ　Ｌａｂｕａｎ　Ｆｏｕｎｄａｔｉｏｎ,,401,,,,,,,,Ｂｒｕｍｂｙ　Ｃｅｎｔｒｅ　Ｌｏｔ　４２，Ｊａｌａｎ　Ｍｕｈｉｂｂａｈ，Ｌａｂｕａｎ，Ｍａｌａｙｓｉａ,,,,,,2017-04-18,1,,,,,タブールラブアンフアウンデーシヨン,0
5407,6700150082497,01,1,2018-06-22,2017-04-18,ＵＴｉ　ＡＳＩＡ　ＰＡＣＩＦＩＣ　ＬＩＭＩＴＥＤ,,401,,,,,,,,９　Ｃｏｌｕｍｂｕｓ　Ｃｅｎｔｒｅ　Ｐｅｌｌｃａｎ　Ｄｒｉｖｅ　Ｒｏａｄ　Ｔｏｗｎ　Ｔｏｒｔｏｌａ　Ｂｒｉｔｉｓｈ　Ｖｉｒｇｉｎ　Ｉｓｌａｎｄｓ,,,,,,2017-04-18,1,,,,,ユーテイアイアジアパシフイツクリミテツド,0
5408,6700150082555,01,1,2018-06-22,2017-04-19,株式会社ネックスウィン,,401,千葉県,市川市,南八幡３丁目７番１６－３０２号,,12,203,2720023,大韓民国ソウル特別市江南区論峴路５０７、８０７号（駅三洞、ソンジハイツ３次ビル）,00109212,,,,,2017-04-19,1,,,,,カブシキガイシヤネツクスウイン,0
5409,6700150082687,01,1,2018-06-04,2017-04-26,ＰＩＸＯＮＩＣ　ＬＬＣ,,401,,,,,,,,Ｃｏｒｐｏｒａｔｉｏｎ　Ｔｒｕｓｔ　Ｃｅｎｔｅｒ，１２０９　Ｏｒａｎｇｅ　Ｓｔｒｅｅｔ，Ｗｉｌｍｉｎｇｔｏｎ，１９８０１　Ｕ．Ｓ．Ａ．,,,,,,2017-04-26,1,,,,,ピクソニツクエルエルシー,0
5410,6700150082902,01,1,2018-02-20,2017-05-11,Ａｌｐｉｎｖｅｓｔ　Ｐａｒｔｎｅｒｓ　Ｐｒｉｍａｒｙ　Ｆｕｎｄ　Ｉｎｖｅｓｔｍｅｎｔｓ　２０１３　Ⅱ　Ｂ．Ｖ．,00110155,401,,,,,,,,Ｊａｃｈｔｈａｖｅｎｗｅｇ　１１８，１０８１　ＫＪ　Ａｍｓｔｅｒｄａｍ，Ｎｅｔｈｅｒｌａｎｄｓ,,,,,,2017-05-11,1,,,,,,0
5411,6700150082976,01,1,2018-06-22,2017-05-12,ＨＡＺ　ＴＲＡＤＩＮＧ　ＣＯＭＰＡＮＹ,,401,神奈川県,大和市,柳橋３丁目２４－７第２鶴屋ハイツ１０３,,14,213,2420022,スリランカ民主社会主義共和国アクラナ、７マイルポスト、Ｎｏ．６４０,,,,,,2017-05-12,1,,,,,ハズトレーデイングカンパニー,0
5412,6700150083000,01,1,2018-06-22,2017-05-12,ジャパン・ソーラー・インベストメンツ・リミテッド,,401,東京都,港区,六本木６丁目１０番１号六本木ヒルズ森タワー,,13,103,1060032,中華人民共和国香港特別行政区クイーンズロードセントラル２、チョンコンセンター６８階,,,,,,2017-05-12,1,,,,,ジヤパンソーラーインベストメンツリミテツド,0
5413,6700150083116,01,1,2018-06-22,2017-05-18,Ａ　ＮＥＷ　ＯＣＥＡＮ　Ｓ．Ａ．,,401,,,,,,,,３ｒｄ　ｆｌｏｏｒ，Ｓａｌｄｕｂａ　Ｂｕｉｌｄｉｎｇ，Ｅａｓｔ　５３ｒｄ　Ｓｔｒｅｅｔ，Ｍａｒｂｅｌｌａ　Ｕｒｂａｎｉｚａｔｉｏｎ，Ｐａｎａｍａ　Ｃｉｔｙ，Ｒｅｐｕｂｌｉｃ　ｏｆ　Ｐａｎａｍａ,,,,,,2017-05-18,1,,,,,アニユーオーシヤンエスエイ,0
5414,6700150083652,01,1,2018-06-22,2017-06-02,Ｊａｐｏｗ　ＬＬＣ,,401,,,,,,,,アメリカ合衆国、ニューハンプシャー州、センターコンウェイ、サージェントロード７２,,,,,,2017-06-02,1,,,,,ジヤパウエルエルシー,0
5415,6700150083660,01,1,2018-06-22,2017-06-06,Ｓｐｅｅｄ　Ｔｒａｃｋ　Ｈｏｌｄｉｎｇｓ　Ｌｉｍｉｔｅｄ,,401,,,,,,,,Ｐｏｒｔｃｕｌｌｉｓ　ＴｒｕｓｔＮｅｔ　Ｃｈａｍｂｅｒｓ，４ｔｈ　Ｆｌｏｏｒ　Ｅｌｌｅｎ　Ｓｋｅｌｔｏｎ　Ｂｕｉｌｄｉｎｇ，３０７６　Ｓｉｒ　Ｆｒａｎｃｉｓ　Ｄｒａｋｅ　Ｈｉｇｈｗａｙ，Ｒｏａｄ　Ｔｏｗｎ，Ｔｏｒｔｏｌａ，Ｂｒｉｔｉｓｈ　Ｖｉｒｇｉｎ　Ｉｓｌａｎｄｓ,,,,,,2017-06-06,1,,,,,スピードトラツクホールデイングズリミテツド,0
5416,6700150083909,01,1,2018-06-11,2017-06-13,ＦＡＲＩＤＡ　ＳＨＯＥＳ　ＰＲＩＶＡＴＥ　ＬＩＭＩＴＥＤ,,401,東京都,渋谷区,渋谷１丁目１０番地７号,,13,113,1500002,インド、タミル・ナードゥ州、チェンナイ、ラマプラン、マウント・プーナマリー・ロード、１５１／４,,,,,,2017-06-13,1,,,,,フアリダシユーズプライベートリミテツド,0
5417,6700150083966,01,1,2018-06-22,2017-06-16,拏岩実業　株式会社,,401,新潟県,南魚沼市,姥島新田２２１,,15,226,9496425,大韓民国ソウル麻浦区老姑山洞１０７－１１１,,,,,,2017-06-16,1,,,,,ダイワジツギヨウカブシキカイシヤ,0
5418,6700150085161,12,0,2020-05-28,2018-04-24,Ｄｒｅａｍ　Ｍａｎｐｏｗｅｒ　Ｃａｍｂｏｄｉａ株式会社,,401,福岡県,福岡市博多区,博多駅南３丁目１５番３０－１１０７号ローズマンション第２博多,,40,132,8120016,カンボジア王国プノンペン首都メンチャイ市スチンメンチャイ区トレア３村３７１通り５Ｄ,,,,,,2017-09-13,1,,,,,ドリームマンパワーカンボジアカブシキガイシヤ,0
5419,6700150085228,01,1,2018-06-22,2017-09-15,ダイナミックパワーホールディングズリミテッド,,401,,,,,,,,シーメドウハウス、ブラックバーンハイウェイ（ピーオーボックス１１６）ロードタウン、トルトラ、イギリス領バージン諸島,,,,,,2017-09-15,1,,,,,ダイナミツクパワーホールデイングズリミテツド,0
5420,6700150085236,01,1,2018-06-22,2017-09-15,Ｂａｒｒｅｔｔ　Ｔｉｅｒ　Ｎｏｍｉｎｅｅｓ　Ｐｔｙ　Ｌｔｄ,,401,,,,,,,,Ｍａｒｔｙｎ　Ｔｉｅｒ　Ｕｎｉｔ　３０３　８１　Ｍａｃｌｅａｙ　Ｓｔｒｅｅｔ　Ｐｏｔｔｓ　Ｐｏｉｎｔ　ＮＳＷ　２０１１,,,,,,2017-09-15,1,,,,,バレツトテイアノミニーズピーテイーワイリミテツド,0
5421,6700150085327,01,1,2018-06-22,2017-09-20,Ｌｕｆｔｈａｎｓａ　ＡｉｒＰｌｕｓ　Ｓｅｒｖｉｃｅｋａｒｔｅｎ　ＧｍｂＨ　東京支店,,401,東京都,港区,芝公園３丁目１－１３,,13,103,1050011,ドイツ連邦共和国ヘッセン州ノイ＝イーゼンブルク、ドルンホーフ通り１０,,,,,,2017-09-20,1,,,,,ルフトハンザエアープラスサービスカルテンゲーエムベーハートウキヨウシテン,0
5422,6700150085384,01,1,2018-07-31,2017-09-25,ＣｈａｎｇＴｅｅ　Ｉｎｖｅｓｔｍｅｎｔ　Ｈｏｌｄｉｎｇｓ　Ｌｔｄ,,401,,,,,,,,Ａｋａｒａ　Ｂｕｉｌｄｉｎｇ　２４　Ｄｅ　Ｃａｓｔｒｏ　Ｓｔｒｅｅｔ　Ｗｉｃｋｈａｍｓ　Ｒｏａｄ　Ｔｏｗｎ，Ｔｏｒｔｏｌａ，Ｂｒｉｔｉｓｈ　Ｖｉｒｇｉｎ　Ｉｓｌａｎｄｓ,,,,,,2017-09-25,1,,,,,チヤンツイーインベストメントホールデイングスリミテツド,0
5423,6700150085401,12,0,2019-01-15,2018-10-31,阿拉丁國際貿易有限公司,,401,大阪府,大阪市中央区,北久宝寺町１丁目７－７－１０２,,27,128,5410057,台湾桃園市大園区三民路二段５８９号１階,,,,,,2017-09-26,1,,,,,アラテインコクサイボウエキユウゲンコウシ,0
5424,6700150085632,01,1,2018-04-25,2017-10-13,Ｃｏｌｔ　Ｔｅｃｈｎｏｌｏｇｙ　Ｓｅｒｖｉｃｅｓ　Ｉｎｄｉａ　Ｐｒｉｖａｔｅ　Ｌｉｍｉｔｅｄ,,401,,,,,,,,Ｂｕｉｌｄｉｎｇ　Ｎｏ．４，Ｕｎｉｔｅｃｈ　ＳＥＺ，Ｓｅｃｔｏｒ４８，Ｔｉｋｒｉ，Ｇｕｒｇａｏｎ－１２２００１（Ｈａｒｙａｎａ）,,,,,,2017-10-13,1,,,,,コルトテクノロジーサービシーズインデイアプライベートリミテツド,0
5425,6700150085640,01,1,2018-06-22,2017-10-13,ＭＧＩ　ＧＲＯＵＰ　ＩＮＤＩＡ　ＰＲＩＶＡＴＥ　ＬＩＭＩＴＥＤ,,401,,,,,,,,７７ｔｈ　Ｆｌｏｏｒ，Ｍａｆａｔｌａｌ　Ｃｅｎｔｒｅ，２３８　Ｎａｒｉｍａｎ　Ｐｏｉｎｔ，Ｍｕｍｂａｉ　４０００２７，Ｍａｈａｒａｓｈｔｒａ，Ｉｎｄｉａ,,,,,,2017-10-13,1,,,,,エムジーアイグループインデイアプライベートリミテツド,0
5426,6700150085780,01,1,2018-04-20,2017-10-23,ＢＩＧ　ＣＨＥＥＳＥ　ＨＯＬＤＩＮＧＳ　ＬＩＭＩＴＥＤ,,401,,,,,,,,Ｐ．Ｏ．Ｂｏｘ　９５７，Ｏｆｆｓｈｏｒｅ　Ｉｎｃｏｒｐｏｒａｔｉｏｎｓ　Ｃｅｎｔｒｅ，Ｒｏａｄ　Ｔｏｗｎ，Ｔｏｒｔｏｌａ，Ｂｒｉｔｉｓｈ　Ｖｉｒｇｉｎ　Ｉｓｌａｎｄｓ,,,,,,2017-10-23,1,,,,,ビツクチーズホールデイングスリミツテツド,0
