3110,4700150005237,01,1,2018-06-21,2015-10-09,ＢｒｏａｄＳｏｆｔ　Ｉｎｔｅｒｎａｔｉｏｎａｌ，Ｉｎｃ．,,401,東京都,港区,西新橋１丁目２－９,,13,103,1050003,アメリカ合衆国デラウェア州１９８０８、ニューキャッスル郡ウィルミントン、センタービル・ロード２７１１、スイート４００,,,,,,2015-10-09,1,,,,,ブロードソフトインターナシヨナルインク,0
3111,4700150005253,01,1,2018-06-21,2015-10-09,ブッケハーブ・リミテッド,,401,東京都,港区,虎ノ門３丁目７－２０,,13,103,1050001,デンマーク王国ズベンドボルグ５７００ノーゲスバイ２,,,,,,2015-10-09,1,,,,,ブツケハーブリミテツド,0
3112,4700150005261,01,1,2018-06-21,2015-10-09,ヘンペル・シンガポール・プライベイト・リミテッド,,401,東京都,港区,西新橋１丁目２番９号日比谷セントラルビル１４階,,13,103,1050003,シンガポール共和国シンガポール市トゥアス通り１１、２５番地,,,,,,2015-10-09,1,,,,,ヘンペルシンガポールプライベイトリミテツド,0
3113,4700150005278,12,0,2020-03-02,2019-11-26,北京思元軟件有限公司,,401,東京都,江戸川区,西葛西１丁目１４番１４－５０４号,,13,123,1340088,中国北京市海淀区高梁橋斜街４４号一区８９号科教楼７層７１８室,,,,,,2015-10-09,1,,,,,ペキンシゲンナンケンユウゲンコウシ,0
3114,4700150005303,01,1,2018-06-21,2015-10-09,Ｂｏｒｇｗａｌｄｔ　ＫＣ　ＧｍｂＨ,,401,東京都,港区,高輪２丁目２－１９－１０２,,13,103,1080074,Ｂｏｒｇｗａｌｄｔ　ＫＣ　ＧｍｂＨ　Ｓｃｈｎａｃｋｅｎｂｕｒｇａｌｌｅｅ　１５，２２５２５　Ｈａｍｂｕｒｇ，Ｇｅｒｍａｎｙ,,,,,,2015-10-09,1,,,,,ボルグワルトケーシーユウゲンガイシヤ,0
3115,4700150005311,13,0,2020-02-13,2020-02-04,マグロウヒル・エデュケーション・パブリケーションズ・オーバーシーズ・エル・エル・シー,,401,東京都,港区,新橋４丁目２１番３号新橋東急ビル３階,,13,103,1050004,アメリカ合衆国ニューヨーク州ニューヨーク、アベニュー・オブ・ザ・アメリカス１３２５,,,,,,2015-10-09,1,,,,,マグロウヒルエデユケーシヨンパブリケーシヨンズオーバーシーズエルエルシー,0
3116,4700150005328,01,1,2018-05-10,2015-10-09,Ｍｙｏｋｏ　ＩＢＬＰ　Ｈｏｌｄｉｎｇｓ　ＬＬＣ,,401,,,,,,,,アメリカ合衆国、１９８０１、デラウェア州、ウィルミントン、オレンジ・ストリート１２０９,,,,,,2015-10-09,1,,,,,ミヨウコウアイビーエルピーホールデイングスエルエルシー,0
3117,4700150005369,12,0,2019-10-16,2019-07-04,ユーコー・カーキャリアーズ株式会社,,401,東京都,千代田区,神田神保町１丁目１０５番地神保町三井ビルディング３階,,13,101,1010051,大韓民国ソウル特別市松坡区オリンピック路３００、２８階（新川洞、ロッテワールドタワー）,,,,,,2015-10-09,1,,,,,ユーコーカーキヤリアーズカブシキカイシヤ,0
3118,4700150005377,01,1,2018-06-21,2015-10-09,株式会社ＵＮＩＤ日本支店,,401,東京都,港区,虎ノ門５丁目１１－２オランダヒルズ森タワー１８階,,13,103,1050001,１７ｔｈ　Ｆｌｙ　Ｆｅｒｒｕｍ　Ｔｏｗｅｒ．＃１９　Ｅｕｌｊｉ－５ｇｉｌ　（ｓｕｈａ－ｄｏｎｇ），Ｊｕｎｇ－ｇｕ，Ｓｅｏｕｌ，Ｋｏｒｅａ,,,,,,2015-10-09,1,,,,,カブシキカイシヤユニドニホンシテン,0
3119,4700150005385,01,1,2018-04-03,2015-10-09,ＤＵＲＩＡＮ２　ＴＭＫ　ＨＯＬＤＩＮＧ　ＰＴＥ．ＬＴＤ．,,401,東京都,港区,虎ノ門３丁目２２番１０－２０１号,,13,103,1050001,シンガポール共和国、５０ラッフルズプレイス、＃２５－０３、シンガポールランドタワー,,,,,,2015-10-09,1,,,,,ドリアンツーテイーエムケーホールデイングプライベートリミテツド,0
3120,4700150005402,13,0,2016-01-13,2015-12-21,ＲＥＰＳＣＪ　Ｈｏｌｄｉｎｇｓ　Ｐｔｅ．Ｌｔｄ．,,401,東京都,港区,虎ノ門４丁目１－２８,,13,103,1050001,シンガポール共和国マーケット・ストリート１３７、グレース・グローバル・ラッフルズ０５－０５号,,,,,,2015-10-09,1,,,,,,0
3121,4700150005410,01,1,2018-06-21,2015-10-09,Ｒｏｄｅｎｓｔｏｃｋ　ＧｍｂＨ,,401,,,,,,,,Ｅｌｓｅｎｈｅｉｍｅｒ　ｓｔｒ．３３，Ｄ－８０６８７，Ｍｕｎｉｃｈ　Ｇｅｒｍａｎｙ,,,,,,2015-10-09,1,,,,,ローデンストツクゲーエムベーハー,0
3122,4700150005419,12,1,2018-06-21,2016-10-18,トラベルポート・サービセズ・リミテッド,,401,東京都,品川区,大崎１丁目１１番２号ゲートシティ大崎イーストタワー,,13,109,1410032,英国バークシャー、ラングレー、ハリケーン・ウェイ１０、アクシス・パーク、アクシス・ワン,,,,,,2015-10-09,1,,,,,トラベルポートサービセズリミテツド,0
3123,4700150005427,01,1,2018-06-21,2015-10-09,コーロンインダストリー東京事務所,,401,東京都,港区,新橋１丁目１８－２１第１日比谷ビル　９Ｆ,,13,103,1050004,大韓民国　京畿道果川市　コーロン路１１　コーロンタワー１６Ｆ,,,,,,2015-10-09,1,,,,,コーロンインダストリートウキヨウジムシヨ,0
3124,4700150005435,01,1,2018-06-21,2015-10-09,カナダ林産業審議会,,401,東京都,港区,虎ノ門３丁目８－２７巴町アネックス２号館　９Ｆ,,13,103,1050001,カナダ国ブリティッシュ・コロンビア州　バンクバー街　ウエストペンダーストリート　スイート　１５０１－７００　ペンダープレイスＩビジネスビル,,,,,,2015-10-09,1,,,,,カナダリンサンギヨウシンギカイ,0
3125,4700150005658,01,1,2018-06-21,2015-10-09,Ｓｙｓｔｅｍ　Ｐａｒｔｎｅｒｓ　Ｌｉｍｉｔｅｄ,,401,東京都,新宿区,内藤町１,,13,104,1600014,英国エディンバラ、９６、ロ一ズストリート、スイート１０,,,,,,2015-10-09,1,,,,,システムパートナーズリミテツド,0
3126,4700150005716,01,1,2018-06-21,2015-10-09,大進電気販売株式会社　東京支店,,401,東京都,新宿区,新宿１丁目１８－１２柳田ビル４Ｆ,,13,104,1600022,大韓民国ソウル特別市瑞草区瑞草洞１５８８－１,,,,,,2015-10-09,1,,,,,ダイシンデンキハンバイカブシキガイシヤトウキヨウシテン,0
3127,4700150005807,01,1,2018-06-21,2015-10-09,ヴリルコンジャンクションインコーポレーテッド,,401,東京都,新宿区,赤城下町４４番地１０２,,13,104,1620803,アメリカ合衆国デラウェア州ニューキャッスル郡ニューアーク市バークスデールプロフェッショナルセンター１１３,,,,,,2015-10-09,1,,,,,ヴリルコンジヤンクシヨンインコーポレーテツド,0
3128,4700150005815,01,1,2018-06-21,2015-10-09,北京東方虹嘉技術諮詢有限公司,,401,東京都,新宿区,左門町１３－２,,13,104,1600017,中華人民共和国北京市朝陽区道家園６号楼８門３０１室,,,,,,2015-10-09,1,,,,,ペキントウホウホンジヤギジユツシジユンユウゲンコンス,0
3129,4700150005823,01,1,2018-06-21,2015-10-09,ＭＩＴＡＳＵ株式会社,,401,東京都,新宿区,若葉１丁目６番１号,,13,104,1600011,ミャンマー連邦共和国ヤンゴン県ヤンゴン市ミンガラタンニット区ドウテェインテェン通りグランドフロア８２番,,,,,,2015-10-09,1,,,,,ミタスカブシキガイシヤ,0
3130,4700150005930,01,1,2018-06-21,2015-10-09,Ａｒｔｅｃｏ　ＮＶ,,401,東京都,港区,赤坂４丁目２番１９号,,13,103,1070052,ベルギー王国、２９００スコーテン地区メトロポールシュトラート２５番地,,,,,,2015-10-09,1,,,,,アルテコエヌヴイ,0
3131,4700150005955,01,1,2018-06-21,2015-10-09,キャンベル・グレイインコーポレーテッド,,401,東京都,港区,六本木５丁目１３－６,,13,103,1060032,カナダバンクーバートリニティ通り２２６６スート２０３番地,,,,,,2015-10-09,1,,,,,キヤンベルグレイインコーポレーテツド,0
3132,4700150005988,12,1,2018-06-21,2017-12-13,カラビナ・ソフトウェアＬＬＣ,,401,東京都,港区,東麻布１丁目４番２号＃８０４,,13,103,1060044,アメリカ合衆国メリーランド州ボルチモア市９９１８フィニー・ドライブ,,,,,,2015-10-09,1,,,,,カラビナソフトウエアエルエルシー,0
3133,4700150006004,01,1,2018-06-21,2015-10-09,Ａｔｈｅｎａ　Ｔｅｘｔｉｌｅ　Ｌｉｍｉｔｅｄ,,401,東京都,港区,赤坂９丁目７番４号オークウッドプレミア東京ミッドタウン８０２号室,,13,103,1070052,英領バージン諸島トルトラ島ロードタウンオフショアインコーポレーションセンター私書箱９５７号,,,,,,2015-10-09,1,,,,,アテナテキスタイルリミテツド,0
3134,4700150006012,01,1,2018-06-21,2015-10-09,Ｇｉｇａｍｏｎ　ＵＫ　ＬＴＤ,,401,東京都,港区,南麻布３丁目１９番２３号オーク南麻布ビル,,13,103,1060047,英国、ＥＣ４Ｍ、８ＡＢ、ロンドン、セント・ポールズ・チャーチヤード６５番、パターノスター・ハウス３階,,,,,,2015-10-09,1,,,,,ギガモンユーケーエルテイーデイー,0
3135,4700150006020,01,1,2018-06-21,2015-10-09,ＲＪＬＦ　ＳＡＫＵＲＡ　ＳＰＥ２ＰＴＥ．ＬＴＤ．,,401,東京都,港区,赤坂２丁目１０番５号税理士法人赤坂国際会計事務所内,,13,103,1070052,シンガポール共和国０６８８９８、＃０２－００、ロビンソン・ロード８０,,,,,,2015-10-09,1,,,,,アールジエーエルエフサクラエスピーイーツーピーテイーイーリミテツド,0
3136,4700150006029,13,1,2018-06-21,2017-03-03,ゼネラル．エレクトリック．インターナショナル．インク,,401,東京都,港区,赤坂５丁目２番２０号,,13,103,1070052,アメリカ合衆国オハイオ州シンシナティ、ローザ・パーク・ストリート１９１,,,,,,2015-10-09,1,,,,,ゼネラルエレクトリツクインターナシヨナルインク,0
3137,4700150006045,13,1,2018-06-21,2016-09-01,Ｇｏｏｇｌｅ　Ａｓｉａ　Ｐａｃｉｆｉｃ　Ｐｔｅ．Ｌｔｄ．,,401,,,,,,,,７０　Ｐａｓｉｒ　Ｐａｎｊａｎｇ　Ｒｏａｄ，＃０３－７１　Ｍａｐｌｅｔｒｅｅ　Ｂｕｓｉｎｅｓｓ　Ｃｉｔｙ，Ｓｉｎｇａｐｏｒｅ　１１７３７１,,,,,,2015-10-09,1,,,,,グーグルアジアパシフイツクプライベートリミテツド,0
3138,4700150006053,13,0,2018-11-14,2018-11-08,ゲンスラー・アンド・アソシエイツ・インターナショナル・リミテッド,,401,東京都,港区,南青山２丁目１１番１６号,,13,103,1070062,アメリカ合衆国カリフォルニア州９４１０５サンフランシスコ、フレモントストリート４５、スイート１５００,,,,,,2015-10-09,1,,,,,ゲンスラーアンドアソシエイツインターナシヨナルリミテツド,0
3139,4700150006061,12,0,2019-11-19,2019-08-29,ＩＮＦＥＲＲＥＴ　ＬＩＭＩＴＥＤ,,401,東京都,中央区,新富２丁目４番６号,,13,102,1040041,イギリスノーサンプトンシャー州ノーサンプトンブーズライズ１７番地,,,,,,2015-10-09,1,,,,,インフエレツトリミテツド,0
3140,4700150006078,01,1,2018-06-21,2015-10-09,ＫＵＡＨＩＷＩ　Ｏ　ＭＡＫＡＭＡＥ，ＬＬＣ,,401,東京都,港区,南麻布４丁目７番２号,,13,103,1060047,アメリカ合衆国９６８２５ハワイ州ホノルル市マカフエナプレイス７１４１,,,,,,2015-10-09,1,,,,,クアヒウイオマカマエエルエルシー,0
3141,4700150006111,12,1,2018-06-21,2016-06-02,Ｓａｎｄｏｒ　Ｍａｎａｇｅｍｅｎｔ　Ｌｉｍｉｔｅｄ,,401,東京都,港区,北青山３丁目６－７青山パラシオタワー１１Ｆ,,13,103,1070061,英国マン島ダグラス市ビクトリア街４１－４３番クイーン・ビクトリア・ハウス４階,,,,,,2015-10-09,1,,,,,サンドールマネージメントリミテツド,0
3142,4700150006128,01,1,2018-06-21,2015-10-09,Ｓａａｂ　Ｉｎｔｅｒｎａｔｉｏｎａｌ　ＡＢ,,401,東京都,港区,六本木１丁目９番１０号アークヒルズ仙石山森タワー２９階,,13,103,1060032,スウェーデン王国リンシェーピング５８１－８８、フス２０９－７、サーブ・アーベー・グループファイナンス内,,,,,,2015-10-09,1,,,,,サーブインターナシヨナルアーベー,0
3143,4700150006144,01,1,2018-06-21,2015-10-09,シャイニングパートナーズリミテッド,,401,東京都,港区,六本木６丁目１０番１六本木ヒルズ森タワー,,13,103,1060032,ケイマン諸島、グランド・ケイマン、ジョージ・タウン、メアリー・ストリート、ピー・オー・ボックス９０８ＧＴ、ウォーカー・ハウス、ウォーカース・エスピーヴィ・リミテッド,,,,,,2015-10-09,1,,,,,シヤイニングパートナーズリミテツド,0
3144,4700150006160,01,1,2018-06-21,2015-10-09,シーベル・ヘルプライン・ドットコム・インク,,401,東京都,港区,北青山２丁目５－８オラクル青山センター,,13,103,1070061,アメリカ合衆国９４０６５カリフォルニア州レッドウッドシティー、オラクルパークウェイ５００,,,,,,2015-10-09,1,,,,,シーベルヘルプラインドツトコムインク,0
3145,4700150006169,01,1,2018-06-21,2015-10-09,スペインビジネスアンドテクノロジーオフィス,,401,東京都,港区,六本木１丁目３－２９－２Ｆ,,13,103,1060032,スペイン国　マドリッド州　マドリッド市　シッド通り４番地,,,,,,2015-10-09,1,,,,,スペインビジネスアンドテクノロジーオフイス,0
3146,4700150006202,01,1,2018-06-21,2015-10-09,Ｓｔｅｉｎｗａｙ，Ｉｎｃ．,,401,,,,,,,,１，Ｓｔｅｉｎｗａｙ　Ｐｌａｃｅ，Ｌｏｎｇ　Ｉｓｌａｎｄ　Ｃｉｔｙ，ＮＹ　１１１０５　Ｕ．Ｓ．Ａ．,,,,,,2015-10-09,1,,,,,スタインウエイインク,0
3147,4700150006210,01,1,2018-06-21,2015-10-09,ＧＥキャピタルサービス・ピーティーイー・リミテッド,,401,東京都,港区,赤坂５丁目２番２０号,,13,103,1070052,シンガポール共和国、１３８５８９、ノースブオナ・ヴィスタ通り１１、メトロポリス・タワー２、レベル９,,,,,,2015-10-09,1,,,,,ジーイーキヤピタルサービスピーテイーイーリミテツド,0
3148,4700150006219,01,1,2018-05-25,2015-10-09,Ｊａｐａｎ　ＭＤＣ，ＬＬＣ,,401,東京都,港区,南青山２丁目２番６－１１０１号,,13,103,1070062,アメリカ合衆国デラウェア州ニューキャッスルカウンティ・ウィルミントン・テニソンロード４４０６気付け,,,,,,2015-10-09,1,,,,,ジヤパンエムデイーシーエルエルシー,0
3149,4700150006227,11,1,2018-06-21,2016-02-16,トタル・インターナショナル・エス・エー,,401,東京都,港区,赤坂４丁目２番１９号赤坂シャスタ・イースト,,13,103,1070052,スイス国、１２１４ヴェルニエ、シェマン・ド・ブランドネ２,,,,,,2015-10-09,1,,,,,トタルインターナシヨナルエスエー,0
3150,4700150006235,01,1,2018-06-21,2015-10-09,シャローリバー・エル・エル・シー,,401,東京都,港区,六本木３丁目２番３２号,,13,103,1060032,アメリカ合衆国オレゴン州９７１２４ヒルズボロノース・イースト・セカンドストリート１２６,,,,,,2015-10-09,1,,,,,シヤローリバーエルエルシー,0
3151,4700150006243,13,1,2018-06-21,2017-08-21,エバー・ロイヤル・ジャパン・リミテッド,,401,東京都,港区,赤坂９丁目７番１号ミッドタウンタワー２２階,,13,103,1070052,中華人民共和国香港特別行政区、上環、１６８－２００、コノート・ロード・セントラル、信徳センター、チャイナ・マーチャンツ・タワー、ユニット２００８－２０１４,,,,,,2015-10-09,1,,,,,エバーロイヤルジヤパンリミテツド,0
3152,4700150006251,01,1,2018-05-24,2015-10-09,ダブロイド・インコーポレイテッド,,401,東京都,港区,赤坂２丁目１４－５プラザミカドビル７階,,13,103,1070052,アメリカ合衆国ハワイ州ホノルル市カラカウア通り２２２２スイート６０５,,,,,,2015-10-09,1,,,,,ダブロイドインコーポレイテツド,0
3153,4700150006268,13,0,2020-03-05,2020-02-28,Ｉｎｆｏｓｙｓ　Ｌｉｍｉｔｅｄ,,401,東京都,港区,六本木１丁目６番３号泉ガーデンウイング,,13,103,1060032,インド共和国５６０１００、ベンガルール市ホースール通りエレクトロニクス・シティ,,,,,,2015-10-09,1,,,,,インフオシスリミテツド,0
3154,4700150006334,11,0,2019-09-11,2019-04-12,ＵＮＩＶＡ　Ｍａｒｋｅｔｉｎｇ　Ｌｉｍｉｔｅｄ,,401,東京都,港区,六本木１丁目６番１号泉ガーデンタワー３５階,,13,103,1060032,中華人民共和国香港特別行政区、カオルーン、チムサーチュイ、カントンロード３３、チャイナホンコンシティタワーワン２１階スイート２１０５Ｂ－０７Ｂ,,,,,,2015-10-09,1,,,,,ユニバマーケテイングリミテツド,0
3155,4700150006350,01,1,2018-06-21,2015-10-09,デルフィーノ・キャピタル・リミテッド,,401,東京都,港区,六本木５丁目１４－２３－２０３号　ホ－マットコンコ－ド,,13,103,1060032,アメリカ合衆国デラウェア州ウイルミングトン、レナー通り７０１,,,,,,2015-10-09,1,,,,,デルフイーノキヤピタルリミテツド,0
3156,4700150006490,12,1,2018-06-21,2016-04-01,ヘイワース・ジャパン・エル・エル・シー,,401,東京都,港区,赤坂３丁目９番２号Ｎｏ．Ｒ赤坂見附９Ｆ,,13,103,1070052,アメリカ合衆国４９４２３ミシガン州ホーランドワンヘイワースセンター,,,,,,2015-10-09,1,,,,,ヘイワースジヤパンエルエルシー,0
3157,4700150006508,12,0,2020-05-15,2019-11-25,ＭｉｃｒｏＰｏｒｔ　Ｏｒｔｈｏｐｅｄｉｃｓ　Ｉｎｃ．,,401,東京都,千代田区,内幸町２丁目１番１号飯野ビルディング１０階,,13,101,1000011,５６７７　Ａｉｒｌｉｎｅ　Ｒｏａｄ，Ａｒｌｉｎｇｔｏｎ，ＴＮ　３８００，ＵＳＡ,,,,,,2015-10-09,1,,,,,マイクロポートオーソペデイツクスインク,0
3158,4700150006516,01,1,2018-06-21,2015-10-09,Ｍｉｌｌｅｎｎｉｕｍ　Ｃａｐｉｔａｌ　Ｍａｎａｇｅｍｅｎｔ　Ａｓｉａ　Ｌｉｍｉｔｅｄ,,401,東京都,港区,赤坂９丁目７番１号,,13,103,1070052,中華人民共和国香港特別行政区、セントラル、コンノート・ロード５０、中国農業銀行タワー７階,,,,,,2015-10-09,1,,,,,ミレニアムキヤピタルマネジメントアジアリミテツド,0
3159,4700150006549,12,1,2018-06-21,2017-02-22,Ｒａｄｉｏ　Ｓｙｓｔｅｍｓ　Ｃｏｒｐｏｒａｔｉｏｎ,,401,東京都,港区,虎ノ門５丁目１３番１号虎ノ門４０ＭＴビル７階,,13,103,1050001,アメリカ合衆国デラウェア州ウィルミントン市ニューキャッスル郡オレンジストリート１２０９,,,,,,2015-10-09,1,,,,,ラジオシステムズコーポレーシヨン,0
3160,4700150006581,13,1,2019-11-26,2019-10-11,Ｌａｇａｒｄｅｒｅ　Ｓｐｏｒｔｓ　Ａｓｉａ　Ｐｔｅ．Ｌｔｄ．,,401,東京都,新宿区,西新宿２丁目１－１新宿三井ビルディング１１階,,13,104,1600023,シンガポール０４９１４５＃１０－０１ジョージストリート１,,,,,,2015-10-09,1,,,,,ラガデイエールスポーツアジアプライベートリミテイツド,0
3161,4700150006615,01,1,2018-06-21,2015-10-09,Ｇｏｅｔｈｅ　Ｉｎｓｔｉｔｕｔ　Ｔｏｋｙｏ,,401,東京都,港区,赤坂７丁目５－５６,,13,103,1070052,Ｄａｃｈａｅｒ　Ｓｔｒａｓｓｅ　１２２，８０６３７　Ｍüｎｃｈｅｎ，Ｇｅｒｍａｎｙ,00106085,,,,,2015-10-09,1,,,,,ゲーテインステイトウートトウキヨウ,0
3162,4700150006656,01,1,2018-06-21,2015-10-09,オペラ・ファイナンスカンパニー,,401,東京都,文京区,後楽２丁目３－２７,,13,105,1120004,英領西インド諸島ケイマン諸島グランド・ケイマン、ジョージ・タウン、ピー・オー・ボックス３０９、ウグランド・ハウス、メイプルズ・アンド・カルダー法律事務所,,,,,,2015-10-09,1,,,,,オペラフアイナンスカンパニー,0
3163,4700150006813,01,1,2018-06-21,2015-10-09,コープランドデベロップメンツインターナショナル,,401,東京都,文京区,西片２丁目１８－２０恵びす第一ビル２Ｆ,,13,105,1130024,イギリス国タークスアンドカイコス島グランドタークスチャーチルビルディングピーオーボックス１７０,,,,,,2015-10-09,1,,,,,コープランドデベロツプメンツインターナシヨナル,0
3164,4700150006838,13,1,2018-06-21,2017-05-26,ＪＡＴＯ　Ｊａｐａｎリミテッド,,401,東京都,文京区,西片２丁目２２－２１,,13,105,1130024,英国アクスブリッジ、オックスフォードロード、ハイブリッジインダストリアルエステート、ハントンハウス,,,,,,2015-10-09,1,,,,,ジエイトージヤパンリミテツド,0
3165,4700150007051,01,1,2018-06-21,2015-10-09,大連通産経済技術交流有限公司,,401,東京都,台東区,上野３丁目１７番４号,,13,106,1100005,中華人民共和国遼寧省大連市西岡区民運街２３号嘉彙ビル７階７０８室,,,,,,2015-10-09,1,,,,,ダイレンツウサンケイザイギジユツコウリユウユウゲンコウシ,0
3166,4700150007183,01,1,2018-05-24,2015-10-09,丹陽努必拉鞋業有限公司,,401,東京都,台東区,浅草５丁目４４－１３金島ビル１Ｆ,,13,106,1110032,中華人民共和国江蘇省丹陽経済開発区（大泊鎮南首）,,,,,,2015-10-09,1,,,,,ダンヤンヌビラシユーズユウゲンコウシ,0
3167,4700150007233,01,1,2018-06-21,2015-10-09,ラザガインターナショナルＰＶＴ．ＬＴＤ．,,401,東京都,台東区,千束３丁目２３番１号臼井様方,,13,106,1110031,ネパール王国、カトマンズ市１１区、ババルマハル、サミティマルグ１９８,,,,,,2015-10-09,1,,,,,ラザガインターナシヨナルピーブイテイーリミテツド,0
3168,4700150007266,01,1,2018-06-21,2015-10-09,アイティー・セレクト・アセット・リミテッド,,401,東京都,品川区,西五反田２丁目６番３号,,13,109,1410031,英領ヴァージン諸島、トートラ、ロードタウン、オフショアーインコーポレーションズセンター私書箱９５７,,,,,,2015-10-09,1,,,,,アイテイーセレクトアセツトリミテツド,0
3169,4700150007324,01,1,2019-06-24,2015-10-09,サイバードリーム・インコーポレイテッド,,401,東京都,品川区,西五反田４丁目５－１－６１０,,13,109,1410031,アメリカ合衆国ハワイ州ホノルル市カラカウア通り２２２２スイー卜６０５,,,,,,2015-10-09,1,,,,,サイバードリームインコーポレイテツド,0
3170,4700150007332,01,1,2018-06-21,2015-10-09,シュレーダー・エレクトロニクス・リミッテッド,,401,東京都,品川区,大崎１丁目６－１,,13,109,1410032,北アイルランドＢＴ４１１ＱＳアントリム、テクノロジー・パーク１１,,,,,,2015-10-09,1,,,,,シユレーダーエレクトロニクスリミツテツド,0
3171,4700150007381,13,0,2017-08-03,2017-07-26,ＳＵＰＥＲ　ＳＯＲＧＨＵＭ　ＡＳＩＡ　ＨＯＬＤＩＮＧＳ　ＰＴＥ．ＬＴＤ．,,401,東京都,品川区,北品川５丁目９－１５,,13,109,1410001,シンガポール共和国コリヤキー１１番地ザ・アーケード＃１０－０２,,,,,,2015-10-09,1,,,,,,0
3172,4700150007448,01,1,2018-06-21,2015-10-09,Ｆｒｕｉｔｍａｃｈｉｎｅ,,401,東京都,品川区,南大井２丁目１２－５－７１７号,,13,109,1400013,英国ロンドンアンドリューズロード８番地リージェントスタジオスタジオ７５ｂ,,,,,,2015-10-09,1,,,,,フルーツマシン,0
3173,4700150007464,01,1,2019-06-26,2015-10-09,Ｗｈｉｔｅ　Ｓｈｉｐ，Ｉｎｃ．,,401,東京都,品川区,西五反田２丁目２４－７－８０７号室,,13,109,1410031,アメリカ合衆国ハワイ州ホノルル市ワイマヌストリート１２３２番Ａ－２号室,,,,,,2015-10-09,1,,,,,ホワイトシツプインク,0
3174,4700150007555,01,1,2018-06-21,2015-10-09,ヘレンエックスポトアンドインポトカンパニプライベトリミテド,,401,東京都,品川区,平塚１丁目１３－２０,,13,109,1420051,ネパール王国カトマンズ市第１０区シャラムマーグ２７３、ブッダナガル,,,,,,2015-10-09,1,,,,,ヘレンエツクスポトアンドインポトカンパニプライベトリミテド,0
