14406,2700150080356,01,1,2018-05-30,2017-01-26,岐阜県立大垣北高等学校育友会,,499,岐阜県,大垣市,中川町４丁目１１０－１,,21,202,5030017,,,,,,,2017-01-26,1,,,,,ギフケンリツオオガキキタコウトウガッコウイクユウカイ,0
14407,2700150086337,01,1,2018-06-22,2017-12-05,岐阜県砂防協会,,499,岐阜県,岐阜市,薮田南５丁目１４－１２岐阜県シンクタンク庁舎内,,21,201,5008384,,,,,,,2017-12-05,1,,,,,ギフケンサボウキヨウカイ,0
21574,3700150081031,01,1,2018-06-12,2017-02-17,バンビの森,,499,岐阜県,郡上市,大和町剣８２－１,,21,219,5014612,,,,,,,2017-02-17,1,,,,,バンビノモリ,0
21575,3700150082608,01,1,2018-06-12,2017-04-24,安八町農業再生協議会,,499,岐阜県,安八郡安八町,氷取１６１番地,,21,383,5030121,,,,,,,2017-04-24,1,,,,,アンパチチヨウノウギヨウサイセイキヨウギカイ,0
21576,3700150083309,01,1,2018-06-12,2017-05-23,江吉良コミュニティセンター協議会,,499,岐阜県,羽島市,江吉良町５５８番地,,21,209,5016236,,,,,,,2017-05-23,1,,,,,エギラコミユニテイセンターキヨウギカイ,0
21577,3700150089669,11,0,2019-01-08,2018-12-01,中津川・恵那観光推進協議会,,499,岐阜県,恵那市,長島町正家１０６７－７１,,21,210,5097203,,,,,,,2018-06-27,1,,,,,ナカツガワエナカンコウスイシンキヨウギカイ,0
28733,4700150080412,01,1,2018-05-30,2017-01-27,大垣市文教協会,,499,岐阜県,大垣市,丸の内２丁目５５番地大垣市教育委員会　学校教育課内,,21,202,5030888,,,,,,,2017-01-27,1,,,,,オオガキシブンキョウキョウカイ,0
28734,4700150083308,12,0,2019-10-15,2019-08-30,福寿コミュニティセンター協議会,,499,岐阜県,羽島市,福寿町本郷１丁目２２番地,,21,209,5016254,,,,,,,2017-05-23,1,,,,,フクジユコミユニテイセンターキヨウギカイ,0
28735,4700150083423,01,1,2018-06-13,2017-05-24,ひるかわ学童クラブ,,499,岐阜県,中津川市,蛭川２１７８－１,,21,206,5098301,,,,,,,2017-05-24,1,,,,,ヒルカワガクドウクラブ,0
28736,4700150083522,01,1,2018-06-13,2017-05-31,チャレンジ　中津川・恵那プロジェクト実行委員会,,499,岐阜県,恵那市,長島町正家１０６７－７１,,21,210,5097203,,,,,,,2017-05-31,1,,,,,チヤレンジナカツガワエナプロジエクトジツコウイインカイ,0
28737,4700150087449,01,1,2018-06-07,2018-02-16,恵那市食生活改善連絡協議会,,499,岐阜県,恵那市,長島町正家１丁目１番地１恵那市役所　健康推進課内,,21,210,5097203,,,,,,,2018-02-16,1,,,,,エナシショクセイカツカイゼンレンラクキョウギカイ,0
35938,5700150080064,01,1,2018-06-14,2017-01-18,岐阜県ユニセフ協会,,499,岐阜県,各務原市,鵜沼各務原町１丁目４－１（コープぎふ１Ｆ）,,21,213,5090141,,,,,,,2017-01-18,1,,,,,ギフケンユニセフキヨウカイ,0
35939,5700150082977,01,1,2018-06-14,2017-05-12,苗木地域まちづくり推進協議会,,499,岐阜県,中津川市,苗木７５１６番地の１苗木事務所内,,21,206,5080101,,,,,,,2017-05-12,1,,,,,ナエギチイキマチヅクリスイシンキヨウギカイ,0
35940,5700150083307,01,1,2018-06-14,2017-05-23,竹鼻南コミュニティセンター協議会,,499,岐阜県,羽島市,竹鼻町飯柄１３２４番地,,21,209,5016233,,,,,,,2017-05-23,1,,,,,タケハナミナミコミユニテイセンターキヨウギカイ,0
35941,5700150088280,12,0,2019-10-02,2019-08-27,多治見駅南地区市街地再開発組合,,499,岐阜県,多治見市,栄町１丁目６番地１,,21,204,5070035,,,,,,,2018-04-06,1,,,,,タジミエキミナミチクシガイチサイカイハツクミアイ,0
43199,6700150082431,01,1,2018-04-27,2017-04-14,苗木学童保育所　すみれ組,,499,岐阜県,中津川市,苗木２０８３,,21,206,5080101,,,,,,,2017-04-14,1,,,,,ナエギガクドウホイクシヨスミレグミ,0
43200,6700150083306,01,1,2018-06-18,2017-05-23,竹鼻コミュニティセンター協議会,,499,岐阜県,羽島市,竹鼻町７３０番地,,21,209,5016241,,,,,,,2017-05-23,1,,,,,タケハナコミユニテイセンターキヨウギカイ,0
43201,6700150086481,01,1,2018-06-22,2017-12-12,岩野田小学校支援推進委員会,,499,岐阜県,岐阜市,粟野西２丁目３３番地,,21,201,5020006,,,,,,,2017-12-12,1,,,,,イワノダシヨウガツコウシエンスイシンイインカイ,0
50356,7700150083305,01,1,2018-06-18,2017-05-23,小熊コミュニティセンター協議会,,499,岐阜県,羽島市,小熊町３丁目３９７番地２,,21,209,5016273,,,,,,,2017-05-23,1,,,,,オグマコミユニテイセンターキヨウギカイ,0
50357,7700150084773,01,1,2018-06-18,2017-08-17,平成２９年度　全国高等学校スキー大会　岐阜県実行委員会,,499,岐阜県,岐阜市,薮田南２丁目１－１,,21,201,5008384,,,,,,,2017-08-17,1,,,,,ヘイセイニジユウキユウネンドゼンコクコウトウガツコウスキータイカイギフケンジツコウイインカイ,0
50358,7700150085664,01,1,2018-06-18,2017-10-17,岐阜市農業まつり実行委員会,,499,岐阜県,岐阜市,神田町１丁目１１番地,,21,201,5008833,,,,,,,2017-10-17,1,,,,,ギフシノウギヨウマツリジツコウイインカイ,0
50359,7700150089665,01,0,2018-08-13,2018-06-27,大垣地域経済戦略推進協議会,,499,岐阜県,大垣市,小野４丁目３５番地１０,,21,202,5030803,,,,,,,2018-06-27,1,,,,,オオガキチイキケイザイセンリヤクスイシンキヨウギカイ,0
57527,8700150081613,01,1,2018-06-19,2017-03-06,高山ロータリークラブ,,499,岐阜県,高山市,下三之町１３６十六銀行高山支店２Ｆ,,21,203,5060841,,,,,,,2017-03-06,1,,,,,タカヤマロータリークラブ,0
57528,8700150083304,01,1,2018-06-19,2017-05-23,足近コミュニティセンター協議会,,499,岐阜県,羽島市,足近町７丁目６６番地１,,21,209,5016207,,,,,,,2017-05-23,1,,,,,アヂカコミユニテイセンターキヨウギカイ,0
57529,8700150083312,01,1,2018-06-19,2017-05-23,下中コミュニティセンター協議会,,499,岐阜県,羽島市,下中町城屋敷３１８－１,,21,209,5016314,,,,,,,2017-05-23,1,,,,,シモナカコミユニテイセンターキヨウギカイ,0
57530,8700150084772,01,1,2018-04-06,2017-08-17,平成３０年度　全国高等学校総合体育大会　岐阜県実行委員会,,499,岐阜県,岐阜市,薮田南２丁目１－１,,21,201,5008384,,,,,,,2017-08-17,1,,,,,ヘイセイサンジユウネンドゼンコクコウトウガツコウソウゴウタイイクタイカイギフケンジツコウイインカイ,0
57531,8700150087569,01,1,2018-06-07,2018-02-21,ささゆりの里布ぞうり研究会,,499,岐阜県,恵那市,串原３１１１－４串原温泉マレットハウス,,21,210,5097831,,,,,,,2018-02-21,1,,,,,ササユリノサトヌノゾウリケンキュウカイ,0
64725,9700150081752,01,1,2018-06-21,2017-03-07,大湫町コミュニティ推進協議会,,499,岐阜県,瑞浪市,大湫町４２２番地の１,,21,208,5096471,,,,,,,2017-03-07,1,,,,,オオクテチヨウコミユニテイスイシンキヨウギカイ,0
64726,9700150083311,01,1,2018-06-21,2017-05-23,上中コミュニティセンター協議会,,499,岐阜県,羽島市,上中町沖１６９０番地,,21,209,5016318,,,,,,,2017-05-23,1,,,,,カミナカコミユニテイセンターキヨウギカイ,0
64727,9700150089366,01,0,2018-06-22,2018-06-11,川辺ボートコミュニティ,,499,岐阜県,加茂郡川辺町,比久見北垣外９番２号,,21,503,5090315,,,,,,,2018-06-11,1,,,,,カワベボートコミユニテイ,0
12467,1700150083153,01,1,2018-06-05,2017-05-18,浜松市立富塚中学校夢をはぐくむ学校づくり推進協議会,,499,静岡県,浜松市中区,富塚町４６０－１,,22,131,4328002,,,,,,,2017-05-18,1,,,,,ハママツシリツトミツカチユウガツコウユメヲハグクムガツコウヅクリスイシンキヨウギカイ,0
24975,2700150083152,01,1,2018-06-07,2017-05-18,浜松市立三方原中学校夢をはぐくむ学校づくり推進協議会,,499,静岡県,浜松市北区,豊岡町１９６,,22,135,4338103,,,,,,,2017-05-18,1,,,,,ハママツシリツミカタハラチユウガツコウユメヲハグクムガツコウヅクリスイシンキヨウギカイ,0
24976,2700150084084,01,1,2018-06-07,2017-06-22,エブリネイションチャーチ伊豆,,499,静岡県,伊豆市,柏久保６１６－１,,22,222,4102407,,,,,,,2017-06-22,1,,,,,エブリネイシヨンチヤーチイズ,0
24977,2700150087442,01,1,2018-06-22,2018-02-15,神座土地改良区,,499,静岡県,島田市,神座２３１６,,22,209,4270032,,,,,,,2018-02-15,1,,,,,カンザトチカイリヨウク,0
37442,3700150080438,01,1,2018-06-12,2017-02-01,日本基督教会　静岡池田伝道教会,,499,静岡県,静岡市駿河区,栗原３４－８,,22,102,4228008,,,,,,,2017-02-01,1,,,,,ニホンキリストキヨウカイシズオカイケダデンドウキヨウカイ,0
37443,3700150080636,01,1,2018-06-12,2017-02-08,ふらっと,,499,静岡県,袋井市,方丈３丁目５－１１,,22,216,4370022,,,,,,,2017-02-08,1,,,,,フラツト,0
37444,3700150085833,01,1,2018-06-12,2017-10-25,浜松市立河輪小学校夢をはぐくむ学校づくり推進協議会,,499,静岡県,浜松市南区,東町３３３番地,,22,134,4300822,,,,,,,2017-10-25,1,,,,,ハママツシリツカワワシヨウガツコウユメヲハグクムガツコウヅクリスイシンキヨウギカイ,0
49965,4700150082029,01,1,2018-05-15,2017-03-22,富士宮ライオンズクラブ,,499,静岡県,富士宮市,朝日町１２－１８,,22,207,4180057,,,,,,,2017-03-22,1,,,,,フジノミヤライオンズクラブ,0
49966,4700150083076,01,1,2018-06-13,2017-05-16,萩丘小よい子を育てる会,,499,静岡県,浜松市中区,幸５丁目１２番１号,,22,131,4338123,,,,,,,2017-05-16,1,,,,,ハギオカシヨウヨイコヲソダテルカイ,0
49967,4700150083101,01,1,2018-06-13,2017-05-18,駿河台四丁目町内会,,499,静岡県,富士市,今泉３３２５番地の１,,22,210,4170001,,,,,,,2017-05-18,1,,,,,スルガダイヨンチヨウメチヨウナイカイ,0
49968,4700150083605,01,1,2018-06-13,2017-06-01,姉妹都市提携４５周年記念バレエ公演実行委員会,,499,静岡県,浜松市中区,佐鳴台６丁目７－３６,,22,131,4328021,,,,,,,2017-06-01,1,,,,,シマイトシテイケイヨンジユウゴシユウネンキネンバレエコウエンジツコウイインカイ,0
49969,4700150083860,01,1,2018-06-13,2017-06-13,藤枝市男女共同参画推進センター運営協議会,,499,静岡県,藤枝市,駅前２丁目１－５,,22,214,4260034,,,,,,,2017-06-13,1,,,,,フジエダシダンジヨキヨウドウサンカクスイシンセンターウンエイキヨウギカイ,0
49970,4700150083968,01,1,2018-06-13,2017-06-16,ＮＡＯＴＯＲＡ女性サミット実行委員会,,499,静岡県,浜松市中区,元城町１０３－２,,22,131,4300946,,,,,,,2017-06-16,1,,,,,ナオトラジヨセイサミツトジツコウイインカイ,0
49971,4700150084322,21,0,2019-09-03,2019-06-23,訪問Ｒｅｓｔ－Ｒｕｎｆ,,499,静岡県,浜松市浜北区,西美薗３４３－１,,22,136,4340033,,,2019-06-23,31,,,2017-07-06,1,,,,,ホウモンレストランエフ,0
49972,4700150088752,01,0,2018-05-30,2018-05-11,浅羽東地区まちづくり協議会,,499,静岡県,袋井市,梅山６３－１,,22,216,4371105,,,,,,,2018-05-11,1,,,,,アサバヒガシチクマチヅクリキヨウギカイ,0
62521,5700150083174,01,1,2018-06-14,2017-05-18,三方原中学校区心の教育推進協議会,,499,静岡県,浜松市北区,豊岡町１９６,,22,135,4338103,,,,,,,2017-05-18,1,,,,,ミカタハラチユウガツコウクココロノキヨウイクスイシンキヨウギカイ,0
62522,5700150084271,01,1,2018-05-18,2017-07-04,「浜松・浜名湖地域　食×農楽会」実行委員会,,499,静岡県,浜松市中区,元城町１０３－２浜松市役所　農業水産課内,,22,131,4300946,,,,,,,2017-07-04,1,,,,,ハママツハマナコチイキショクノウガッカイジッコウイインカイ,0
62523,5700150086094,01,1,2018-05-29,2017-11-16,ラフィーネ草薙管理組合,,499,静岡県,静岡市清水区,楠新田２０６,,22,103,4240882,,,,,,,2017-11-16,1,,,,,ラフイーネクサナギカンリクミアイ,0
62524,5700150087448,01,1,2018-06-07,2018-02-16,静岡県都市清掃協議会,,499,静岡県,静岡市葵区,追手町５番１号,,22,101,4200853,,,,,,,2018-02-16,1,,,,,シズオカケントシセイソウキョウギカイ,0
62525,5700150088719,01,0,2018-06-11,2018-05-10,浜松市認定農業者協議会,,499,静岡県,浜松市中区,元城町１０３－２浜松市農業振興課　内,,22,131,4300946,,,,,,,2018-05-10,1,,,,,ハママツシニンテイノウギヨウシヤキヨウギカイ,0
62526,5700150089353,01,0,2018-07-23,2018-06-11,わくわく手づくり市,,499,静岡県,牧之原市,白井１１５１－１－２,,22,226,4210502,,,,,,,2018-06-11,1,,,,,ワクワクテヅクリイチ,0
75021,6700150083925,01,1,2018-06-18,2017-06-15,かけがわ乳幼児教育未来学会,,499,静岡県,掛川市,長谷１丁目１－１,,22,213,4360047,,,,,,,2017-06-15,1,,,,,カケガワニユウヨウジキヨウイクミライガツカイ,0
75022,6700150084601,01,1,2018-06-18,2017-07-25,浜松市自主防災隊連合会,,499,静岡県,浜松市中区,元城町１０３－２危機管理課内,,22,131,4300946,,,,,,,2017-07-25,1,,,,,ハママツシジシユボウサイタイレンゴウカイ,0
75023,6700150084700,01,1,2018-06-18,2017-08-10,三島市地域公共交通網形成協議会,,499,静岡県,三島市,北田町４番４７号三島市役所内,,22,206,4110854,,,,,,,2017-08-10,1,,,,,ミシマシチイキコウキヨウコウツウモウケイセイキヨウギカイ,0
75024,6700150088536,01,0,2018-04-24,2018-04-19,西熊堂自治会,,499,静岡県,沼津市,西熊堂３７５番地,,22,203,4100051,,,,,,,2018-04-19,1,,,,,ニシクマンドウジチカイ,0
87575,7700150082100,12,1,2018-06-18,2017-08-30,旭・板屋Ａ－２地区市街地再開発組合,,499,静岡県,浜松市中区,旭町１０番地８,,22,131,4300927,,,,,,,2017-03-29,1,,,,,アサヒイタヤエーツーチクシガイチサイカイハツクミアイ,0
87576,7700150087025,01,1,2018-06-07,2018-01-16,静岡県市街地再開発促進協議会,,499,静岡県,浜松市中区,元城町１０３－２,,22,131,4300946,,,,,,,2018-01-16,1,,,,,シズオカケンシガイチサイカイハツソクシンキョウギカイ,0
100087,8700150080160,01,1,2018-06-19,2017-01-20,静岡県工業高等学校長会,,499,静岡県,静岡市葵区,長沼５００－１静岡県立科学技術高等学校内,,22,101,4200813,,,,,,,2017-01-20,1,,,,,シズオカケンコウギヨウコウトウガツコウチヨウカイ,0
100088,8700150080301,01,1,2018-06-19,2017-01-25,静岡地域メディカルコントロ－ル協議会,,499,静岡県,静岡市駿河区,南八幡町１０番３０号,,22,102,4228074,,,,,,,2017-01-25,1,,,,,シズオカチイキメデイカルコントロールキヨウギカイ,0
100089,8700150082347,01,1,2018-06-19,2017-04-11,熱海縁側ふくしフォーラム,,499,静岡県,熱海市,緑ガ丘町１３－１２社会福祉法人緑葉会内,,22,205,4130035,,,,,,,2017-04-11,1,,,,,アタミエンガワフクシフオーラム,0
100090,8700150083403,01,1,2018-06-19,2017-05-23,浜松市立芳川北小学校夢をはぐくむ学校づくり推進協議会,,499,静岡県,浜松市南区,頭陀寺町１０４６番地の１,,22,134,4300817,,,,,,,2017-05-23,1,,,,,ハママツシリツホウガワキタシヨウガツコウユメヲハグクムガツコウヅクリスイシンキヨウギカイ,0
100091,8700150086249,01,1,2018-05-24,2017-11-28,静清地域地下水利用対策協議会,,499,静岡県,静岡市葵区,追手町５番１号,,22,101,4200853,,,,,,,2017-11-28,1,,,,,セイセイチイキチカスイリヨウタイサクキョウギカイ,0
100092,8700150086686,01,1,2018-06-22,2017-12-19,伊豆市鳥獣被害防止対策協議会,,499,静岡県,伊豆市,小立野２４－１,,22,222,4102413,,,,,,,2017-12-19,1,,,,,イズシチヨウジユウヒガイボウシタイサクキヨウギカイ,0
100093,8700150088856,01,0,2018-06-11,2018-05-23,浜松市茶振興協議会,,499,静岡県,浜松市中区,元城町１０３－２浜松市農業振興課　内,,22,131,4300946,,,,,,,2018-05-23,1,,,,,ハママツシチヤシンコウキヨウギカイ,0
112596,9700150080655,01,1,2018-05-08,2017-02-10,倉真３区,,499,静岡県,掛川市,倉真３４８９番地の２,,22,213,4360341,,,,,,,2017-02-10,1,,,,,クラミサンク,0
112597,9700150083047,01,1,2018-06-21,2017-05-16,焼津市東益津第１５自治会下根方区１１町内会,,499,静岡県,焼津市,小浜１０８４,,22,212,4250011,,,,,,,2017-05-16,1,,,,,ヤイヅシヒガシマシヅダイジユウゴジチカイシモネカタクジユウイチチヨウナイカイ,0
112598,9700150085209,01,1,2018-07-04,2017-09-13,御殿場市地方創生魅力創造スポーツタウン推進連絡会,,499,静岡県,御殿場市,新橋１９９０－１０ＢＥ－ＯＮＥビル５Ｆ５０１号,,22,215,4120043,,,,,,,2017-09-13,1,,,,,ゴテンバシチホウソウセイミリヨクソウゾウスポーツタウンスイシンレンラクカイ,0
26777,1700150082477,01,1,2018-06-05,2017-04-17,幸田広域組織,,499,愛知県,額田郡幸田町,大字菱池字元林１番地１,,23,501,4440113,,,,,,,2017-04-17,1,,,,,コウタコウイキソシキ,0
26778,1700150083087,01,1,2018-05-18,2017-05-16,木曽路共栄会,,499,愛知県,名古屋市昭和区,白金３丁目１８番１３号,,23,107,4660058,,,,,,,2017-05-16,1,,,,,キソジキョウエイカイ,0
26779,1700150086305,01,1,2018-05-08,2017-11-30,西小鷹野町自治会,,499,愛知県,豊橋市,西小鷹野２丁目５－７,,23,201,4400013,,,,,,,2017-11-30,1,,,,,ニシオダカノチョウジチカイ,0
26780,1700150087963,01,1,2018-06-22,2018-03-12,小牧通訳ボランティア会,,499,愛知県,小牧市,光ケ丘６丁目３４番地７,,23,219,4850811,,,,,,,2018-03-12,1,,,,,コマキツウヤクボランテイアカイ,0
26781,1700150089803,12,0,2020-04-14,2020-04-01,下三ツ木町,,499,愛知県,岡崎市,下三ツ木町字丁田９番地２,,23,202,4440247,,,,,,,2018-06-29,1,,,,,シモミツギチヨウ,0
53619,2700150080034,01,1,2018-06-07,2017-01-17,名古屋インマヌエル・デフ教会,,499,愛知県,額田郡幸田町,大字大草字北川後６１－８ＢＷＯＶｉｌｌａｇｅ　Ｄ号室,,23,501,4440103,,,,,,,2017-01-17,1,,,,,ナゴヤインマヌエルデフキヨウカイ,0
53620,2700150080166,01,1,2018-06-07,2017-01-20,豊田公共嘱託登記事務連絡協議会,,499,愛知県,豊田市,十塚町２丁目１番地,,23,211,4710869,,,,,,,2017-01-20,1,,,,,トヨタコウキヨウシヨクタクトウキジムレンラクキヨウギカイ,0
53621,2700150080182,01,1,2018-06-11,2017-01-20,豊橋市担い手育成総合支援協議会,,499,愛知県,豊橋市,今橋町１豊橋市役所　農業企画課内,,23,201,4400801,,,,,,,2017-01-20,1,,,,,トヨハシシニナイテイクセイソウゴウシエンキョウギカイ,0
53622,2700150080249,01,1,2018-06-11,2017-01-24,名城大学経済・経営学会,,499,愛知県,名古屋市天白区,塩釜口１丁目５０１番地,,23,116,4680073,,,,,,,2017-01-24,1,,,,,メイジョウダイガクケイザイケイエイガッカイ,0
53623,2700150082633,01,1,2018-06-07,2017-04-24,第６０回日本手外科学会　学術集会,,499,愛知県,名古屋市昭和区,鶴舞町６５番名古屋大学大学院医学系研究科手の外科学内,,23,107,4660065,,,,,,,2017-04-24,1,,,,,ダイロクジユツカイニホンテゲカガツカイガクジユツシユウカイ,0
53624,2700150087806,01,1,2018-06-22,2018-03-06,丸美タウンマンション橘　管理組合,,499,愛知県,名古屋市中区,橘１丁目１５－７,,23,106,4600016,,,,,,,2018-03-06,1,,,,,マルミタウンマンシヨンタチバナカンリクミアイ,0
53625,2700150089042,01,0,2018-07-31,2018-05-29,天伯団地ささえ合い活動ひだまりの会,,499,愛知県,豊橋市,天伯町字三ツ山１６－１９,,23,201,4418122,,,,,,,2018-05-29,1,,,,,テンパクダンチササエアイカツドウヒダマリノカイ,0
53626,2700150089521,01,0,2018-06-22,2018-06-19,ＪＲ春日井駅南東地区市街地再開発組合,,499,愛知県,春日井市,上条町１丁目２１５番地,,23,206,4860833,,,,,,,2018-06-19,1,,,,,ジエイアールカスガイエキナントウチクシガイチサイカイハツクミアイ,0
80410,3700150080735,01,0,2019-05-08,2017-02-13,手羽先サミット実行委員会,,499,愛知県,名古屋市熱田区,金山町１丁目１６－９つくばビル３Ｆ,,23,109,4560002,,,,,,,2017-02-13,1,,,,,テバサキサミツトジツコウイインカイ,0
80411,3700150082211,01,1,2018-05-15,2017-04-05,愛知県卓球協会,,499,愛知県,名古屋市千種区,若水３丁目２番１２号愛知工業大学名電高等学校内,,23,101,4640071,,,,,,,2017-04-05,1,,,,,アイチケンタッキュウキョウカイ,0
80412,3700150085511,01,1,2018-05-24,2017-10-04,中発取引先持株会,,499,愛知県,みよし市,福田町宮下４３番地１中央発條株式会社内,,23,236,4700225,,,,,,,2017-10-04,1,,,,,チュウハツトリヒキサキモチカブカイ,0
80413,3700150088497,01,0,2018-05-17,2018-04-18,前飛保会館,,499,愛知県,江南市,前飛保町寺前７７,,23,217,4838335,,,,,,,2018-04-18,1,,,,,マエヒボカイカン,0
107333,4700150080305,12,0,2019-03-18,2018-04-01,海部東部障害者総合支援協議会,,499,愛知県,あま市,甚目寺二伴田７６番地,,23,237,4901111,,,,,,,2017-01-25,1,,,,,アマトウブシヨウガイシヤソウゴウシエンキヨウギカイ,0
107334,4700150082565,01,1,2018-06-13,2017-04-19,愛知県カヌー協会,,499,愛知県,みよし市,三好町東山２０９－１,,23,236,4700224,,,,,,,2017-04-19,1,,,,,アイチケンカヌーキヨウカイ,0
107335,4700150082680,01,1,2018-06-13,2017-04-26,岡崎公証人合同役場,,499,愛知県,岡崎市,羽根町字貴登野１５シビックセンタ－２階,,23,202,4440813,,,,,,,2017-04-26,1,,,,,オカザキコウシヨウニンゴウドウヤクバ,0
107336,4700150084818,01,1,2018-06-13,2017-08-18,一宮市国際交流協会,,499,愛知県,一宮市,本町２丁目５番６号,,23,203,4910859,,,,,,,2017-08-18,1,,,,,イチノミヤシコクサイコウリユウキヨウカイ,0
107337,4700150085436,01,1,2018-05-24,2017-09-27,日本プラネタリウム協議会,,499,愛知県,名古屋市中区,栄２丁目１７番１号名古屋市科学館内,,23,106,4600008,,,,,,,2017-09-27,1,,,,,ニホンプラネタリウムキョウギカイ,0
107338,4700150086806,01,1,2018-05-08,2017-12-22,錦二丁目７番地区市街地再開発組合,,499,愛知県,名古屋市中区,錦２丁目７番６号,,23,106,4600003,,,,,,,2017-12-22,1,,,,,ニシキニチョウメナナバンチクシガイチサイカイハツクミアイ,0
107339,4700150087829,01,1,2018-06-22,2018-03-06,日進香久山西部土地区画整理組合,,499,愛知県,日進市,梅森町新田１３５番地６２３,,23,230,4700132,,,,,,,2018-03-06,1,,,,,ニツシンカグヤマセイブトチクカクセイリクミアイ,0
107340,4700150089395,01,0,2018-06-15,2018-06-12,赤中区,,499,愛知県,田原市,赤羽根町天神１０４番地,,23,231,4413502,,,,,,,2018-06-12,1,,,,,アカナカク,0
134206,5700150082300,21,0,2018-09-18,2017-07-05,春日井市観光コンベンション協会,,499,愛知県,春日井市,上条町１丁目ＪＲ春日井駅北口１階,,23,206,4860833,,,2017-07-05,31,,,2017-04-10,1,,,,,,0
134207,5700150082614,01,1,2018-06-14,2017-04-24,アジア競技大会愛知・名古屋合同準備会,,499,愛知県,名古屋市中区,三の丸３丁目１－２,,23,106,4600001,,,,,,,2017-04-24,1,,,,,アジアキヨウギタイカイアイチナゴヤゴウドウジユンビカイ,0
134208,5700150085534,01,1,2018-06-14,2017-10-11,八名生涯学習クラブ,,499,愛知県,新城市,黒田字萩平野９６－２,,23,221,4411332,,,,,,,2017-10-11,1,,,,,ヤナシヨウガイガクシユウクラブ,0
134209,5700150086788,12,0,2018-10-09,2018-09-14,小鈴谷地域保全隊,,499,愛知県,常滑市,小鈴谷字亀井戸６９,,23,216,4790807,,,,,,,2017-12-22,1,,,,,コスガヤチイキホゼンタイ,0
134210,5700150087480,01,1,2018-06-22,2018-02-20,東浦天白土地区画整理組合,,499,愛知県,知多郡東浦町,大字緒川字政所２０,,23,442,4702102,,,,,,,2018-02-20,1,,,,,ヒガシウラテンパクトチクカクセイリクミアイ,0
134211,5700150087794,01,1,2018-06-22,2018-03-06,東海富木島石根土地区画整理組合,,499,愛知県,東海市,富木島町南屋敷１９番地,,23,222,4760011,,,,,,,2018-03-06,1,,,,,トウカイフキシマイシネトチクカクセイリクミアイ,0
161010,6700150080245,01,1,2018-05-08,2017-01-24,北尾自治会,,499,愛知県,大府市,北崎町内田面３０番地,,23,223,4740001,,,,,,,2017-01-24,1,,,,,キタオジチカイ,0
161011,6700150083355,01,1,2018-06-18,2017-05-23,大府横根平子土地区画整理組合,,499,愛知県,大府市,横根町家下８７番地１,,23,223,4740011,,,,,,,2017-05-23,1,,,,,オオブヨコネヒラコトチクカクセイリクミアイ,0
161012,6700150084270,01,1,2018-06-18,2017-06-30,こどもと未来をつなぐ虹の会,,499,愛知県,岩倉市,大地新町２丁目６６,,23,228,4820025,,,,,,,2017-06-30,1,,,,,コドモトミライヲツナグニジノカイ,0
