922,2700150000074,01,1,2018-06-21,2015-10-09,Ａｌｖａ　Ｕｎｄｅｒｗｒｉｔｉｎｇ　ＬＬＰ,,401,東京都,千代田区,霞が関３丁目２－６東京倶楽部ビルディング６階,,13,101,1000013,Ｏｎｅ　Ｌｉｍｅ　Ｓｔｒｅｅｔ　Ｌｏｎｄｏｎ　ＥＣ３Ｍ　７ＨＡ　ＵＫ,,,,,,2015-10-09,1,,,,,アルバアンダーライテイングエルエルピー,0
923,2700150000082,01,1,2018-06-21,2015-10-09,ＥＷＪＭ　ＬＬＰ,,401,東京都,千代田区,霞が関３丁目２－６東京倶楽部ビルディング６階,,13,101,1000013,Ｏｎｅ　Ｌｉｍｅ　Ｓｔｒｅｅｔ　Ｌｏｎｄｏｎ　ＥＣ３Ｍ　７ＨＡ　ＵＫ,,,,,,2015-10-09,1,,,,,イーダブルジエイエムエルエルピー,0
924,2700150000090,01,1,2018-06-21,2015-10-09,Ａｌｔｉｒ　Ｕｎｄｅｒｗｒｉｔｉｎｇ　Ｌｉｍｉｔｅｄ,,401,東京都,千代田区,霞が関３丁目２－６東京倶楽部ビルディング６階,,13,101,1000013,Ｏｎｅ　Ｌｉｍｅ　Ｓｔｒｅｅｔ　Ｌｏｎｄｏｎ　ＥＣ３Ｍ　７ＨＡ　ＵＫ,,,,,,2015-10-09,1,,,,,アルテイアンダーライテイングリミテツド,0
925,2700150000099,01,1,2018-06-21,2015-10-09,Ａｍｒａｓ　Ｃａｐｉｔａｌ　Ｌｉｍｉｔｅｄ,,401,東京都,千代田区,霞が関３丁目２－６東京倶楽部ビルディング６階,,13,101,1000013,Ｏｎｅ　Ｌｉｍｅ　Ｓｔｒｅｅｔ　Ｌｏｎｄｏｎ　ＥＣ３Ｍ　７ＨＡ　ＵＫ,,,,,,2015-10-09,1,,,,,アマスキヤピタルリミテツド,0
926,2700150000116,01,1,2018-06-21,2015-10-09,Ａｅｇｉｓ　Ｅｌｅｃｔｒｉｃ　＆　Ｇａｓ　Ｉｎｔｅｒｎａｔｉｏｎａｌ　Ｓｅｒｖｉｃｅｓ　Ｌｉｍｉｔｅｄ,,401,東京都,千代田区,霞が関３丁目２－６東京倶楽部ビルディング６階,,13,101,1000013,Ｏｎｅ　Ｌｉｍｅ　Ｓｔｒｅｅｔ　Ｌｏｎｄｏｎ　ＥＣ３Ｍ　７ＨＡ　ＵＫ,,,,,,2015-10-09,1,,,,,アイギスエリクトリツクアンドガスインターナシヨナルサービスリミテツド,0
927,2700150000124,01,1,2018-06-21,2015-10-09,Ａｒｇｅｎｔａ　Ｕｎｄｅｒｗｒｉｔｉｎｇ　Ｎｏ．　９　Ｌｉｍｉｔｅｄ,,401,東京都,千代田区,霞が関３丁目２－６東京倶楽部ビルディング６階,,13,101,1000013,Ｏｎｅ　Ｌｉｍｅ　Ｓｔｒｅｅｔ　Ｌｏｎｄｏｎ　ＥＣ３Ｍ　７ＨＡ　ＵＫ,,,,,,2015-10-09,1,,,,,アルジエンタアンダーライテイングナンバーナインリミテツド,0
928,2700150000140,01,1,2018-06-21,2015-10-09,Ｗｕｌｓｉｎ　Ｌｉｍｉｔｅｄ,,401,東京都,千代田区,霞が関３丁目２－６東京倶楽部ビルディング６階,,13,101,1000013,Ｏｎｅ　Ｌｉｍｅ　Ｓｔｒｅｅｔ　Ｌｏｎｄｏｎ　ＥＣ３Ｍ　７ＨＡ　ＵＫ,,,,,,2015-10-09,1,,,,,ウオルスンリミテツド,0
929,2700150000149,13,1,2019-06-27,2019-04-05,株式会社ウィズドメイン,,401,東京都,中央区,京橋２丁目５－２Ａ・Ｍ京橋ビル５０１,,13,102,1040031,大韓民国京畿道城南市盆唐区ファンセウル路２６２、１０階（薮内洞、ソンオクビルディング）,,,,,,2015-10-09,1,,,,,カブシキガイシヤウイズドメイン,0
930,2700150000157,01,1,2018-06-21,2015-10-09,Ｗｏｏｄｐｅｃｋｅｒｓ　Ｕｎｄｅｒｗｒｉｔｉｎｇ　ＬＬＰ,,401,東京都,千代田区,霞が関３丁目２－６東京倶楽部ビルディング６階,,13,101,1000013,Ｏｎｅ　Ｌｉｍｅ　Ｓｔｒｅｅｔ　Ｌｏｎｄｏｎ　ＥＣ３Ｍ　７ＨＡ　ＵＫ,,,,,,2015-10-09,1,,,,,ウツドペツカーズアンダーライテイングエルエルピー,0
931,2700150000165,01,1,2018-06-21,2015-10-09,Ｗｏｏｄｓｆｏｒｄ　Ｕｎｄｅｒｗｒｉｔｉｎｇ　ＬＬＰ,,401,東京都,千代田区,霞が関３丁目２－６東京倶楽部ビルディング６階,,13,101,1000013,Ｏｎｅ　Ｌｉｍｅ　Ｓｔｒｅｅｔ　Ｌｏｎｄｏｎ　ＥＣ３Ｍ　７ＨＡ　ＵＫ,,,,,,2015-10-09,1,,,,,ウツズフオードアンダーライテイングエルエルピー,0
932,2700150000198,01,1,2018-06-21,2015-10-09,ＰａｒｔｎｅｒＲｅ　Ｃｏｒｐｏｒａｔｅ　Ｍｅｍｂｅｒ　２　Ｌｉｍｉｔｅｄ,,401,東京都,千代田区,霞が関３丁目２－６東京倶楽部ビルディング６階　ロイズジャパン株式会社内,,13,101,1000013,Ｏｎｅ　Ｌｉｍｅ　Ｓｔｒｅｅｔ　Ｌｏｎｄｏｎ　ＥＣ３Ｍ　７ＨＡ　ＵＫ,,,,,,2015-10-09,1,,,,,パートナーリコーポレートメンバーツーリミテツド,0
933,2700150000215,01,1,2018-06-21,2015-10-09,Ａｒｋ　Ｃｏｒｐｏｒａｔｅ　Ｍｅｍｂｅｒ（Ｎｏ２）Ｌｉｍｉｔｅｄ,,401,東京都,千代田区,霞が関３丁目２－６東京倶楽部ビルディング６階　ロイズジャパン株式会社内,,13,101,1000013,Ｏｎｅ　Ｌｉｍｅ　Ｓｔｒｅｅｔ　Ｌｏｎｄｏｎ　ＥＣ３Ｍ　７ＨＡ　ＵＫ,,,,,,2015-10-09,1,,,,,アークコーポレートメンバーナンバーツーリミテツド,0
934,2700150000223,01,1,2018-06-21,2015-10-09,エア・インディア・リミテッド,,401,東京都,千代田区,内幸町１丁目１－１帝国ホテルタワー１１階,,13,101,1000011,インド、ニューデリー市グルドウワラ、ラカブガンジロード、エアラインハウス１１３,,,,,,2015-10-09,1,,,,,エアインデイアリミテツド,0
935,2700150000231,01,1,2018-06-21,2015-10-09,ＡＳＬＰ８６,,401,東京都,千代田区,霞が関３丁目２－６東京倶楽部ビルディング６階,,13,101,1000013,Ｏｎｅ　Ｌｉｍｅ　Ｓｔｒｅｅｔ　Ｌｏｎｄｏｎ　ＥＣ３Ｍ　７ＨＡ　ＵＫ,,,,,,2015-10-09,1,,,,,エーエスエルピーエイトシツクス,0
936,2700150000248,01,1,2018-06-21,2015-10-09,ＡＳＬＰ１１２　ＳＬＰ,,401,東京都,千代田区,霞が関３丁目２－６東京倶楽部ビルディング６階,,13,101,1000013,Ｏｎｅ　Ｌｉｍｅ　Ｓｔｒｅｅｔ　Ｌｏｎｄｏｎ　ＥＣ３Ｍ　７ＨＡ　ＵＫ,,,,,,2015-10-09,1,,,,,エーエスエルピーワンワンツーエスエルピー,0
937,2700150000264,01,1,2018-06-21,2015-10-09,ＡＳＬＰ１００　ＳＬＰ,,401,東京都,千代田区,霞が関３丁目２－６東京倶楽部ビルディング６階,,13,101,1000013,Ｏｎｅ　Ｌｉｍｅ　Ｓｔｒｅｅｔ　Ｌｏｎｄｏｎ　ＥＣ３Ｍ　７ＨＡ　ＵＫ,,,,,,2015-10-09,1,,,,,エーエスエルピーワンゼロゼロエスエルピー,0
938,2700150000272,01,1,2018-06-21,2015-10-09,ＬＢ　Ｌｉｍｉｔｅｄ,,401,東京都,千代田区,霞が関３丁目２－６東京倶楽部ビルディング６階,,13,101,1000013,Ｏｎｅ　Ｌｉｍｅ　Ｓｔｒｅｅｔ　Ｌｏｎｄｏｎ　ＥＣ３Ｍ　７ＨＡ　ＵＫ,,,,,,2015-10-09,1,,,,,エルビーリミテツド,0
939,2700150000280,01,1,2018-06-21,2015-10-09,ＡＪＳＬＰ９,,401,東京都,千代田区,霞が関３丁目２－６東京倶楽部ビルディング６階,,13,101,1000013,Ｏｎｅ　Ｌｉｍｅ　Ｓｔｒｅｅｔ　Ｌｏｎｄｏｎ　ＥＣ３Ｍ　７ＨＡ　ＵＫ,,,,,,2015-10-09,1,,,,,エージエイエスエルピーナイン,0
940,2700150000289,01,1,2018-06-21,2015-10-09,ＳＴＡＲＨＩＬＬ　ＧＬＯＢＡＬ　ＲＥＩＴ　ＪＡＰＡＮ　ＳＰＣ　ＯＮＥ　ＰＴＥ．ＬＴＤ．,,401,東京都,千代田区,丸の内３丁目１－１国際ビル９階,,13,101,1000005,シンガポール共和国シンガポール、オーチャード・ロード＃２１－０８、３９１Ｂ、ニー・アン・シティ・タワーＢ,,,,,,2015-10-09,1,,,,,スターヒルグローバルリートジヤパンエスピーシーワンピーテイーイーリミテツド,0
941,2700150000297,01,1,2018-06-21,2015-10-09,ＳＫエナジー株式会社,,401,東京都,千代田区,内幸町１丁目１番７号,,13,101,1000011,大韓民国ソウル特別市鍾路区瑞麟洞９９,,,,,,2015-10-09,1,,,,,エスケイエナジーカブシキガイシヤ,0
942,2700150000306,01,1,2018-06-21,2015-10-09,Ｎ　Ｃｈａｒｌｅｓｗｏｒｔｈ　ＬＬＰ,,401,東京都,千代田区,霞が関３丁目２－６東京倶楽部ビルディング６階,,13,101,1000013,Ｏｎｅ　Ｌｉｍｅ　Ｓｔｒｅｅｔ　Ｌｏｎｄｏｎ　ＥＣ３Ｍ　７ＨＡ　ＵＫ,,,,,,2015-10-09,1,,,,,エヌチヤールズワースエルエルピー,0
943,2700150000314,01,1,2016-06-08,2015-10-09,Ｏｓｅｒ，ＰＣ　Ａａｒｏｎ　Ｍ．,,401,,,,,,,,１２００　Ｓｅｖｅｎｔｅｅｎｔｈ　Ｓｔｒｅｅｔ，ＮＷ，Ｗａｓｈｉｎｇｔｏｎ，ＤＣ　２００３６　Ｕ．Ｓ．Ａ．,,,,,,2015-10-09,1,,,,,,0
944,2700150000330,01,1,2018-06-21,2015-10-09,Ｅｓｃｏｔｔ　Ｆａｒｍ　ＬＬＰ,,401,東京都,千代田区,霞が関３丁目２－６東京倶楽部ビルディング６階,,13,101,1000013,Ｏｎｅ　Ｌｉｍｅ　Ｓｔｒｅｅｔ　Ｌｏｎｄｏｎ　ＥＣ３Ｍ　７ＨＡ　ＵＫ,,,,,,2015-10-09,1,,,,,エスコツトフアームエルエルピー,0
945,2700150000339,01,1,2018-06-21,2015-10-09,ＳＭＳ　Ｇｒｏｕｐ　ＧｍｂＨ,,401,東京都,千代田区,霞が関３丁目２－５,,13,101,1000013,ドイツ連邦共和国、デュッセルドルフ，エドゥアードシュールマンシュトラーセ４,,,,,,2015-10-09,1,,,,,エスエムエスグループゲーエムベーハー,0
946,2700150000363,01,1,2018-06-21,2015-10-09,ＡＳＬＰ　６１,,401,東京都,千代田区,霞が関３丁目２－６東京倶楽部ビルディング６階,,13,101,1000013,Ｏｎｅ　Ｌｉｍｅ　Ｓｔｒｅｅｔ　Ｌｏｎｄｏｎ　ＥＣ３Ｍ　７ＨＡ　ＵＫ,,,,,,2015-10-09,1,,,,,エーエスエルピーシツクスワン,0
947,2700150000371,01,1,2018-06-21,2015-10-09,Ｏｒｉａｎａ　Ｕｎｄｅｒｗｒｉｔｉｎｇ　Ｌｉｍｉｔｅｄ,,401,東京都,千代田区,霞が関３丁目２－６東京倶楽部ビルディング６階,,13,101,1000013,Ｏｎｅ　Ｌｉｍｅ　Ｓｔｒｅｅｔ　Ｌｏｎｄｏｎ　ＥＣ３Ｍ　７ＨＡ　ＵＫ,,,,,,2015-10-09,1,,,,,オリアーナアンダーライテイングリミテツド,0
948,2700150000405,01,1,2018-06-21,2015-10-09,Ｃｈｕｂｂ　Ｃａｐｉｔａｌ　１　Ｌｔｄ,,401,東京都,千代田区,霞が関３丁目２－６東京倶楽部ビルディング６階,,13,101,1000013,Ｏｎｅ　Ｌｉｍｅ　Ｓｔｒｅｅｔ　Ｌｏｎｄｏｎ　ＥＣ３Ｍ　７ＨＡ　ＵＫ,,,,,,2015-10-09,1,,,,,チヤブキヤピタルワンリミテツド,0
949,2700150000413,01,1,2018-06-21,2015-10-09,Ｃａｎｏｐｉｕｓ　Ｃａｐｉｔａｌ　Ｎｉｎｅ　Ｌｉｍｉｔｅｄ,,401,東京都,千代田区,霞が関３丁目２－６東京倶楽部ビルディング６階,,13,101,1000013,Ｏｎｅ　Ｌｉｍｅ　Ｓｔｒｅｅｔ　Ｌｏｎｄｏｎ　ＥＣ３Ｍ　７ＨＡ　ＵＫ,,,,,,2015-10-09,1,,,,,カノピウスキヤピタルナインリミテツド,0
950,2700150000421,01,1,2018-06-21,2015-10-09,ＬＳエムトロン株式会社　日本事務所,,401,東京都,千代田区,霞が関３丁目２－６東京倶楽部ビル１３Ｆ,,13,101,1000013,１１Ｆ，ＬＳ　Ｔｏｗｅｒ，１０２６－６　Ｈｏｇｙｅ－ｄｏｎｇ，ｄｏｎｇａｎ－ｇｕ，Ａｎｙａｎｇ－ｓｉ，Ｇｙｅｏｎｇｇｉ－ｄｏ．Ｋｏｒｅａ．,,,,,,2015-10-09,1,,,,,エルエスエムトロンカブシキガイシヤニホンジムシヨ,0
951,2700150000438,01,1,2018-06-21,2015-10-09,ＡＳ　Ｕｎｄｅｒｗｒｉｔｉｎｇ　ＬＬＰ,,401,東京都,千代田区,霞が関３丁目２－６東京倶楽部ビルディング６階　ロイズジャパン株式会社内,,13,101,1000013,Ｏｎｅ　Ｌｉｍｅ　Ｓｔｒｅｅｔ　Ｌｏｎｄｏｎ　ＥＣ３Ｍ　７ＨＡ　ＵＫ,,,,,,2015-10-09,1,,,,,エーエスアンダーライテイングエルエルピー,0
952,2700150000446,01,1,2018-06-21,2015-10-09,カーライル・ジャパン・エルエルシー,,401,東京都,千代田区,丸の内１丁目５－１新丸の内ビルディング,,13,101,1000005,アメリカ合衆国２０００４－２５０５ワシントンＤ．Ｃ．、エヌダブリュースイート２２０サウス、ペンシルヴェニア・アヴェニュー１００１カーライルグループ気付,,,,,,2015-10-09,1,,,,,カーライルジヤパンエルエルシー,0
953,2700150000454,12,0,2019-02-04,2017-03-01,株式会社　ＤＯＮＧＷＯＯＮ　ＡＮＡＴＥＣＨ,,401,東京都,千代田区,霞が関３丁目２番５号霞が関ビルディング,,13,101,1000013,大韓民国ソウル特別市瑞草区南部循環路２３５１（瑞草洞、アリランタワー）,,,,,,2015-10-09,1,,,,,カブシキガイシヤドンウンアナテツク,0
954,2700150000462,01,1,2018-06-21,2015-10-09,ＣａｒＶａｌ　Ｉｎｖｅｓｔｏｒｓ　Ｐｔｅ．Ｌｔｄ．,,401,東京都,千代田区,丸の内３丁目１－１,,13,101,1000005,シンガポール共和国１９９５５５、コンコース２３－０１、ビーチロード３００,,,,,,2015-10-09,1,,,,,カーバルインベスターズピーテイーイーリミテツド,0
955,2700150000479,01,1,2018-06-21,2015-10-09,Ｃａｐｅｎｈｕｒｓｔ　ＬＬＰ,,401,東京都,千代田区,霞が関３丁目２－６東京倶楽部ビルディング６階,,13,101,1000013,Ｏｎｅ　Ｌｉｍｅ　Ｓｔｒｅｅｔ　Ｌｏｎｄｏｎ　ＥＣ３Ｍ　７ＨＡ　ＵＫ,,,,,,2015-10-09,1,,,,,カペンハーストエルエルピー,0
956,2700150000487,01,1,2018-06-21,2015-10-09,Ｃａｒｓａｙ　Ｕｎｄｅｒｗｒｉｔｉｎｇ　ＬＬＰ,,401,東京都,千代田区,霞が関３丁目２－６東京倶楽部ビルディング６階,,13,101,1000013,Ｏｎｅ　Ｌｉｍｅ　Ｓｔｒｅｅｔ　Ｌｏｎｄｏｎ　ＥＣ３Ｍ　７ＨＡ　ＵＫ,,,,,,2015-10-09,1,,,,,カーセイアンダーライテイングエルエルピー,0
957,2700150000495,01,1,2018-06-21,2015-10-09,Ｈ４Ｏ　ＨＯＬＤＩＮＧＳ,,401,東京都,千代田区,麹町５丁目３－６第７秋山ビル,,13,101,1020083,英国領ケイマン諸島、グランド・ケイマン、ジョージ・タウン、８７メアリーストリート、ウォーカーハウス、私書箱ＫＹ１－９００２、ウォーカーズエスピービーリミテッド,,,,,,2015-10-09,1,,,,,エイチフオーオーホールデイングス,0
958,2700150000504,01,1,2018-06-21,2015-10-09,Ｋｉｌｎ　Ｃｏｔｅｓｗｏｒｔｈ　Ｓｔｅｗａｒｔ　ＳＬＰ　２,,401,東京都,千代田区,霞が関３丁目２－６東京倶楽部ビルディング６階,,13,101,1000013,Ｏｎｅ　Ｌｉｍｅ　Ｓｔｒｅｅｔ　Ｌｏｎｄｏｎ　ＥＣ３Ｍ　７ＨＡ　ＵＫ,,,,,,2015-10-09,1,,,,,キルンコテスワーススチユワートエスエルピーツー,0
959,2700150000512,01,1,2018-06-21,2015-10-09,金融監督院　東京事務所,,401,東京都,千代田区,有楽町１丁目７－１有楽町電気ビル南館１０５１,,13,101,1000006,大韓民国ソウル特別市永登浦区汝矣島洞２７,,,,,,2015-10-09,1,,,,,キンユウカントクイントウキヨウジムシヨ,0
960,2700150000529,01,1,2018-06-21,2015-10-09,Ｇｉｌｍｏｕｒ　Ｕｎｄｅｒｗｒｉｔｉｎｇ　ＬＬＰ,,401,東京都,千代田区,霞が関３丁目２－６東京倶楽部ビルディング６階,,13,101,1000013,Ｏｎｅ　Ｌｉｍｅ　Ｓｔｒｅｅｔ　Ｌｏｎｄｏｎ　ＥＣ３Ｍ　７ＨＡ　ＵＫ,,,,,,2015-10-09,1,,,,,ギルモアアンダーライテイングエルエルピー,0
961,2700150000537,01,1,2018-06-21,2015-10-09,ＣＡＴＢＡＮＧ　９２６　ＬＩＭＩＴＥＤ,,401,東京都,千代田区,霞が関３丁目２－６東京倶楽部ビルディング６階,,13,101,1000013,Ｏｎｅ　Ｌｉｍｅ　Ｓｔｒｅｅｔ　Ｌｏｎｄｏｎ　ＥＣ３Ｍ　７ＨＡ　ＵＫ,,,,,,2015-10-09,1,,,,,キヤトバンナインツーシツクスリミテツド,0
962,2700150000545,01,1,2018-06-21,2015-10-09,Ｋｉｍａｋａ　Ｌｉｍｉｔｅｄ,,401,東京都,千代田区,霞が関３丁目２－６東京倶楽部ビルディング６階　ロイズジャパン株式会社内,,13,101,1000013,Ｏｎｅ　Ｌｉｍｅ　Ｓｔｒｅｅｔ　Ｌｏｎｄｏｎ　ＥＣ３Ｍ　７ＨＡ　ＵＫ,,,,,,2015-10-09,1,,,,,キマカリミテツド,0
963,2700150000553,01,1,2018-06-21,2015-10-09,Ｇｒｅａｔｈｅａｒｔ（ＵＫ）Ｌｉｍｉｔｅｄ,,401,東京都,千代田区,霞が関３丁目２－６東京倶楽部ビルディング６階　ロイズジャパン株式会社内,,13,101,1000013,Ｏｎｅ　Ｌｉｍｅ　Ｓｔｒｅｅｔ　Ｌｏｎｄｏｎ　ＥＣ３Ｍ　７ＨＡ　ＵＫ,,,,,,2015-10-09,1,,,,,グレートハートユーケーリミテツド,0
964,2700150000561,01,1,2018-06-21,2015-10-09,Ｇｒｅａｔｈｅａｒｔ　Ｕｎｄｅｒｗｒｉｔｉｎｇ　Ｌｔｄ,,401,東京都,千代田区,霞が関３丁目２－６東京倶楽部ビルディング６階,,13,101,1000013,Ｏｎｅ　Ｌｉｍｅ　Ｓｔｒｅｅｔ　Ｌｏｎｄｏｎ　ＥＣ３Ｍ　７ＨＡ　ＵＫ,,,,,,2015-10-09,1,,,,,グレートハートアンダーライテイングリミテツド,0
965,2700150000578,01,1,2018-06-21,2015-10-09,Ｇｌｙｎｄｅｒｉ　ＬＬＰ,,401,東京都,千代田区,霞が関３丁目２－６東京倶楽部ビルディング６階,,13,101,1000013,Ｏｎｅ　Ｌｉｍｅ　Ｓｔｒｅｅｔ　Ｌｏｎｄｏｎ　ＥＣ３Ｍ　７ＨＡ　ＵＫ,,,,,,2015-10-09,1,,,,,グリンデリエルエルピー,0
966,2700150000586,13,1,2018-06-21,2017-02-15,Ｃｒｏｗｎ　Ｊｅｗｅｌｓ　Ｃｏｎｓｕｌｔａｎｔｓ　Ｌｉｍｉｔｅｄ,,401,東京都,千代田区,霞が関３丁目２－６東京倶楽部ビルディング１１階,,13,101,1000013,英国ロンドン、ワーシップ・ストリート３１－４１,,,,,,2015-10-09,1,,,,,クラウンジユエルズコンサルタンツリミテツド,0
967,2700150000594,01,1,2018-06-21,2015-10-09,Ｇｒｅｙｈｏｕｎｄ　Ｃａｐｉｔａｌ　ＬＬＰ,,401,東京都,千代田区,霞が関３丁目２－６東京倶楽部ビルディング６階,,13,101,1000013,Ｏｎｅ　Ｌｉｍｅ　Ｓｔｒｅｅｔ　Ｌｏｎｄｏｎ　ＥＣ３Ｍ　７ＨＡ　ＵＫ,,,,,,2015-10-09,1,,,,,グレイハウンドキヤピタルエルエルピー,0
968,2700150000603,01,1,2018-06-21,2015-10-09,グローバルプロスペクトパートナーズ・エルエルシー,,401,東京都,千代田区,霞が関３丁目２番５号,,13,101,1000013,米国６０６１１イリノイ州、シカゴ、イースト・ピアソンストリート１８０、スウィート５１０３,,,,,,2015-10-09,1,,,,,グローバルプロスペクトパートナーズエルエルシー,0
969,2700150000611,01,1,2018-06-21,2015-10-09,Ｇｌｅｎｃａｉｒｎ　Ｃａｍｐｂｅｌｌ　ＬＬＰ,,401,東京都,千代田区,霞が関３丁目２－６東京倶楽部ビルディング６階　ロイズジャパン株式会社内,,13,101,1000013,Ｏｎｅ　Ｌｉｍｅ　Ｓｔｒｅｅｔ　Ｌｏｎｄｏｎ　ＥＣ３Ｍ　７ＨＡ　ＵＫ,,,,,,2015-10-09,1,,,,,グレンケアンキヤンベルエルエルピー,0
970,2700150000628,01,1,2018-06-21,2015-10-09,ＫＰＭＧ　Ｊａｐａｎ　Ｓｅｒｖｉｃｅｓ　ＬＬＣ,,401,東京都,千代田区,大手町１丁目９番７号大手町フィナンシャルシティサウスタワー,,13,101,1000004,アメリカ合衆国ニュージャージー州モントベール、チェスナットリッジロード３、ビルディング１,,,,,,2015-10-09,1,,,,,ケーピーエムジージヤパンサービスエルエルシー,0
971,2700150000644,01,1,2018-06-21,2015-10-09,Ｋｅｔｔｏｎ　Ｕｎｄｅｒｗｒｉｔｉｎｇ　ＬＬＰ,,401,東京都,千代田区,霞が関３丁目２－６東京倶楽部ビルディング６階,,13,101,1000013,Ｏｎｅ　Ｌｉｍｅ　Ｓｔｒｅｅｔ　Ｌｏｎｄｏｎ　ＥＣ３Ｍ　７ＨＡ　ＵＫ,,,,,,2015-10-09,1,,,,,ケトンアンダーライテイングエルエルピー,0
972,2700150000652,01,1,2018-06-21,2015-10-09,Ｋｅｎｓｉｎｇｔｏｎ　Ｕｎｄｅｒｗｒｉｔｉｎｇ　Ｌｔｄ,,401,東京都,千代田区,霞が関３丁目２－６東京倶楽部ビルディング６階,,13,101,1000013,Ｏｎｅ　Ｌｉｍｅ　Ｓｔｒｅｅｔ　Ｌｏｎｄｏｎ　ＥＣ３Ｍ　７ＨＡ　ＵＫ,,,,,,2015-10-09,1,,,,,ケンジントンアンダーライテイングリミテツド,0
973,2700150000677,01,1,2018-06-21,2015-10-09,ＣＯＮＩＳＴＯＮ　ＮＯ　１０１　ＬＬＰ,,401,東京都,千代田区,霞が関３丁目２－６東京倶楽部ビルディング６階,,13,101,1000013,Ｏｎｅ　Ｌｉｍｅ　Ｓｔｒｅｅｔ　Ｌｏｎｄｏｎ　ＥＣ３Ｍ　７ＨＡ　ＵＫ,,,,,,2015-10-09,1,,,,,コニシヨンナンバーワンゼロワンエルエルピー,0
974,2700150000685,01,1,2018-06-21,2015-10-09,Ｃｏｒａｍ　Ｃａｐｉｔａｌ　ＬＬＰ,,401,東京都,千代田区,霞が関３丁目２－６東京倶楽部ビルディング６階,,13,101,1000013,Ｏｎｅ　Ｌｉｍｅ　Ｓｔｒｅｅｔ　Ｌｏｎｄｏｎ　ＥＣ３Ｍ　７ＨＡ　ＵＫ,,,,,,2015-10-09,1,,,,,コーラムキヤピタルエルエルピー,0
975,2700150000702,01,1,2018-06-21,2015-10-09,Ｂａｃｋｗｅｌｌｓ　Ｌｉｍｉｔｅｄ,,401,東京都,千代田区,霞が関３丁目２－６東京倶楽部ビルディング６階,,13,101,1000013,Ｏｎｅ　Ｌｉｍｅ　Ｓｔｒｅｅｔ　Ｌｏｎｄｏｎ　ＥＣ３Ｍ　７ＨＡ　ＵＫ,,,,,,2015-10-09,1,,,,,バツクウエルズリミテツド,0
976,2700150000719,01,1,2018-06-21,2015-10-09,Ｇｏｌｄｒｉｄｇｅ　Ｕｎｄｅｒｗｒｉｔｉｎｇ　ＬＬＰ,,401,東京都,千代田区,霞が関３丁目２－６東京倶楽部ビルディング６階,,13,101,1000013,Ｏｎｅ　Ｌｉｍｅ　Ｓｔｒｅｅｔ　Ｌｏｎｄｏｎ　ＥＣ３Ｍ　７ＨＡ　ＵＫ,,,,,,2015-10-09,1,,,,,ゴールドリツジアンダーライテイングエルエルピー,0
977,2700150000727,01,1,2018-06-21,2015-10-09,Ｔｈｅ　Ｌｏｒｄ　Ｗｙｎｆｏｒｄ　ＬＬＰ,,401,東京都,千代田区,霞が関３丁目２－６東京倶楽部ビルディング６階,,13,101,1000013,Ｏｎｅ　Ｌｉｍｅ　Ｓｔｒｅｅｔ　Ｌｏｎｄｏｎ　ＥＣ３Ｍ　７ＨＡ　ＵＫ,,,,,,2015-10-09,1,,,,,ザロードウインフオードエルエルピー,0
978,2700150000743,01,1,2018-06-21,2015-10-09,Ｔｈｅ　Ｇｗｅｒｔｚｍａｎ　Ｆａｍｉｌｙ　ＬＬＰ,,401,東京都,千代田区,霞が関３丁目２－６東京倶楽部ビルディング６階,,13,101,1000013,Ｏｎｅ　Ｌｉｍｅ　Ｓｔｒｅｅｔ　Ｌｏｎｄｏｎ　ＥＣ３Ｍ　７ＨＡ　ＵＫ,,,,,,2015-10-09,1,,,,,ザグウツツマンフアミリーエルエルピー,0
979,2700150000751,01,1,2018-06-21,2015-10-09,Ｔｈｅ　Ｈｕｔｔｓ　Ｕｎｄｅｒｗｒｉｔｉｎｇ　ＬＬＰ,,401,東京都,千代田区,霞が関３丁目２－６東京倶楽部ビルディング６階,,13,101,1000013,Ｏｎｅ　Ｌｉｍｅ　Ｓｔｒｅｅｔ　Ｌｏｎｄｏｎ　ＥＣ３Ｍ　７ＨＡ　ＵＫ,,,,,,2015-10-09,1,,,,,ザハツツアンダーライテイングエルエルピー,0
980,2700150000776,01,1,2018-06-21,2015-10-09,サムスン重工業株式会社　東京事務所,,401,東京都,千代田区,富士見２丁目１０－２飯田橋グラン・ブルーム,,13,101,1020071,大韓民国　ソウル特別市　瑞草区　瑞草大路７４－４　三星生命瑞草タワー,,,,,,2015-10-09,1,,,,,サムスンジユウコウギヨウカブシキガイシヤトウキヨウジムシヨ,0
981,2700150000784,01,1,2018-06-21,2015-10-09,Ｔｈｅ　Ｒｉｔｃｈｉｅ　ＳＬＰ,,401,東京都,千代田区,霞が関３丁目２－６東京倶楽部ビルディング６階,,13,101,1000013,Ｏｎｅ　Ｌｉｍｅ　Ｓｔｒｅｅｔ　Ｌｏｎｄｏｎ　ＥＣ３Ｍ　７ＨＡ　ＵＫ,,,,,,2015-10-09,1,,,,,ザリツチーエスエルピー,0
982,2700150000792,01,1,2018-06-21,2015-10-09,Ｔｈｅ　Ｒｏｂｅｒｔｓｏｎ　ＳＬＰ,,401,東京都,千代田区,霞が関３丁目２－６東京倶楽部ビルディング６階,,13,101,1000013,Ｏｎｅ　Ｌｉｍｅ　Ｓｔｒｅｅｔ　Ｌｏｎｄｏｎ　ＥＣ３Ｍ　７ＨＡ　ＵＫ,,,,,,2015-10-09,1,,,,,ザロバートソンエスエルピー,0
983,2700150000834,01,1,2018-06-21,2015-10-09,Ｊｏｈｎ　Ｃｏｖｅｒｄａｌｅ　ＬＬＰ,,401,東京都,千代田区,霞が関３丁目２－６東京倶楽部ビルディング６階,,13,101,1000013,Ｏｎｅ　Ｌｉｍｅ　Ｓｔｒｅｅｔ　Ｌｏｎｄｏｎ　ＥＣ３Ｍ　７ＨＡ　ＵＫ,,,,,,2015-10-09,1,,,,,ジヨンカバーデイルエルエルピー,0
984,2700150000850,01,1,2018-06-21,2015-10-09,ＳＵＩＲＯ　ＣＯＲＰＯＲＡＴＩＯＮ,,401,東京都,千代田区,大手町１丁目７－２東京サンケイビル２７階,,13,101,1000004,アメリカ合衆国ハワイ州ホノルル市プナホウ通１２１２番地３３０５号室,,,,,,2015-10-09,1,,,,,スイロコーポレーシヨン,0
985,2700150000867,01,1,2018-06-21,2015-10-09,Ｊｏｈｎ　Ｓｔｅｖｅｎｓ　ＬＬＰ,,401,東京都,千代田区,霞が関３丁目２－６東京倶楽部ビルディング６階,,13,101,1000013,Ｏｎｅ　Ｌｉｍｅ　Ｓｔｒｅｅｔ　Ｌｏｎｄｏｎ　ＥＣ３Ｍ　７ＨＡ　ＵＫ,,,,,,2015-10-09,1,,,,,ジヨンステイーブンスエルエルピー,0
